Abteilung,Suchbegriff,Suchhäufigkeit,ASIN,Nr. 1 der geklickten Titel,Klickfreigabe,Umwandlungs-Anteil,ASIN,Nr. 2 der geklickten Titel,Klickfreigabe,Umwandlungs-Anteil,ASIN,Nr. 3 der geklickten Titel,Klickfreigabe,Umwandlungs-Anteil
Amazon.de,baustellenradio,"98,86",B00PKC34CE,"Makita Akku-Baustellenradio 7,2 - 18 V, DMR105","18,91","4,92",B008ZPTMKQ,"Bosch Professional Akku-Baustellenradio GML 10,8 V-LI für 10,8V Akkubetrieb, Aux-In (3,5mm), ohne Akku, Netz-Adapter, Karton","12,83","14,63",B0043JKPA4,"Bosch Professional GML 50 Akku-Baustellenradio mit Ladefunktion, 50 Watt Nennleistung, USB, SD, 2x Aux-In, Aux-Out, 12 V Steckdose","6,03","1,08"
Amazon.de,gardena schlauch,"98,86",B004Z54Y94,Gardena 8009-20 Classic Wand-Schlauchtrommel 50 Set,"12,97","0,25",B00HPXVIPQ,"Gardena Comfort Flex Schlauch 9 x 9, 13 mm, 1/2 Zoll, 10 m ohne Systemteile, 18030-20","8,62","8,09",B00HPXVCS4,"Gardena Comfort Flex Schlauch 9 x 9, 13 mm, 1/2 Zoll, 30 m ohne Systemteile, 18036-20","6,56","5,99"
Amazon.de,leifheit,"98,86",B0090WTEQ0,"Leifheit 55077 Wischtuchpresse Profi Evo Set mit Bodenwischer, 42 cm, türkis","12,5","7,47",B005ELNR0K,"Leifheit 55356 Set Combi Clean inkl. Eimer mit Presse und Bodenwischer mit Micro Duo Bezug, Classic Green","10,02","3,41",B00L25FFOS,"Leifheit 51147 Fenstersauger mit Stiel und Einwascher (Akku, elektrischer Fensterreiniger, 28 cm Fensterwischer) weiß/grün","7,31","0,19"
Amazon.de,luftmatratze wasser,"98,86",B004CLZRM4,"Intex Lounge Mesh, mehrfarbig, 178 x 94 cm","19,42","1,43",B0006N01AK,"Intex Lounge 18-Pocket Fashion, mehrfarbig, 188 x 71 cm","8,46","1,41",B01D4Z5MUA,,"6,16",0
Amazon.de,new era cap,"98,86",B00X5P05L6,New Era Kappe New York Yankees,"13,23",0,B00X5P068I,New Era Erwachsene Baseball Cap Mütze MLB Basic NY Yankees 59 Fifty Fitted,"6,81",0,B00X5P07R8,New Era Erwachsene Baseball Cap Mütze Mlb Basic NY Yankees 59Fifty Fitted,"5,96",0
Amazon.de,playstation vr,"98,86",B00ULWWFIC,PlayStation VR - [PlayStation 4],"77,02",0,B00910B3B0,"PS3 - Gaming Seat ""Gyroxus""","3,41",0,B00BT9DW0Q,PlayStation Kamera für PS4,"3,3","19,51"
Amazon.de,apple,"98,85",B008ATNI98,"Apple MacBook Pro Retina Display MC975D/A 39,1 cm (15,4 Zoll) Notebook (Intel Core i7 3615QM, 2,3GHz, 8GB RAM, 256GB Flashspeicher, NVIDIA GT 650M, Mac OS)","34,73",0,B004Z3PNW8,"Apple iMac MC813D/A 68.6 cm (27 Zoll) Desktop-PC (Intel Core i5-2500S, 2,7GHz, 4GB RAM, 1TB HDD, AMD HD 6770M, DVD, Mac OS)","11,75",0,B005YYTIOG,"Apple MacBook Pro MD318D/A 39,1 cm (15,4 Zoll) Notebook (Intel Core i7-2675QM, 2,2GHz, 4GB RAM, 500GB HDD, AMD HD 6750M, Mac OS)","6,09",0
Amazon.de,galaxy j5 tasche,"98,85",B013QG5400,mumbi ECHT Ledertasche Samsung Galaxy J5 Tasche Leder Etui weiss (Lasche mit Rückzugfunktion Ausziehhilfe),"53,06","49,34",B013QG4852,mumbi ECHT Ledertasche Samsung Galaxy J5 Tasche Leder Etui (Lasche mit Rückzugfunktion Ausziehhilfe),"44,51","8,22",B01E00AV9U,mumbi Ledertasche im Bookstyle für Samsung Galaxy J5,"0,76","7,05"
Amazon.de,samsonite,"98,85",B007WQJSGM,"Samsonite S'Cure Spinner 75/28 Koffer, 52cm, 102 L, Black","15,75","1,1",B00BY5RXOQ,"Samsonite Termo Young Upright 82/31 Koffer, 82cm, 120 L, Schwarz","8,8",0,B00BY5S0YI,"Samsonite Suitcase Termo Young, 85 cm, 120 L, Blue electric, 53398-1324","8,1","8,26"
Amazon.de,sporthose damen,"98,85",B0093GVOZM,Ultrasport Damen antibakterielle Fitness Caprihose mit Quick Dry Function,"6,74",0,B0093GVYOI,Ultrasport Damen antibakterielle Fitness Hose lang mit Quick Dry Function,"5,06",0,B01CVGHXJ6,,"4,35",0
Amazon.de,tank top herren,"98,85",B00EJNX29K,Urban Classics Herren Sport Top Jersey Big Tank Top,"12,89",0,B01GJN83L4,,"9,29",0,B0017KOO90,Fruit of the Loom Athletic Unterhemd,"3,57",0
Amazon.de,vileda,"98,85",B004X5IAIC,"Vileda EasyWring & Clean Komplett-Set, Wischmop und Eimer mit PowerSchleuder","18,46","0,58",B0047Y1HP2,"Vileda UltraMat Komplett-Set, Bodenwischer und Eimer mit PowerPresse","17,92","8,42",B00604Y0ME,"Vileda  EasyWring UltraMat Komplett-Set, Bodenwischer und Eimer mit PowerSchleuder","15,26","1,01"
Amazon.de,wachsmalstifte,"98,85",B000JWJ9ZQ,"Pelikan 722942 - Wachsmalstifte 665 / 8d dreieckig, wasserfest","24,54","9,62",B000WL5J76,"Faber-Castell 120010 - Dreikant Wachsmalstifte, 12er Etui","17,83","14,27",B000XJ90CW,"Pelikan 723155 - Wachsmalstifte 655 / 10 in einer Schiebehülse, vermalbar","12,37","7,28"
Amazon.de,arlo,"98,84",B00TDNYNP8,"Netgear Arlo VMS3230-100EUS Smart Home 2 HD-überwachung Kamera-Sicherheitssystem (100% kabellos, Indoor/Outdoor, Bewegungssensor, Nachtsicht) weiß","33,76","14,19",B00TDNYNN0,"Netgear Arlo VMS3330-100EUS Smart Home 3 HD-überwachung Kamera-Sicherheitssystem (100% kabellos, Indoor/Outdoor, Bewegungssensor, Nachtsicht) weiß","16,94","17,34",B00TDNYNXA,"Netgear Arlo VMC3030-100EUS Smart Home Zusatz-HD-Security-überwachung Kamera (100% kabellos, Indoor/Outdoor, Bewegungssensor, Nachtsicht) weiß","11,67","19,07"
Amazon.de,charlotte link,"98,84",3734100852,Die Betrogene: Kriminalroman,"18,62","8,14",3442377323,Schattenspiel: Kriminalroman,"10,74","11,1",3442382599,Im Tal des Fuchses: Kriminalroman,"8,42","10,52"
Amazon.de,nele neuhaus,"98,84",3550080557,"Im Wald: Kriminalroman (Ein Bodenstein-Kirchhoff-Krimi, Band 8)","26,11","3,86",354828776X,"Die Lebenden und die Toten (Ein Bodenstein-Kirchhoff-Krimi, Band 7)","18,6","12,18",3548609023,"Tiefe Wunden: Der dritte Fall für Bodenstein und Kirchhoff (Ein Bodenstein-Kirchhoff-Krimi, Band 3)","8,74","8,99"
Amazon.de,norton internet security 2016,"98,84",B016BIQSKK,"SYMANTEC Norton Security Deluxe (5 Geräte - PC, Mac, Smartphone, Tablet)","52,31","27,28",B016BIQSM8,"SYMANTEC Norton Security Standard (1 Gerät - PC, Mac, Smartphone, Tablet)","17,99","38,57",B01CGDGIGI,Symantec Norton Security Deluxe (5 Geräte) mit Norton Utilities 16.0 Bundle,"11,68","1,09"
Amazon.de,samsung gear,"98,84",B014WGN4MI,Samsung Gear S2 Classic schwarz,"18,37","0,69",B01GJW7H2Q,Samsung Gear Fit II - Smartwatch mit Herzfrequenzmessung und Notifications Dark Gray (L),"17,2","3,49",B018JZRDJS,Samsung Gear VR Virtual Reality Brille weiß,"16,8","2,43"
Amazon.de,fahrradständer,"98,83",B005UVJ7M6,Sonstige Parkstütze O-Stand Eco,"15,77","12,67",B00EQ5G446,Relaxdays Fahrradmontageständer Reparaturständer mit Werkzeugablage - klappbar & höhenverstellbar - schwarzer Montageständer vierbeinig stabil mit festem Stand - Stahl pulverbeschichtet,"12,57","4,27",B001R4BR96,"Fahrradständer Willworx Superstand, Silber","7,61","6,95"
Amazon.de,grillbesteck,"98,83",B00UFGMVME,Bruzzzler Edelstahl Grillbesteck-Set 3-teilig im Koffer,"30,62","1,65",B005LR3BB2,"Weber 6645 Grillbesteck Kompakt 2-teilig, Edelstahl, schwarz","14,9","4,5",B0002DF1SG,"Landmann Grillbesteck, Silber, 37,5 x 7 x 2 cm","8,07","4,49"
Amazon.de,gästebett,"98,83",B000COQ5GW,"Frankana Luftmatratzen Intex Comfort Luft- und Gästebett 191 x 99 cm, 33083","13,41","3,82",B01CZNNJ7A,,"11,26",0,B000COQ5GM,"Intex Luftbett Pillow Rest Blue Queen (230 V), blau, 152 x 203 x 42 cm","8,58","3,61"
Amazon.de,maxi cosi,"98,83",B00F4OIWE8,Maxi-Cosi Citi SPS Babyschale (bis 13 kg) carmine,"14,93","1,65",B014T3YUFO,"Maxi-Cosi Citi Babyschale, Gruppe 0+, bis 13 kg, black raven","11,92","25,77",B00MS3UDMC,"Maxi-Cosi Cabriofix Babyschale Gruppe 0+ (0-13 kg), black crystal","8,97","1,1"
Amazon.de,samsung galaxy j5 ledertasche,"98,83",B013QG5400,mumbi ECHT Ledertasche Samsung Galaxy J5 Tasche Leder Etui weiss (Lasche mit Rückzugfunktion Ausziehhilfe),"53,63","67,74",B013QG4852,mumbi ECHT Ledertasche Samsung Galaxy J5 Tasche Leder Etui (Lasche mit Rückzugfunktion Ausziehhilfe),"45,22","22,58",B01E00ANQQ,mumbi Ledertasche im Bookstyle für Samsung Galaxy J5 Tasche weiss,"0,27",0
Amazon.de,withings,"98,83",B00BKRQ4E8,"Withings WS-50 Smart Body Analyzer, schwarz","22,1","2,5",B01F3LJ2RW,Withings Body - Analyse der Körperzusammensetzung,"11,31","6,19",B018SL790Q,Withings Activité Steel - Smartwatch mit Aktivitäts- und Schlaftracker - Mineraglas & Edelstahl - Black,"11,25","2,86"
Amazon.de,birkenstocks,"98,82",B01008R7FC,Birkenstock Classic Gizeh Birko-Flor Unisex-Erwachsene Zehentrenner,"7,64",0,B00QTY5IUI,Birkenstock Classic ARIZONA BF Unisex-Erwachsene Pantoletten,"5,45",0,B01008RA40,Birkenstock Classic Gizeh Birko-Flor Damen Zehentrenner,"4,18",0
Amazon.de,buch,"98,82",3789167061,Die Eule mit der Beule,"23,55","3,26",3888979145,Mach dieses Buch fertig: Erweiterte Neuausgabe,"12,55","0,74",3596196353,Morgen kommt ein neuer Himmel: Roman,"6,56","5,61"
Amazon.de,galaxy j5 ledertasche,"98,82",B013QG5400,mumbi ECHT Ledertasche Samsung Galaxy J5 Tasche Leder Etui weiss (Lasche mit Rückzugfunktion Ausziehhilfe),"54,34",0,B013QG4852,mumbi ECHT Ledertasche Samsung Galaxy J5 Tasche Leder Etui (Lasche mit Rückzugfunktion Ausziehhilfe),"45,66",0,,,,0
Amazon.de,gürtel,"98,82",B004OQZZ9C,Urban Classics Herren Gürtel Gürtel schwarz (Black) One Size,"34,16","11,74",B002V9210U,"camel active Lederguertel 4026609B66 Herren Accessoires/ Grtel, Gr. M Schwarz (schwarz 9)","23,28","6,47",B00NONWUL2,"Tommy Hilfiger Herren Gürtel NEW DENTON BELT, Einfarbig, Gr. 100 cm, Braun (TESTA DI MORO-EUR 066)","10,75","1,68"
Amazon.de,hochstuhl,"98,82",B0014R524W,roba 7562 - Treppenhochstuhl Sit up III,"22,87","1,62",B00KWZQQ6K,"Hauck 661079 Hochstuhl Alpha +, natur","8,79","0,67",B00NRSTEZO,"Safety 1st 27620100 Timba Basic - Mitwachsender Hochstuhl mit abnehmbarem Tisch, holz","5,35","5,6"
Amazon.de,kindle voyage,"98,82",B00IOY524S,"Kindle Voyage eReader, 15,2 cm (6 Zoll) hochauflösendes Display (300 ppi) mit integriertem intelligenten Frontlicht, PagePress-Sensoren, WLAN","71,49","15,65",B00GMUQCE0,"Kindle Voyage 3G eReader, 15,2 cm (6 Zoll) hochauflösendes Display (300 ppi) mit integriertem intelligenten Frontlicht, PagePress-Sensoren, Gratis 3G + WLAN","9,35","11,63",B00JAKBZGY,"Kindle Voyage, Zertifiziert und generalüberholt, 15,2 cm (6 Zoll) hochauflösendes Display (300 ppi) mit integriertem intelligenten Frontlicht, PagePress-Sensoren, WLAN","7,94","46,92"
Amazon.de,nalgene,"98,82",B00I0509HQ,Nalgene Trinkflasche Kunststoffflaschen Everyday OTF,"28,7",0,B001NCDE8O,"Nalgene Kunststoffflaschen 'Everyday WH', Blau, 078605","9,49","5,95",B0047GHCIQ,"Nalgene Trinkflasche Everyday OTF, Red, 0.7 Liter, 5565-7024","8,77","3,93"
Amazon.de,new nintendo 3ds,"98,82",B00S84TXLM,New Nintendo 3DS schwarz,"41,69","23,18",B00S84U0XM,New Nintendo 3DS weiß,"14,35","26,95",B00S84TIJY,New Nintendo 3DS XL metallic schwarz,"10,92","1,81"
Amazon.de,canon 80d,"98,81",B01C2XJVPC,"Canon EOS 80D Digitale Spiegelreflexkamera (24.2 Megapixel APS-C CMOS Sensor, 45 AF-Kreuzsensoren, DIGIC 6 Bildprozessor, NFC und WLAN, Full HD, 7,7 cm (3 Zoll) Display) nur Gehäuse schwarz","69,91","21,49",B01C2XJWZ6,"Canon EOS 80D Digitale Spiegelreflexkamera (24,2 Megapixel, 7,7 cm (3 Zoll) Display, DIGIC 6 Bildprozessor, NFC und WLAN, Full HD) inkl. EF-S 18-55mm 1:3,5-5,6 IS STM schwarz","14,11","13,46",B01CJMBXUC,"Canon EOS 80D 18-135mm IS USM, 1263C042","3,43",0
Amazon.de,dr house,"98,81",B00G0MNI6A,,"44,63",0,B00GNWHYRQ,,"38,01",0,B00K9J6CHM,"Dr. House - Die komplette Serie, Season 1-8 (46 Discs)","10,84","24,83"
Amazon.de,huawei-p8-lite,"98,81",B00W1KSK86,"Huawei P8 lite Dual-SIM Smartphone (5 Zoll (12,7 cm) Touch-Display, 16 GB Speicher, Android 5.0) schwarz","71,76","56,19",B00W1KSGFI,"Huawei P8 lite Dual-SIM Smartphone (5 Zoll (12,7 cm) Touch-Display, 16 GB Speicher, Android 5.0) weiß","14,11","28,27",B01DYN5N06,"Huawei P9 lite Smartphone (13,2 cm (5,2 Zoll) Touch-Display, 16 GB interner Speicher, 3 GB RAM, Dual-SIM, Android 6) schwarz","3,9","2,43"
Amazon.de,macbook air,"98,81",B005DQ0CDG,"Apple MC966D/A MacBook Air 33,8 cm (13,3 Zoll) Notebook (Intel Core i5-2557M, 1,7GHz, 4GB RAM, 256GB Flash Speicher, Intel HD Graphics 3000, Mac OS)","18,17",0,B008ATNHJY,"Apple MacBook Air MD231D/A 33,8 cm (13,3 Zoll) Notebook (Intel Core i5 3427U, 1,8GHz, 4GB RAM, 128GB Flashspeicher, Intel HD 4000, Mac OS)","16,93",0,B00UJ3M47A,"Apple MacBook Air MJVE2D/A 33,8 cm (13,3 Zoll) Notebook (Intel Core i5 5257U, 1,6GHz, 4GB RAM, 128GB HDD, OS X Yosemite) silber - Modell März 2015","11,09",0
Amazon.de,monster hunter,"98,81",B01E5QLQCA,Monster Hunter Generations [3DS],"59,63","10,89",B01FLQ3W2A,New Nintendo 3DS XL - Konsole (Monster Hunter Generations Edition),"13,93","4,8",B00QYEXLKM,Monster Hunter 4 Ultimate,"6,56","13,84"
Amazon.de,need for speed,"98,81",B00Y2JXATI,Need for Speed - [PlayStation 4],"50,52","1,46",B00Y2JXNWW,Need for Speed - [PC],"27,39","19,13",B00YPOXD56,Need for Speed [AT Pegi] - [PC],"9,13","19,36"
Amazon.de,globus,"98,8",B000P1ZOZ0,Idena 569902 Leuchtglobus 30 cm mit Halogen Energiesparlampe und zwei Kartenbildern,"25,29","18,89",B00B2XEYMY,Ravensburger 00558 - tiptoi Interaktiver Globus,"11,1","0,08",3934922449,"PAL 3010 Antikstil: Antikdesign-Leuchtglobus 30 cm, aktuelle politische Karte, messingfarbener Metallmeridian, Holzfuß (Alter Globus)","9,02","10,04"
Amazon.de,lego duplo,"98,8",B000T735AQ,Lego Duplo 6176 - Grundbausteine,"11,5","2,72",B013GY7GQ2,LEGO Duplo 10816 - Meine ersten Fahrzeuge,"6,79","3,77",B00HX8N2ZW,Lego Duplo 10558 - Zahlenzug,"5,23","4,82"
Amazon.de,mülltonnenbox,"98,8",B007KL43AK,"Keter Mülltonnenbox Store it Out Midi, Schwarz, 845L","22,88","17,94",B00IKFDGNK,"Keter Mülltonnenbox Store it Out Max, Anthrazit, 1.200L","16,25","19,65",B004SKU0WG,"Habau Mülltonnenverkleidung Mülltonnenbox 120, Gelb, 65 x 75 x 115 cm","9,12","27,02"
Amazon.de,schnellhefter,"98,8",B00M20AREU,"Esselte-Leitz 30011099 WOW Schnellhefter (A4, Karton) sortiert","19,82","4,6",B0041J2HW0,Herlitz 11037181 Schnellhefter A4 Karton gefaltet farbig sortiert 10er Packung,"19,36","6,41",B000S5L6FK,Herlitz 11387206 Schnellhefter  PP A4 10 Stück,"17,6","17,59"
Amazon.de,schutzbrille,"98,8",B006RAW942,"3M Virtua AP Schutzbrille VirtuaA0, AS, UV, PC, klar, wiegt nur 26 g","26,93","13,56",B00BFW9QES,"Uvex pheos 9192 HC/AF schwarz / grün, 9192225","17,15","8,71",B005F40TMA,"3M SOLUS Schutzbrille Solus0SO, AS/UV, PC, klar Rahmen schwarz/orange","9,5","8,73"
Amazon.de,wäschesammler,"98,8",B00576BLL4,"WENKO 3440113100 Wäschesammler Trio Beige - Wäschekorb, Fassungsvermögen 130 L, 100 % Polyester, 63 x 57 x 38 cm, Beige","9,55","2,55",B00N9W7YNC,"Zeller 13226 Wäschesammler, 2-fach, Polyester / Alu, 59 x 38 x 57 cm, taupe","7,26","9,08",B00NUS5KI6,"AmazonBasics Wäschekorb, Wäschesammler mit 3 Fächern","6,07","0,54"
Amazon.de,amazon wasserkocher,"98,79",B0019QLTMW,"Philips HD4646/20  Serie Wasserkocher (1,5 Liter, 2400 Watt, Anti-Kalk) schwarz","7,4","1,2",B000T7UA54,"Philips HD4646/00 Wasserkocher (1,5 Liter, 2400 Watt, Flaches Heizelement) weiß","4,98","4,92",B00E7SD2ZG,"Philips HD9321/20 Wasserkocher aus Edelstahl, 1.7 L, 2200 W, 360 Grad Pirouette, Silber","4,55","0,62"
Amazon.de,bügeltisch,"98,79",B0018O2QSG,Vileda Viva Express Smart+ Bügeltisch mit dampfdurchlässiger Oberfläche,"20,3","6,53",B002LLN7NI,"WENKO 1201143100 Bügeltischbezug Air Comfort L - 4 mm Komfortpolsterung, 100 % Baumwolle, Blau","9,32","1,84",B00IVI72P4,Leifheit 72563 Bügeltisch Air Board M Solid,"8,39","7,98"
Amazon.de,kindersitz,"98,79",B00R0TNQ0K,"Safety 1st 85347641 - Manga Autositzerhöhung - Kindersitz Gruppe 2/3 (ab 3,5 bis 12 Jahre), full black","21,96","22,49",B0072SN7H6,"Maxi-Cosi Priori SPS Plus Autokindersitz Gruppe 1 (ab 9 Monate bis circa 3,5 Jahre, 9-18 kg) stone","15,7","0,99",B002SG6PA8,"Maxi-Cosi Rodi SPS Autokindersitz Gruppe 2/3 (ab 3,5 Jahre bis ca. 12 Jahre, 15-36 kg)  stone","9,6","1,44"
Amazon.de,kochbuch,"98,79",3833816775,20 Minuten sind genug!: Über 150 Rezepte aus der frischen Küche (GU Themenkochbuch),"13,47","13,9",3898834891,Gesund kochen ist Liebe,"9,51","1,82",3442392748,"Heimat: Kochbuch. Mit über 120 Rezepten, in hochwertiger Ausstattung mit Leineneinband und Goldfolienprägung","8,01","9,62"
Amazon.de,kühlbox waeco,"98,79",B00H7WV4VS,"Waeco TropiCool TC 21 thermoelektrische Kühlbox, 12/24/230-Volt-Anschluss, 20 Liter, A++","6,86","10,72",B003KP3NL0,Dometic 9105202819 CombiCool RC 1200 EGP (50 mbar),"6,15","1,73",B00B6VNEGY,"Mobicool W48 AC/DC Elektrische Trolley-Kühlbox, 12 und 230 Volt Anschluss","4,84","0,89"
Amazon.de,multimeter,"98,79",B000VE5QPY,"Hama Digital Multimeter EM393B (Messung von Spannung, Strom, Widerstand) schwarz/gelb","60,72","2,81",B0011D6O0A,Fluke 115 MULTIMETER,"7,28","6,77",B000RZHW5O,"Benning Multimeter Digital MM1-3, 044083","4,2","8,12"
Amazon.de,peppa wutz,"98,79",B01DWQXHR6,,"12,94",0,B012TRE6GU,,"6,09",0,B001TH4YO6,"TY 7196230 - Peppa Large - Schwein mit rotem Kleid und Bär, 25 cm","5,6","5,96"
Amazon.de,schirmständer,"98,79",B003N8299Q,Nexos Schirmständer Sonnenschirmständer Granit eckig 45x45cm Steindicke 5cm ca. 25kg Edelstahlrohr Griff Rollen grau,"25,51","6,33",B001L6C5V4,"Schneider PE-Schirmständer, weiß, ca. 20 ltr.","9,21","2,35",B00294O1BO,"Stern 669971 Schirmständer, Kunststoff, Füllinhalt circa 25 kg mit Sand, eisengrau","6,13","5,19"
Amazon.de,sekundenkleber,"98,79",B004V4B60Y,"Pattex Sekundenkleber Mini Trio flüssig 3 x 1 g, PSMT2","35,88","14,77",B0000WRNV2,Loctite Sekundenkleber 401 5G,"20,48","12,09",B00O23B8IE,"Pattex Sekundenkleber Minitrio Gel 3 x 1 g, PSMG3","11,38","8,11"
Amazon.de,wanduhr funk,"98,79",B004MDLECO,"Hama Funk Wanduhr PG-300 (automatische Zeitanpassung, automatische Zeitumstellung von Sommer- und Winterzeit, modernes Ziffernblatt) schwarz","8,01","5,38",B00FRA1EEO,TFA Dostmann 60.3514 Funk-Wanduhr,"5,66","5,83",B0039MHT4G,"TFA 60.3503.10 Wanduhr, Analog, Funk","4,61","3,17"
Amazon.de,wwe 2k17,"98,79",B01GEIBTX8,WWE 2K17 - [PlayStation 4],"59,32","25,31",B01IFAHXPG,WWE 2K17 - NXT Edition - [PlayStation 4],"12,21","2,78",B01IFAIAKS,WWE 2K17 - NXT Edition - [Xbox One],"9,72","3,55"
Amazon.de,yoga,"98,79",1407511491,Yoga: Das große Praxisbuch für Einsteiger & Fortgeschrittene,"17,42","23,66",B002L5ZH8W,Yogistar Yogamatte Basic - rutschfest - Zen Black,"8,93","2,13",344216995X,Yoga für dich und überall: 60 unglaublich nützliche Übungen - für jedermann und jeden Tag,"6,81","9,69"
Amazon.de,babyalbum,"98,78",B00R3I64LG,"Wie schön, du bist da!: Deine ersten Jahre","11,77","3,32",B00IXLU4FO,"Willkommen, mein Schatz!","8,08","3,38",B000V7MUQY,"Hama Babyalbum Baby Feel (Fotoalbum mit 29 x 32 cm, 60 Seiten, 60 Blatt, 300 Fotos) sand","5,33","1,79"
Amazon.de,calendar girl,"98,78",3548288847,"Calendar Girl - Verführt: Januar/Februar/März (Calendar Girl Quartal, Band 1)","69,6","39,37",3548288855,"Calendar Girl - Berührt: April/Mai/Juni (Calendar Girl Quartal, Band 2)","17,78","22,03",3548288863,"Calendar Girl - Begehrt: Juli/August/September (Calendar Girl Quartal, Band 3)","4,79","2,87"
Amazon.de,fitbit surge,"98,78",B00X71TBG8,Fitbit Fitness Super Watch Fitbit Surge,"85,16",0,B00SV21RVU,Fitbit Aktivitätstracker Charge HR,"3,29",0,B01D062XY6,,"3,13",0
Amazon.de,galaxy j5,"98,78",B012CC7ORK,"Samsung Galaxy J5 Smartphone (5 Zoll (12,7 cm) Touch-Display, 8 GB Speicher, Android 5.1) schwarz","27,2","19,68",B00ZRJ9YRY,mumbi Schutzhülle Samsung Galaxy J5 Hülle transparent weiss,"15,34","7,23",B00ZRJAH6Q,mumbi Schutzhülle Samsung Galaxy J5 Hülle,"14,92","2,95"
Amazon.de,soda stream crystal,"98,78",B005Q9GKXG,"SodaStream Wassersprudler Crystal  (mit 1 x CO2-Zylinder 60L und 2 x 0,6L Glaskaraffen) Titan/Silber","51,02","1,05",B003KGAH18,"SodaStream Wassersprudler Crystal (mit 1 x CO2-Zylinder 60L und 1 x 0,6L Glaskaraffe)","9,09","21,83",B003KGAI3K,"SodaStream Wassersprudler Crystal Umsteiger (1 x 0,6L Glaskaraffe, ohne CO2-Zylinder), Titan-silber","8,3","21,78"
Amazon.de,taschenkalender 2017,"98,78",3848515458,2017 SEI abenteuerlustig authentisch einfach du glücklich kreativ lebensfroh mutig optimistisch...: Terminplaner mit Wochenkalendarium,"6,03","2,14",3848515423,"Mir reichts, ich geh schaukeln 2017: Terminplaner mit Wochenkalendarium","4,3","2,81",3848515350,Zeit für Neues 2017: Terminplaner mit Wochenkalendarium,"3,56","2,75"
Amazon.de,burton rucksack,"98,77",B00UN3E11I,"Burton Daypack EMPHASIS, Grey Heather, 31 x 19 x 47 cm, 26 Liter, 16328100079","13,2","15,02",B00W5EI0RE,"Burton Daypack TINDER, Beaver Tail Crinkle, 32 x 16 x 52 cm, 25 Liter, 14947101209","6,82","15,41",B00K76NPWC,"Burton Daypack KILO, True Black, 30 x 15 x 44.5 cm, 27 Liter, 13649100002","5,99","0,24"
Amazon.de,dlan,"98,77",B00ADW9R22,"TP-Link TL-PA4010PKIT Powerline-Netzwerkadapter (500Mbps, Fast Ethernet, integrierte Steckdose) 2er Set","26,12","16,22",B00FRCDFYE,TP-Link TL-PA411KIT V2.0 AV500 Mini Powerline-Netzwerkadapter (500Mbps) 2-er Set,"14,28","16,62",B00B4D3UZY,"Devolo dLAN 500 duo Powerlan Adapter Starter Kit (500 Mbit/s, 2 Adapter im Set, 2x LAN Port, Netzwerk, Powerline, Kompaktgehäuse) weiß","8,23","2,18"
Amazon.de,grillpfanne,"98,77",B000PTJ3PY,WMF 0589674291 Grillpfanne 27x27 cm Party,"14,58","7,67",B003VJV67I,"Krüger 63028 Gusseisen-Steakpfanne, Rustica, 28, 28 cm, schwarz","9,81","4,14",B001A553MO,Grillpfanne Grill Bratpfanne,"9,78","17,02"
Amazon.de,hundebox,"98,77",B00305MP78,"Trixie 39721 Vario Transportbox, Größe S, 61×43×46 cm","11,83","11,52",B00QAVO07C,"AmazonBasics Hundekäfig mit 1 Tür, Metall, zusammenklappbar, Gr. S","10,74","4,68",B000VBPFCQ,"Trixie 39692 Transport-Hütte Twister, faltbar, hellblau/dunkelblau, Größe S, 45 × 45 × 64 cm","7,82","6,24"
Amazon.de,jogginghose damen,"98,77",B007PMEO2G,erima Damen Hose Sweathose Mit Bündchen,"11,16",0,B01FJXWUUA,adidas Damen Trainingshose Essentials 3-Streifen,"5,84",0,B00DN2DFBI,erima Damen Sweathose,"5,15",0
Amazon.de,samsung,"98,77",B012CC7ORK,"Samsung Galaxy J5 Smartphone (5 Zoll (12,7 cm) Touch-Display, 8 GB Speicher, Android 5.1) schwarz","26,6","12,02",B00LGZXTSI,"Samsung Galaxy S5 mini Smartphone (4,5 Zoll (11,4 cm) Touch-Display 16 GB Speicher, Android 4.4) schwarz","10,56","0,88",B012CC7KY2,"Samsung Galaxy J5 Smartphone (5 Zoll (12,7 cm) Touch-Display, 8 GB Speicher, Android 5.1) gold","9,28","9,45"
Amazon.de,tshirt herren,"98,77",B005B8M3WY,Fruit of the Loom Herren T-Shirt 5 er PackRegular Fit 11182V,"10,56",0,B00P421OBS,Jack & Jones Tech Herren T-shirt JJT Foam New Tee Short Sleeves Crew Neck Noos,"7,63",0,B00361NEHQ,,"4,61",0
Amazon.de,türstopper,"98,77",B001FR2410,Relaxdays 10010084 Türstopper 2-er Set Edelstahl Schwarz Keilform,"13,5","13,55",B001FR3U7C,"Relaxdays 10010080 Relaxdays Türstopper, Design extra hoch 1,1 kg, edelstahl","11,36","7,5",B002L1IF94,"Mannesmann Türstopper, M41135","10,17","11,51"
Amazon.de,ventilator leise,"98,77",B001AO0OXI,Honeywell HO-5500RE Turmventilator oszillierend silber/schwarz,"17,18","2,74",B003KHJO6G,"Honeywell HT-900E Kraftvoller und geräuscharmer Turbo-Ventilator, schwarz","16,31","3,08",B001UHOU12,AEG VL 5529 Tisch-/Wand-Ventilator,"9,63","2,95"
Amazon.de,akte x,"98,76",B00LZB9B8K,,"22,88",0,B019NXYTL0,Akte X - Die neuen Fälle [Blu-ray],"18,58","20,37",B00LZAZ82O,,"13,57",0
Amazon.de,beginner,"98,76",B01GF9NTQ6,Advanced Chemistry (Limited Deluxe Box),"78,23","18,04",B0002W3ECC,Blast Action Heroes (Version 2.0),"5,37","20,29",B00000JB3Q,Bambule,"4,96","8,69"
Amazon.de,fahrradkorb vorne,"98,76",B0010AIA5Q,"KLICKfix Farradtasche Uni Korb, Feinma. Schwarz, 0397KLIK","27,16","15,49",B00426HBNM,"Blue Bird Korb Lenkerkorbtasche, Schwarz/Hibiskusblüte, 05111700","19,07","12,37",B00F2KY6ZI,"KLICKfix Fahrradtasche BLACK DOTS, 0303BD","12,29","2,49"
Amazon.de,federmäppchen,"98,76",B003PHF73A,"Eastpak Federmäppchen BENCHMARK, Sunday Grey","15,92","4,22",B000VZK4FK,"Eastpak Federmäppchen OVAL, 5 x 22 x 9 cm, Black","9,43","0,87",B0174ADBXG,"DAKINE Damen Federmäppchen School Case, Rhapsody Ii, 22 x 10 x 5 cm, 1 Liter, 08260056","6,32","10,24"
Amazon.de,fritz repeater,"98,76",B009CXPY0W,"AVM FRITZ!WLAN Repeater 310 (300 Mbit/s, WPS)","34,09","17,74",B00N80IK88,"AVM FRITZ!WLAN Repeater 1750E - Dual-WLAN AC + N bis zu 1.300 MBit/s 5 GHz + 450MBit/s 2,4 GHz","29,24","5,73",B00I69NOQO,"AVM FRITZ!WLAN Repeater 450E (450 MBit/s, Gigabit LAN, WPA2)","11,54","28,51"
Amazon.de,lamzac,"98,76",B01F37C2PA,LayBag - DAS ORIGINAL. Mit Luft befüllbarer Lounge-Sessel | Ultraleicht. Einfach aufblasbar. Extrem gemütlich. | Ultrastrong Ripstop Nylon (BLAU),"55,13","15,28",B01FKE0MEO,,"27,56",0,B004CLZRM4,"Intex Lounge Mesh, mehrfarbig, 178 x 94 cm","8,33","0,38"
Amazon.de,nexo knights,"98,76",B01CCT2FLI,LEGO Nexo Knights 70323 - Jestros Vulkanfestung,"8,17","4,02",B01AC1BDG6,LEGO Nexo Knights 70336 - Ultimativer Axl,"6,55","3,35",B013JQDXKA,LEGO Nexo Knights 70317 - Fortrex - Die rollende Festung,"6,43","5,3"
Amazon.de,schwimmbecken,"98,76",B001IWNDDA,"Intex Frame Pool Family, blau, 300 x 200 x 75 cm","23,7","3,03",B001TL0MSO,"Intex Aufstellpool Easy Set Pools, TÜV/GS, blau, Ø 305 x 76 cm","9,97","2,11",B00J7R9VY8,Jilong JL010291-1NPF -P79 Giant Pool 2R200,"7,51","13,41"
Amazon.de,stargate,"98,76",B00ERMV4RK,,"33,24",0,B008RHGC7S,"Stargate Kommando SG-1 - Die komplette Serie (inkl. Continuum, The Ark of Truth) [61 DVDs]","14,93","26,21",B00ERK3PZ6,,"14,17",0
Amazon.de,violetta,"98,76",B00WF8W5TY,,"11,82",0,B00GWSSDM6,Giochi Preziosi 70051801 - Disney VIOLETTA Tagebuch,"6,55","2,27",B01AVGJ120,,"5,68",0
Amazon.de,fahrradanhänger,"98,75",B01CSREL52,,"16,05",0,B01AI8KP1M,,"11,35",0,B00CB7LKTA,"homcom 61-0004 360° Drehbar Kinderanhänger 2 in 1 Fahrradanhänger Jogger, cream/kaffeebraun","11,09","17,48"
Amazon.de,kehrmaschine,"98,75",B000ORYO4W,Kärcher S 650 Kehrmaschine,"52,11","21,5",B000OS01XO,Kärcher S 750 Kehrmaschine,"19,84","17,53",B003BUBLMM,"Güde Kehrmaschine GKM 700, 16787","8,21","19,07"
Amazon.de,lightstrike 360,"98,75",B01FKG4KO0,,"53,82",0,B01ERT6HG0,,"31,88",0,B00F9ZH4O6,LED Lenser P7.2 Taschenlampe Box,"8,81",0
Amazon.de,ryobi,"98,75",B00B1QNKA4,Ryobi RCD18022L 2-Gang Kompakt-Akkubohrschrauber [Energieklasse A],"10,05","4,21",B00ITLK79G,"Ryobi Akku-Heckenschere OHT1855R 18 V, 5133002161 [Energieklasse A]","4,91","1,22",B00HUX5E1A,"Ryobi Akku-Rasentrimmer OLT1831S 18 V, 5133002162","4,59","2,48"
