Abteilung,Suchbegriff,Suchhäufigkeit,ASIN,Nr. 1 der geklickten Titel,Klickfreigabe,Umwandlungs-Anteil,ASIN,Nr. 2 der geklickten Titel,Klickfreigabe,Umwandlungs-Anteil,ASIN,Nr. 3 der geklickten Titel,Klickfreigabe,Umwandlungs-Anteil
Amazon.de,honor 8,"99,43",B01J0RYDPG,"Honor 8 Smartphone (13,2 cm (5,2 Zoll) Touchscreen, 32GB interner Speicher, Android OS) blau","74,83","50,06",B01J0RYDPQ,"Honor 8 Smartphone (13,2 cm (5,2 Zoll) Touchscreen, 32GB interner Speicher, Android OS) schwarz","7,82","12,66",B01483WYBW,"Honor 7 Smartphone (13,2 cm (5,2 Zoll) Touchscreen, 16GB interner Speicher, Android OS) grau","7,34","2,28"
Amazon.de,ninjago,"99,43",B01AC1BHIA,LEGO® NINJAGO 70588 - Titan-Ninjamobil,"8,22","4,5",B013GY9ZYS,LEGO NINJAGO 70600 - Ninja-Bike Jagd,"6,08","3,99",B01AC1BNPC,LEGO® NINJAGO 70595 - Ultra-Tarnkappen-Fahrzeug,"5,86","2,19"
Amazon.de,victorinox,"99,43",B0001P151W,"Victorinox Offiziermesser Huntsman 15 Funktionen, rot/silber, 1.3713-033","13,34","5,21",B0001P15CG,"Victorinox Offiziermesser Spartan, 12 Funktionen, rot/silber, 1.3603-033","8,14","5,26",B002H3WAU6,"Victorinox Taschenwerkzeug Schweizer Soldatenmesser 08 Grün/Schwarz, 0.8461.MWCH","5,23","1,75"
Amazon.de,wäschespinne,"99,43",B004KIM8YE,Leifheit 82001 Wäscheschirm Linomatic 500 Deluxe,"31,61","11,14",B004QF0Q8G,Wäschespinne Lift-O-Matic 50 M - 45 mm Rohr mit Metall-Bodenanker und Schutzhülle,"14,33","12,86",B00CIT6JZQ,Leifheit 85351 Wäscheschirm LinoLift 600,"7,11","4,37"
Amazon.de,füller,"99,42",B00OBC3QEA,"Pelikan 947366 Füller Twist, universell für Rechts- und Linkshänder, Feder M, silber","16,76","12,24",B003C1VQBG,"Parker S0161590 Jotter Füllfederhalter (edelstahl mit Chromeinfassung, mittlere Schreibfeder, Geschenkbox)","9,67","5,73",B000FA5DRK,"Lamy Füllhalter Safari umbra matt, Feder: F","6,97","1,55"
Amazon.de,gossip girl staffel 2,"99,42",B00ERL1K9I,,"96,16",0,B00ERMAPZ2,,"2,51",0,B003VDC0GK,Gossip Girl - Die komplette zweite Staffel [7 DVDs],"0,94",100
Amazon.de,jojo moyes,"99,42",3805250940,Ein ganz neues Leben,"23,85","6,44",3499267330,"Über uns der Himmel, unter uns das Meer","15,75",15,349926790X,Die Tage in Paris,"8,88","16,09"
Amazon.de,kindergartenrucksack,"99,42",B004LU19LE,"Lässig Mini Backpack Kinderrucksack Kindergartentasche Kindergarten Kleinkind Kind Vorschule mit Brustgurt, Namensschild und Utensilientasche, Brotdosenfach unten, Mushroom magenta Pink","13,19","5,29",B002L10NI0,"Jack Wolfskin Unisex - Kinder Rucksack Little Joe, night blue, 31 x 26 x 23 cm, 11 liters, 26221","7,73","3,28",B019XHEKOC,"Herlitz 11437670 Kindergartenrucksack rookie, butterfly","5,71","2,11"
Amazon.de,malen nach zahlen,"99,42",B001XCWHBY,"Ravensburger 27854 - Tiefer Schlaf - Malen nach Zahlen, 13 x 18 cm","6,22","2,6",B009ECBF3Q,"REEVES Malen nach Zahlen "" Artist Collection "" für Erwachsene, 30x40cm, 20 Farben, Motiv - Vögel","3,47","2,97",B00EYWXNVI,"Ravensburger 28242 - Pferde im Sonnenuntergang - Malen nach Zahlen, 18 x 24 cm","3,09","2,48"
Amazon.de,stichsäge,"99,42",B003DZ13JG,"Bosch DIY Stichsäge PST 900 PEL, 1 Sägeblatt T 144 D, Spanreißschutz, Koffer (620 W, Schnittiefe 90 mm Holz, 8 mm Stahl)","19,92","3,09",B00BEQ3VMS,"Makita Pendelhubstichsäge 135 mm, mit LED, 720W, 4351FCTJ","11,55","3,67",B003ASAF7M,"Bosch DIY Stichsäge PST 700 E DIY, 1 Sägeblatt T 144 D für Holz, Koffer (500 W, Schnitttiefe in Holz 70 mm, Schnitttiefe in Stahl 4 mm)","10,95","6,4"
Amazon.de,taschenkalender 2017,"99,42",3862294102,VintageArt 2017: Terminplaner,"6,68","1,47",3862294048,Timer Schwarz 2017: Terminplaner in Lederoptik,"6,06","1,06",3848515458,2017 SEI abenteuerlustig authentisch einfach du glücklich kreativ lebensfroh mutig optimistisch...: Terminplaner mit Wochenkalendarium,"5,3","1,95"
Amazon.de,thermomix,"99,42",3943807827,Mix ohne Fix!: Lieblingsgerichte aus dem Thermomix,"12,7","2,31",3868837728,Abnehmen mit dem Thermomix: Leichte Low-Carb-Küche zum Genießen,"11,71","2,42",394380786X,Leicht & Smart: Schlanke Gerichte aus dem Thermomix,"5,02","2,6"
Amazon.de,dect telefon,"99,41",B00EDQ4IMS,"Gigaset A415 Dect-Schnurlostelefon, schwarz","14,79","9,21",B01BBWWFB2,"AVM FRITZ!Fon C5 DECT-Komforttelefon für FRITZ!Box (hochwertiges Farbdisplay, HD-Telefonie, Internet-/Komfortdienste, Steuerung FRITZ!Box-Funktionen)","11,04","2,27",B00EHMDCTS,Gigaset C430A Duo Dect - Schnurlostelefon mit Anrufbeantworter (inkl. 1 zusätzlichen Mobilteil) schwarz,"9,02","3,26"
Amazon.de,fußballschuhe,"99,41",B00D853ODY,adidas Performance Predito LZ TRX FG Q21649 Herren Fußballschuhe,"8,95",0,B01GK0PH2O,,"8,09",0,B01IY7N1CE,,"4,37",0
Amazon.de,galaxy note 7,"99,41",B01JMLQZ42,"Samsung Galaxy Note 7 Smartphone (14,4 cm (5,7 Zoll) Display, 64 GB Speicher, Android 6.0) schwarz-onyx","57,07","61,49",B01I3S2FVC,,"24,05",0,B01JMLQTNO,"Samsung Galaxy Note 7 Smartphone (14,4 cm (5,7 Zoll) Display, 64 GB Speicher, Android 6.0) blau-coral","10,11","12,4"
Amazon.de,kühlbox 12v 230v,"99,41",B00TZXVBPG,Severin KB 2922 Elektrische Kühlbox / A++ / 41.6 cm Höhe / 70 kWh/Jahr / zum Kühlen und Warmhalten geeignet [Energieklasse A++],"15,88","6,74",B019PT5RW2,"MOBICOOL 9103501263 Elektrische Kühlbox für Auto und Steckdose V26 AC/DC A++, 12/230 Volt Anschluss, 25 Liter, Blau",13,"8,67",B01AT2FMJC,"MOBICOOL Elektrische Kühlbox für Auto und Steckdose V26 AC/DC, 12/230 Volt-Anschluss, 25 Liter, Grau","6,58","3,33"
Amazon.de,sonnenbrille herren,"99,41",B00KM3U7OO,"Dice Unisex Sonnenbrille, black, one size, D06210-25","15,37","11,19",B006J108VU,"Vans Herren Sonnenbrille M Spicoli 4 Shades, Black, One size, VLC0BLK","12,58","4,52",B00D2P0LNG,"Cressi Rocker, Sonnenbrille Herren Polarisiert mit Etui - Verspiegelt Version Erhältlich","4,31","2,37"
Amazon.de,tauchpumpe,"99,41",B00FAMEG4E,"Güde Schmutzwassertauchpumpe GS4002P mit var.Schwimmerschalter, 94630","14,39","8,37",B000OY6LS2,Gardena 1790-20 Classic Schmutzwasserpumpe 6000,"12,02","9,17",B00B18KAEQ,"Einhell Schmutzwasserpumpe GH-DP 6315 N (630 W, max. 17000 l/h, max. Förderhöhe 8 m, Fremdkörper bis 15 mm, Edelstahl-Pumpengehäuse)","9,17","12,55"
Amazon.de,wanduhr,"99,41",B008GBS0UC,"TFA 60.3017 Wanduhr, weiß","16,2","6,95",B004MDLECO,"Hama Funk Wanduhr PG-300 (automatische Zeitanpassung, automatische Zeitumstellung von Sommer- und Winterzeit, modernes Ziffernblatt) schwarz","7,69","2,63",B0039MHT4G,"TFA 60.3503.10 Wanduhr, Analog, Funk","4,59","2,56"
Amazon.de,durex,"99,4",B00N9W34X6,"Durex Gefühlsecht Kondome, 1er Pack (1 x 16 Stück)","27,54","10,77",B01DDO6M5G,"Durex Invisible,  extra dünne Kondome,  1er Pack (1 x 12 Stück)","13,35","9,14",B00KIQI5A8,"Durex Fun Explosion Kondome Megapack 40er Großpackung, 1er Pack (1 x 40 Stück)","10,36","7,02"
Amazon.de,kühlschrank mit gefrierfach,"99,4",B002V937D0,Bomann KS 163.1 Kühlschrank / A+ / Kühlen: 86 L / Gefrieren: 10 L / weiß,"12,39","15,09",B01AUM6NL2,Bomann KS 3261 Kühlschrank / A+ / 84 cm Höhe / 110 kWh/Jahr / weiß,"7,33","5,21",B008KFXHS4,Bomann KG 320 Kühl-Gefrier-Kombination / A++ / 163 kWh/Jahr / 112 L Kühlteil / 48 L Gefrierteil / weiß,"6,11","2,93"
Amazon.de,metallica,"99,4",B01KOHOD7O,Hardwired…To Self-Destruct (Deluxe Edition),"43,67","6,25",B01H803VH8,The Ultimate Roots of,"34,4","23,14",B01CUMG37Y,Liberte Egalite Fraternite:Live,"4,27","3,38"
Amazon.de,pürierstab,"99,4",B00A925G3A,"Bosch MSM66110 Ergonomischer Stabmixer mit Zubehör, Edelstahl-Mixfuß (600 Watt) sonstige","14,7","5,14",B00EQB0ZY0,"Braun MQ 745 Aperitive 7 Stabmixer (750 Watt, 0,6 Liter, Multiquick) schwarz","12,8","1,85",B007KIVDLK,"Bosch MSM66120 ergonomischer Stabmixer mit Zubehör, Edelstahl-Mixfuß QuattroBlade, 600 Watt","7,87","2,94"
Amazon.de,whiteboard,"99,4",B002W5VOJW,"Idena 568019 - Whiteboard Alu-Rahmen, ca. 40 x 60 cm, mit Stiftablage","27,72","8,36",B014PFRN9G,"AmazonBasics Magnetisches Whiteboard mit Stiftablage und Aluminiumleisten, trocken abwischbar, 90 x 60 cm (B x H)","17,67","13,86",B001J8JR8I,"magnetoplan Whiteboard SP 90 x 60 cm, in weiteren Größen auswählbar, mit speziallackierter Oberfläche, Metallrückwand, inklusive Befestigungsmaterial","14,52","9,71"
Amazon.de,black-roll,"99,39",B003BP5AGA,"Blackroll Standard Selbstmassagerolle, schwarz","28,18","10,51",B004E2TDHQ,"Blackroll Orange (Das Original) - Faszienrolle inkl. Übungs-DVD, Übungsposter & Booklet. Die Massagerolle für die Faszien, auch Foam Roller, Gymnastikrolle oder Fitnessrolle genannt, dient der Selbstmassage und gezielten Behandlung des Bindegewebes","23,32","6,51",B01IRAKI42,,"9,04",0
Amazon.de,cap,"99,39",B00CV31G34,,"20,44",0,B00BKVGBJM,Nike Kappe Metal Swoosh H86,"8,17",0,B004ZWNMWW,,"7,78",0
Amazon.de,tommy hilfiger damen,"99,39",B016Q9TDEM,"Tommy Hilfiger Damen Gürtel CLASSIC H BELT, Gr. 75 cm, Beige (NEW TAUPE 201)","3,68",0,B018HU1F9O,,"3,09",0,B01AXH8SUS,Tommy Hilfiger Damen K1285esha 6d Sneakers,"3,05",0
Amazon.de,federmäppchen,"99,38",B003PHF73A,"Eastpak Federmäppchen BENCHMARK, Sunday Grey, 6 x 20.5 x 7.5 cm","8,59",1,B01BUAM4GQ,"DAKINE Damen Accessory Case Federmäppchen, Wallflower, One Size","6,82","1,75",B000VZK4FK,"Eastpak Federmäppchen OVAL, 5 x 22 x 9 cm, Black","6,08","1,61"
Amazon.de,gästebuch hochzeit,"99,38",B003NWTMR4,"Walther GB-173 Gästebuch ""Puzzle"", Format 23 x 25 cm, 144 weiße Seiten, mit Ausschnitt für persönlichen Namen","13,87","8,84",B00GY8IEC8,"Liebes Brautpaar ...: Das Hochzeits-Gästebuch, das Spaß macht!","13,74","7,37",B008XCP0FC,Walther GB-123 Gästebuch Sweet Heart,"7,82","8,29"
Amazon.de,katzenspielzeug,"99,38",B00EQFRCAG,"catit 51096 Katzenspielzeug Play n Scratch mit Katzenminze, grün","11,98","5,01",B00A4A7UOU,"Catit Design Senses Play Circuit Kit, Spielschiene für Katzen","8,34","3,7",B001LWRFW2,Catit 50730 Senses Spielschiene für Katzen,"8,09","3,77"
Amazon.de,nackenkissen,"99,38",B00HZ10H2I,"daydream Reise-Nackenkissen mit Mikroperlen, schwarz","18,56","14,43",B00EL8FWSW,"daydream Reise-Nackenkissen (mit Mikroperlen), blau","17,42","13,34",B01DXHVMW6,"travelstar: Aufblasbares Nackenkissen mit Fleece-Bezug, schwarz","11,22","4,7"
Amazon.de,nikon d500,"99,38",B01AUBSY38,"Nikon D500 Digitale Spiegelreflexkamera (20.9 Megapixel, 8 cm (3,2 Zoll) LCD-Touchmonitor, 4K-UHD-Video) nur Gehäuse schwarz","61,84","25,14",B01AUBSWVW,"Nikon D500 Digitale Spiegelreflexkamera (20.9 Megapixel, 8 cm (3,2 Zoll) LCD-Touchmonitor, 4K-UHD-Video) Kit inkl. Nikkor AF-S DX 16-80mm 1:2;8-4 E VR ED Objektiv","17,46","16,16",B00NINZLKK,"Nikon D750 SLR-Digitalkamera (24,3 Megapixel, 8,1 cm (3,2 Zoll) Display, HDMI, USB 2.0) nur Gehäuse schwarz","4,8",0
Amazon.de,razer,"99,38",B00MVT7AYW,Razer BlackWidow Chroma Mechanische Gaming Tastatur (RGB Beleuchtet und voll programmbierbar mit 5 Macrotasten),"17,95","3,46",B00MXV1Q4I,Razer DeathAdder Chroma RGB beleuchtete Ergonomische Gaming Maus (10.000 dpi Sensor),"12,4","3,83",B00ZU1Z7DE,Razer Mamba Tournament Edition Chroma Ergonomische Gaming Maus (16.000 dpi Sensor mit 9 programmierbaren Tasten),"6,64","8,4"
Amazon.de,regenhose,"99,38",B002QUZL9W,"Regatta Packaway II, Athmungsaktive Überhose","25,29",0,B00DCKLX3I,,"10,31",0,B00F6O7D0U,,"6,16",0
Amazon.de,spülmaschine,"99,38",B0095WC4SU,"Bosch SMU53L15EU Serie 6 Silence Plus Unterbaugeschirrspüler / A++ / 258 kWh/Jahr / 12 Maßgedecke / 59,8 cm / Edelstahl / Drei-fach Wasserschutz","35,51","19,37",B00DKYB02U,Bosch SMS50D32EU Serie 4 Silence Plus Freistehender Geschirrspüler / A+ / 12 Maßgedecke / 290 kWh/Jahr / Weiß / Super Silence / Active Water,"8,82","10,69",B0095WBZXK,Siemens iQ500 SN45L501EU speedMatic Unterbaugeschirrspüler / A+ / 12 Maßgedecke / Edelstahl / AutomatikProgramm / VarioSpeed / GlasSchonsystem,"6,59","7,03"
Amazon.de,titanfall 2,"99,38",B01H08TGRC,Titanfall 2 [AT PEGI] - [PlayStation 4],"33,28","14,34",B01E5LFVY4,Titanfall 2 [PC],"27,49","37,12",B01HBK8GES,"Titanfall 2 ""Marauder Corps"" Collectors Edition Merchandise - ohne Spiel","9,72","7,68"
Amazon.de,dampfbügeleisen,"99,37",B004GUQ10I,Tefal FV4680 Dampfbügeleisen Ultragliss türkisblau,"26,23","4,61",B00M89TPZC,"Philips GC3811/70 Azur Performer Dampfbügeleisen, 2,400 W, 160 g Dampfstoß, SteamGlide Plus, weiß / türkis","13,5","3,98",B000HDV086,"Philips GC4410/02 Dampfbügeleisen (2400 W, SteamGlide-Bügelsohle) weiß/blau","6,06","2,17"
Amazon.de,pets,"99,37",B01J4ZUTFM,Pets,"44,95","11,01",B01J4ZUU74,Pets  (+ BR) [3D Blu-ray],"9,02","4,74",B01J4ZUTSO,Pets [Blu-ray],"6,54","6,2"
Amazon.de,regenjacke herren,"99,37",B01HI7PTIU,adidas Herren Regenjacke Core,"13,07",0,B00GJQU914,PUMA Herren Jacke Rain Jacket,"8,01",0,B004JV6I02,,"7,52",0
Amazon.de,wii,"99,37",B000UVI1G4,Nintendo Wii - Konsole weiß inkl. Wii Sports,"38,6",0,B005OK7NWO,"Nintendo Wii ""Family Edition"" - Konsole inkl. Wii Sports + Wii Party, weiß","14,13",0,B005TJBLSC,"Nintendo Wii ""Mario Kart Pack"" - Konsole inkl. Mario Kart, Wii Wheel, Remote Plus Controller, schwarz","9,63",0
Amazon.de,badelatschen,"99,36",B00I0SMD68,JAKO Herren Badelatschen Jakolette II,"11,39",0,B0122XI6NA,adidas Duramo Slide Unisex-Erwachsene Dusch & Badeschuhe,"10,84",0,B0122XI5HW,adidas Adilette Unisex-Erwachsene Dusch & Badeschuhe,"5,4",0
Amazon.de,garmin fenix 3,"99,36",B00S9G2RRQ,"Garmin fenix 3 GPS-Multisport Uhr (hochwertiges Design, zahlreiche Navigations & Sportfunktionen, GPS/GLONASS)","59,64","42,68",B01GG0C2D0,"Garmin fenix 3 HR GPS-Multisport-Smartwatch - Herzfrequenzmessung am Handgelenk, zahlreiche Navigations- & Sportfunktionen, GPS/GLONASS","13,79","13,4",B00S9G5KKM,"Garmin fenix 3 GPS-Multisport Uhr (hochwertiges Design, zahlreiche Navigations & Sportfunktionen, GPS/GLONASS)","11,69","24,12"
Amazon.de,gossip girl staffel 3,"99,36",B00ERMAPZ2,,"95,1",0,B0057LNSF6,Gossip Girl - Die komplette dritte Staffel [5 DVDs],"2,36",100,B00ERJKKTG,,"1,88",0
Amazon.de,handschuhe,"99,36",B004D3L87O,mumbi Touchscreen Handschuhe für kapazitive Displays Grösse L,"31,13",0,B00GGGD5RW,mumbi Touchscreen Handschuhe für kapazitive Displays Grösse S in rosa,"29,57",0,B00GGGD74I,mumbi Touchscreen Handschuhe für kapazitive Displays Grösse M in rosa,"29,38",0
Amazon.de,huawei g8,"99,36",B014W37JVS,mumbi Schutzhülle Huawei G8 / GX8 Hülle transparent weiss,"30,64",0,B014W376FC,mumbi ECHT Ledertasche Huawei G8 / GX8 Tasche Leder Etui (Lasche mit Rückzugfunktion Ausziehhilfe),"30,4",0,B014W37P80,mumbi Schutzhülle Huawei G8 / GX8 Hülle,"30,12","12,5"
Amazon.de,liebeskind,"99,36",B015AAZ3S8,"Liebeskind Berlin Rabia zip detail/washed cow Rabia zip Damen Kosmetiktäschchen 13x11x3 cm (B x H x T), Braun (toasted coffee 2809)","6,11","8,48",B015A9S37C,"Liebeskind Berlin Paula vintage suede fringes Paula fringes Damen Henkeltaschen 48x31x17 cm (B x H x T), Braun (cognac)","2,9",0,B0193HDPSE,"Liebeskind Berlin KiwiB vintage/woven veg Damen Kosmetiktäschchen 20cm x 13cm x 0.6 cm (B x H x T), Elfenbein (light powder 2004)","2,57","3,68"
Amazon.de,mikrofon,"99,36",B00AE4T0Q2,"Auna MIC-900B USB Kondensator Mikrofon für Studio-Aufnahmen inkl. Spinne (16mm Kapsel, Nierencharakteristik, 320Hz - 18KHz) schwarz","26,67","5,32",B005SHO2ZO,"Speedlink Capo Desktop und Hand Mikrofon (perfekt für Sprach- und Gesangsaufnahmen, inklusive Stativ, rauschunterdrückend, 3,5mm Klinke)","17,54","17,01",B0002KZAKS,Behringer Ultravoice XM8500 Dynamisches Gesangsmikrofon mit Nierencharakteristik,"9,02","17,5"
Amazon.de,verlängerungskabel,"99,36",B00GJP1X6A,"Meister Schutzkontakt-Verlängerung 5 m, weiß, 7432510","28,07","16,33",B0013NAPKI,"Brennenstuhl Kunststoff-Verlängerungskabel 3m weiß, 1161660","13,24","7,67",B00IUMTC9U,"Brennenstuhl Bremaxx Verlängerungskabel IP 44 20m rot, 1161760","5,92","2,91"
Amazon.de,druckerpapier,"99,35",B00FFU3HVY,"Avery Zweckform 2575 Drucker- und Kopierpapier A4 (80 g/m², 500 Blatt) weiß (Optimierte Schutzverpackung)","38,68","6,33",B00NEOJR3A,"Avery Zweckform 2575 Drucker- und Kopierpapier A4, 80 g/m², 5 x 500 Blatt, alle Drucker, weiß (Frustfreie Verpackung)","19,73","9,22",B01B7ZP10U,"Avery Zweckform 2575 Drucker- und Kopierpapier A4, 80 g/m², 500 Blatt, alle Drucker, weiß (Optimierte Schutzverpackung)","8,48","3,9"
Amazon.de,gehörschutz,"99,35",B002IV8I1C,"3M Kapselgehörschützer H510AC Peltor für Lärmpegel bis 98 dB, sehr leicht, stufenlos verstellbare Kopfbügel, gelb","16,61","11,17",B000VDX18E,"Peltor H540A-411-SV OPTIME III Kapselgehörschützer, schwarz/rot","15,75","9,42",B004RANCEA,3M Kapselgehörschutz Optime II,"6,98","8,13"
Amazon.de,gewürzregal,"99,35",B000T2AREI,Metaltex 364633095 Gewürzregal Pepito mit 3 Etagen,"16,92","10,16",B0002FCGMS,"Polder 18-Glas-Gew&uuml;rzregal, silberfarben","9,37","5,61",B00PJ2FMIO,"Ostmann Chrom-Gewürzregal gefüllt mit 21 Gewürzdosen, 1er Pack","8,2","0,58"
Amazon.de,kokosöl,"99,35",B013JOSM1C,"Mituso Bio Kokosöl nativ, 1er Pack (1 x 1 l)","54,36","12,84",B01EOUWB8A,"Danlee Kokosnussöl, kaltgepresst - nativ, 1er Pack (1 x 500 g)","13,93","7,04",B00GA2RZT6,"New World Gourmet Kokosöl - nativ, kaltgepresst 500 ml, 1er Pack (1 x 500 ml)","8,92","6,12"
Amazon.de,luftpumpe,"99,35",B001R4BQB0,"BETO Hochdruck Standpumpe, silber/schwarz","26,07","10,52",B000NCJEH0,"Intex Luftpumpe Hochleistungshandpumpe, Schwarz, 48 cm","20,63","5,11",B005C29L7O,"SKS Stand-Luftpumpe mit Manometer und Duokopf für alle Ventilarten Air X-Press, schwarz- grau, 560","8,12","2,47"
Amazon.de,samsung,"99,35",B012CC7ORK,"Samsung Galaxy J5 Smartphone (5 Zoll (12,7 cm) Touch-Display, 8 GB Speicher, Android 5.1) schwarz","31,44","6,54",B012CC7KY2,"Samsung Galaxy J5 Smartphone (5 Zoll (12,7 cm) Touch-Display, 8 GB Speicher, Android 5.1) gold","9,83","2,7",B018WFZ5N6,"Samsung Galaxy A5 (2016) Smartphone (5,2 Zoll (13,22 cm) Touch-Display, 16 GB Speicher, Android 5.1) gold","8,66",0
Amazon.de,samsung galaxy s7 edge hülle,"99,35",B01CUFNH6G,mumbi double GRIP Hülle für Samsung Galaxy S7 Edge Schutzhülle schwarz,"35,18","12,31",B01C42FH4A,mumbi UltraSlim Hülle für Samsung Galaxy S7 Edge Schutzhülle transparent (Ultra Slim - 0.55 mm),"17,96","9,6",B01A5OU154,mumbi Hülle für Samsung Galaxy S7 Edge Schutzhülle,"7,26","8,46"
Amazon.de,warcraft,"99,35",B01FYOWT4Q,Warcraft: The Beginning [Blu-ray],"71,82","15,72",3833232641,World of Warcraft: Chroniken Bd. 1,"5,86","13,37",3833232668,Warcraft: Durotan - Die offizielle Vorgeschichte zum Film (Warcraft Kinofilm),"4,44","13,56"
Amazon.de,die bestimmung,"99,34",B01CJZSMTE,Die Bestimmung – Allegiant [Blu-ray] [Deluxe Edition],"33,66","9,81",B01CJZSCY4,Die Bestimmung – Allegiant [2 DVDs],"14,61","6,53",B00UWHRS60,Die Bestimmung - Insurgent [Deluxe Fan Edition] [Blu-ray],"14,3","13,92"
Amazon.de,gartenschlauch,"99,34",B004Z54Y94,Gardena 8009-20 Classic Wand-Schlauchtrommel 50 Set,"30,09","3,35",B006YTU1XC,Gardena 2692-20 Schlauchwagen-Set,"9,32","6,43",B004I6AK66,Gardena 8010-20 Classic Schlauchtrommel 10 Set,"6,93","1,64"
Amazon.de,heizlüfter,"99,34",B00MFEHQJ2,"Rowenta Heizlüfter Instant Comfort Aqua, SO6510","20,54","6,71",B004540AWU,Clatronic Heizlüfter HL 3378,"10,2","6,14",B0043VVZJ2,Bomann HL 1096 CB Heizlüfter,"9,23","6,88"
Amazon.de,mähroboter,"99,34",B006MWDNVI,"Gardena Mähroboter R40Li, 4071-20","24,07","20,23",B00BCMCIS2,"Gardena Mähroboter R 70 Li, 04072-20","16,05","28,91",B00IS5VXJQ,,10,0
Amazon.de,polar m600,"99,34",B01JOKD3J6,"POLAR Smartwatch M600, Black, M/L, 90061186","72,82","96,78",B00OBZKT2E,"POLAR Trainingscomputer M400 HR, Schwarz, 90051341","6,02","1,75",B01JOKD44U,"POLAR Smartwatch M600, White, M/L, 90062398","4,57",0
Amazon.de,schulsachen,"99,34",B00C580LQS,"Brunnen 1027348 Haftnotizblock Schoko (mit abgebissener Ecke, mit 100 Haftnotizen)","13,17","12,66",3888979145,Mach dieses Buch fertig: Erweiterte Neuausgabe,"10,77","0,21",3956140354,Kalender für kontrolliertes Chaos,"8,32","4,29"
Amazon.de,tischkreissäge,"99,34",B017A1N6MU,"Einhell Tischkreissäge TC-TS 2025 U (1800 W, Sägeblatt Ø 250 x Ø 30 mm, max. Schnitthöhe 85 mm, Tischgröße 640x487 mm)","21,54","16,3",B0081C02IO,"Bosch DIY Tischkreissäge PTS 10 T, Untergestell, Spaltkeil, Tischverlängerung, Winkelanschlag, Absaugschlauch, Karton (1400 W, Kreissägeblatt Nenn-Ø  254 mm, Schnitttiefe bei 90° 75 mm)","11,49","5,08",B00MX58NT0,"Makita Tischkreissäge 315 mm, 2712","5,66","7,45"
Amazon.de,galaxy j5 hülle,"99,33",B00ZRJAH6Q,mumbi Schutzhülle Samsung Galaxy J5 (2015) Hülle,"32,44","2,21",B00ZRJA67G,mumbi Schutzhülle Samsung Galaxy J5 (2015) Hülle transparent schwarz,"31,61","2,8",B00ZRJ9YRY,mumbi Schutzhülle Samsung Galaxy J5 (2015) Hülle transparent weiss,"31,25","2,36"
Amazon.de,gardena bewässerungssystem,"99,33",B0035X1RW4,Gardena 8255-20 Sprinklersystem Start-Set für Garten-Pipeline,"11,52","4,77",B0001E3S36,Gardena 01243-20 Funkzentrale,"7,56","10,08",B00GHEH8OE,"Gardena Bewässerungsuhr EasyControl, 01881-20","7,26","4,4"
Amazon.de,hoverboard,"99,33",B01K14YIJI,,"31,46",0,B011QM88XQ,"Ninebot One E+ Solowheel, Wei&szlig;","13,88",0,B01EYURP2W,,"9,96",0
Amazon.de,kindle fire,"99,33",B00ZDWLEEG,"Fire-Tablet, 17,7 cm (7 Zoll) Display, WLAN, 8 GB (Schwarz) - mit Spezialangeboten","36,68","6,79",B018Y22I00,"Fire-Tablet, 17,7 cm (7 Zoll) Display, WLAN, 16 GB (Schwarz) - mit Spezialangeboten","17,4","19,61",B00ZAPLERS,"Fire HD 10-Tablet, 25,65 cm (10,1 Zoll), HD-Display, WLAN, 16 GB (Schwarz) - mit Spezialangeboten","9,94","10,81"
Amazon.de,magnettafel,"99,33",B00191X1MI,"Herlitz 10524627 Whiteboard und Magnettafel (silbernen Holzrahmen, 40 x 60cm) weiß","24,69","12,39",B001OQ9BUO,"Zeller 11120 Magnettafel, Edelstahl / 40 x 60","8,88","12,74",B0083UAY82,"Sigel GL169 Glas-Magnetboard / Magnettafel artverum Design Schiefer-Stone, 48 x 48 cm - weitere Designs/Größen auswählbar","8,07","3,96"
Amazon.de,smaragdgrün,"99,33",B01GS706S4,Smaragdgrün,"48,2","21,37",B01HE16JHK,,"30,4",0,3401063480,Liebe geht durch alle Zeiten 03. Smaragdgrün (Kerstin Gier Fantasy-Romane),"7,07","32,82"
Amazon.de,3d drucker,"99,32",B017EU3PF0,Wanhao Duplicator i3 3D-Drucker,"16,96","5,37",B00ZAD8II8,"Dremel 3D-Drucker Idea Builder, Filamentspule weiß, Stromkabel, USB-Kabel, SD-Karte, Spulenarretierung, Druckmatte, Nivellierblatt, Reinigungsdorn","16,92",0,B00OG3LWJK,"BQ 05BQKIT040 Kit Prusa i3 Hephestos 3D Drucker, PLA/HIPS/FilaFlex, Rot","10,76","26,85"
Amazon.de,gürteltasche,"99,32",B000NDGCCO,"Eastpak Gürteltasche Springer, black, 2 liters, EK074008","18,08","3,49",B00AWPXT4C,"Jack Wolfskin Unisex Hüfttasche Hokus Pokus, black, 17 x 16 x 3cm, 2 liter, 86472","13,73","9,19",B000UDNRT8,"Eastpak Gürteltasche DOGGY BAG, 3 liter, Black","11,88","5,67"
Amazon.de,logitech headset,"99,32",B00CJ5FPUE,Logitech G430 Gaming Kopfhörer (Dolby 7.1-Surround-Sound für PC und PS4) blau,"33,36","9,27",B015HG77FC,"Logitech G933 Artemis Spectrum Kabelloses professionelles Gaming Kopfhörer (mit 7.1-Surround-Sound, 2,4-GHz-Verbindung) schwarz","18,25","2,2",B00CJ5FPS6,"Logitech G930 PC-Gaming Kopfhörer (schnurlos, für PC) schwarz","11,68","1,64"
Amazon.de,netatmo,"99,32",B0098MGWA8,"Netatmo Wetterstation für iPhone, Android und Windows Phone","33,75","20,98",B00X5CMMUQ,"Netatmo Welcome, WLAN Kamera mit Gesichtserkennung, NSC01-EU","19,4","8,33",B00D89YKBK,Netatmo Zusätzliches Modul für Wetterstation,"9,54","14,4"
Amazon.de,samsung galaxy j5 schutzhülle,"99,32",B00ZRJAH6Q,mumbi Schutzhülle Samsung Galaxy J5 (2015) Hülle,"32,73","1,55",B00ZRJ9YRY,mumbi Schutzhülle Samsung Galaxy J5 (2015) Hülle transparent weiss,"32,7",0,B00ZRJA67G,mumbi Schutzhülle Samsung Galaxy J5 (2015) Hülle transparent schwarz,"32,23","3,91"
Amazon.de,seifenspender,"99,32",B000KJOHHS,"Inno Bathroom DS1PEUW001 Seifenspender ""Smart"", 500 ml","9,46","5,8",B00TQQ49MY,"Wenko 21719100 Seifenspender Goa, Kunststoff - Polyresin, 9 x 16 x 7,4 cm, grau","7,54","2,97",B0037WX4YC,"Zeller 18316 Seifenspender ""Schiefer"", Polyresin, 8 x 8 x 16 cm, schwarz","5,45","3,84"
Amazon.de,spiegelschrank,"99,32",B01CUAS9O6,"Schildmeyer 133076 Spiegelschrank Holz, esche grau Dekor, 70 x 17 x 67 cm","14,53","11,12",B00MAGDPPY,"trendteam CP50391 Badezimmerspiegelschrank Eiche San Remo Nachbildung, BxHxT 60x80x15 cm, weiß","6,58","9,26",B00KIKITRI,"trendteam NL50301 Badezimmerspiegelschrank Weiß Nachbildung, BxHxT 65x80x21 cm","5,09","12,97"
Amazon.de,stirnlampe,"99,32",B00UAJ2CXO,"Petzl Stirnlampe Tikkina, Black, E91HNE","55,14","22,6",B00FYVF62C,"LED Lenser H7R.2 Box, Stirnlampe","5,48","0,89",B00UAJ2B8A,"Petzl Stirnlampe Tikka, black, One size, E93HNE","4,07","4,19"
Amazon.de,treppenschutzgitter,"99,32",B00GO4N698,Hauck 597026 Open'n Stop Safety Gate,"19,42","6,87",B00PAVXCS6,"Hauck Türschutzgitter Squeeze Handle Safety Gate 75 cm - 81 cm + 14 cm Verlängerung, weiss","10,73","3,96",B000V6N1IQ,Geuther - Treppenschutzgitter 2733,"8,87","9,57"
Amazon.de,usb verlängerung,"99,32",B00NH136GE,"AmazonBasics USB 2.0-Verlängerungskabel A-Stecker auf A-Buchse, 2 m","37,42","11,47",B00NH11PEY,AmazonBasics USB 2.0 Verlängerungskabel A-Stecker auf A-Buchse (3 m),"15,9","10,17",B00NH13UFQ,AmazonBasics USB 3.0-Verlängerungskabel (A-Stecker auf A-Buchse) 1 m,"12,98","10,09"
Amazon.de,vorhängeschloss,"99,32",B004ZZTJFS,"ABUS Aluminium-Vorhangschloss myLock 508714 T65AL/40, schwarz","22,04","8,07",B007VL757W,Abus 561986 Hangschloss 64TI/45,"7,89","5,25",B0001MQPFG,ABUS 9345 Kombinations-Zahlenschloss 155/30SB/F Größe: 30 mm,"7,79","3,75"
Amazon.de,waage,"99,32",B003CT4XS6,Soehnle 61350 PWD SilverSense Digitale Personenwaage,"26,34","8,41",B003J367QG,Clatronic PW 3368 Personenwaage,"17,82","10,29",B00OVUQ8HY,Medisana PS-72E Personenwaage,"10,07","5,09"
Amazon.de,gossip girl staffel 5,"99,31",B00ERNKHJ0,,"95,6",0,B00B17G9F6,Gossip Girl - Die komplette fünfte Staffel [5 DVDs],"2,6","95,68",B00J361KMY,,"1,12",0
Amazon.de,notstromaggregat,"99,31",B01GM0VEII,,14,0,B01BDGR1LA,,"9,64",0,B00DSB7EPW,"Matrix Stromgenerator, 160100470","8,13","15,61"
