Abteilung,Suchbegriff,Suchhäufigkeit,ASIN,Nr. 1 der geklickten Titel,Klickfreigabe,Umwandlungs-Anteil,ASIN,Nr. 2 der geklickten Titel,Klickfreigabe,Umwandlungs-Anteil,ASIN,Nr. 3 der geklickten Titel,Klickfreigabe,Umwandlungs-Anteil
Amazon.de,gartenschlauch,"99,15",B004Z54Y94,Gardena 8009-20 Classic Wand-Schlauchtrommel 50 Set,"25,4","7,49",B006YTU1XC,Gardena 2692-20 Schlauchwagen-Set,"10,71","3,37",B00HPXVE2S,"Gardena Classic Schlauch, 13 mm, 1/2 Zoll, 30 m ohne Systemteile, 18009-20","8,48","11,07"
Amazon.de,kollegah imperator,"99,15",B01LCPWZKE,Imperator (Deluxe Box),"95,82","25,05",B01I5HSTS4,DREAMS (Limited Deluxe Box),"1,48","0,96",B01CRKPZC8,Vibe,"0,88","1,32"
Amazon.de,laptop rucksack,"99,15",B00EEBS9O0,"AmazonBasics Laptop-Rucksack geeignet für bis zu 43,2 cm (17 Zoll)","21,74","13,57",B001V5JAXG,"Belkin Notebook-Rucksack (geeignet für Notebooks bis zu 43,2 cm (17 Zoll)) kohlenschwarz/weinrot","10,42","9,46",B002J9HBSE,"Case Logic VNB217 Notebook Backpack 43,9 cm (17,3 Zoll) Rucksack Schwarz","7,25","16,28"
Amazon.de,monitor 27 zoll,"99,15",B00IZBIMLK,"BenQ GL2760H 68,6 cm (27 Zoll) LED Monitor (Full-HD, Eye-Care, HDMI, VGA, 2ms Reaktionszeit) schwarz","17,79","21,17",B01BCF09R0,"Samsung LC27F396FHUXEN 68,6 cm (27 Zoll) LED Monitor (VGA, HDMI, 4ms Reaktionszeit) schwarz/silber","12,84","5,72",B00S63S4EM,"Acer S271HLAbid 69 cm (27 Zoll) Monitor (DVI, HDMI, Full HD, 2ms Reaktionszeit, EEK B) schwarz","7,98","13,35"
Amazon.de,netgear arlo,"99,15",B00TDNYNP8,"NETGEAR Arlo VMS3230-100EUS Smart Home 2 HD-Überwachung Kamera-Sicherheitssystem (100% kabellos, Indoor/Outdoor, Bewegungssensor, Nachtsicht) weiß","31,43","5,11",B01DVVY81Q,"NETGEAR Arlo VMS3430-100EUS Smart Home 4 HD-Kamera-Sicherheitssystem  Überwachung (100% kabellos, Indoor/Outdoor, sensor, Nachtsicht) weiß","16,31","15,32",B00TDNYNN0,"NETGEAR Arlo VMS3330-100EUS Smart Home 3 HD-Überwachung Kamera-Sicherheitssystem (100% kabellos, Indoor/Outdoor, Bewegungssensor, Nachtsicht) weiß","16,04","7,99"
Amazon.de,pets,"99,15",B01J4ZUTFM,Pets,"57,67","18,82",B01J4ZUTSO,Pets [Blu-ray],"10,5","12,35",B01J4ZUU74,Pets  (+ Blu-ray) [Blu-ray 3D],"8,07","5,37"
Amazon.de,regenjacke,"99,15",B004JV6I02,,"15,06",0,B005G3KC6S,,"12,41",0,B0052X4O4I,"The North Face Herren Jacke M Resolve Jacket, Tnf Black, XL, 0027906714060","11,96","8,82"
Amazon.de,samsung galaxy note 7,"99,15",B01I3S2FVC,,"25,66",0,B00R5W51SW,"Samsung Galaxy Note Edge Smartphone (14,2 cm (5,6 Zoll) Super-AMOLED-Display, 2,7GHz Quad-Core Prozessor,  32 GB interner Speicher, 16 Megapixel-Kamera, Android 4.4) frost white","22,31",0,B01JMLQTNO,"Samsung Galaxy Note 7 Smartphone (14,4 cm (5,7 Zoll) Display, 64 GB Speicher, Android 6.0) blau-coral","20,08","11,12"
Amazon.de,trachtenschuhe damen,"99,15",B01AXEMZWI,,"4,99",0,B01F72IXDG,,"3,89",0,B00WGW82XW,Bergheimer Trachtenschuhe Rosi Damen Pumps,"3,89",0
Amazon.de,xbox,"99,15",B01H0NKK2W,Xbox One S 2TB Konsole mit 4K Blu-ray Player,"27,83","36,84",B01KAGPBB6,Xbox One S 500GB Konsole - FIFA 17 Bundle,"24,91","17,75",B016ZLYVKM,Xbox One 500 GB Konsole 2015,"9,28","22,67"
Amazon.de,zahlenschloss,"99,15",B0001MQPFG,"Abus 9345 Kombinations-Zahlenschloss 155/30SB/F, 30 mm","26,03","8,78",B0001MQQZK,"Abus 20128 Messing Zahlenschloss 165/40SB, 40 mm","14,73","7,98",B004V94G8I,"Abus 535178 155/30 Zahlen-Vorhangschloss mit verstellbarem Code, schwarz","6,68","2,74"
Amazon.de,adidas superstar damen,"99,14",B00UCYWY1C,adidas Originals Superstar Unisex-Kinder Sneakers,"15,26",0,B0123RCI5C,adidas Superstar Foundation Herren Sneakers,"7,39",0,B0122XIV6C,adidas Superstar Foundation Unisex-Erwachsene Sneakers,"5,91",0
Amazon.de,kühltasche,"99,14",B004MW50UM,"Campingaz Kühltasche Picnic Cooler, 28 Liter, 46,5 x 32 x 35 cm","10,08","10,99",B00AGAG2UQ,"Campingaz Kuehltasche Fold N Cool, dunkelblau/grau, 20 Liter, 32 x 20 x 37 cm","8,3","9,26",B001QB2U4G,"Ezetil Kuehltasche 10 723120  KC Professional 12,schwarz/beige, 37 x 22,5 x 27 cm","7,52",0
Amazon.de,masturbator,"99,14",B01ICI2HCK,,"16,6",0,B001GHGG5O,You2Toys Masturbator Oxana Pussy and Ass - lebensechter Torso-Masturbator für Herren mit extra enger Vagina und Anus,"6,06","4,21",B0124QFLB0,,"5,56",0
Amazon.de,sonnenbrille herren,"99,14",B00CO4APBO,"Cressi Herren Sonnenbrille Ninja Floating, schwarz, DB100001","17,15","6,12",B00D2P0LNG,"Cressi Unisex Wassersportbrille Rocker, schwarz, M, DB100011","12,03","6,17",B00KM3U7OO,"Dice Unisex Sonnenbrille, black, one size, D06210-25","10,78","3,7"
Amazon.de,stromerzeuger,"99,14",B01BDGR1LA,,"8,55",0,B01GM0VEII,,"7,66",0,B00Y2UK9GO,"Matrix Stromgenerator, 160100720","4,74","22,22"
Amazon.de,switch,"99,14",B000FNFSPY,TP-Link TL-SF1005D Netzwerk Switch 5x 10/100MBit/s RJ45 ports [Amazon frustfreie Verpackung],"22,7","12,87",B00A128S24,"TP-Link TL-SG105 5-port Metal Gigabit Switch(10/100/1000M RJ45 ports, lüfterloses Passivkühlkonzept)","19,52","10,41",B00A121WN6,"TP-Link TL-SG108 8-port Metal Gigabit Switch(10/100/1000M RJ45 ports, lüfterloses Passivkühlkonzept)","9,33","6,41"
Amazon.de,bioshock,"99,13",B01HXPVE8Q,BioShock - The Collection - [PlayStation 4],"56,37","17,76",B01JZQ9A8W,BioShock - The Collection - Steelbook Edition (exklusiv bei Amazon.de) - [PlayStation 4],"15,75","16,45",B01HXPVQ7A,BioShock - The Collection - [Xbox One],"9,73","8,06"
Amazon.de,burton rucksack,"99,13",B00K76NTH8,"Burton Daypack KILO, Grey Heather, 30 x 15 x 44.5 cm, 27 Liter, 13649100079","9,63","4,11",B00K76OYTU,"Burton Daypack TREBLE YELL, True Black, 31 x 17 x 47 cm, 21 Liter, 14379100002","8,04","3,81",B00UN3DMP4,"Burton Daypack EMPHASIS, True Black, 31 x 19 x 47 cm, 26 Liter, 16328100002","7,87","6,02"
Amazon.de,fahrradträger für anhängerkupplung,"99,13",B00I9RTRJQ,Thule 915020 EuroPower 915 Anhängerkupplungs-Fahrradträger,"18,47","4,77",B003DTL84C,"Thule EuroRide 940, Anhängerkupplungs-Fahrradträger","14,37","11,65",B005F2YPO0,Atera 022685 Fahrradträger Strada Sport M 3 - Kupplungsträger,"9,44","6,23"
Amazon.de,mini pc,"99,13",B01C3O2C1A,"Asus VivoMini UN45-VM014M 90MS00L1-M00140 Barebone Mini-PC (Intel Celeron N3000,  2GB DDR3, 32GB M.2 SSD, HDMI, Win 10) midnight blau","13,96","31,24",B007N5FO88,Mini-Q PC-Q05 - Mini Tower - Thin mini ITX,"10,73",0,B00R0ZT1ZS,"Asus Chromebox-M118U Mini Desktop-PC (Intel Celeron 2955U, 2GB RAM, 16GB HDD, Chrome OS) schwarz","6,74","13,39"
Amazon.de,playmobil mädchen,"99,13",B0077QT4VG,Playmobil 5167 - Mein Neues Mitnehm-Puppenhaus,"9,67","3,29",B01608LE5A,"PLAYMOBIL 6179 - Einhornköfferchen Feenland, Spielwerkzeug","7,61","10,11",B00O4E3078,"PLAYMOBIL 6159 - Aufklapp-Spiel-Box ""Sonnenterrasse""","6,55","4,62"
Amazon.de,prison break staffel 2,"99,13",B00ILH91TA,,"95,97",0,B006OV6WVU,Prison Break - Die komplette Season 2 [6 DVDs],"1,81","68,42",B00ILHB9XQ,,"0,68",0
Amazon.de,s7 edge hülle,"99,13",B01CUFNH6G,mumbi double GRIP Hülle für Samsung Galaxy S7 Edge Schutzhülle schwarz,"34,51","8,99",B01C42FH4A,mumbi UltraSlim Hülle für Samsung Galaxy S7 Edge Schutzhülle transparent (Ultra Slim - 0.55 mm),"16,46","14,42",B01A5OU154,mumbi Hülle für Samsung Galaxy S7 Edge Schutzhülle,"12,45","17,98"
Amazon.de,tennisbälle,"99,13",B00IIP4AB4,"Wilson Tennisbälle Tour Practice 4er, Gelb, 6, WRT114500","24,69","14,96",B001GM5286,Head Radical Tennisball (3 x 4 Stück),"20,43","14,73",B000W8G4JG,"Head Tennisbälle Championship, Gelb, 4er Dose, 489750042","12,5","9,43"
Amazon.de,zelda,"99,13",B00KX8DQIM,The Legend of Zelda: Breath of the Wild  - [Wii U],"32,29","19,54",1506703356,The Legend of Zelda: Art & Artifacts,"6,09","1,46",B01FWK09UI,The Legend of Zelda: Ocarina of Time 3D - Nintendo Selects - [3DS],"4,93","3,25"
Amazon.de,bosch küchenmaschine,"99,12",B0041G5R3Y,"Bosch MUM56340 Küchenmaschine Styline MUM5 (900 Watt, Edelstahl-Rührschüssel, Durchlaufschnitzler, Rühr-Schlagbesen und weiteres Zubehör) silber","23,9","3,7",B000VSXPNU,"Bosch MUM4427 Küchenmaschine MUM4 (500 Watt, 3,9 Liter) weiß","15,71","8,6",B004MPQQ0C,"Bosch MUM48A1 Küchenmaschine MUM4 (600 Watt, 3.9 Liter, Edelstahl-Rührschüssel, Durchlaufschnitzler, Rezept DVD) schwarz","10,63","8,82"
Amazon.de,kabeltrommel,"99,12",B00475BHVA,"as - Schwabe Kabeltrommel, 25m Kabel, mit Schutzkappen, 16a, 10118","17,1","3,96",B0009WDTMU,"Brennenstuhl Garant S IP44 Kabeltrommel outdoor 50m, 1198530","16,1","1,46",B00234VXSO,"as - Schwabe Kabelbox, Mini-Kabeltrommel, 10m, IP20 Indoor, 16 A, 16094","6,98","8,33"
Amazon.de,kindergartenrucksack,"99,12",B004LU19LE,"Lässig Mini Backpack Kinderrucksack Kindergartentasche Kindergarten Kleinkind Kind Vorschule mit Brustgurt, Namensschild und Utensilientasche, Brotdosenfach unten, Mushroom magenta Pink","13,53","8,36",B00PIWZ7T4,"Jack Wolfskin Unisex - Kinder Rucksack Buttercup, night blue, 28 x 22 x 18 cm, 4,5 liters, 2003761","8,78","7,33",B019XHEKOC,"Herlitz 11437670 Kindergartenrucksack rookie, butterfly","7,61","10,89"
Amazon.de,oculus rift vr,"99,12",B00ZFOGHRG,Oculus Rift,"64,83","97,1",B01GVXJJWY,,"17,63",0,B01HP63ACQ,,"3,18",0
Amazon.de,schlüsselkasten,"99,12",B005CFZGES,"BURG-WÄCHTER, Wand-Schlüsselbox, 10 Haken, Praktischer Magnetverschluss, Edelstahl, Höhe: 240 mm, Quad 6204/10 Ni","18,02","7,41",B006514HKM,"Pavo 8027040 Schlüssel-Kasten/Schrank, 54 Haken mit seitlichem Schlüsseleinwurf, dunkelgrau","13,53","11,66",B001F1AIIC,"Zeller 13846 Schlüsselkasten ""Schlüssel"", Buche/Edelstahl / 21,5 x 5,5 x 24,5 cm","10,21","9,33"
Amazon.de,eos 80d,"99,11",B01C2XJVPC,"Canon EOS 80D SLR-Digitalkamera (24,2 Megapixel, 7,7 cm (3 Zoll) Display, APS-C CMOS Sensor, 45 AF-Kreuzsensoren, DIGIC 6 Bildprozessor, NFC und WLAN, Full HD) nur Gehäuse schwarz","60,8","12,17",B01C2XJWZ6,"Canon EOS 80D SLR-Digitalkamera (24,2 Megapixel, 7,7 cm (3 Zoll) Display, DIGIC 6 Bildprozessor, NFC und WLAN, Full HD) Kit inkl. EF-S 18-55mm 1:3,5-5,6 IS STM, schwarz","21,96","53,91",B00SH1TIAW,"Canon EOS 6D SLR-Digitalkamera (20,2 Megapixel, CMOS-Vollformatsensor, 7,6 cm (3 Zoll) Display, Full-HD) Kit inkl. 24-105 mm IS STM, schwarz","2,71",0
Amazon.de,jogginghose damen,"99,11",B007PMEO2G,erima Damen Hose Sweathose Mit Bündchen,"12,66",0,B00G4CBSM2,,"6,4",0,B002HVJWC2,,"5,27",0
Amazon.de,hundespielzeug,"99,1",B0054Q9TMA,"Trixie Dog Activity Flip Board Strategiespiel für Hunde, 23 cm","11,84","2,67",B000958670,"Trixie 3499 Spielset Sun'n'Fun für Hunde, 4 Teile","9,05","2,8",B0029EWVES,"Trixie 35912 Geier ""Gustav"", Plüsch, 28 cm","4,98","2,67"
Amazon.de,kappsäge,"99,1",B00BLZXOVU,"Einhell Zug Kapp Gehrungssäge TC-SM 2131 Dual (1800 W, Sägeblatt Ø 210 mm, Schnittbreite 310 mm, schwenkbarer Sägekopf, Laser)","21,47","16,7",B00NA054EE,"Metabo Kappsäge KGS 216 M, 6.19260.00","17,74","8,06",B00N9ZXT10,"Metabo Kappsäge KGS 254 M, 6.02540.00","8,13","4,12"
Amazon.de,lenkrad,"99,1",B00YUIM2J0,"Logitech G29 Racing Lenkrad Driving Force für PS4, PS3 und PC",19,"0,85",B000LY293Q,"Hama PC-Racing-Wheel ""Thunder V18"", mit Gas und Bremspedal, mit USB-Anschluss","12,34","29,73",B00ANHE7CW,"Speedlink Drift O.Z. Lenkrad für PC (Schaltknauf, Gas- und Bremspedale, XInput und DirectInput, Vibrationsfunktion, einstellbare Lenk-Empfindlichkeit)","8,65","12,61"
Amazon.de,pc lenkrad,"99,1",B000LY293Q,"Hama PC-Racing-Wheel ""Thunder V18"", mit Gas und Bremspedal, mit USB-Anschluss","12,68","9,85",B00YUIM2J0,"Logitech G29 Racing Lenkrad Driving Force für PS4, PS3 und PC","9,6","0,19",B00ANHE7CW,"Speedlink Drift O.Z. Lenkrad für PC (Schaltknauf, Gas- und Bremspedale, XInput und DirectInput, Vibrationsfunktion, einstellbare Lenk-Empfindlichkeit)","7,98","4,7"
Amazon.de,raclette,"99,1",B000JUF98Y,"Severin RG 2341 Raclette-Partygrill mit Naturgrillstein (1500 Watt, 8 Pfännchen), schwarz","18,45","10,3",B007HMT43I,"Severin RG 2343 Raclette - Partygrill mit Naturgrillstein, schwarz","9,85","5,93",B00MOIFBN2,"Severin RG 9640 Raclette-Grill mit Naturgrillstein, schwarz","9,4","5,46"
Amazon.de,tischtennisbälle,"99,1",B0012QOX18,JOOLA Tischtennis-Bälle Training 40 weiss 12er Blister,"26,87","11,65",B002A9N7UY,75 Tischtennisbälle 38mm ohne Aufdruck weiss stabiles Material,"18,2","15,25",B00PI0I5E0,"Donic-Schildkröt Tischtennis-Ball T-One Training 12er Pack, weiß-orange, 40 mm, 618045","8,01","5,37"
Amazon.de,tommy hilfiger herren,"99,1",B005OQKS7A,Tommy Hilfiger Herren Poloshirt,"6,46",0,B008R7LOTY,Hilfiger Denim Herren T-Shirt Slim Fit Panson vn tee s/s KIR / 1957826352,"5,22",0,B00H5FNEFG,Hilfiger Denim Herren Poloshirt Pilot polo flag s/s KIR 1957826350,"4,53",0
Amazon.de,cody mcfadyen,"99,09",3785725663,"Die Stille vor dem Tod: Thriller (Smoky Barrett, Band 5)","76,47","8,16",3404158539,Die Blutlinie: Smoky Barretts 1. Fall,"7,11","13,64",3404165810,Ausgelöscht: Thriller: Smoky Barretts 4. Fall,"3,31","8,19"
Amazon.de,dash button,"99,09",B01I29J290,Ariel Dash Button,"34,8","3,16",B01I29706W,Durex Dash Button,"12,88","4,67",B01I29WVRU,Gillette Dash Button,"11,13","4,63"
Amazon.de,schrittzähler,"99,09",B00KQCQ7F4,Omron Schrittzähler Walking style IV,"32,79","39,78",B00MOIUV28,"Runtastic ORBIT Ersatzarmbänder Color Set 3  (Grün, Grau, Weiß)","11,08","5,12",B008EHB5PU,Omron Schrittzähler Walking style One 2.1,"8,62","9,39"
Amazon.de,t-shirt,"99,09",B005B8M3WY,Fruit of the Loom Herren T-Shirt 5 er PackRegular Fit 11182V,"16,87",0,B00361NEHQ,,"11,03",0,B01II1H3YS,,"9,57",0
Amazon.de,terminplaner,"99,09",3862294102,VintageArt 2017: Terminplaner,"12,6","3,42",3862294048,Timer Schwarz 2017: Terminplaner in Lederoptik,"9,36","2,05",3866793197,Chäff Family-Timer 2016/2017  - Der Familien-Planer! 18 Monate Jul 2016 - Dez 2017,"4,96","2,25"
Amazon.de,barttrimmer,"99,08",B000OS72Y0,Remington MB320C Bartschneider-Set,"23,75","5,64",B00ROSVV7M,"Philips Series 1000 MG1100/16 Multigroom (Präzisionstrimmer, Click On Bartstyler)","11,52","6,86",B011N0VYTG,"Philips BT405/15 Bartschneider Series 1000, 20 Längeneinstellungen","9,49","6,37"
Amazon.de,fahrradlampe,"99,08",B004CJ81MO,"Sigma Sport Beleuchtungsset Micro Combo, 17243","29,21","7,05",B004CJ81ME,"Sigma Sport Unisex Sport-Beleuchtung LED, schwarz, 17241","12,85","6,01",B009P15B0O,"Büchel Scheinwerfer Road Lite, mit Schalter, schwarz, 51250760","8,34","17,89"
Amazon.de,heizdecke,"99,08",B00439XOS4,"Medisana HUB Wärmeunterbett, weiß","23,89","10,73",B00N5TOVAS,Medisana HU 665 Wärmeunterbett,"16,07","5,2",B00N5TOVA8,"Medisana HDW Heizdecke, braun / crème",15,"13,82"
Amazon.de,ps4 neo,"99,08",B01H0CG7GQ,PlayStation 4 Pro - Konsole (1TB),"37,43","20,46",B00ULWWFIC,PlayStation VR - [PlayStation 4],"26,51",0,B01IFJEWTM,Nintendo Classic Mini: Nintendo Entertainment System,"9,24",0
Amazon.de,regal,"99,08",B002TUQQXO,"Demeyere 5614 Polykub Regal 4 Nischen, weiß","14,48","7,44",B0011EAP3Q,"Kinderregal ""Easy Life Compo 8"" Farbe: Weiß","11,3","6,55",B00GMHNP66,"Demeyere 399345 Regal Polykub, 4 Nischen, sonoma eiche","8,92","6,83"
Amazon.de,reisetagebuch,"99,08",B00GYAAQ0Y,Reisetagebuch (Beige Version) (GROH Tagebuch),"17,63","7,64",B007RE4ZDA,Travelogue  interaktives Reisemagazin mit Rubbelseiten,"10,89","7,05",B00V53TJF8,Reisetagebuch (Blaue Version) (GROH Tagebuch),"9,74","8,2"
Amazon.de,swiffer,"99,08",B006VAC3GC,"Swiffer Staubmagnet Nachfüller, 2er Pack (2 x 9 Tücher)","22,33","9,44",B006VABXBS,Swiffer Staubmagnet Starterset & Griff inkl. 3 Tücher,"18,66","9,35",B0144MAXQU,"Swiffer Staubmagnet Tücher - Nachfüllpack, 20 Tücher","15,92","11,97"
Amazon.de,vikings staffel 3,"99,08",B00ZB7PPC0,,"42,4",0,B00ZB7PQ10,,"26,86",0,B01F31QJ8C,Vikings - Die komplette Season 3 [3 DVDs],"22,4","73,28"
Amazon.de,amazon gutschein,"99,07",B0054PDOV8,Amazon.de Gutschein per E-Mail (A wie Amazon),"37,08","2,25",B00X67BVFM,Amazon.de Grußkarte mit Geschenkgutschein - 30 EUR (Happy Birthday Ballons),"23,16","6,48",B0054PDP2Q,Amazon.de Gutschein zum Drucken (A wie Amazon),"20,39","1,57"
Amazon.de,bodenwischer,"99,07",B0047Y1HP2,"Vileda UltraMat Komplett-Set, Bodenwischer und Eimer mit PowerPresse","18,75","3,02",B00KM40ELY,Leifheit 55210 Bodenwischer Classic,"13,69","14,52",B005ELNR0K,"Leifheit 55356 Set Combi Clean inkl. Eimer mit Presse und Bodenwischer mit Micro Duo Bezug, Classic Green","8,88","3,73"
Amazon.de,brustbeutel,"99,07",B00HSGJ5ZA,Jack Wolfskin Unisex Brustbeutel Organizer,"42,73",0,B001HYCY4I,"Jack Wolfskin Damen Brustbeutel Passport, black, 18 x 12.5cm, 0.04 Liter, 84210-600","13,35","9,33",B000FSEWME,"Tatonka Geldaufbewahrung Skin ID Pocket, Natural, 10 x 13 cm, 2844","5,74","18,81"
Amazon.de,bücher neuerscheinungen 2016,"99,07",1534870067,,"10,42","20,59",3548286577,Ich bin zu alt für diesen Scheiß: Roman,"7,14","4,39",3945067189,,"5,25","8,78"
Amazon.de,campingstuhl,"99,07",B004PYD4YG,"Grand Canyon Campingstuhl DIRECTOR, Grau, 54x54x84","12,21","9,47",B00MUYI93Y,,"9,56",0,B008380K4W,10T Quickfold Easy - Mobiler Camping-Stuhl mit flexiblen Armlehnen sehr handlich faltbar inkl. Tasche,"7,73","6,96"
Amazon.de,ebook reader,"99,07",B00QJDO0QC,"Kindle Paperwhite eReader, 15 cm (6 Zoll) hochauflösendes Display (300 ppi) mit integrierter Beleuchtung, WLAN (Schwarz) - mit Spezialangeboten","26,14","6,33",B0186FESVC,"Der neue Kindle eReader, 15,2 cm (6 Zoll) Touchscreen ohne Spiegeleffekte, WLAN (Schwarz) - mit Spezialangeboten","16,29","7,97",B00W5Z6X68,,"7,89","45,92"
Amazon.de,leifheit,"99,07",B0090WTEQ0,"Leifheit 55077 Wischtuchpresse Profi Evo Set mit Bodenwischer, 42 cm, türkis","10,79","8,77",B005ELNR0K,"Leifheit 55356 Set Combi Clean inkl. Eimer mit Presse und Bodenwischer mit Micro Duo Bezug, Classic Green","9,84","5,01",B0002HOUIE,"Leifheit 55045 Bodenwischer Profi micro duo, 42 cm, mehrfarbig","7,97","6,24"
Amazon.de,polar m400,"99,07",B00OBZKT2E,"POLAR Trainingscomputer M400 HR, Schwarz, 90051341","62,12","35,46",B00NPZ7WNU,"POLAR Trainingscomputer M400, Schwarz, 90051092","21,51","18,97",B00OBZKS3E,"POLAR Trainingscomputer M400 HR, Weiß, 90051347","7,49","11,25"
Amazon.de,recore,"99,07",B00ZRKAE0O,ReCore [Xbox One],"64,29","50,95",B01HBM7SHM,ReCore Collector’s Edition - Xbox One,"15,18","44,59",B00ZRKAL7K,Sea of Thieves [Xbox One],"5,63","0,58"
Amazon.de,reiseadapter,"99,07",B007WVHL5M,"Brennenstuhl Reisestecker/-adapter-Set mit 10 A Sicherung schwarz/blau, 1508160","34,04","13,53",B000KA2HYM,"Kopp SB Weltreise-Stecker-Adapter Travel-Star, schwarz, 172205012","22,04","9,46",B005G0F4DW,SKROSS External Power  Adapter (Netz-Reiseadapter) weiß,"13,55","10,32"
Amazon.de,who am i,"99,07",B00VKYY4X4,,"89,65",0,B00NW8C44C,Who am I - Kein System ist sicher [Blu-ray],"7,21","8,41",B00NW8C1GS,Who am I - Kein System ist sicher,"2,46","76,33"
Amazon.de,b00kcs1k5o|b00kcs1k5o|b00r8vchfu|b00tzzq3ts|b01dt5x4ri,"99,06",B01DT5X4RI,House of Cards - Die komplette vierte Season (4 Discs),"72,43","27,99",B00R8VCHFU,House of Cards - Die komplette erste Season [4 DVDs],"10,66","5,76",B00TZZQ3TS,House of Cards - Die komplette dritte Season [4 DVDs],"5,62","2,3"
Amazon.de,baby,"99,06",B00IBVJMIQ,,"8,77",0,B000VDB26M,Playgro 40016 Klipp Klapp Pferd mit Rassel,"6,98","7,24",B00IEV9ZFI,"Philips AVENT SCH400/00 Babypflege-Set inkl. aller Pflegeartikel, gelb","6,78","2,32"
Amazon.de,einhorn,"99,06",B00PIVQ8QG,,"11,47",0,B00BNTH7AS,"Aurora World 21246 - Dreamy Eyes Einhorn 12In/30.5 cm, weiß","6,82","10,71",B01KXK3ZCG,,"6,77",0
Amazon.de,freundebuch schule,"99,06",3407794754,Mein Kinder Künstler Freundebuch,"8,71","2,95",3780628767,Meine Schulfreunde,"5,08","4,18",3811233718,Meine Freunde (Clevere Jungs!),"4,41","4,91"
Amazon.de,funksteckdose,"99,06",B002UJKW7K,mumbi Funksteckdosen Set: 3 x Funksteckdose und 1x Fernbedienung - Plug & Play - 1100 Watt,"27,41","11,86",B001AX8QUM,"Brennenstuhl Funkschalt-Set RCS 1000 N Comfort, 1507450","22,61","12,58",B0017USSM4,REV Ritter 00834514 Funk-Schalter-Set 1+3 Aktion,"11,11","8,23"
Amazon.de,hausschuhe,"99,06",B00HB4W1D2,,"12,87",0,B01F5E0OTC,,"10,26",0,B0105PRKUC,Lico Bioline Herren Flache Hausschuhe,"9,93",0
Amazon.de,häcksler,"99,06",B00BYTVXMK,"Makita UD2500  Elektro - Häcksler, für starke Äste und weiches Häckselgut, 2500 W","19,05","6,64",B008RWN7X0,Atika 300657 Messerhäcksler AMA 2500,"15,6","4,99",B0037Q6X2S,Atika Leise Walzenhäcksler LHF 2800,"15,28","70,28"
Amazon.de,ps4 spielen,"99,06",B00ZRQTKO4,Horizon: Zero Dawn - [PlayStation 4],"6,88",0,B01H1QQG6W,Death Stranding - [PlayStation 4],"4,53",0,B01H1KE0DE,Resident Evil 7 Biohazard - [PlayStation 4],"4,18",0
Amazon.de,razer blackwidow,"99,06",B00MVT7AYW,Razer BlackWidow Chroma Mechanische Gaming Tastatur (RGB Beleuchtet und voll programmbierbar mit 5 Macrotasten),"55,02","27,06",B00J89TDMK,Razer BlackWidow Mechanische Gaming Tastatur (Voll programmbierbar mit 5 Macrotasten),"9,15","21,7",B016OFRH0K,Razer BlackWidow Ultimate Stealth 2016 Mechanische Gaming Tastatur (Beleuchtet und Voll programmbierbar),"8,24","8,26"
Amazon.de,assassins creed,"99,05",B00XJTFKSQ,Assassin's Creed Syndicate - Special Edition - [PlayStation 4],"31,86","12,92",B01LW2XHAE,Assassin's Creed Ezio Collection - [Playstation 4],"22,4","2,61",B01AL8UOR4,Assassin's Creed Chronicles - [PlayStation 4],"4,51","2,32"
Amazon.de,backofen,"99,05",B003HD7YJC,Severin TO 2034 Toastofen / ca. 1500 Watt / 20 Liter Garraum / schwarz-silber,"20,44","17,75",B00EUB4F0G,Bosch HBA33B150 Serie 6 Einbaubackofen / A / 66 L / Edelstahl / 3D Heißluft Plus,"20,26","15,56",B00D1V5BIQ,Amica EB 13523 E Backofen Elektro / A / 0.95 kWh / 66 L / Steam Clean Reinigungsfunktion durch Wasserdampf / Sensor Control-Timer mit rotem LED Display / edelstahl,"7,08","11,67"
Amazon.de,cd player kinder,"99,05",B0028R3B90,Lenco SCD-24 Stereo UKW-Radio mit CD-Player und Teleskopantenne pink,"13,04","6,46",B0089AK54E,Lenco SCD-24 Stereo UKW-Radio mit CD-Player und Teleskopantenne blau/schwarz,"7,08","3,82",B00F0A7ZT4,Grundig RCD 1445 Radio (USB 2.0) mit CD/-MP3/-WMA Wiedergabe pink/silber,"5,81","2,24"
Amazon.de,duden,"99,05",3411046503,Duden - Die deutsche Rechtschreibung: Das umfassende Standardwerk auf der Grundlage der aktuellen amtlichen Regeln (Duden - Deutsche Sprache in 12 Bänden),"53,35","24,92",3411051620,Schülerduden Rechtschreibung und Wortkunde (gebunden): Das Rechtschreibwörterbuch für die Sekundarstufe I,"15,32","11,05",3411055081,Duden - Deutsches Universalwörterbuch: Das umfassende Bedeutungswörterbuch der deutschen Gegenwartssprache,"6,16","13,26"
Amazon.de,fondant,"99,05",B0052CMBI0,Rollfondant Weiß 1 Kg inkl. Vorratsdose,"27,11","11,21",B005RIRCK6,"FunCakes Fondant, feuerrot, 1er Pack (1 x 250 g)","8,83","5,83",B004PDMTQ6,"FunCakes Fondant, meeresblau, 1er Pack (1 x 250 g)","7,99","2,86"
Amazon.de,globus,"99,05",B000P1ZOZ0,Idena 569902 Leuchtglobus 30 cm mit Halogen Energiesparlampe und zwei Kartenbildern,"27,47","24,83",B00B2XEYMY,Ravensburger 00558 - tiptoi Interaktiver Globus,"10,32","1,12",B001V9KPL8,"Idena 569904 - Geografischer Globus mit Licht und Lupe, 30 cm","9,59","6,89"
Amazon.de,iphone 5 hülle,"99,05",B00PHV9TOK,mumbi TPU Silikon Schutzhülle iPhone SE 5S 5 Hülle in schwarz,"21,02","4,56",B00PHV74TW,mumbi TPU Silikon Schutzhülle iPhone SE 5 5S Hülle transparent schwarz,"13,36","8,67",B01D90RB1S,mumbi UltraSlim Hülle für iPhone SE 5 5S  Schutzhülle transparent (Ultra Slim - 0.55 mm),"12,41","4,74"
Amazon.de,nike free 5.0,"99,05",B012NK4JMY,"Nike Free 5.0, Herren Laufschuhe","29,97",0,B012NK4J7O,"Nike Free 5.0, Damen Laufschuhe","12,04",0,B00V8SYGGC,Nike Free 5.0 Herren Laufschuhe,"8,44",0
Amazon.de,walkie talkie,"99,05",B00KAQYJLU,Motorola TLKR T41 PMR Funkgerät mit LC-Display blau,"30,97","13,43",B00PLPC4AS,"Stabo Elektronik 20100 - Stabo Freecomm Funkhandy, schwarz","15,43","8,18",B00ANG0M0E,Motorola TLKR T40 PMR Funkgerät mit LC-Display rot,"9,44","8,64"
Amazon.de,27 zoll monitor,"99,04",B00IZBIMLK,"BenQ GL2760H 68,6 cm (27 Zoll) LED Monitor (Full-HD, Eye-Care, HDMI, VGA, 2ms Reaktionszeit) schwarz","17,38","12,58",B01BCF09R0,"Samsung LC27F396FHUXEN 68,6 cm (27 Zoll) LED Monitor (VGA, HDMI, 4ms Reaktionszeit) schwarz/silber","12,34","6,23",B00S63S4EM,"Acer S271HLAbid 69 cm (27 Zoll) Monitor (DVI, HDMI, Full HD, 2ms Reaktionszeit, EEK B) schwarz","9,09","16,71"
Amazon.de,canon 80d,"99,04",B01C2XJVPC,"Canon EOS 80D SLR-Digitalkamera (24,2 Megapixel, 7,7 cm (3 Zoll) Display, APS-C CMOS Sensor, 45 AF-Kreuzsensoren, DIGIC 6 Bildprozessor, NFC und WLAN, Full HD) nur Gehäuse schwarz","61,5","19,1",B01C2XJWZ6,"Canon EOS 80D SLR-Digitalkamera (24,2 Megapixel, 7,7 cm (3 Zoll) Display, DIGIC 6 Bildprozessor, NFC und WLAN, Full HD) Kit inkl. EF-S 18-55mm 1:3,5-5,6 IS STM, schwarz","25,25","26,15",B00SH1TIAW,"Canon EOS 6D SLR-Digitalkamera (20,2 Megapixel, CMOS-Vollformatsensor, 7,6 cm (3 Zoll) Display, Full-HD) Kit inkl. 24-105 mm IS STM, schwarz","2,44",0
Amazon.de,fritzfon,"99,04",B01BBWWFB2,"AVM FRITZ!Fon C5 DECT-Komforttelefon für FRITZ!Box (hochwertiges Farbdisplay, HD-Telefonie, Internet-/Komfortdienste, Steuerung FRITZ!Box-Funktionen)","57,27","32,65",B00H90PS92,"AVM FRITZ!Fon C4 Telefon (Farbdisplay, beleuchtete Tastatur) weiß","23,9","32,68",B0031D3A78,"AVM FRITZ!Fon MT-F DECT-Komforttelefon für FRITZ!Box (Farbdisplay, HD-Telefonie)","5,28",0
Amazon.de,klobürste,"99,04",B003SLDWSK,"WENKO 18931100 WC-Garnitur Basic Schwarz, Kunststoff, 14 x 38 x 14 cm, Schwarz","23,8","7,93",B00TQQ3Y9S,"Wenko 21694100 Edelstahl WC-Garnitur Detroit, rostfrei, 8,9 x 41,5 x 8,9 cm, satiniert","9,85","6,9",B0037X132Q,"Zeller 18319 WC-Bürste ""Schiefer"", Polyresin, 9,5 x 9,5 x 38,5 cm, schwarz","6,04","3,54"
