Abteilung,Suchbegriff,Suchhäufigkeit,ASIN,Nr. 1 der geklickten Titel,Klickfreigabe,Umwandlungs-Anteil,ASIN,Nr. 2 der geklickten Titel,Klickfreigabe,Umwandlungs-Anteil,ASIN,Nr. 3 der geklickten Titel,Klickfreigabe,Umwandlungs-Anteil
Amazon.de,nikon d750,"98,85",B00NINZLKK,"Nikon D750 SLR-Digitalkamera (24,3 Megapixel, 8,1 cm (3,2 Zoll) Display, HDMI, USB 2.0) nur Gehäuse schwarz","55,29","17,82",B00NMD804A,"Nikon D750 SLR-Digitalkamera (24,3 Megapixel, 8,1 cm (3,2 Zoll) Display, HDMI, USB 2.0) Kit inkl. AF-S Nikkor 24-120 mm 1:4G ED VR Objektiv schwarz","15,36","13,36",B00NINZL6O,"Nikon D750 SLR-Digitalkamera (24,3 Megapixel, 8,1 cm (3,2 Zoll) Display, HDMI, USB 2.0) Kit inkl. 24-85 mm Objektiv schwarz","9,08","8,91"
Amazon.de,schere,"98,85",B005IUSC4S,"Westcott N-90027 00 Easy Grip Scheren Set, 3 Stück, 13cm + 21cm + 25 cm, schwarz-blau","30,54","8,14",B0013CMZI4,"Wedo 97665 Universalschere, rostfreier Edelstahl, spitz, Kunststoff Softgriffe 16 cm, schwarz/rot","11,62","9,63",B01BRGUC9Y,"AmazonBasics Schere mit weichem Griff, 20 cm, Titan-Scherenblätter, 1 Stück","8,75","10,24"
Amazon.de,sekundenkleber,"98,85",B004V4B60Y,"Pattex Sekundenkleber Mini Trio flüssig 3 x 1 g, PSMT2","39,99","13,3",B00O23B8IE,"Pattex Sekundenkleber Minitrio Gel 3 x 1 g, PSMG3","14,62","7,99",B0000WRNV2,Loctite Sekundenkleber 401 5G,"10,73","5,52"
Amazon.de,sony rx100,"98,85",B0089BUVG0,"Sony DSC-RX100 Cyber-shot Digitalkamera (20 Megapixel, 3,6-fach opt. Zoom, 7,6 cm (3 Zoll) Display, lichtstarkes 28-100mm Zoomobjektiv F1,8 - 4,9, Full HD, bildstabilisiert) schwarz","36,76","16,84",B00KLVFV34,"Sony DSC-RX100 III Digitalkamera (20.1 Megapixel Exmor R Sensor, 3-fach opt. Zoom, 7,6 cm (3 Zoll) Display, Full HD, WiFi/NFC) schwarz","24,81","7,72",B00ZUFRD4Q,"Sony DSC-RX100 IV Digitalkamera (Stacked Exmor RS CMOS Sensor, 40-fach Super-Zeitlupe, 4K Video, Anti-Distortion Verschluss, Pop-Up-Sucher, 24-70 mm ZEISS Vario-Sonnar T) schwarz","17,42","11,58"
Amazon.de,verbandskasten,"98,85",B009T2XNXG,"Leina-Werke 10002 KFZ-Verbandkasten Standard, Schwarz/Weiß","25,64","17,56",B001BB20IM,Leina 73602 Verbandtasche DIN 13164 mit Rettungsdecke (sortiert - schwarz / rot),"22,18",10,B002B5526Y,"Cartrend 7700126 Verbandkasten Classic mit Malteser Erste-Hilfe-Sofortmaßnahmen, DIN 13164, Blau","12,11","10,53"
Amazon.de,vibrator,"98,85",B000FJ9A52,"Orion 559814 Babyvibe Vibrator, rot,  13 cm lang, Ø 2,5 cm, stufenlos regelbar.","12,83","11,95",B00IF42W40,Ouch! einstellbar Höschen - schwarz - Kugeln und Mini vibratoren - Fetish,"11,9","2,5",B00OZBI6QA,Fifty Shades of Grey Aufladbarer Rabbit Vibrator - Greedy Girl,"10,81","3,55"
Amazon.de,axon 7,"98,84",B01I092IPC,"ZTE Axon 7 Smartphone (13,9 cm (5,5 Zoll) Display, 20 Megapixel Kamera, 64 GB Speicher) Grau","69,28","38,32",B01I092FLY,"ZTE Axon 7 Smartphone (13,9 cm (5,5 Zoll) Display, 20 Megapixel Kamera, 64 GB Speicher) Gold","26,24","61,68",B01I0931A8,"ZTE Axon 7 Mini Smartphone (13,2 cm (5,2 Zoll) Display, 32 GB Speicher, Android 6.0) gold","1,55",0
Amazon.de,fußmatte,"98,84",B00S6CSJZM,"Astra FS1618015044 Sauberlaufmatte, Türmatte, Fußmatte Selena für den Innenbereich, 40 x 60 cm, schwarz","23,25","4,51",B00P6BC9UM,"Astra FS0610015040 Fußmatte / Sauberlaufmatte Nela, 100 % Polypropylen, 40 x 60 cm, grau","12,76","5,26",B01G91F0BM,"Star Wars Yoda Fußmatte, mehrfarbig","4,22","3,18"
Amazon.de,maze runner,"98,84",B015R1BLLS,Maze Runner - Die Auserwählten in der Brandwüste,"32,31","19,51",3551520682,Maze Runner-Trilogie - Die Auserwählten: Schuber mit Bonusmaterial (Die Auserwählten – Maze Runner),"18,97","18,87",B00TACZ2SE,,"14,48",0
Amazon.de,minions,"98,84",B01076V78K,Minions,"11,94","3,71",B00T2HS0MW,"Undercover MNOH2250 - Mal- und Schreibturm Minions, 25 teilig","7,3","12,13",B00W765A7S,"Joy Toy 90556 Minion Stuart 3D-Keramiktasse 350 ml in Geschenkpackung, 8 x 12 x 11,5 cm","5,79","5,2"
Amazon.de,nike pullover,"98,84",B00I03Z1W6,"Nike Kinder Sweatshirt Team Club, black, M, 658500-010","16,14","31,34",B00RD8IRK2,"Nike Kinder Sweatshirt Team Club, black, S, 658500-010","16,14","11,19",B00J9YSXYS,"Nike Jungen Kapuzenpullover Brushed Fleece, dk grey heather/white, XS, 619080-063","7,01","6,53"
Amazon.de,bügeltisch,"98,83",B0018O2QSG,Vileda Viva Express Smart+ Bügeltisch mit dampfdurchlässiger Oberfläche,"18,87","7,89",B002LLN7NI,"WENKO 1201143100 Bügeltischbezug Air Comfort L - 4 mm Komfortpolsterung, 100 % Baumwolle, Blau","12,55","2,44",B00IVI72PY,Leifheit 72564 Bügeltisch Air Board M Solid Plus,"9,3","4,4"
Amazon.de,monster high,"98,83",B01ARGBW1M,"Mattel Monster High DNX65 - Fledermaus Draculaura, Ankleidepuppen","6,76","0,37",B00T03U04Y,Mattel Monster High CJF48 - Mega Monsterschule,"6,07","2,18",B00T03T5V8,"Mattel Monster High CHW63 - Buh York, Elle Edee, Puppe","5,53","6,04"
Amazon.de,polar a 360,"98,83",B016BKJW42,POLAR Activity Tracker A360,"74,91",0,B016BD69MM,"POLAR Activity TrackerA360, Black, M, 90057421","5,85","17,93",B01DK5D9ZO,Polar Wechselarmband,"4,35",0
Amazon.de,bettwäsche 155x220,"98,82",B008VOEC5G,"Bierbaum 6277_04 Feinbiber-Bettwäsche Dessin 155 x 220 cm + 80 x 80 cm, mokka","10,69","2,69",B008VOEI9G,"Bierbaum 4757 Mako-Satin-Bettwäsche Dessin 155 x 220 cm + 80 x 80 cm, rot","9,9","4,64",B00YXEKFEK,"Kaeppel G-105840-79D3-VL97 Bettwäsche Motion, zinn, Linon, 1 x 80/80 plus 155/220 cm","7,4","3,66"
Amazon.de,dokumentenmappe,"98,82",B00AOEL1TG,"Alassio Dokumentenmappe, DIN A4, Lederimitat, schwarz","13,27","13,52",B000P38VEO,"Pagna 30503-01 - Dokumentenmappe DIN A4, Kunstleder, schwarz","10,38","17,07",B000OZVOIS,"Genie Exclusiv A4 Schreibmappe mit Ringbuch, Taschenrechner, Reißverschluss, inkl. A4-Schreibblock, Lederoptik schwarz","7,94","1,91"
Amazon.de,norton internet security 2017,"98,82",B016BIQSKK,"SYMANTEC Norton Security Deluxe (5 Geräte - PC, Mac, Smartphone, Tablet)","50,34","26,53",B016BIQSM8,"SYMANTEC Norton Security Standard (1 Gerät - PC, Mac, Smartphone, Tablet)","18,65","21,66",B017IGESSI,"SYMANTEC Norton Security Deluxe (3 Geräte - PC, Mac, Smartphone, Tablet)","14,77","20,66"
Amazon.de,oral-b,"98,82",B00KBWBPRY,Oral-B PRO 600 CrossAction wiederaufladbare elektrische Zahnbürste,"17,99","4,25",B00LVUY84W,Oral-B PRO 6500 elektrische Zahnbürste (mit Bluetooth & 2. Handstück),"13,35","0,6",B010LB4O7W,Oral-B PRO 700 Tiefenreinigung wiederaufladbare elektrische Zahnbürste,"7,87","4,24"
Amazon.de,sonax,"98,82",B00PWRCRK2,"SONAX 761541 AutopflegeSet mit Tasche, 7 Teile","16,65","10,07",B00100EJ24,"SONAX 206300 XTREME Polster- & AlcantaraReiniger, 400ml","6,21","1,92",B004GHMRSQ,"SONAX 283241 XTREME CockpitReiniger Matteffect, 500ml","6,13","2,89"
Amazon.de,zwilling,"98,82",B003BNYW5C,"Zwilling Twin Gourmet Messerblock, 31665, 9-tlg, 320 x 115 x 290 mm, natur, genietet, Vollerl, Friodur Klinge","21,03","5,87",B000XFG2QI,Zwilling 30795180 Twin Pollux Chinesisches Kochmesser,"14,02","15,66",B003Y737E2,"Zwilling Professional S Messerblock, Bambus, 7-tlg., 320 x 115 x 290 mm (Rostfreier Spezialstahl, Zwilling Sonderschmelze, genietet, Vollerl, Kunststoff-Schalen) schwarz","9,53","7,83"
Amazon.de,funkkopfhörer,"98,81",B005I49EH8,"Thomson Funkkopfhörer ""WHP3001BK"" kabellos mit Ladestation (Over-Ear, PLL-System, Reichweite 100 m, 863 MHz, Wireless) schwarz","14,54","6,5",B004MPQ81Y,Sony MDR-RF865RK Kabelloser Funkkopfhörer schwarz,"13,06","8,9",B005M17IZC,Sennheiser RS 120-II Funkkopfhörer,"10,05","6,14"
Amazon.de,gehäuse,"98,81",B00NCG16O8,"Sharkoon VG4-W Blau PC-Gehäuse mit Window Kit (2x USB 3.0, 2x USB 2.0, ATX) schwarz/blau","11,04","19,51",B015J8QGDC,"Sharkoon VG5-W PC-Gehäuse (Schnellverschlüsse, 2x 120-mm-LED-Lüfter vorinstalliert, USB 3.0) grün","10,96","10,15",B00N0W2R9W,"Sharkoon VS4-V PC-Gehäuse (2x USB 3.0, ATX) schwarz","8,06","4,01"
Amazon.de,harry potter band 8 deutsch,"98,81",3551559007,Harry Potter: Harry Potter und das verwunschene Kind. Teil eins und zwei (Special Rehearsal Edition Script),"90,7","8,92",0751565350,Harry Potter and the Cursed Child - Parts I & II (Special Rehearsal Edition): The Official Script Book of the Original West End Production,"5,18","6,56",3742300296,Das inoffizielle Harry-Potter-Kochbuch: Von Butterbier bis Kürbispasteten - mehr als 150 magische Rezepte zum Nachkochen,"2,35","2,8"
Amazon.de,lenovo yoga book,"98,81",B01M0QDH4C,"Lenovo Yoga Book 25,65cm (10,1 Zoll Full HD) 2-in-1 Tablet (Intel Z8550 Quad-Core, 2,4GHz, 4GB RAM, 64GB eMMC, Kamera:2MP+8MP, Touch, Dolby Atmos, Android 6.0) grau inkl. Halo Tastatur+Real Pen","22,68","28,56",B01LX5LMIE,"Lenovo Yoga Book 25,65cm (10,1 Zoll Full HD) 2-in-1 Tablet (Intel Z8550 Quad-Core, 2,4GHz, 4GB RAM, 64GB eMMC, Kamera:2MP+8MP, Touch, Dolby Atmos, LTE, Android 6.0) gold inkl. Halo Tastatur+Real Pen","22,26","20,4",B01LT2T7RE,"Lenovo Yoga Book 25,65cm (10,1 Zoll Full HD) 2-in-1 Tablet (Intel Z8550 Quad-Core, 2,4GHz, 4GB RAM, 64GB eMMC, Kamera:2MP+8MP, Touch, Dolby Atmos, Windows 10 Pro) schwarz inkl. Halo Tastatur+Real Pen","14,32","16,32"
Amazon.de,schminkkoffer,"98,81",B007L0FUCK,"BriConti Schminkkoffer 'Everybody's Darling', Koffer im Alu-Design mit 51 teiligem Schmink- / Make-Up Set","31,57","23,42",B00WHZY4C6,"BriConti Schminkkoffer 'Beauty Case' black, 1 Stück","14,05","15,53",B004BTLKI2,"DynaSun ALU Design Beautycase Schmuckfach Schminkkoffer Kosmetikkoffer, 24 cm, Pink","13,8","10,35"
Amazon.de,softair,"98,81",B0010XI90Y,"Softair Pistole Taurus PT 24/7 Kaliber 6 mm Federdruck < 0.5 Joule, 201889","26,07","31,17",B009Z9C406,Softair Gewehr  203910 B&T A5 Kaliber 6 mm AEG-System  < 0.5 Joule,"19,12","10,39",B005O07AC2,"Mil-Tec Ghillie Antifire 4-Teilig woodland,M/L",8,0
Amazon.de,vogelhaus,"98,81",B002CX0BSO,Habau Vogelhaus Rotdrossel,"12,11","6,83",B004S6QFP6,Habau 1731 Futterhaus Bergfink,"9,48","11,7",B000WFI9R4,"Trixie 5570 natura Vogelhaus aus Holz mit Ständer, 46 x 22 x 44 cm/1.15 m","7,27","6,83"
Amazon.de,werkzeugwagen,"98,81",B000K2LLP6,"Mannesmann Werkstattwagen bestückt mit Werkzeugen, M28270","11,75","6,98",B00E8GD216,"Meister Werkstattwagen ohne Inhalt, 8986100","11,11","10,47",B004H4CCJM,HAZET Werkstattwagen mit Sortiment 178-6/169,"7,7",0
Amazon.de,galaxy s7 edge hülle,"98,8",B01CUFNH6G,mumbi double GRIP Hülle für Samsung Galaxy S7 Edge Schutzhülle schwarz,"45,85","4,34",B01C42FH4A,mumbi UltraSlim Hülle für Samsung Galaxy S7 Edge Schutzhülle transparent (Ultra Slim - 0.55 mm),"8,99",6,B01A5OU154,mumbi Hülle für Samsung Galaxy S7 Edge Schutzhülle,"6,35","8,93"
Amazon.de,gamer stuhl,"98,8",B0056YNWVO,"DX Racer1, Bürostuhl, Gaming Stuhl, Schreibtischstuhl, Chefsessel mit Armlehnen, Gaming chair, Gestell Nylon, 78 x 124-134 x 52 cm, Stoffbezug schwarz / rot","50,29","28,55",B019IZKTUS,"MC Racing 5 Gaming Stuhl, Chefsessel mit Armlehnen, Büro-/Schreibtischstuhl, Sportsitz Optik, inklusiv Kissen, Bezug Kunstleder/ PVC, circa 69 x 125-135 x 58 cm, schwarz / rot, Robas Lund 62495SR3","14,21",0,B00BU2S8YW,"DX Racer5 Gaming Stuhl, Schreibtischstuhl, Bürostuhl, Chefsessel mit Armlehnen, Gaming chair, Gestell Nylon schwarz, 78 x 52 x 124-134 cm, Stoff schwarz / grau","8,38","7,48"
Amazon.de,haarfön,"98,8",B00BCQIK4O,"Philips HP8232/00 Ionen-Haartrockner, 2200 Watt, weiß","18,69","3,18",B00BCQIIMS,"Philips HP8230/00 Haartrockner, 2100 Watt, schwarz","14,45","3,46",B002EW8KN6,Philips HP8182/00 Haartrockner SalonDry Control mit Ionisierungsfunktion,"9,82","3,02"
Amazon.de,hausschuhe herren,"98,8",B00HB4W1D2,,"13,89",0,B0105PRKUC,Lico Bioline Herren Flache Hausschuhe,7,0,B00QWSDJBG,Dr. Brinkmann 605141 Unisex-Erwachsene Pantoletten,"5,56",0
Amazon.de,kochbuch,"98,8",3833816775,20 Minuten sind genug!: Über 150 Rezepte aus der frischen Küche (GU Themenkochbuch),"15,15","13,08",3898834891,Gesund kochen ist Liebe,"14,96","2,41",3831022631,"Jamies 15-Minuten-Küche: Blitzschnell, gesund und superlecker","6,86","0,96"
Amazon.de,nhl 17,"98,8",B01GDQZ3TW,NHL 17 - [PlayStation 4],82,"47,24",B01GDQZ4JQ,NHL 17 - [Xbox One],"8,42","41,04",B01GO4FMNU,FIFA 17 - [PlayStation 4],"3,94",0
Amazon.de,sms für dich,"98,8",3499290200,SMS für dich,"42,12","34,64",B01L1V2BQW,SMS für dich,"39,58","14,17",3845821779,Die sture Raupe Rieke,"5,27","5,4"
Amazon.de,weinkühlschrank,"98,8",B002BRDS0O,"CASO WineDuett 21 Design Weinkühlschrank für bis zu 21 Flaschen (bis zu 310 mm Höhe), zwei Temperaturzonen 7-18°C","16,49","16,48",B00E0FQTFG,Bomann KSW 344 Weinkühlschrank Freistehend / A / 131 kWh/Jahr / 52.0 cm / 16 Flaschen / elektronische Temperatursteuerung und -einstellung / schwarz,"16,1","20,59",B007PRU2X6,Liebherr WTES 5972 Vinidor Weinkühlschrank / 211 bouteilles,"8,58",0
Amazon.de,yoga,"98,8",1407511491,Yoga: Das große Praxisbuch für Einsteiger & Fortgeschrittene,"21,23","12,21",B004AO0HLY,Yogaworks - Das Basisprogramm,"6,68","5,47",380943003X,Yoga für Einsteiger: Das Übungsprogramm für Zuhause,"6,2","5,14"
Amazon.de,bettwäsche 135x200,"98,79",B008VOEGY8,"Bierbaum 4757_63 Mako-Satin-Bettwäsche Dessin 135 x 200 cm + 80 x 80 cm, rot","15,82","7,4",B008VOEC38,"Bierbaum 6277_04 Feinbiber-Bettwäsche Dessin 135 x 200 cm + 80 x 80 cm, mokka","8,45","3,41",B00YXEKF8Q,"Kaeppel G-105840-79D1-VL97 Bettwäsche Motion, zinn, Linon, 1 x 80/80 plus 135/200 cm","6,43","6,23"
Amazon.de,captain america civil war,"98,79",B01ERM5VPA,The First Avenger: Civil War [Blu-ray],"70,36","33,98",B01ERM5WDG,"The first Avenger - Civil War  3D: 3D+2D, Steelbook Edition [3D Blu-ray]","18,06","46,83",B01FHMN5YS,X-Men Apocalypse [Blu-ray],"3,41","0,86"
Amazon.de,gregs tagebuch,"98,79",384320005X,Gregs Tagebuch - Von Idioten umzingelt! (Baumhaus Verlag),"15,39","9,91",3833936517,Gregs Tagebuch 10 - So ein Mist!: Band 10,"15,01","6,18",3833936525,Gregs Tagebuch 11 - Alles Käse!,"12,37","1,75"
Amazon.de,hudora big wheel 205,"98,79",B000YD02MO,"Hudora Scooter Big Wheel GS 205, schwarz/grün, 880 x 350 x 1035 mm, 14695","22,88","10,64",B001OC6D3Q,"Hudora Scooter Big Wheel RX 205, schwarz/rot, 880 x 350 x 1035 mm, 14724","11,2","9,08",B002QAXC1Q,"Hudora Scooter Big Wheel 205, 880 x 330 x 1035 mm, magenta/silber, 14764","11,12","10,6"
Amazon.de,salomon,"98,79",B00YHNWDDI,Salomon XA PRO 3D GTX Herren Traillaufschuhe,"15,04",0,B01CJGTSLO,,"9,36",0,B00WTZRDMW,Salomon Speedcross 3 Herren Traillaufschuhe,"6,9",0
Amazon.de,walking dead staffel 6,"98,79",B01L32LWHI,The Walking Dead - Die komplette sechste Staffel [6 DVDs],"89,93","36,61",B014SCQ9GY,"The Walking Dead - Die komplette fünfte Staffel (Uncut, 5 Discs)","2,3",0,B01L32LWGY,The Walking Dead - Die komplette sechste Staffel - Uncut [Blu-ray],"1,41","3,7"
Amazon.de,brettspiele,"98,78",B0038JKO38,"KLUGSCHEISSER - das ultimative Spiel für alle, die auf (fast) alles eine Antwort haben...","8,44","2,39",B004QF0UK0,Heidelberger Spieleverlag 335- Civilization: Das Brettspiel,"7,7","2,73",B014O8OZ1S,Libellud 002955 - Mysterium,"4,81","1,47"
Amazon.de,downton abbey staffel 6,"98,78",B01GR9U5G6,Downton Abbey - Staffel 6 [4 DVDs],"90,18","72,48",B01GR9U5IO,Downton Abbey - Staffel 6 [Blu-ray],"3,06","21,21",B019PGRQGU,,"1,37",0
Amazon.de,hundebox,"98,78",B008B9ZVVK,"Nobby 72126 Transportbox für mittlere und große Hunde ""Skudo 3 Iata"" 60 x 40 x 39 cm","15,57","8,22",B000VBPFCQ,"Trixie 39692 Transport-Hütte Twister, faltbar, hellblau/dunkelblau, Größe S, 45 × 45 × 64 cm","8,83","7,73",B00305MP78,"Trixie 39721 Vario Transportbox, Größe S, 61×43×46 cm","7,66","1,29"
Amazon.de,logitech g502,"98,78",B019NFPE2G,Logitech G502 Proteus Spectrum RGB Tunable Gaming Mouse (mit 11 programmierbaren Tasten) schwarz,"81,29","88,64",B00L8VNQ88,"Logitech G402 Hyperion Fury FPS Gaming Mouse (mit 8 programmierbaren Tasten, USB) schwarz","6,23","7,89",B00IGS9LU8,Logitech Proteus Core G502 Tunable Gaming Maus,"2,37",0
Amazon.de,matratze 90x200,"98,78",B004LAYFGU,"Das Original - OrthoMatra KSP-500, Orthopädische Kaltschaummatratze, 7 Zonen, Raumgewicht RG 30, Höhe 16 cm, Bezug waschbar bis 60 Grad, Größe 90 x 200 cm, Härtegrad H3","20,3","7,16",B00G96LEPY,Traumnacht 03890460159 Orthopädische Kaltschaummatratze Härtegrad 3 (H3) 90 x 200 cm,"17,24","10,58",B004LRO1CQ,"Badenia Bettcomfort 3887860159 Roll-Komfortmatratze, Trendline BT 100 H2 90 x 200 cm, weiß","14,11","11,03"
Amazon.de,quadrocopter,"98,78",B00G7G76YE,"Revell Control 23971 - Mini Quadrocopter Nano, farblich sortiert","21,52","20,41",B00MLGB7VC,Carrera 370503001 - RC 2.4 GHz Quadrocopter CRC X1,"12,49","32,07",B015HIOH6M,"fm-electrics MJX X101w - Quadrocopter mit Wifi FPV, Riesen Reichweite, Headless Mode und One-Key Return, Sonderedition, Looping Funktion, C4010 Wlan Kamera in HD, XXL","8,9",0
Amazon.de,waschmaschine,"98,78",B005F5OAJ2,Beko WMB 71643 PTE Frontlader Waschmaschine / A+++ A / 0.749 kWh / 1600 UpM / 7 kg / 41 L / Pet Hair Removal / Watersafe / weiß,"14,52","3,23",B00FMW23LK,Miele WMH120WPS D LW PWash&TDos Waschmaschine FL / A+++ / 156 kWh/Jahr / 9900 Liter/Jahr / 8 kg / 1600 UpM / Thermo-Schontrommel / PowerWash / lotos weiß,"5,45",0,B008QY3NTW,Bauknecht WA PLUS 634 Waschmaschine Frontlader / A+++ / 2+2 Jahre Herstellergarantie / 1400 UpM / 6 kg / Weiß / Startzeitvorwahl / 15-Minuten-Programm / Farbprogramme,"4,56","0,27"
Amazon.de,x-t2,"98,78",B01I5LE51A,"Fujifilm X-T2 Systemkamera nur Gehäuse (24,3 Megapixel) schwarz","59,62","27,96",B01I5LE53S,"Fujifilm X-T2 Systemkamera Kit inkl. XF18-55mm Objektiv (24,3 Megapixel) schwarz","21,25","58,06",B01AP7S4GE,Fujifilm X-Pro2 Systemkamera Gehäuse schwarz,"6,34",0
Amazon.de,akku ladegerät,"98,77",B00HV5XOEG,Varta LCD Plug Ladegerät für AA/AAA/9V und USB-Geräte (inkl. 4x AA 2100 mAh) schwarz,"23,15","8,82",B000WILI42,Technoline BC 700 Akku-Ladegerät schwarz,"13,99","3,77",B002JLJ2MA,ANSMANN PhotoCam IV Akku-Ladegerät für Micro AAA/Mignon AA Akkus Steckerladegerät mit LCD-Anzeige autom. Abschaltung,"8,8","6,2"
Amazon.de,bügeleisen testsieger 2016,"98,77",B004GUQ10I,Tefal FV4680 Dampfbügeleisen Ultragliss türkisblau,"34,52","7,5",B00M89TPZC,"Philips GC3811/70 Azur Performer Dampfbügeleisen, 2,400 W, 160 g Dampfstoß, SteamGlide Plus, weiß / türkis","18,98","6,63",B000HDV086,"Philips GC4410/02 Dampfbügeleisen (2400 W, SteamGlide-Bügelsohle) weiß/blau","6,36","5,26"
Amazon.de,christian kracht,"98,77",3462045547,Die Toten: Roman,"65,51","17,32",3596185351,Imperium: Roman (Hochkaräter),"9,67","10,19",3596185327,Faserland: Roman,"6,31",5
Amazon.de,fächermappe,"98,77",B006HYLMLE,Herlitz 11208394 Fächermappe A4 PP 12 Fächer schwarz,"18,79","3,81",B00191UZCW,"Herlitz 1978048 Fächermappe (A4 PP, 12 Fächer) farbig sortiert","15,07","5,88",B00IECAO8O,Herlitz 11306016 Fächermappe Ladylike Roses (12 Fächer mit Gummizug und Verschlußknopf),"9,77",5
Amazon.de,gartenpumpe,"98,77",B0009PTUTS,"T.I.P. 30111 Gartenpumpe Edelstahl GP 3000 Inox, bis 2.950 l/h Fördermenge","16,58","11,42",B00SY6818K,"Einhell Gartenpumpe GC-GP 6538 (650 W, 3800 l/h max. Fördermenge, 3,6 bar, Wassereinfüllschraube, Wasserablassschraube)","8,3","13,38",B001RB2L9O,"Einhell Gartenpumpe BG-GP 1140 N (1100 W, 4000 l/h, max 35 °C, 4,3 bar, 43 m max Förderhöhe, Edelstahlgehäuse)","7,66","4,89"
Amazon.de,jack wolfskin rucksack,"98,77",B01G8ZTXQ2,"Jack Wolfskin Unisex Rucksack Perfect Day, 22 liters","7,8",0,B011L82CV4,"Jack Wolfskin Damen Rucksack Ancona, 13 liters","7,25",0,B00BS4KBB0,"Jack Wolfskin Unisex Rucksack Dayton, schwarz,  48 x 36 x 14cm, 28 liter, 2002481","6,79","15,55"
Amazon.de,one blade,"98,77",B01B1NVCEC,"Philips OneBlade QP2530/30, Trimmen, Stylen, Rasieren / 4 Trimmeraufsätze, 1 Ersatzklinge","51,51",28,B01AXMKH2A,"Philips OneBlade Pro QP6520/30, Trimmen, Stylen, Rasieren / Präzisionskamm für 14 Längen","22,63","8,93",B01AXMKPG8,"Philips OneBlade Pro QP6510/30, Trimmen, Stylen, Rasieren / Präzisionskamm für 12 Längen","10,47","18,53"
Amazon.de,schwangerschaftstagebuch,"98,77",B00VV58PXM,Schwangerschaftstagebuch: Anne Geddes,"13,52","6,82",B019BWT8RS,Schwangerschafts-Tagebuch - Jetzt wird's rund!: Mein Schwangerschafts-Tagebuch,"11,32","7,64",B015R0H3TS,Mein Schwangerschaftstagebuch (GROH Tagebuch),"9,59","5,98"
Amazon.de,whey,"98,77",B004U4WUFU,"ESN Designer Whey Protein,  Pro Series, Chocolate, 1er Pack (1 x 1000g Beutel)","30,83","8,11",B008BH7KKM,"MyProtein Impact Whey Protein, Vanilla, 1000g","16,18","5,12",B000GISU1M,"Optimum Nutrition Whey Gold Standard Protein, Vanille, 2,3 kg","15,72","0,63"
Amazon.de,xperia x compact,"98,77",B01L34I7I8,"Sony Xperia XCompact Smartphone (11,7 cm (4,6 Zoll), 32 GB Speicher, Android 6.0) Universe Black","74,01","53,55",B01L34I7P6,"Sony Xperia XCompact Smartphone (11,7 cm (4,6 Zoll), 32 GB Speicher, Android 6.0) Mist Blue","10,83","35,25",B01L34I7HY,"Sony Xperia XCompact Smartphone (11,7 cm (4,6 Zoll), 32 GB Speicher, Android 6.0) White","7,55","10,18"
Amazon.de,braun rasierer,"98,76",B00LZSPM0Y,Braun Series 9 9090cc elektrischer Rasierer mit Reinigungsstation silber,"15,87","2,49",B01490RM1G,"Braun SmartControl Classic Rasierer / elektrischer Rasierapparat (mit Etui, wasserfester Elektrorasierer), schwarz","12,54","8,71",B00WW8BVHO,"Braun Series 3 3040s elektrischer Rasierer (Rasierapparat, Elektrorasierer einsetzbar als Trockenrasierer und Nassrasierer (Wet und Dry)) blau","10,77","5,39"
Amazon.de,campingtisch,"98,76",B00D3KGK4E,Ultranatura Campingtisch Lindau - 75 x 55 x 60/25 cm,"25,02","18,69",B0027EAQX8,10T Flaprack Single - Camping Klapp-Tisch 80x60cm Aluminum stabile Tischplatte Telekopbeine stufenlos,"8,42","3,69",B0027Q6CKC,10T Portable Single - Camping Klapp-Tisch 60x45cm Aluminium Holzdekor mit Tragegriff,"5,93","2,87"
Amazon.de,hgb,"98,76",3423050020,"Handelsgesetzbuch HGB: mit Seehandelsrecht, mit Wechselgesetz und Scheckgesetz und Publizitätsgesetz","80,35","39,46",1523200448,,"7,07","32,91",3423050012,"Bürgerliches Gesetzbuch BGB: mit Allgemeinem Gleichbehandlungsgesetz, BeurkundungsG, BGB-Informationspflichten-Verordnung, Einführungsgesetz","4,8","0,62"
Amazon.de,häkeln,"98,76",3831023948,"Häkeln Schritt für Schritt: Über 100 Techniken und Häkelmuster, 20 Projekte für Einsteiger","7,55","9,15",3772463665,Häkeln - Das Standardwerk: Mit vielen aktuellen Trend- und Spezialtechniken|Standardwerk,"4,58","8,73",3772463851,Edwards freche Tierparade: 40 kuschelweiche Häkelfreunde,"4,47","3,15"
Amazon.de,logitech harmony,"98,76",B014GXQOJ2,Logitech Harmony Elite - Touchscreen-Fernbedienung für Home Entertainment schwarz,"21,31","14,39",B00J06UPEQ,Logitech Harmony Ultimate One  Universalfernbedienung,"20,54","1,11",B014GXQILQ,Logitech Harmony 950,"11,91","10,39"
Amazon.de,milchschäumer,"98,76",B000V3LA6E,ScanPart Milchaufschäumer,"17,59","12,08",B0043WC0W2,"Severin SM 9684 Milchaufschäumer (500 Watt, Induktion, 500 ml, kaltes und warmes Aufschäumen) Edelstahl/weiß","10,94","5,66",B0043W42ZU,"Xavax Milchicopter Milchaufschäumer (extra starker Motor, Spezialspirale, leichte Reinigung) schwarz","7,55","3,34"
Amazon.de,navigon,"98,76",B003URUB04,"Navigon 40 EASY Navigationssystem ( 4.3 Zoll Display,starrer Monitor, 16:9,Kontinent-Ausschnitt )","15,66",0,B00VVQ5L5G,"Garmin nüvi 57LMT Navigationsgerät (lebenslange Kartenupdates, Premium Verkehrsfunklizenz, 12,7cm (5 Zoll) Touchscreen)","14,99","8,09",B004WDH2HK,"Navigon 70 Easy Navigationssystem (12,7 cm (5 Zoll) Display, Europa 20, TMC, Aktiver Fahrspurassistent, Navigon MyBest POI, Navigon MyRoutes)","11,97",0
Amazon.de,apple pencil,"98,75",B016NY7784,APPLE iPad Pro Pencil for 9.7 u. 12.9,"80,44","70,45",B0148S20I4,"Adonit ADJDS Jot Dash dünner kapazitiver Präzisions Stylus (Aluminium, Trageclip, Akku, für iOS & Android, z.B. Apple iPad Pro, Air 2, mini 4) silber","6,31","3,63",B01DKTNR2K,"Ozaki O!Coat Snap-On Schutzhülle für Apple 9,7"" iPad Pro / Air 2 in schwarz [Ultra dünn | Extrem leicht | Soft-Touch Beschichtung | Apple Pencil Halterung   Apple Smart Keyboard & Smart Cover kompatibel] - OC129BK","5,25",0
Amazon.de,doppelseitiges klebeband,"98,75",B000GPI4PW,"tesa Doppelseitiges Klebeband für Teppich Verlegung sowie Bastel- und Dekorationsarbeiten, 10m x 50mm","24,86","16,43",B000QB6HFK,"tesa doppelseitiges Verlegeband, extra stark klebend, 10m x 50mm","17,04","12,8",B000QB2ZWO,"tesa doppelseitiges Klebeband für Teppich Verlegung sowie Bastel- und Dekorationsarbeiten, 25m x 50mm","13,2","8,72"
Amazon.de,frozen,"98,75",B00GSQLGCQ,Die Eiskönigin - Völlig Unverfroren,"8,7","3,14",B00LJPOWLS,"Totum 680012 - Disney Frozen Die Eiskönigin Bastel-Set Armbänder für Mädchen (Kreativ-Set mit Amulett, verschiedenen Perlen, Satinband, Gummiband, Sticker)","7,44","6,14",B00MGPUQR4,"Philips Disney Frozen (Die Eiskönigin) LED Projektor Tischleuchte, hellblau, 717690816","4,96","1,57"
Amazon.de,kärcher staubsauger,"98,75",B00IAPOPAI,Kärcher Mehrzwecksauger WD 3 Premium,"18,17","7,91",B00IAPS112,"Kärcher Mehrzwecksauger WD 3 P Extension Kit mit Steckdose und 1,5 m Saugschlauchverlängerung","16,14","10,08",B00IAQ3BCA,Kärcher Mehrzwecksauger WD 3,"12,27","9,37"
Amazon.de,lte router,"98,75",B00PIBBWSK,"TP-Link M7350 mobiler 4G/LTE MiFi Dualband-WLAN-Router (LTE Cat.4 150Mbit/s, 2550mAh interner Akku, OLED-Display, SIM-Kartensteckplatz, microSD-Kartenslot)","21,87","15,36",B014VB4N4M,"TP-LINK ARCHER MR200 Wireless Dualband 4G LTE Router (150 Mbit/s im Download, simultanes Dualband 300 Mbit/s +  433 Mbit/s, frei konfigurierbarer LAN/WAN-Port)","15,62","27,95",B003WK62OS,"TP-Link TL-MR3420 3G/4G WLAN-Router (bis zu 300 Mbps Datenübertragungsrate, UMTS/HSPA/EVDO)","11,2","9,98"
Amazon.de,messer,"98,75",B0002TTRQW,"Fiskars Universalmesser, Schwarz, Länge: 21cm","13,65","6,36",B005LTSUR0,"Böker Messer Starfighter, 01RY069","8,7",0,B007XULXQ0,"KS Tools Klappmesser mit Tasche,193mm 115mm, geschlossen, 907.2105","6,84","6,04"
