Abteilung,Suchbegriff,Suchhäufigkeit,ASIN,Nr. 1 der geklickten Titel,Klickfreigabe,Umwandlungs-Anteil,ASIN,Nr. 2 der geklickten Titel,Klickfreigabe,Umwandlungs-Anteil,ASIN,Nr. 3 der geklickten Titel,Klickfreigabe,Umwandlungs-Anteil
Amazon.de,fondant,"98,8",B0052CMBI0,Rollfondant Weiß 1 Kg inkl. Vorratsdose,"27,09","13,09",B004PDMTQ6,"FunCakes Fondant, meeresblau, 1er Pack (1 x 250 g)","10,13","4,53",B005RIRCK6,"FunCakes Fondant, feuerrot, 1er Pack (1 x 250 g)","8,74","8,21"
Amazon.de,heißluftfritteuse,"98,8",B00XVN7QBO,"Tristar FR-6990 Heißluftfritteuse (ohne Öl), Airfryer/ 5 Portionen/ 3,2 Liter","21,54",20,B00Y4SN790,"Princess Digitale Airfryer Heißluftfritteuse (ohne Öl) mit 1500 Watt, 3,2 Liter","15,37","19,96",B00B5WGO7K,"Tefal ActiFry FZ7070 Snacking Heißluft-Fritteuse (1 kg Fassungsvermögen, 1.400 Watt, inkl. 2 Rezeptbücher)","12,57","7,55"
Amazon.de,hundespielzeug,"98,8",B000958670,"Trixie 3499 Spielset Sun'n'Fun für Hunde, 4 Teile","11,51","4,17",B0054Q9TMA,"Trixie Dog Activity Flip Board Strategiespiel für Hunde, 23 cm","9,67","2,12",B0029EWVES,"Trixie 35912 Geier ""Gustav"", Plüsch, 28 cm","4,45","3,93"
Amazon.de,jack wolfskin rucksack,"98,8",B01G8ZTXQ2,Jack Wolfskin Unisex Rucksack Perfect Day,"12,6",0,B011L82CV4,Jack Wolfskin Damen Rucksack Ancona,"10,45",0,B00KXYX1NG,"Jack Wolfskin Rucksack Moab Jam, Black, 53 x 34 x 13 cm, 30 Liter, 2002292-6000","6,78","10,13"
Amazon.de,lenkrad,"98,8",B00YUIM2J0,"Logitech G29 Racing Lenkrad Driving Force für PS4, PS3 und PC","21,34","2,22",B00ANHE7CW,"Speedlink Drift O.Z. Lenkrad für PC (Schaltknauf, Gas- und Bremspedale, XInput und DirectInput, Vibrationsfunktion, einstellbare Lenk-Empfindlichkeit)","9,5","19,56",B000LY293Q,"Hama PC-Racing-Wheel ""Thunder V18"", mit Gas und Bremspedal, mit USB-Anschluss","8,57",22
Amazon.de,selection,"98,8",3737354219,Selection - Die Krone: Band 5,"38,86","11,3",373350030X,Selection,"16,62","17,98",3737352240,Selection – Die Kronprinzessin: Band 4,"11,31","12,51"
Amazon.de,dlan,"98,79",B00ADW9R22,"TP-Link TL-PA4010PKIT Powerline-Netzwerkadapter (500Mbps, Fast Ethernet, integrierte Steckdose) 2er Set","31,8","15,78",B00FRCDFYE,TP-Link TL-PA411KIT V2.0 AV500 Mini Powerline-Netzwerkadapter (500Mbps) 2-er Set,"14,32","14,02",B00KIHXS7W,dLAN 550 duo+ Starter Kit Powerline,"7,57","5,09"
Amazon.de,fritz box,"98,79",B00EO777DI,"AVM FRITZ!Box 7490 WLAN AC + N Router (VDSL/ADSL, 1.300 Mbit/s (5 GHz), 450 Mbit/s (2,4 GHz), DECT-Basis, Media Server)","34,27","16,86",B0117ZTDSG,"AVM FRITZ!Box 7430 (VDSL-/ADSL2+, WLAN N, 450 MBit/s (2,4 GHz), TK-Anlage für Voice over IP mit DECT-Basis, Mediaserver)","24,54","27,94",B00YOJ9JL4,"AVM FRITZ!Box 4020 WLAN-Router für Anschluss an Kabel-/DSL-/Glasfasermodem (WLAN N, 450 MBit/s (2,4 GHz) 4 x Fast-Ethernet, 1 x USB 2.0, Mediaserver)","13,78","26,67"
Amazon.de,galaxy j5 tasche,"98,79",B013QG5400,mumbi ECHT Ledertasche Samsung Galaxy J5 (2015) Tasche Leder Etui weiss (Lasche mit Rückzugfunktion Ausziehhilfe),"52,7",0,B013QG4852,mumbi ECHT Ledertasche Samsung Galaxy J5 (2015) Tasche Leder Etui (Lasche mit Rückzugfunktion Ausziehhilfe),"44,77","25,34",B01E7KV7H8,mumbi Tasche im Bookstyle für Samsung Galaxy J5 (2016) Tasche,"0,61","48,27"
Amazon.de,kochbuch,"98,79",3833816775,20 Minuten sind genug!: Über 150 Rezepte aus der frischen Küche (GU Themenkochbuch),"14,66","13,95",3898834891,Gesund kochen ist Liebe,"14,18","1,87",3442392748,"Heimat: Kochbuch. Mit über 120 Rezepten, in hochwertiger Ausstattung mit Leineneinband und Goldfolienprägung","8,02","4,38"
Amazon.de,luftmatratze wasser,"98,79",B0006N01AK,"Intex Lounge 18-Pocket Fashion, Farblich Sortiert, 188 x 71 cm","19,25","8,21",B004CLZRM4,"Intex Lounge Mesh, mehrfarbig, 178 x 94 cm","8,04","2,04",B001ZD6KL4,"Bestway 43040 Luftmatratze Fashion, 188 x 71 cm","7,11","3,44"
Amazon.de,mein kampf,"98,79",3981405234,,"52,09","25,45",3471665536,Adolf Hitlers Mein Kampf,"30,12","15,82",3455503950,"Hitlers ""Mein Kampf"": Geschichte eines Buches","4,92",0
Amazon.de,sonax,"98,79",B00PWRCRK2,"SONAX 761541 AutopflegeSet mit Tasche, 7 Teile","16,45","11,72",B00100EJ24,"SONAX 206300 XTREME Polster- & AlcantaraReiniger, 400ml","6,47","2,59",B004GHMRSQ,"SONAX 283241 XTREME CockpitReiniger Matteffect, 500ml","5,28","2,72"
Amazon.de,funksteckdose,"98,78",B002UJKW7K,mumbi Funksteckdosen Set: 3 x Funksteckdose und 1x Fernbedienung - Plug & Play - 1000 Watt,"24,91","12,11",B001AX8QUM,"Brennenstuhl Funkschalt-Set RCS 1000 N Comfort, 1507450","22,28","9,03",B0017USSM4,REV Ritter 00834514 Funk-Schalter-Set 1+3 Aktion,"10,42","8,97"
Amazon.de,gürtel,"98,78",B004OQZZ9C,Urban Classics Herren Gürtel Gürtel schwarz (Black) One Size,"37,11","34,05",B002V9210U,"camel active Lederguertel 4026609B66 Herren Accessoires/ Grtel, Gr. M Schwarz (schwarz 9)","22,89","18,25",B00NONWUL2,"Tommy Hilfiger Herren Gürtel NEW DENTON BELT, Einfarbig, Gr. 100 cm, Braun (TESTA DI MORO-EUR 066)","13,92","9,38"
Amazon.de,hochstuhl,"98,78",B0014R524W,roba 7562 - Treppenhochstuhl Sit up III,"20,25","7,38",B00NRSTEZO,"Safety 1st Timba - Mitwachsender extragroßer Hochstuhl mit abnehmbarem Tisch, Buchenholz","20,09","10,4",B00KWZQQ6K,"Hauck 661079 Hochstuhl Alpha +, natur","8,99","3,54"
Amazon.de,häcksler,"98,78",B00BYTVXMK,"Makita UD2500  Elektro - Häcksler, für starke Äste und weiches Häckselgut, 2500 W","22,38","13,11",B008RWN7X0,Atika 300657 Messerhäcksler AMA 2500,"18,06","11,79",B0037Q6X2S,Atika Leise Walzenhäcksler LHF 2800,"13,06","15,82"
Amazon.de,schwangerschaft,"98,78",3833815779,Das große Buch zur Schwangerschaft. Umfassender Rat für jede Woche,"20,15","15,31",3831030154,Alles über meine Schwangerschaft Tag für Tag,"9,76","5,82",3833836172,Meine  Schwangerschaft: Tag für Tag faszinierende Bilder und umfassender Rat,"8,67","11,17"
Amazon.de,seitenschläferkissen,"98,78",B01BSHOUBS,"Traumnacht 03774854438, 3-Star Seitenschläferkissen, weiches und bequemes Seitenschläferkissen aus softer Mircofaser, 40 x 145 cm, waschbar","69,41","45,39",B007AF6TS0,"Badenia 03774853244 Bettcomfort Seitenschläferkissen, 40 x 120 cm, weiß","14,93","19,65",B00J8FARLA,f.a.n. frankenstolz 07950-76249-10 Seitenschläferkissen / Medisan Sleep und Care / 140 x 040 cm,"3,6","23,68"
Amazon.de,babyschaukel,"98,77",B000PKKG3G,Hudora 72112 - Babyhochschaukel,"16,69","6,79",B00I96FFFM,Bright Starts 60198 Senecircaportable Babyschaukel,"9,31","3,44",B00F524KXG,"Kinderschaukel aus Holz im maritimen Stil, für Kinder ab 2 Jahren geeignet, Sicherheit durch Gurt und Stoffbahn, belastbar bis 25kg","6,78","10,41"
Amazon.de,federmappe,"98,77",B000VZK4FK,"Eastpak Federmäppchen OVAL, 5 x 22 x 9 cm, Black","8,86","4,56",B003PHF73A,"Eastpak Federmäppchen BENCHMARK, Sunday Grey, 6 x 20.5 x 7.5 cm","7,98","5,15",B01BUACLAU,"DAKINE Damen Federmäppchen SCHOOL CASE, Fireside, One Size, 08260056","7,21","2,53"
Amazon.de,fensterreiniger,"98,77",B00HUORV7Y,Kärcher 1.633-301.0 Fenstersauger WV2,"31,56","9,67",B00L25FFOS,"Leifheit 51147 Fenstersauger mit Stiel und Einwascher (Akku, elektrischer Fensterreiniger, 28 cm Fensterwischer) weiß/grün","14,65","13,08",B00QM9NHW6,Kärcher 1.633-440.0 Fenstersauger WV5,"13,72","7,62"
Amazon.de,flexfit cap,"98,77",B00CV31G34,,"42,01",0,B00ICLVAYO,Flexfit Erwachsene Mütze Wooly Combed,"14,42",0,B00ICLV8JG,Flexfit Erwachsene Mütze Double Jersey,"5,77",0
Amazon.de,galaxy s7 edge hülle,"98,77",B01CUFNH6G,mumbi double GRIP Hülle für Samsung Galaxy S7 Edge Schutzhülle schwarz,"55,65","4,3",B01C42FH4A,mumbi UltraSlim Hülle für Samsung Galaxy S7 Edge Schutzhülle transparent (Ultra Slim - 0.55 mm),"7,35","5,44",B01BLHLCNY,,"4,51",0
Amazon.de,kleiderständer,"98,77",B00P2F5XRI,,"21,58","19,43",B003SLDY1A,"Wenko 6200050100 Teleskop-Garderoben-System Herkules - verstellbares Ordnungssystem, Stahl, weiß","14,77","3,97",B019N08TO6,Garderobe Metall weiß 46 x 90 x 172 cm | Stahlgestell | Schuhablage |,"6,82","1,79"
Amazon.de,millenium lego,"98,77",B0017V21EY,LEGO Star Wars 10179 - Ultimatives Millenium Falcon Sammlermodell,"75,51",0,B00SDTTH5E,LEGO  Star Wars 75105 - Millennium Falcon,"17,2",0,B004OT8HJO,Lego Star Wars 7965 - Millennium Falcon,"3,61",0
Amazon.de,smoker,"98,77",B003LBEJCK,"El Fuego Holzkohlegrill/Smoker Dakota, Schwarz, 122x133x66 cm","20,91","24,66",B00BVZFU9Y,Ultranatura Smoker Grill Denver 2 Brennkammern - 119 x 66 x 135 cm,"10,79","8,9",B006CE0W6K,Tepro Toronto Holzkohlegrill,"7,88","0,69"
Amazon.de,switched at birth,"98,77",B00K5PALHW,,"95,25",0,B00JE3L936,Switched at Birth - Die komplette erste Staffel [3 DVDs],"2,21","86,96",B00KNIWIF4,Switched at Birth - Die komplette zweite Staffel [5 DVDs],"1,23","13,04"
Amazon.de,vibrator,"98,77",B000FJ9A52,"Orion 559814 Babyvibe Vibrator, rot,  13 cm lang, Ø 2,5 cm, stufenlos regelbar.","14,53","11,74",B00IF42W40,Ouch! einstellbar Höschen - schwarz - Kugeln und Mini vibratoren - Fetish,"11,9",0,B000FUCQI4,"Orion 551333 Natur-Vibrator, Gleitmaterial 17 cm lang, Ø 3,5 cm, stufenlos regelbar","8,68","10,81"
Amazon.de,call of duty infinite warfare,"98,76",B01F28DVVO,Call of Duty: Infinite Warfare - Legacy Edition - [PlayStation 4],"57,26","15,73",B01F28EI3Y,Call of Duty: Infinite Warfare - Legacy Pro Edition - [PlayStation 4],"13,69","13,93",B01F26HMR0,Call of Duty: Infinite Warfare - Standard Edition - [PlayStation 4],"9,69","11,84"
Amazon.de,fahrradkorb vorne,"98,76",B0010AIA5Q,"KLICKfix Farradtasche Uni Korb, Feinma. Schwarz, 0397KLIK","23,45","14,9",B00426HBNM,"Blue Bird Korb Lenkerkorbtasche, Schwarz/Hibiskusblüte, 05111700","18,69","11,74",B00F2KY6ZI,"KLICKfix Damen Fahrradkorb, Black Dots, 35 x 28 x 26 cm","10,44","3,86"
Amazon.de,fallout 4,"98,76",B00YSOD3RG,Fallout 4 Uncut - [PlayStation 4],"44,19","15,65",B00YSOCGCO,Fallout 4 Uncut - [PC],"19,85","19,18",B0159XJHHY,Fallout 4 - Season Pass,"9,1","8,89"
Amazon.de,kaninchenstall,"98,76",B00HVWPM9E,"Bunny Business ""The Grove"" Doppeldecker-Laufstall, für Kaninchen / Meerschweinchen, Farbton Spearmint","8,92","17,76",B01CN9XLDI,"A.K. for Pets 20098 Hasenstall ""Avoriaz"", 147 x 53 x 85 cm","7,73","10,65",B004XOZ4K0,"Bunny Business Zweistöckiger Kaninchen- / Meerschweinchenstall mit Ausziehfächern, ca. 104 cm","6,83","13,32"
Amazon.de,kaspersky internet security 2016,"98,76",B011LNOXPM,Kaspersky Internet Security 2016 Upgrade - 1 PC / 1 Jahr (Frustfreie Verpackung),"30,65","12,03",B011LNPS7O,Kaspersky Internet Security 2016 Upgrade - 3 PCs / 1 Jahr (Frustfreie Verpackung),"22,11","9,45",B018HWJSK0,Kaspersky Internet Security 2016 - 1 PC / 1 Jahr (Frustfreie Verpackung),"17,51","12,12"
Amazon.de,office 365,"98,76",B00A2ILVP8,Microsoft Office 365 Home - 5PCs/MACs - 1 Jahresabonnement - multilingual (Product Key Card ohne Datenträger),"35,28","23,76",B01EA1MRFU,Microsoft Office 365 Home 5PCs/MACs - 1 Jahresabonnement - multilingual (Product Key Card ohne Datenträger),"32,39","27,19",B01EA1P4NM,Microsoft Office 365 Personal - 1 PC/MAC - 1 Jahresabonnement - multilingual (Product Key Card ohne Datenträger),"23,2","35,88"
Amazon.de,rollschuhe soy luna,"98,76",B01AY6P52M,"Soy Luna 70032331 - Roller skate, Größe 36/37","33,2","46,08",B01I0N6C46,,"19,21",0,B01AY6P5DQ,"Soy Luna 70032321 - Roller skate, Größe 34/35","7,48","5,99"
Amazon.de,samsung galaxy j5 ledertasche,"98,76",B013QG5400,mumbi ECHT Ledertasche Samsung Galaxy J5 (2015) Tasche Leder Etui weiss (Lasche mit Rückzugfunktion Ausziehhilfe),"53,83",0,B013QG4852,mumbi ECHT Ledertasche Samsung Galaxy J5 (2015) Tasche Leder Etui (Lasche mit Rückzugfunktion Ausziehhilfe),"45,04","13,04",B01E7KV7H8,mumbi Tasche im Bookstyle für Samsung Galaxy J5 (2016) Tasche,"0,42",0
Amazon.de,schere,"98,76",B005IUSC4S,"Westcott N-90027 00 Easy Grip Scheren Set, 3 Stück, 13cm + 21cm + 25 cm, schwarz-blau","29,4","9,33",B0013CMZI4,"Wedo 97665 Universalschere, rostfreier Edelstahl, spitz, Kunststoff Softgriffe 16 cm, schwarz/rot","12,25","11,81",B00191RXVI,"Herlitz Design Bastelschere aus Stahl/Kunststoff, spitz","7,07","1,73"
Amazon.de,apple,"98,75",B008ATNI98,"Apple MacBook Pro Retina Display MC975D/A 39,1 cm (15,4 Zoll) Notebook (Intel Core i7 3615QM, 2,3GHz, 8GB RAM, 256GB Flashspeicher, NVIDIA GT 650M, Mac OS)","28,03",0,B004Z3PNW8,"Apple iMac MC813D/A 68.6 cm (27 Zoll) Desktop-PC (Intel Core i5-2500S, 2,7GHz, 4GB RAM, 1TB HDD, AMD HD 6770M, DVD, Mac OS)","11,99",0,B005YYTIOG,"Apple MacBook Pro MD318D/A 39,1 cm (15,4 Zoll) Notebook (Intel Core i7-2675QM, 2,2GHz, 4GB RAM, 500GB HDD, AMD HD 6750M, Mac OS)","7,8",0
Amazon.de,arlo,"98,75",B00TDNYNP8,"NETGEAR Arlo VMS3230-100EUS Smart Home 2 HD-Überwachung Kamera-Sicherheitssystem (100% kabellos, Indoor/Outdoor, Bewegungssensor, Nachtsicht) weiß","29,17","11,07",B00TDNYNXA,"NETGEAR Arlo VMC3030-100EUS Smart Home Zusatz-HD-Security-Überwachung Kamera (100% kabellos, Indoor/Outdoor, Bewegungssensor, Nachtsicht) weiß","15,22","16,85",B00TDNYNN0,"NETGEAR Arlo VMS3330-100EUS Smart Home 3 HD-Überwachung Kamera-Sicherheitssystem (100% kabellos, Indoor/Outdoor, Bewegungssensor, Nachtsicht) weiß","14,27","7,84"
Amazon.de,charlotte link,"98,75",3734100852,Die Betrogene: Kriminalroman,"21,56","10,03",3442377323,Schattenspiel: Kriminalroman,"10,47","7,77",3442382599,Im Tal des Fuchses: Kriminalroman,"8,6","4,11"
Amazon.de,dji phantom 3,"98,75",B013J39S0M,DJI Phantom 3 Standard,"48,21","43,75",B00WAGS5W2,DJI Phantom III Professional Quadrocopter mit 4K Kamera,"12,29","7,71",B00WAGS478,DJI Phantom III Advanced Quadrocopter mit 1080P HD Kamera,"11,63","9,85"
Amazon.de,klobürste,"98,75",B003SLDWSK,"WENKO 18931100 WC-Garnitur Basic Schwarz, Kunststoff, 14 x 38 x 14 cm, Schwarz","24,03","7,05",B0037X132Q,"Zeller 18319 WC-Bürste ""Schiefer"", Polyresin, 9,5 x 9,5 x 38,5 cm, schwarz","7,09","4,4",B00TQQ3Y9S,"Wenko 21694100 Edelstahl WC-Garnitur Detroit, rostfrei, 8,9 x 41,5 x 8,9 cm, satiniert","7,02","2,61"
Amazon.de,pc lenkrad,"98,75",B00YUIM2J0,"Logitech G29 Racing Lenkrad Driving Force für PS4, PS3 und PC","10,9","0,36",B00ANHE7CW,"Speedlink Drift O.Z. Lenkrad für PC (Schaltknauf, Gas- und Bremspedale, XInput und DirectInput, Vibrationsfunktion, einstellbare Lenk-Empfindlichkeit)","10,64","23,66",B000LY293Q,"Hama PC-Racing-Wheel ""Thunder V18"", mit Gas und Bremspedal, mit USB-Anschluss","10,47","10,65"
Amazon.de,sony a7,"98,75",B00FWUDE9W,"Sony Alpha 7 nur Gehäuse (24,3 Megapixel, 7,6 cm (3 Zoll) Display, BIONZ X, 2,3 Megapixel OLED Sucher, NFC) schwarz   ILCE7B.CE/ILCE7","26,74",0,B00Q2KEUFI,"Sony Alpha 7 II nur Gehäuse (24,3 Megapixel, 7,62 cm (3 Zoll) LCD Display, Full HD Videofunktion (XAVC S, AVCHD), Vollformat Exmor CMOS Sensor) schwarz","26,74","13,7",B00FWUDEEC,"Sony Alpha 7KB Systemkamera (24,3 Megapixel, 7,6 cm (3 Zoll) Display, BIONZ X, 2,3 Megapixel OLED Sucher, NFC) inkl. SEL 28-70mm schwarz","12,43",0
Amazon.de,violetta,"98,75",B00GWSSDM6,Giochi Preziosi 70051801 - Disney VIOLETTA Tagebuch,"9,27","0,88",B00UC3AR8A,"Disney Violetta Bastel-Set Freundschafts-Armbänder ( Kreativ-Set mit Bändern, Perlen und süßen Anhängern in verschiedenen Farben)","6,23","10,66",B00WF8W5TY,,"5,55",0
Amazon.de,familienkalender 2017,"98,74",1474832105,Familienkalender 2017,"9,4","7,96",3731817314,XL Familienplaner 2017: Familientimer mit Ferienterminen und Vorschau bis März 2018,"6,8","3,9",3731817403,Familienplaner Farbenspiel 2017: Familientimer mit Ferienterminen und Vorschau bis März 2018,"5,22","2,31"
Amazon.de,galaxy j5 ledertasche,"98,74",B013QG5400,mumbi ECHT Ledertasche Samsung Galaxy J5 (2015) Tasche Leder Etui weiss (Lasche mit Rückzugfunktion Ausziehhilfe),"54,31",0,B013QG4852,mumbi ECHT Ledertasche Samsung Galaxy J5 (2015) Tasche Leder Etui (Lasche mit Rückzugfunktion Ausziehhilfe),"45,61",0,B01E7KV9AI,mumbi Tasche im Bookstyle für Samsung Galaxy J5 (2016) Tasche weiss,"0,04",100
Amazon.de,hasenstall,"98,74",B00A77XQOS,FeelGoodUK 2 stufiger Hasenstall / Kaninchenstall mit Dach,"11,28","9,94",B00121VS6G,"Trixie 62315 Hülle für natura-Stall # 62321, 116 × 97 × 69 cm","10,41","4,14",B01CN9XLDI,"A.K. for Pets 20098 Hasenstall ""Avoriaz"", 147 x 53 x 85 cm","6,4","7,46"
Amazon.de,isomatte selbstaufblasend,"98,74",B008CFRBAM,,"22,26",0,B01C8ATHCG,,"15,72",0,B004TIF8U6,10T Tom 600 - Selbstfüllende Iso-Matte mit Kunststoffventil grau TPU-Beschichtung 193x63x6cm,"9,68","15,2"
Amazon.de,klemmbrett,"98,74",B006HYLMXM,Herlitz 11217221 Klemmbrettmappe PF A4 schwarz,"19,62","7,12",B000KJR88I,"Wedo 57601 Klemmbrett A4, Kunststoff mit abgerundeten Ecken, vernickelte Metallklemme und Aufhängeöse, schwarz","11,12","10,73",B000WL3O1O,,"8,95","9,12"
Amazon.de,kurbelradio,"98,74",B00U2XLQLC,"Sangean MMR-88 tragbares Kurbelradio (UKW/MW-Tuner, Taschenlampe, Notfall-Signalton, integrierter Li-Ion-Akku, Kopfhöreranschluss) gelb/schwarz","22,54","20,74",B00SXA05QI,Midland C1173 ER300 Outdoor-Radio (UKW/SOS/Lampe/Solar/PowerBank) rot,"21,25","11,55",B00B3NTC0M,"Karcher KR 110 tragbares Kurbelradio (AM/FM-Radio, Taschenlampe, Handy-Ladefunktion) schwarz","17,29","6,8"
Amazon.de,luftreiniger,"98,74",B01C90JO7S,"Dyson Pure Cool Link Turm-Luftreiniger (Speziell für Allergiker, HEPA Filter, Ventilatorfunktion, automatische Reinigung, App Steuerung, Sleep-Timer, Fernbedienung) weiß","19,62","17,76",B00JDFNUJ6,Philips Luftreiniger AC4072/11 mit hocheffizientem HEPA-Kombifilter für Wohnung und Büro,"16,66","13,47",B009DFZM0G,DeLonghi AC 75 Luftreiniger,"11,74","4,81"
Amazon.de,m400 polar,"98,74",B00NPZ7WNU,"POLAR Trainingscomputer M400, Schwarz, 90051092","52,59","36,83",B00OBZKT2E,"POLAR Trainingscomputer M400 HR, Schwarz, 90051341","23,11","9,25",B0114KM7CS,"POLAR Trainingscomputer M400 HR, Blue","7,35","25,32"
Amazon.de,12 monkeys,"98,73",B01GKME37M,,"41,84",0,B01GKME5SY,,"37,61",0,B01GR9U5GG,12 Monkeys - Staffel 1 [Blu-ray],"9,61","19,37"
Amazon.de,herren t-shirt,"98,73",B01J6INBC0,,"6,13",0,B01ICWXTNW,,"5,53",0,B00P421OBS,Jack & Jones Tech Herren T-shirt JJT Foam New Tee Short Sleeves Crew Neck Noos,"4,97",0
Amazon.de,kniebandage,"98,73",B003J37DOG,Rehband Herren Kniebandage 7751,"22,53",0,B000ORS9P2,Hansaplast Knie-Bandage,"13,44","33,27",B00KARK0TO,,"9,43",0
Amazon.de,microfaser handtuch,"98,73",B00XPKVV3W,"Dream Art extra saugfähiges Mikrofaser-Badetuch, 90 x 180cm, fuchsia","27,63","28,02",B00F23FX2U,,"23,88",0,B015CQIG4S,AmazonBasics Mikrofaser Sporthandtuch-Set (1 Badetuch & 1 Handtuch),"19,89","15,5"
Amazon.de,nexo knights,"98,73",B013JQDXKA,LEGO Nexo Knights 70317 - Fortrex - Die rollende Festung,"8,66","4,02",B01CCT2FLI,LEGO Nexo Knights 70323 - Jestros Vulkanfestung,"7,84","3,69",B01AC1BDG6,LEGO Nexo Knights 70336 - Ultimativer Axl,"5,51","5,79"
Amazon.de,reisehandtuch,"98,73",B00F23FX2U,,"46,52",0,B00XPKVV3W,"Dream Art extra saugfähiges Mikrofaser-Badetuch, 90 x 180cm, fuchsia","27,49","83,04",B015CQIG4S,AmazonBasics Mikrofaser Sporthandtuch-Set (1 Badetuch & 1 Handtuch),"7,36","8,68"
Amazon.de,sekundenkleber,"98,73",B004V4B60Y,"Pattex Sekundenkleber Mini Trio flüssig 3 x 1 g, PSMT2","38,53","11,83",B0000WRNV2,Loctite Sekundenkleber 401 5G,"14,21","6,82",B00O23B8IE,"Pattex Sekundenkleber Minitrio Gel 3 x 1 g, PSMG3","13,08","7,7"
Amazon.de,bettwäsche 155x220,"98,72",B008VOEC5G,"Bierbaum 6277_04 Feinbiber-Bettwäsche Dessin 155 x 220 cm + 80 x 80 cm, mokka","7,85","4,2",B008VOEI9G,"Bierbaum 4757 Mako-Satin-Bettwäsche Dessin 155 x 220 cm + 80 x 80 cm, rot","7,7","3,68",B00BJEVZVY,"Bierbaum 6383_02 Mako-Satin-Bettwäsche Dessin, 155 x 220 cm und 80 x 80 cm, türkis 02","7,24","2,89"
Amazon.de,bibi und tina 3 dvd,"98,72",B01B9004FK,Bibi & Tina - Mädchen gegen Jungs!,"63,81","22,32",B01GNZ670C,"Bibi & Tina DVD 3. Kinofilm: ""Mädchen gegen Jungs!"" + Tischkalender 2017  Limited Edition [exklusiv bei Amazon]","29,39","34,16",B00R2S3ITS,"Bibi & Tina, Voll verhext","2,05","5,61"
Amazon.de,destiny,"98,72",B00ZR6LRSG,Destiny - König der Besessenen [PlayStation 4],41,"19,32",B01KAGUSPK,Destiny - The Collection - [Xbox One],13,"7,47",B00ZR6M9TM,Destiny - König der Besessenen [Xbox One],"7,05","4,98"
Amazon.de,dokumentenmappe,"98,72",B00AOEL1TG,"Alassio Dokumentenmappe, DIN A4, Lederimitat, schwarz","13,93","9,75",B000P38VEO,"Pagna 30503-01 - Dokumentenmappe DIN A4, Kunstleder, schwarz","9,01","8,36",B000OZVOIS,"Genie Exclusiv A4 Schreibmappe mit Ringbuch, Taschenrechner, Reißverschluss, inkl. A4-Schreibblock, Lederoptik schwarz","6,25","2,18"
Amazon.de,drucksprüher,"98,72",B0007VHFY6,"Gloria Drucksprüher Drucksprühgerät 5Liter Prima5 42E, gelb","25,87","6,1",B002NZ9KW4,"Tukan Drucksprüher Drucksprühgerät 5 Liter, weiß","12,47","4,09",B005AEDOX6,"Tukan Drucksprüher Universal Drucksprüher 1,5L mit Messingdüse und Überdruckventil, weiß","8,42","4,83"
Amazon.de,krabbeldecke,"98,72",B001WAK4X0,"Taf Toys 10845 Sehr große Spieldecke, 100 x 150 cm","16,36","4,78",B00B477KV0,"Roba 1406 S145 Spiel- und Krabbeldecke Jumbotwins, grau","11,97","13,45",B000FFL58Q,Mattel K4562 - Fisher-Price Rainforest Erlebnisdecke,"8,75","1,6"
Amazon.de,laminierfolien a4,"98,72",B000NJUWME,"Fellowes ImageLast Laminierfolien (80 Mikron, DIN A4, 100 Stück ) transparent","33,08","8,58",B004YB9KVQ,"Olympia 9166 Laminierfolien, 80 Mic, DIN A4, 100 Stück","18,25","6,88",B000NDL5WG,"Peach PP580-02 Laminierfolien, DIN A4, 80 mikron, 100 Stück","9,56","4,93"
Amazon.de,laptop rucksack,"98,72",B00EEBS9O0,"AmazonBasics Laptop-Rucksack geeignet für bis zu 43,2 cm (17 Zoll)","21,02","7,98",B001V5JAXG,"Belkin Notebook-Rucksack (geeignet für Notebooks bis zu 43,2 cm (17 Zoll)) kohlenschwarz/weinrot","11,82","9,23",B002J9HBSE,"Case Logic VNB217 Notebook Backpack 43,9 cm (17,3 Zoll) Rucksack Schwarz","5,25","9,23"
Amazon.de,peppa wutz,"98,72",B01DWQXHR6,,"14,46",0,3845103981,Peppa: Tolle Vorlesegeschichten mit Peppa,"10,95","8,23",B001TH4YO6,"TY 7196230 - Peppa Large - Schwein mit rotem Kleid und Bär, 25 cm","5,86","8,6"
Amazon.de,salomon speedcross 3,"98,72",B01CJGTSLO,,"20,44",0,B00WTZRDMW,Salomon Speedcross 3 Herren Traillaufschuhe,"16,28",0,B00WTZR6N8,Salomon Speedcross 3 Herren Traillaufschuhe,"10,76",0
Amazon.de,sketchers memory foam,"98,72",B00DDV22LI,Skechers Flex Appeal Spring Fever Damen Sneakers,"8,26",0,B00DDV238U,Skechers Flex Appeal Love Your Style Damen Sneakers,"5,84",0,B00DDV27TK,Skechers GO Walk 2 Damen Sneakers,"4,44",0
Amazon.de,werkzeugtasche,"98,72",B003KPHZHS,"Stanley Werkzeugtasche, 44.7x27.5x23.5 cm, 600 Denier Nylon, verstellbarer Schultergurt, wasserdicht, 1-96-183","8,27","8,62",B00RGKK9FI,"Bosch Tasche, groß M, WERKZEUGTASCHE","7,58","1,38",B000P5T6MS,"Stanley Rolltasche, Denier Nylon, 12 Fächer, Dokumententasche, Stifthalter, unbestückt, 1-93-601","6,52","3,1"
Amazon.de,canon,"98,71",B01CQPABLE,"Canon EOS 1300D Digitale Spiegelreflexkamera (18 Megapixel, APS-C CMOS-Sensor, WLAN mit NFC, Full-HD) Kit inkl. EF-S 18-55mm IS Objektiv","16,11","17,18",B01C2XJVPC,"Canon EOS 80D SLR-Digitalkamera (24,2 Megapixel, 7,7 cm (3 Zoll) Display, APS-C CMOS Sensor, 45 AF-Kreuzsensoren, DIGIC 6 Bildprozessor, NFC und WLAN, Full HD) nur Gehäuse schwarz","6,21",0,B00HTV6GB0,"Canon Legria Mini X Camcorder (12 Megapixel CMOS Sensor, 6,9 cm (2,7 Zoll), USB 2.0) schwarz","6,07",0
Amazon.de,dragonball xenoverse 2,"98,71",B01I3QVJJI,Dragon Ball Xenoverse 2 - Deluxe Edition - [PlayStation 4],"41,27","31,54",B01I2BO2L6,Dragon Ball Xenoverse 2 - Collector's Edition - [PlayStation 4],"22,57","10,3",B01I3QUS40,Dragon Ball Xenoverse 2 - [PlayStation 4],"21,69","22,72"
Amazon.de,gehäuse,"98,71",B00NCG16O8,"Sharkoon VG4-W Blau PC-Gehäuse mit Window Kit (2x USB 3.0, 2x USB 2.0, ATX) schwarz/blau","11,62","7,95",B015J8QGDC,"Sharkoon VG5-W PC-Gehäuse (Schnellverschlüsse, 2x 120-mm-LED-Lüfter vorinstalliert, USB 3.0) grün","11,46","9,72",B00N0W2R9W,"Sharkoon VS4-V PC-Gehäuse (2x USB 3.0, ATX) schwarz","7,1","9,21"
Amazon.de,kindle voyage,"98,71",B00IOY524S,"Kindle Voyage eReader, 15,2 cm (6 Zoll) hochauflösendes Display (300 ppi) mit integriertem intelligenten Frontlicht, PagePress-Sensoren, WLAN","73,81","19,99",B00GMUQCE0,"Kindle Voyage 3G eReader, 15,2 cm (6 Zoll) hochauflösendes Display (300 ppi) mit integriertem intelligenten Frontlicht, PagePress-Sensoren, Gratis 3G + WLAN","9,72","13,31",B00JAKBZGY,"Kindle Voyage, (Zertifiziert und generalüberholt), 15,2 cm (6 Zoll) hochauflösendes Display (300 ppi) mit integriertem intelligenten Frontlicht, PagePress-Sensoren, WLAN","5,69","53,95"
Amazon.de,knete,"98,71",B000O8RL5U,"Herlitz 8 Stangen Knete, 8 Farben","11,89","9,82",B00132AVYY,"Hasbro 23414186 - Play-Doh Spaßeimer, sortiert","11,86","4,2",B001QFYS56,"Hasbro 22037477 - Play-Doh Party Turm, sortiert","8,96",6
Amazon.de,laufrad,"98,71",B0017VHEXW,"Kettler 8715-600 - Laufrad Speedy, 25,4 cm (10"")","33,36","25,19",B00W8T566O,Kettler 0T04015-0035 - Laufrad - Speedy 10 Zoll Rocket,"8,86","12,57",B006IRT1WM,Puky Laufrad LR M 4058,"7,27","2,63"
Amazon.de,soda stream crystal,"98,71",B005Q9GKXG,"SodaStream Wassersprudler Crystal  (mit 1 x CO2-Zylinder 60L und 2 x 0,6L Glaskaraffen) Titan/Silber","54,36","29,01",B00CFH1TGU,"SodaStream Wassersprudler Crystal (mit 1 x CO2-Zylinder 60L und 1 x 0,6L Glaskaraffe), Premium-weiß","6,76","6,61",B003KGAI3K,"SodaStream Wassersprudler Crystal Umsteiger (1 x 0,6L Glaskaraffe, ohne CO2-Zylinder), Titan-silber","6,72","30,88"
Amazon.de,wow,"98,71",B01AM42KL0,World of Warcraft: Legion (Add-On) - [PC/Mac],"61,43","21,02",B00F8BGHQM,World of Warcraft,"6,53","40,03",B01AM42Z56,World of Warcraft: Legion (Add-On) - Collector's Edition,"6,21","11,7"
Amazon.de,batterien aaa,"98,7",B00LN803K0,Varta VA4003 AAA/Micro/LR03 Batterie (40-er Pack),"30,86","7,73",B00B1WQ20I,"Duracell DURAUL24AAA Ultra Power Batterien (AAA, Micro, LR03, 24er Box)","16,9","9,05",B009YF5S90,GP LR03 Micro AAA Super Alkaline (40-er Pack),"10,1","8,1"
Amazon.de,dvd,"98,7",B015SWA2Z2,Alles steht Kopf,"14,86","2,35",B01CJZSCY4,Die Bestimmung – Allegiant [2 DVDs],"6,41","0,49",B01CPLX9XQ,Batman v Superman: Dawn of Justice,"6,11","0,86"
