Abteilung,Suchbegriff,Suchhäufigkeit,ASIN,Nr. 1 der geklickten Titel,Klickfreigabe,Umwandlungs-Anteil,ASIN,Nr. 2 der geklickten Titel,Klickfreigabe,Umwandlungs-Anteil,ASIN,Nr. 3 der geklickten Titel,Klickfreigabe,Umwandlungs-Anteil
Amazon.de,toilettenpapierhalter,"99,08",B003SLDWMQ,"WENKO 18774100 Turbo-Loc Toilettenpapierrollenhalter  - Befestigen ohne bohren, Stahl, 14 x 6 x 9 cm, Chrom","11,03","3,64",B000MS0WK8,Toilettenpapierhalter Classic / Matt Steel,"8,24","5,26",B00G12KJ6G,"Bisk 04312 Natura Papierhalter ohne Deckel Verchromt, 13 x 7.5 x 5 cm","7,32","3,47"
Amazon.de,wanderhose damen,"99,08",B01AUV3T4C,The North Face Damen Hose W Exploration Pants,"9,05",0,B00HEHAC5K,CMP Damen Hose Zip Off,"7,9",0,B00HROJWKQ,Jack Wolfskin Damen Softshell Hose Activate Pants,"7,72",0
Amazon.de,badeschuhe herren,"99,07",B00KPP25G2,Waimea Erwachsene Wassersportschuhe Aquaschuhe,"10,18",0,B01H23A4Z8,Beco Herren Badeschuh Surf,"8,95",0,B013COPMJE,BECO Badeschuhe / Surfschuhe für Damen und Herren,"8,77",0
Amazon.de,digimon,"99,07",B00SZCQD74,,"36,76",0,B01G2Q2JH2,Digimon Adventure 01 im Sammelschuber (Volume 1: Episode 01-18)(3 Disc Set) [Limited Edition],"17,21","46,47",B00TEG8VXE,,"12,17",0
Amazon.de,homematic,"99,07",B00BZ6XLJ0,"HomeMatic 103584 Zentrale Haussteuerung CCU2, weiß","12,43","5,85",B01G7TNLD0,,"4,92",0,B0024G59VS,"HomeMatic Funk-Schaltaktor 1fach, Unterputzmontage","4,81","5,21"
Amazon.de,led lenser,"99,07",B00F9ZH4O6,LED Lenser P7.2 Taschenlampe Box,"20,26","8,39",B00HVEI3G6,LED Lenser P5.2 Taschenlampe Gift Box 9405,"12,03","9,79",B016P27MGG,"LED Lenser P7R Box, Taschenlampe 9408-R","8,04","6,32"
Amazon.de,leifheit bodenwischer,"99,07",B00KM40ELY,Leifheit 55210 Bodenwischer Classic,"15,82","4,8",B0002HOUIE,"Leifheit 55045 Bodenwischer Profi micro duo, 42 cm, mehrfarbig","11,19","7,91",B005ELNR0K,"Leifheit 55356 Set Combi Clean inkl. Eimer mit Presse und Bodenwischer mit Micro Duo Bezug, Classic Green","10,76","3,08"
Amazon.de,leiter,"99,07",B00WECNAHM,Hailo L20 Alu-Haushaltsleiter mit EasyClix und Bügel (verschiedene Größen),"21,6","12,06",B00WECMKXM,Hailo L60 Alu-Haushaltsleiter mit EasyClix und Schale (verschiedene Größen),"16,57","0,73",B00WECLQ7I,"Hailo XXL Garden&Home  mit  EasyClix, breiten Stufen und Wiesenbodenleiste (verschiedene Größen)","5,3","8,12"
Amazon.de,nes mini classic,"99,07",B01IFJEWTM,Nintendo Classic Mini: Nintendo Entertainment System,"66,72","26,02",B01IH5O186,Nintendo Classic Mini: NES-Controller,"19,85","39,42",B0111WVVLM,SEGA Mega Drive / Genesis Wireless Retro Console with 80 Video Games,"2,88",0
Amazon.de,penispumpe,"99,07",B003Z1O93K,Orion Bang Bang Penispumpe Schwarz,"25,85","6,67",B001G6P3I6,"You2Toys Penispump Deluxe mit Druckmess, 1 Stück","17,43","6,78",B007W92W1M,"You2Toys Stiff&Strong Penispumpe, 1 Stück","9,27","7,71"
Amazon.de,pinnwand,"99,07",B0013NFRAG,Bi-Office Korktafel / Pinnwand mit Holzrahmen- 5 Größen wählbar - 60 x 40 cm,"14,84","7,5",B000KT7AT0,5 Star 915552 Korktafel mit Holzrahmen 40x30cm braun Kork/Holz,"8,48","10,08",B00191PU90,"Herlitz 10685394 Pinnwand und Magnettafel, 40x60cm mit Holzrahmen, Farbe silber","7,61","5,1"
Amazon.de,stabilo,"99,07",B0007OEE2E,STABILO point 88  Fineliner 10er Etui Standardfarben - sortiert,"13,03","6,68",B019RSYE2A,STABILO Pen 68 - Premium-Filzstifte - 30er Set,"10,07","3,96",B00BB8LCDE,"STABILO point 88 30er Rollerset, 25 + 5 Neonfarben - Fineliner","6,54","6,96"
Amazon.de,stirnlampe,"99,07",B00UAJ2CXO,"Petzl Stirnlampe Tikkina, E91HNE","57,27","25,06",B00UAJ2B8A,"Petzl Stirnlampe Tikka, black, One size, E93HNE","3,69","1,51",B010G1TQ8E,"Mammut Stirnlampe T-Base, Smoke, One size, 2320-00322-0213-1","3,66","6,39"
Amazon.de,zahnbürste elektrische,"99,07",B00J59G236,"Philips Sonicare HX6510/22 EasyClean Elektrische Zahnbürste mit Schalltechnologie, weiß","15,86","0,21",B00LVUY84W,Oral-B PRO 6500 elektrische Zahnbürste (mit Bluetooth & 2. Handstück),"10,63","0,15",B013EGEFQQ,Braun Oral-B Pro 690 Elektrische Zahnbürste mit 2 Handstücken,"8,27","6,17"
Amazon.de,elektrische kühlbox,"99,06",B00BJF9JPC,EZetil Mirabelle E24 Thermoelektrische Kühlbox 12V,"18,7","2,34",B00TZXVBPG,Severin KB 2922 Mini-Kühlschrank / A++ / 41.6 cm Höhe / 70 kWh/Jahr / zum Kühlen und Warmhalten geeignet,"12,1","0,64",B01AT2FMJC,"MOBICOOL Elektrische Kühlbox für Auto und Steckdose V26 AC/DC, 12/230 Volt-Anschluss, 25 Liter, Grau","8,4","0,49"
Amazon.de,hazet,"99,06",B004H4CCJM,"Hazet Werkzeugwagen Assistent 178 inklusive 169-teilig Sortiment, 178-6/169","7,33",0,B004EXVHRE,HAZET Steckschlüssel-Satz 853-1,"6,89","0,44",B002WGJ8TY,"Heyco/Heytec 50807694500 Montage-Werkzeugkasten, Stahlblech 5-fach aufklappbar inklusive 96-teiligem Werkzeugsortiment, 5 Modulen","4,55",0
Amazon.de,masturbator,"99,06",B0084A8QMC,"Fleshlight Flight Pilot, Masturbator","8,26","2,56",B001GHGG5O,"You2Toys Oxana Pussy and Ass, Masturbator","7,13","3,31",B01ICI2HCK,,"5,76",0
Amazon.de,monitor 27 zoll,"99,06",B00UHAXAKK,"Samsung S27E390H 68,58 cm (27 Zoll) Monitor (HDMI, D-Sub, 4ms Reaktionszeit) schwarz","23,64","11,97",B00HZF2ME0,"BenQ GL2760H 68,6 cm (27 Zoll) LED Monitor (Full-HD, Eye-Care, HDMI, VGA, 2ms Reaktionszeit) schwarz","15,76","9,06",B007Z1AWT6,"Acer G276HLAbid 68,6cm (27 Zoll) Monitor (VGA, DVI, HDMI, 2ms Reaktionszeit) schwarz","6,38","2,55"
Amazon.de,surface,"99,06",B01690TCWG,"Microsoft Surface Pro 4 31,24 cm (12,3 Zoll) Tablet-PC (Intel Core i5, 8GB RAM, 256GB, Intel HD Graphics, Windows 10 Pro)","15,72","12,73",B015MKDO3C,"Microsoft Surface 3, 4GB RAM, 128GB Speicher, WiFi/LTE, Win10","13,45","3,98",B013UY0C28,"Microsoft Surface 3, 4GB RAM, 128GB Speicher, WiFi, Win10","11,93","31,82"
Amazon.de,b00iyd5quo|b00iyd5qjk|b00iyd5qng|b01g2eei6e,"99,05",B00IYD5QNG,"Nivea Men Sport Pflegedusche, 4er Pack (4 x 250 ml)","42,31","24,3",B00IYD5QUO,"Nivea Men Energy Pflegedusche, Duschgel, 4er Pack (4 x 250 ml)","36,41","19,78",B01G2EEI6E,"Nivea Men Jogi Shirt, Größe L, 1 Stück","11,72","36,81"
Amazon.de,eos 80d,"99,05",B01C2XJVPC,"Canon EOS 80D Digitale Spiegelreflexkamera (24.2 Megapixel APS-C CMOS Sensor, 45 AF-Kreuzsensoren, DIGIC 6 Bildprozessor, NFC und WLAN, Full HD, 7,7 cm (3 Zoll) Display) nur Gehäuse schwarz","66,97","12,14",B01C2XJWZ6,"Canon EOS 80D Digitale Spiegelreflexkamera (24,2 Megapixel, 7,7 cm (3 Zoll) Display, DIGIC 6 Bildprozessor, NFC und WLAN, Full HD) inkl. EF-S 18-55mm 1:3,5-5,6 IS STM schwarz","11,03","9,03",B01CJMBXUC,"Canon EOS 80D 18-135mm IS USM, 1263C042","4,9",0
Amazon.de,medela,"99,05",B009M37YA0,"Medela elektrische Doppel-Milchpumpe, Swing maxi","24,46","8,38",B005CTXB28,Medela 030.0028 Swing - moderne elektrische Milchpumpe,"20,06","2,56",B008743JQ8,Medela Freestyle 042.0006 Elektrische Milchpumpe,"15,48","10,44"
Amazon.de,oberfräse,"99,05",B000W34ZEW,"Bosch DIY DIY Oberfräse POF 1400 ACE, 3 x Spannzange, Fräser, Parallelanschlag, Absaugadapter, Karton (1400 W)","19,72","2,73",B00CKYCG8S,Makita RT0700CX2J Oberfräse und Trimmer,"17,78","8,78",B000W34ZB0,"Bosch DIY Oberfräse POF 1400 ACE, 3 x Spannzange, Fräser, Parallelanschlag, Absaugadapter, Karton (1400 W)","13,22","24,37"
Amazon.de,scholl velvet smooth,"99,05",B00FQ1WWHM,"Scholl Velvet Smooth Express Pedi, elektr. Hornhautentferner","51,34","1,96",B019I3O4OW,"Scholl Velvet Smooth Pedi Wet & Dry Elektrischer Hornhautentferner, 1 Stück","23,83","25,27",B00Z9RTTX8,"Scholl Velvet Smooth Elektronisches Nagelpflegesystem, blau","10,63","10,74"
Amazon.de,schuhe gabor sandalen,"99,05",B018I17D20,,"5,96",0,B018HVBG3I,Gabor 42.736 Damen Sandalen,"3,41",0,B00TPO2I0C,Gabor Shoes 03.702_Gabor Damen Pantoletten,"3,28",0
Amazon.de,baby,"99,04",B00IEV9ZFI,"Philips AVENT SCH400/00 Babypflege-Set inkl. aller Pflegeartikel, gelb","8,79","0,4",B000VDB26M,Playgro 40016 Klipp Klapp Pferd mit Rassel,"8,32","13,44",B00QHNT5LO,,"7,3",0
Amazon.de,polar a 360,"99,04",B016BKJW42,POLAR Activity Tracker A360,"73,75",0,B01DK5D9ZO,Polar Wechselarmband,"4,99",0,B017BO18LM,"Garmin vívosmart HR Fitness-Tracker - integrierte Herzfrequenzmessung am Handgelenk, Smart Notifications","3,1",0
Amazon.de,rasendünger,"99,04",B000PKKJSI,Compo 13112 Rasendünger mit Langzeitwirkung 20 kg für 750 m²,"33,36","13,72",B00RQSNYXE,WOLF-Garten 2-in-1: Unkrautvernichter plus Rasendünger SQ 450; 3840745,"12,44","1,19",B001V669YS,Cuxin Rasendünger Spezial Minigran 20kg,"10,28","6,09"
Amazon.de,smoker,"99,04",B003LBEJCK,"El Fuego Holzkohlegrill/Smoker Dakota, Schwarz, 122x133x66 cm","23,41","3,08",B00BVZFU9Y,Ultranatura Smoker Grill Denver 2 Brennkammern - 119 x 66 x 135 cm,"10,25","1,68",B006CE0W6K,Tepro Toronto Holzkohlegrill,"6,53","0,24"
Amazon.de,tennisbälle,"99,04",B001GM5286,Head Radical Tennisball (3 x 4 Stück),"25,98","12,6",B000W8G4JG,"Head Tennisbälle Championship, Gelb, 4er Dose, 489750042","20,63","15,08",B00IIP4AB4,"Wilson Tennisbälle Tour Practice 4er, Gelb, 6, WRT114500","11,98","8,78"
Amazon.de,tischtennisbälle,"99,04",B0012QJW6E,JOOLA Tischtennis-Bälle Training 40 orange 12er Blister,"19,93","6,1",B00PI0I5E0,"Donic-Schildkröt Tischtennis-Ball T-One Training 12er Pack, weiß-orange, 40 mm, 618045","12,67","8,43",B002A9N7UY,75 Tischtennisbälle 38mm ohne Aufdruck weiss stabiles Material,"12,29","10,67"
Amazon.de,werkzeug,"99,04",B0051E16LW,"Mannesmann Universal-Werkzeugsortiment im Klappkoffer, M29085","12,83","2,47",B009I4HRDW,"Mannesmann 130-tlg. Steckschlüssel- und Bitsatz, M29166","11,22","0,2",B0042CWWS0,Makita B-43044 Bohrer Bit Set 66tlg. im MAKPAC,"9,01","1,39"
Amazon.de,aufbewahrungsbox,"99,03",B00YOUM8I4,"Iris 140065 Aufbewahrungsbox set von 3, Ordnungssystem, Stapelbare mit Handel 30 L, Kunststoffbox mit deckel, transparent","15,12","8,55",B000N1ZMW2,Really Useful 35C Kunststoff-Aufbewahrungsbox leicht robust stapelbar 35 Liter 480 x 390 x 310 mm transparent,"9,18","3,32",B000KHRHZO,"Aufbewahrungsbox ""Clear Box Lady Shoe"" 5 L. von Rotho mit Deckel - QR-Code AppMyBox - 5 L. Volumen - (LxBxH) 33x19x11 cm - transparent - stapelbar - Kunststoff/Plastik (PP) - Div. Größen","6,88","4,41"
Amazon.de,das lied von eis und feuer,"99,03",3442267749,Das Lied von Eis und Feuer 01: Die Herren von Winterfell,"32,67","11,66",3764531525,Game of Thrones 1: Der Winter naht,"9,82","2,28",3442267811,Das Lied von Eis und Feuer 02: Das Erbe von Winterfell,"6,95","11,54"
Amazon.de,gardena bewässerungssystem,"99,03",B0001E3S36,"Gardena 1265-20 Urlaubsbewässerung, ohne Behälter","28,08","15,22",B0035X1RW4,Gardena 8255-20 Sprinklersystem Start-Set für Garten-Pipeline,"22,03","11,22",B0001E3SBS,Gardena 1407-20 Vollautomatische Blumenkastenbewässerung,"10,2","13,79"
Amazon.de,iphone 5 hülle,"99,03",B00PHV9TOK,mumbi TPU Silikon Schutzhülle iPhone SE 5S 5 Hülle in schwarz,"22,38","9,05",B00PHV74TW,mumbi TPU Silikon Schutzhülle iPhone SE 5 5S Hülle transparent schwarz,"12,04","9,08",B01D90RB1S,mumbi UltraSlim Hülle für iPhone SE 5 5S  Schutzhülle transparent (Ultra Slim - 0.55 mm),"11,34","3,17"
Amazon.de,toms,"99,03",B009TLIQDY,Toms Earthwise Seasonal Classic 1090B13 Damen Espadrille Halbschuhe,"17,4",0,B000XR4OC0,Toms Classics 1001B07 Damen Espadrille Halbschuhe,"16,47",0,B00121083U,Toms Classic 1001A10 Herren Espadrille Halbschuhe,"6,64",0
Amazon.de,usb ventilator,"99,03",B00L9HGJQ2,"Speedlink Tornado USB Ventilator für den Schreibtisch (2 Geschwindigkeiten, geräuscharm, An- und Aus-Schalter, schwengbar um 360 Grad, geeignet auch für unterwegs) schwarz","22,66","2,49",B003WQI6E6,"mumbi USB Ventilator Mini für den Schreibtisch mit An/Aus-Schalter, schwarz","20,48","8,02",B00PHV8ELY,"mumbi USB Ventilator - Mini Fan für den Schreibtisch mit An / Aus-Schalter, grün","11,74","13,96"
Amazon.de,xbox,"99,03",B01H0NKK2W,Xbox One S 2TB Konsole,"29,33","6,33",B01AHXTTSS,"Xbox One 500GB Konsole inkl. 1 von 4 Spielen (Rise of the Tomb Raider, Forza 6, Halo: MCC oder Rare Replay)","22,65","0,26",B00009L4P1,Xbox - Konsole inkl. Controller small,"10,39",0
Amazon.de,drone,"99,02",B01959FR90,"Amewi 25163 - Luftfahrt - UFO AM X51 FPV inklusive HD-Cam, 2.4 GHz","18,14","31,82",B013J39S0M,DJI Phantom 3 Standard,"17,89","12,73",B0111O7VBO,Parrot Airborne Night Drone Swat grau,"9,16",0
Amazon.de,monster high,"99,02",B00T03U65W,"Mattel Monster High CHW58 - Buh York, Kometen-Schwebestation und Astranova","8,38","5,14",B00QCALDNK,Monster High CJC61 - Schüler-Graustausch Isi Dawndancer Puppe,"5,65","3,1",B01HSHRJOC,,"5,12",0
Amazon.de,plus produkte,"99,02",B0007VHBKO,"Vileda 144 Glitzi Plus mit Antibac - Gründlich, hygienisch & saugstark - 3er Vorratspack (3 Stück)","9,5","7,37",B000MPLG6U,Hansaplast Sensitive Pflaster 20 Strips,"4,74","4,27",B014SYOMDY,"Tempo Taschentücher Duo-Box, 2 x 80 Tücher (160 Tücher)","4,09","1,2"
Amazon.de,reisenthel,"99,02",B000K22T7A,Reisenthel BK7003 Carrybag schwarz,"13,43","2,95",B01B4HTBG6,Reisenthel AT7038 Mini Maxi Shopper Einkaufsbeutel Polyester margarite 43.5 x 60.0 x 7.0 cm,"6,22","3,87",B004J1D05I,"Reisenthel CC0384  , ruby dots","5,08","2,03"
Amazon.de,rudergerät,"99,02",B01BMF0NF8,"SportPlus Rudergerät Rudermaschine, SP-MR-008-B","17,4","13,15",B00863VH1O,"AsVIVA Rudergerät Ergometer Rower Cardio XI Fitness, RA11","14,75","3,48",B00NH9WEUA,Rudergerät Concept2 Indoor Rower 2711,"11,38","5,71"
Amazon.de,schrittzähler,"99,02",B00KQCQ7F4,Omron Schrittzähler Walking style IV,"24,79","23,55",B00FEQ6TVO,"POLAR Activity Tracker Loop, Black, 90054599","12,41","1,28",B008EHB5PU,Omron Schrittzähler Walking style One 2.1,"8,83","22,95"
Amazon.de,12 monkeys,"99,01",B01GKME37M,,"75,77",0,B01GKME5SY,,"13,62",0,B01GR9U5GG,12 Monkeys - Staffel 1 [Blu-ray],"3,36","24,24"
Amazon.de,calvin klein unterwäsche damen,"99,01",B00LATFR62,Calvin Klein underwear Damen Bustier MODERN COTTON - BRALETTE,"72,65",0,B004AM6DFU,Calvin Klein underwear Damen BH/ Push-up Bra F2892E,"3,44",0,B00MHK1HR6,Calvin Klein underwear Damen String MODERN COTTON - THONG,"1,97",0
Amazon.de,caterpillar s60,"99,01",B01FFM09AI,"CAT 77333 S60 Outdoor Smartphone (11,9 cm (4,7 Zoll), Wärmebildkamera, Dual-SIM, 13Megapixel,32GB Speicher, 3GB RAM, Android Marshmallow) schwarz","82,28",92,B0131AFGTA,"CAT S40 Outdoor Smartphone (Dual-SIM, 4,7 Zoll (11,94 cm), 8 MP, 1GB, 16GB int. Speicher, LTE, staubfest, stoß und sturzfest) schwarz/silber","7,06","5,87",B01478QCHU,FLIR ONE Wärmebildkamera für Android-Geräte,"6,84",0
Amazon.de,einschulung,"99,01",B00J9L8PMG,,"15,83",0,3938932031,"Die Geschichte von Bleistift, Radiergummi und Spitzer","10,5","3,43",B00JEAX0YU,Die 30 besten Kinderlieder für den Schulanfang,"6,39","0,33"
Amazon.de,fieberthermometer,"99,01",B00NVMIO02,Braun IRT6520 Thermo Scan 7 Infrarot Ohrthermometer,"24,76",3,B000R5BM2I,reer 9840 Digitales Fieberthermometer mit flexibler und vergoldeter Messspitze,"21,92","9,05",B000IWHU76,Braun IRT 3020 Thermoscan Fieberthermometer,"9,69",4
Amazon.de,geldkassette,"99,01",B000K09Z7Y,"BURG-WÄCHTER Geldkassette mit Hartgeldeinsatz, Mit Schloss, Blau, Money 5020","41,18","12,15",B000TK0I8K,"Geldkassette mit Geldnoten- und Belegeklammer, 5 -Fächer-Münzeinsatz, 25 x 18 x 9 cm, schwarz","11,03","11,24",B00381JA7W,"Maul Geldkassette mit Münzeinwurf, 125 x 95 x 60 mm, weiß","5,16","3,92"
Amazon.de,herren t-shirt,"99,01",B00P421OBS,Jack & Jones Tech Herren T-shirt JJT Foam New Tee Short Sleeves Crew Neck Noos,"9,36",0,B00361NEHQ,,"6,72",0,B00IINLBO0,,"4,71",0
Amazon.de,skateboard,"99,01",B00LW20AWS,"Hudora Skateboard Instinct ABEC 1, 12161","21,15","5,96",B008C1UIV0,"Hudora 12136 - Skateboard retro zitrone, grün","15,22","4,53",B00EX1OWSI,"Hudora Skateboard ABEC 1, 12133","15,14","22,1"
Amazon.de,solardusche,"99,01",B0027QDHA0,10T Sola 20 - Solardusche Camping-Dusche 20 Liter,"19,01","15,46",B001QJBBK2,,"13,74",0,B003AYMILC,"Steinbach Solardusche Speedshower, Schwarz, 200 cm / 20 l","7,92","12,8"
Amazon.de,unkrautbrenner,"99,01",B004SO2KE8,"Gloria Gloria Profi Brenner Thermoflamm bio Professional inkl. 5m Schlauch, blau","33,52","4,61",B0051T5VGS,"Gloria Unkrautbrenner Thermoflamm bio Comfort mit Griffzündung,1xGaskartusche und extra Länge","26,31","25,86",B00GHGFI62,"Gloria Unkrautbrenner Thermoflamm bio Electro Unkrautbrenner/Grillzünder, gelb","10,38","11,32"
Amazon.de,deuter rucksack,99,B00FEOF54S,"Deuter Rucksack Giga, black, 46 x 31 x 23 cm, 28 Liter, 8041470000","6,18","7,46",B009XIUMF8,"Deuter Rucksack Trans Alpine, 54 x 28 x 24 cm, 30 Liter, Midnight-Ocean, 3222339800","6,18","3,73",B00RDCI9FG,"Deuter Wanderrucksack Race, Petrol/Kiwi, 42 x 21 x 16 cm, 10 Liter, 32113","5,14","1,66"
Amazon.de,deutschland trikot kinder,99,B0185K835A,adidas Kinder Oberbekleidung DFB Home Jersey EURO 2016,"31,65",0,B0185K7Z8G,adidas Kinder UEFA EURO 2016 DFB Auswärtstrikot Replica,"16,31",0,B0185K834G,adidas Kinder Trikot UEFA EURO 2016 DFB Mini-Heimausrüstung,"11,92",0
Amazon.de,doctors diary,99,B008DCOVS4,Doctor's Diary Collection - Staffel 1-3 in einer Box [6 DVDs],"79,56","28,45",B003E3TQZ0,Doctor's Diary 3 - Männer sind die beste Medizin [2 DVDs],"4,92","18,72",B005BZ6N32,Doctor's Diary - Staffel 1-3 [Blu-ray],"4,72","12,87"
Amazon.de,eiskönigin,99,B00UC3AO6A,Disney Frozen / Die Eiskönigin / Bastel-Set:  Bastel Deine Eiskristallarmbänder,"9,53","3,95",B00GSQLGCQ,Die Eiskönigin - Völlig Unverfroren,"6,23","3,13",1474803687,Disney Die Eiskönigin - Mega Malspaß,"5,37","2,85"
Amazon.de,fleecejacke damen,99,B01ARV0074,ICEPEAK Damen Fleece Lunette,"7,07",0,B00A23ZKBO,,"6,76",0,B018TM81I8,,"6,13",0
Amazon.de,garmin vivosmart,99,B00NIUBFXU,"Garmin vívosmart Fitness-Tracker (Smart Notifications, Touchsreendisplay)","31,53",0,B017BO18LM,"Garmin vívosmart HR Fitness-Tracker - integrierte Herzfrequenzmessung am Handgelenk, Smart Notifications","28,17",0,B01FE1IUKG,"Garmin vívosmart HR+ Fitness-Tracker - GPS-fähig, Herzfrequenzmessung am Handgelenk, Smart Notifications","20,8",0
Amazon.de,keyboard,99,B00KFBASJ2,"Yamaha PSR-F50 Keyboard (61-Tasten, LED-Display, 6 Watt)","30,25","19,69",B0107NMLGA,"RockJam RJ661-SK Super Kit 61 Tasten LCD Elektronisches Unterrichts-Keyboard mit Ständer, Hocker und Kopfhörer","15,25","16,4",B0081G2SBO,Yamaha EZ-220 Digital Keyboard (61 anschlagdynamische Tasten mit Beleuchtung) inkl.Netzteil,"8,48","1,96"
Amazon.de,nikon d5500,99,B00RVSU3R4,"Nikon D5500 SLR-Digitalkamera (24 Megapixel, 8,1 cm (3,2 Zoll) Touchscreen-Display, bildstabilisiert, Full-HD-Video, Wi-Fi) Kit inkl. 18-55mm VR II Objektiv schwarz","60,48",0,B00T9LIDXC,"Nikon D5500 SLR-Digitalkamera (8,1 cm (3,2 Zoll), 24,2 Megapixel, neig-/drehbares Touchscreen-Display, 39 AF-Messfelder, Full-HD-Video, Wi-Fi, HDMI) Kit inkl.  DX 18-140mm VR Objektiv schwarz","11,28","25,33",B00RVSU11M,"Nikon D5500 SLR-Digitalkamera (24,2 Megapixel, 8,1 cm (3,2 Zoll) Touchscreen-Display, 39 AF-Messfelder, ISO 100-25.600, Full-HD-Video, Wi-Fi, HDMI) Kit inkl. DX 18-105 mm VR Objektiv schwarz","5,17",0
Amazon.de,nikon d7200,99,B00U5W8HFI,"Nikon D7200 SLR-Digitalkamera (24 Megapixel, 8 cm (3,2 Zoll) LCD-Display, Wi-Fi, NFC, Full-HD-Video) nur Kameragehäuse schwarz","38,53","13,25",B00U8KSI0Q,"Nikon D7200 (24 Megapixel, 8 cm (3,2 Zoll) LCD-Display, Wi-Fi, NFC, Full-HD-Video) Kit inkl. AF-S DX Nikkor 18-140 mm 1:3,5-5,6G ED VR Objektiv","32,25","13,91",B00U5W8HAI,"Nikon D7200 SLR-Digitalkamera (24 Megapixel, 8 cm (3,2 Zoll) LCD-Display, Wi-Fi, NFC, Full-HD-Video) Kit inkl. AF-S DX Nikkor 18-105 mm 1:3,5-5,6G ED VR Objektiv","11,41",0
Amazon.de,thermobecher,99,B008TLGIA8,"Emsa 513361 Isolierbecher, Mobil genießen, 360 ml, Quick Press Verschluss, Schwarz, Travel Mug","30,88","0,13",B00VE3I2UW,"Emsa 515615 Isolierbecher, Mobil genießen, 500 ml, Quick Press Verschluss, Schwarz, Travel Mug Grande","19,74","6,01",B00H84XQ7K,"Contigo Thermobecher West Loop, Black Matt, 1000-0289","14,55","0,23"
Amazon.de,27 zoll monitor,"98,99",B00UHAXAKK,"Samsung S27E390H 68,58 cm (27 Zoll) Monitor (HDMI, D-Sub, 4ms Reaktionszeit) schwarz","24,48","15,27",B00HZF2ME0,"BenQ GL2760H 68,6 cm (27 Zoll) LED Monitor (Full-HD, Eye-Care, HDMI, VGA, 2ms Reaktionszeit) schwarz","13,25","10,52",B00N1ULSUW,"Asus VX279H 68,6 cm (27 Zoll) Monitor (Full HD, VGA, HDMI/MHL, 5ms Reaktionszeit) schwarz","7,33","2,76"
Amazon.de,breaking bad,"98,99",B00W2UEHWS,Breaking Bad - Die komplette Serie [Blu-ray],"66,99","0,98",B003X6UEXQ,Breaking Bad - Die komplette erste Season [3 DVDs],"8,86","17,2",B00EIDO5K6,Breaking Bad - Die finale Season [3 DVDs],"4,8","14,74"
Amazon.de,fiskars,"98,99",B017D2JDS2,"Fiskars Unkrautstecher Xact, schwarz","7,22","0,54",B00GHEKNCI,"Fiskars Machete XA3 WoodXpert, Mehrfarbig, 51 cm","4,82","3,62",B001NM33VC,"Fiskars Gartnerspaten Ergonomic, Schwarz, spitz","4,63","2,09"
Amazon.de,game of thrones bücher,"98,99",0345540565,"George R. R. Martin's A Game of Thrones 5-Book Boxed Set (Song of Ice and Fire Series): A Game of Thrones, A Clash of Kings, A Storm of Swords, A ... (George R. R. Martin Song of Ice and Fire)","31,56","1,38",3442267749,Das Lied von Eis und Feuer 01: Die Herren von Winterfell,"23,05","8,11",3764531525,Game of Thrones 1: Der Winter naht,"8,07","6,03"
Amazon.de,lightroom,"98,99",B00W7QJF56,Adobe Photoshop Lightroom 6 WIN & MAC (frustfreie Verpackung),"66,52","26,45",3842101864,Lightroom 6 und CC für digitale Fotografie,"10,12","15,81",B00O1WFX0U,Adobe Creative Cloud Fotografie (Photoshop CC + Lightroom) - 1 Jahreslizenz (Mac/PC),"5,65","0,49"
Amazon.de,messer,"98,99",B0002TTRQW,"Fiskars Universalmesser, Schwarz, Länge: 21cm","8,24","2,53",B0075D8J3A,Fiskars Edge Kochmesser 19cm,"7,83","4,17",B005LTSUR0,"Böker Messer Starfighter, 01RY069","6,05","2,17"
Amazon.de,ps4 spielen,"98,99",B00ZRQTKO4,Horizon: Zero Dawn - [PlayStation 4],"9,52",0,B01GO4FMNU,FIFA 17 - [PlayStation 4],"7,36","8,33",B01H1QQG6W,Death Stranding - [PlayStation 4],"6,25",0
Amazon.de,spiegel bestsellerliste 2015,"98,99",3492307256,"Honigtot: Roman (Honigtot-Saga, Band 1)","9,97","3,22",3442380294,BLACKOUT - Morgen ist es zu spät: Roman,"6,77","7,04",3596196353,Morgen kommt ein neuer Himmel: Roman,"5,15","9,92"
Amazon.de,cd player kinder,"98,98",B0028R3B90,Lenco SCD-24 Stereo UKW-Radio mit CD-Player und Teleskopantenne pink,"15,22","7,95",B0089AK54E,Lenco SCD-24 Stereo UKW-Radio mit CD-Player und Teleskopantenne blau/schwarz,"6,56","4,42",B00F0A7ZT4,Grundig RCD 1445 Radio (USB 2.0) mit CD/-MP3/-WMA Wiedergabe pink/silber,"6,04","3,02"
Amazon.de,ebook reader,"98,98",B00QJDO0QC,"Kindle Paperwhite eReader, 15 cm (6 Zoll) hochauflösendes Display (300 ppi) mit integrierter Beleuchtung, WLAN (Schwarz) - mit Spezialangeboten","23,8","0,19",B0186FESVC,"Der neue Kindle eReader, 15,2 cm (6 Zoll) Touchscreen ohne Spiegeleffekte, WLAN (Schwarz) - mit Spezialangeboten","16,55","7,34",B00ZDWLEEG,"Fire-Tablet, 17,7 cm (7 Zoll) Display, WLAN, 8 GB (Schwarz) - mit Spezialangeboten","9,74","0,05"
Amazon.de,gamer stuhl,"98,98",B0056YNWVO,"DX Racer1, Bürostuhl, Gaming Stuhl, Schreibtischstuhl, Chefsessel mit Armlehnen, Gaming chair, Gestell Nylon, 78 x 124-134 x 52 cm, Stoffbezug schwarz / rot","44,43","6,3",B019IZKTUS,"MC Racing 5 Gaming Stuhl, Chefsessel mit Armlehnen, Büro-/Schreibtischstuhl, Sportsitz Optik, inklusiv Kissen, Bezug Kunstleder/ PVC, circa 69 x 125-135 x 58 cm, schwarz / rot, Robas Lund 62495SR3","13,14","14,7",B00IRXQG0A,hjh OFFICE 621838 Gaming Stuhl / Bürostuhl RACER PRO I Kunstleder schwarz/orange,"9,54","37,67"
Amazon.de,scholl,"98,98",B00FQ1WWHM,"Scholl Velvet Smooth Express Pedi, elektr. Hornhautentferner","40,14","0,49",B019I3O4OW,"Scholl Velvet Smooth Pedi Wet & Dry Elektrischer Hornhautentferner, 1 Stück","20,87","6,21",B00Z9RTTX8,"Scholl Velvet Smooth Elektronisches Nagelpflegesystem, blau","12,66","3,88"
Amazon.de,tamron 16-300,"98,98",B00JM15OCW,"Tamron 16-300mm F/3,5-6,3 DI II C/AF VC PZD Macro für Canon","49,78","40,48",B00JM15OD6,"Tamron 16-300mm F/3,5-6,3 DI II N/AF VC PZD Macro für Nikon","23,94","32,19",B00JXD2A3K,"Tamron 16-300mm F/3,5-6,3 DI II SO/AF PZD Macro für Sony","11,17","16,69"
Amazon.de,ultraschallreinigungsgerät,"98,98",B0044HEMHC,Grundig UC 5020 Ultraschallreiniger,"55,37","12,4",B007BNGV9S,Sanitas SUR 42 Ultraschallreinigungsgerät,"11,15","4,52",B00990DLVW,EMAG 60079 Emmi-12HC Ultraschallreinigungsgerät,"9,13","39,88"
Amazon.de,umhängetasche,"98,98",B000CRDB5M,"Eastpak Umhängetasche DELEGATE, 20 liter, Black","29,06","11,37",B000W9I4WU,"Eastpak Umhängetasche BUDDY, 0.5 liter, Black","11,27","6,86",B000KKLXDS,"Eastpak Umhängetasche THE ONE, 2.5 liter, Black","10,31","7,56"
Amazon.de,walkie talkie,"98,98",B00ANG0M0E,Motorola TLKR T40 PMR Funkgerät mit LC-Display rot,"29,87","19,77",B00KAQYJLU,Motorola TLKR T41 PMR Funkgerät mit LC-Display blau,"14,1","8,36",B00ANG0M18,"Motorola TLKR T80 Extreme PMR Funkgerät nach IPx4 (wetterfest, Reichweite bis zu 10 km)","8,92","5,09"
Amazon.de,b01hgc6qma|b01hgc8ylq|b01hgcbldo|b01gy1to5k,"98,97",B01HGCBLDO,Lang Lebe der Tod,"63,79","28,37",B01HGC6QMA,Lang Lebe der Tod,"29,59","49,94",B01HGC8YLQ,Lang Lebe der Tod [Vinyl LP],"6,14","21,69"
Amazon.de,batman v superman,"98,97",B01CPLX8PA,Batman v Superman: Dawn of Justice – Ultimate Edition [Blu-ray],"60,42","21,66",B01CPLX2Q0,Batman v Superman: Dawn of Justice – Ultimate Edition [3D Blu-ray],"11,52","15,34",B01CPLXBNO,Batman v Superman: Dawn of Justice Steelbook (exklusiv bei Amazon.de) [3D Blu-ray] [Limited Edition],"11,13","31,77"
Amazon.de,beyerdynamic,"98,97",B0011UB9CQ,Beyerdynamic DT-990 Pro Kopfhörer,"20,91","6,81",B0016MNAAI,Beyerdynamic DT-770 Pro 80 Ohm Kopfhörer,"18,3","10,99",B01G8K70GW,beyerdynamic DT 770 Pro Kopfhörer 16 Ohm Limited Black Edition,"9,21","0,44"
Amazon.de,croc shoes,"98,97",B00LA1SKLE,Crocs Crocband Unisex - Erwachsene Clogs,"17,58",0,B00B4ETBPG,Crocs Classic Unisex - Erwachsene Clogs,"9,05",0,B001TOD3PA,crocs Baya 10126 Unisex - Erwachsene Clogs & Pantoletten,"5,2",0
