Abteilung,Suchbegriff,Suchhäufigkeit,ASIN,Nr. 1 der geklickten Titel,Klickfreigabe,Umwandlungs-Anteil,ASIN,Nr. 2 der geklickten Titel,Klickfreigabe,Umwandlungs-Anteil,ASIN,Nr. 3 der geklickten Titel,Klickfreigabe,Umwandlungs-Anteil
Amazon.de,razer blackwidow,"99,05",B00MVT7AYW,Razer BlackWidow Chroma Mechanische Gaming Tastatur (RGB Beleuchtet und voll programmbierbar mit 5 Macrotasten),"48,72","15,67",B016OFRH0K,Razer BlackWidow Ultimate Stealth 2016 Mechanische Gaming Tastatur (Beleuchtet und Voll programmbierbar),"10,61","9,75",B00J89TDMU,Razer BlackWidow Ultimate 2014 - Mechanische Gaming Tastatur (Voll programmbierbar mit 5 Macrotasten),"10,05","16,26"
Amazon.de,bluetooth kopfhörer,"99,04",B00U5WV250,Sony MDR-ZX330BT Kopfhörer mit Bluetooth und NFC schwarz,"19,09","0,26",B012O6U8OA,Philips SHB3060BK/00 Bluetooth-Kopfhörer (kräftigem Bass) schwarz,"6,51","7,95",B00W5QIM5W,MTV 1773 Bluetooth Headphone schwarz/rot,"5,79","11,66"
Amazon.de,iphone ladekabel,"99,04",B010S9M3L6,"AmazonBasics Ladekabel Lightning auf USB, 0,9m, zertifiziert von Apple, Weiß","43,19","14,84",B010S9N6OO,"AmazonBasics Ladekabel Lightning auf USB, 1,8m, zertifiziert von Apple, Weiß","35,08","22,86",B010U3XO3Q,"AmazonBasics Ladekabel Lightning auf USB, 0,9m, zertifiziert von Apple, Schwarz","5,73","5,81"
Amazon.de,michael kors tasche,"99,04",B00TGUCY90,"Michael Kors Jet Set Top-Zip Saffiano Leather Tote 30F2GTTT8L Damen Henkeltaschen 30x27x11 cm (B x H x T), Beige (Blush 655)","10,09",0,B00ZWRYIJK,MICHAEL KORS Cynthia Tasche One Size schwarz,"6,24",0,B00XI5PIRO,,"5,35",0
Amazon.de,polar a360,"99,04",B016BKJW42,POLAR Activity Tracker A360,"82,19",0,B01DK5D9ZO,Polar Wechselarmband,"4,17",0,B016BD69MM,"POLAR Activity TrackerA360, Black, M, 90057421","2,2","13,32"
Amazon.de,tassimo,"99,04",B00MOADPQ0,"Bosch TAS1252 Tassimo Multi-Getränke-Automat VIVY (kompakte Gerätemaße, Getränkevielfalt, vollautomatische 1-Knopf-Bedienung), real black","33,48","21,51",B0095FMJE6,"Tassimo Jacobs Caffè Crema classico XL, 5er Pack (5 x 16 Portionen)","12,5","4,76",B00MOADPSI,"Bosch TAS1254 Tassimo Multi-Getränke-Automat VIVY (kompakte Gerätemaße, Getränkevielfalt, vollautomatische 1-Knopf-Bedienung), Snow White","6,73","10,11"
Amazon.de,zeitschaltuhr,"99,04",B000KJR5S6,"Brennenstuhl Mechanische Zeitschaltuhr MZ 20, 1506450","20,64","13,89",B00AQ9E77M,AVM Intelligente Steckdose FRITZ!DECT 200,"10,66","0,64",B001UWTJVS,"REV Ritter 0025100109 Z-Uhr Digital, weiß","10,03","8,26"
Amazon.de,zirkel,"99,04",B0029FFQ1W,Zirkel Stop System 3Tlg.,"15,25","9,5",B003IQFVA2,Herlitz 11122330 Schnellverstellzirkel my.pen blau/lemon mit Zusatzminen und Anspitzmöglichkeit,"13,87","9,79",B000FFNCOQ,"Faber-Castell 174472 - Schnellverstellzirkel GRIP 2001,  silber","9,8","6,06"
Amazon.de,axon 7,"99,03",B01I092IPC,"ZTE Axon 7 Smartphone (13,9 cm (5,5 Zoll) Display, 20 Megapixel Kamera, 64 GB Speicher) Grau","76,88","49,56",B01I092FLY,"ZTE Axon 7 Smartphone (13,9 cm (5,5 Zoll) Display, 20 Megapixel Kamera, 64 GB Speicher) Gold","16,95","50,44",B01H5KAR5K,,"4,01",0
Amazon.de,fleecejacke herren,"99,03",B005GP8YVQ,,"10,68",0,B00NHEFEWA,SCHÖFFEL Herren Fleecejacke Glen,"6,51",0,B00GFUXZM4,The North Face Herren Fleecejacke 100 Glacier,"6,31",0
Amazon.de,hochentaster,"99,03",B00HT94JC0,"Einhell Akku Hochentaster GC-LC 1815 T (Lithium-Ionen Akku 18 V, 1,5 Ah, Teleskop, 200 mm Schnittlänge, Schnell-Ladegerät, Tragegurt)","12,46","21,25",B00U7GP4FS,"Black + Decker 800W Hochentaster, 25 cm Schwertlänge, 2.7m Länge, 11 m/s Kettengeschwindigkeit, schwenkbarer Kopf PS7525","9,17",0,B00U9UF51A,"Einhell Elektro Hochentaster GC-EC 750 T (750 Watt, 180 mm Schnittlänge, Teleskopstiel bis 2,80 m, inkl. Tragegurt)","8,18","23,72"
Amazon.de,messer,"99,03",B005LTSUR0,"Böker Messer Starfighter, 01RY069","15,36","4,06",B0002TTRQW,"Fiskars Universalmesser, Schwarz, Länge: 21cm","10,84",7,B00BMTWS9E,"Victorinox 67833.S6 SwissClassic Tafelmesser/Tomatenmesser/Brotzeitmesser/Wurstmesser-Set 6-teilig mit Wellenschliff, schwarz","6,85","6,82"
Amazon.de,teva sandale,"99,03",B0055X2U3W,Teva Tirra W's Damen Sport- & Outdoor Sandalen,"9,06",0,B015ZPJYY2,,"8,59",0,B00S1EOL4I,"Teva Verra, Damen Sandalen","5,71",0
Amazon.de,tischtennisbälle,"99,03",B0012QOX18,JOOLA Tischtennis-Bälle Training 40 weiss 12er Blister,"26,5","12,1",B00PI0I5E0,"Donic-Schildkröt Tischtennis-Ball T-One Training 12er Pack, weiß-orange, 40 mm, 618045","14,63","11,88",B002A9N7UY,75 Tischtennisbälle 38mm ohne Aufdruck weiss stabiles Material,"14,56","10,91"
Amazon.de,whisky,"99,03",B00CEZ2HDC,Dalwhinnie 15 Jahre Highland Single Malt Scotch Whisky (1 x 0.7 l),"11,81","2,65",B005SIY52I,Hennessy Beauté du Siècle (1 x 1 l),"8,15",0,B002VZY62K,Lagavulin 16 Jahre Islay Single Malt Whisky (1 x 0.7 l),"6,69","1,2"
Amazon.de,bibi und tina mädchen gegen jungs,"99,02",B01B9004FK,Bibi & Tina - Mädchen gegen Jungs!,"78,83","25,21",B01GNZ670C,"Bibi & Tina DVD 3. Kinofilm: ""Mädchen gegen Jungs!"" + Tischkalender 2017  Limited Edition [exklusiv bei Amazon]","9,21","9,86",B017V9OO7M,Bibi und Tina: Mädchen gegen Jungs,"3,35","8,78"
Amazon.de,geburtstagskalender,"99,02",3731811243,Geburtstagskalender Kerstin Hess: Immerwährender Kalender,"11,95","7,12",3840737184,Geburtstagskalender Auszeit für die Seele - Wandkalender A4 - mit Zitaten - Jahresunabhängig,"7,77","4,11",3840737141,Geburtstagskalender Augenweide - Wandkalender A4 - Jahresunabhängig,"6,67","3,44"
Amazon.de,picknickdecke,"99,02",B00YOY991E,,"61,13",0,B00C67RZ62,"The Greenfield Collection PB003H Voll ausgekleidete, isolierte und wasserabweisende Picknickdecke in mitternachtsblau, passend zum Rucksack","3,99",0,B0006VHTFW,"The Greenfield Collection PB002H Voll ausgekleidete, isolierte und wasserabweisende Picknickdecke in förstergrün, passend zum Rucksack","3,57","13,34"
Amazon.de,baby,"99,01",B00IEV9ZFI,"Philips AVENT SCH400/00 Babypflege-Set inkl. aller Pflegeartikel, gelb","8,88","7,75",B000VDB26M,Playgro 40016 Klipp Klapp Pferd mit Rassel,"8,14","13,96",B00QHNT5LO,,"7,96",0
Amazon.de,dolce gusto,"99,01",B00KMUD4CE,DeLonghi EDG 100.W Nescafé Dolce Gusto Piccolo Kaffeekapselmaschine (manuell) weiß,"15,13","7,9",B00EB30YR6,Krups KP 1201 Nescafé Dolce Gusto Mini Me Kaffeekapselmaschine (automatisch) weiß/grau,"12,14","3,7",B002K8PSMA,"Nescafé Dolce Gusto Grande, 3er Pack (48 Kapseln)","10,39","4,44"
Amazon.de,keyboard,"99,01",B00KFBASJ2,"Yamaha PSR-F50 Keyboard (61-Tasten, LED-Display, 6 Watt)","28,62","18,22",B0107NMLGA,"RockJam RJ661-SK Super Kit 61 Tasten LCD Elektronisches Unterrichts-Keyboard mit Ständer, Hocker und Kopfhörer","16,15","11,54",B0081G2SBO,Yamaha EZ-220 Digital Keyboard (61 anschlagdynamische Tasten mit Beleuchtung) inkl.Netzteil,"7,56","0,75"
Amazon.de,kärcher,"99,01",B00HH9QAME,Kärcher K 2 Compact Home Hochdruckreiniger,"15,74","6,97",B00HUORV7Y,Kärcher 1.633-301.0 Fenstersauger WV2,"10,11","2,35",B00HH9QCSQ,"Kärcher Hochdruckreiniger K 5 Home T350 ,1.180-637.0","8,67","6,73"
Amazon.de,lego minecraft,"99,01",B013GYABXW,LEGO Minecraft 21123 - Der Eisengolem,"11,16","8,07",B00JMV7K42,LEGO Minecraft 21115 - Steve's Haus,"10,3","10,35",B00JMV5PA8,Lego Minecraft 21116 - Creative Box,"7,45",9
Amazon.de,leifheit,"99,01",B0090WTEQ0,"Leifheit 55077 Wischtuchpresse Profi Evo Set mit Bodenwischer, 42 cm, türkis",12,"9,92",B005ELNR0K,"Leifheit 55356 Set Combi Clean inkl. Eimer mit Presse und Bodenwischer mit Micro Duo Bezug, Classic Green","7,88","2,09",B0002HOUIE,"Leifheit 55045 Bodenwischer Profi micro duo, 42 cm, mehrfarbig",7,"5,28"
Amazon.de,masturbator,"99,01",B01ICI2HCK,,"11,87",0,B0124QFLB0,,"7,18",0,B001GHGG5O,You2Toys Masturbator Oxana Pussy and Ass - lebensechter Torso-Masturbator für Herren mit extra enger Vagina und Anus,"5,83","2,36"
Amazon.de,polar a 360,"99,01",B016BKJW42,POLAR Activity Tracker A360,"78,68",0,B01DK5D9ZO,Polar Wechselarmband,"3,95",0,B017BO18LM,"Garmin vívosmart HR Fitness-Tracker - integrierte Herzfrequenzmessung am Handgelenk, Smart Notifications","2,94",0
Amazon.de,zahlenschloss,"99,01",B0001MQPFG,ABUS 9345 Kombinations-Zahlenschloss 155/30SB/F Größe: 30 mm,"21,62","6,46",B0001MQQZK,ABUS 20128 Messing Zahlenschloss165/40SB Größe: 40 mm,"14,37","8,45",B004V94G8I,"Abus 535178 155/30 Zahlen-Vorhangschloss mit verstellbarem Code, schwarz","9,11","5,88"
Amazon.de,dxracer,99,B0056YNWVO,"DX Racer1, Bürostuhl, Gaming Stuhl, Schreibtischstuhl, Chefsessel mit Armlehnen, Gaming chair, Gestell Nylon, 78 x 124-134 x 52 cm, Stoffbezug schwarz / rot","49,17","34,77",B00BU2S8YW,"DX Racer5 Gaming Stuhl, Schreibtischstuhl, Bürostuhl, Chefsessel mit Armlehnen, Gaming chair, Gestell Nylon schwarz, 78 x 52 x 124-134 cm, Stoff schwarz / grau","14,86","21,74",B009S68I6A,"DX Racer6 Gaming Stuhl, Schreibtischstuhl, Bürostuhl, Chefsessel mit Armlehnen, Gaming chair, Gestell Kunststoff, 78 x 52 x 124-134 cm, Kunstleder PU schwarz / weiß","11,31","17,58"
Amazon.de,dörrautomat,99,B000FMM7KE,"Severin OD 2940 Obst-Dörrautomat, weiß / 250 W","25,17","11,92",B0002HOOIK,ROMMELSBACHER DA 750 - DÖRRAUTOMAT - 700 Watt - weiß,"11,39","10,33",B01C78Q1EG,"TV Das Original 01251 Gourmetmaxx Dörrautomat, 250 W, limegrün / weiß","9,56","11,24"
Amazon.de,fritzbox 7390,99,B003108AZI,"AVM FRITZ!Box 7390 Wlan Router (VDSL/ADSL, 300 Mbit/s, DECT-Basis, Media Server)","49,32",0,B00EO777DI,"AVM FRITZ!Box 7490 WLAN AC + N Router (VDSL/ADSL, 1.300 Mbit/s (5 GHz), 450 Mbit/s (2,4 GHz), DECT-Basis, Media Server)","22,48","13,62",B0117ZTDSG,"AVM FRITZ!Box 7430 (VDSL-/ADSL2+, WLAN N, 450 MBit/s (2,4 GHz), TK-Anlage für Voice over IP mit DECT-Basis, Mediaserver)","14,1","16,93"
Amazon.de,gästebett,99,B001RTLKI4,"Intex Luftbett Deluxe Pillow grey-blue Queen (230 V), grau, 152 x 203 x 43 cm","12,2","4,47",B00A6RTW2Y,Gigapur 25069 Visco Luxus Klappmatratze für Erwachsene,"11,78","3,26",B0014KTV3C,"Intex Luftbett Deluxe Pillow grey-blue Twin (230 V), grau, 99 x191 x 43 cm","9,35","7,88"
Amazon.de,kinderwecker,99,B004A0UPMY,"TFA 60.1011.12 ""Hü-ü-ü"" Kinderwecker mit Pferdewiehern, 130 x 52 x 133 mm","14,58","7,01",B00HXTJKM0,Atlanta Kinderwecker Analog blau 1719-5,"5,7",0,B002GRBVPS,"TFA 60.1004 ""Best Friends"" Elektronischer Kinder-Wecker","5,67","6,2"
Amazon.de,navigon,99,B00VVQ5L5G,"Garmin nüvi 57LMT Navigationsgerät (lebenslange Kartenupdates, Premium Verkehrsfunklizenz, 12,7cm (5 Zoll) Touchscreen)","18,92","7,8",B003URUB04,"Navigon 40 EASY Navigationssystem ( 4.3 Zoll Display,starrer Monitor, 16:9,Kontinent-Ausschnitt )","18,06",0,B00BEBPV30,"TomTom Start 25 M Europe Traffic, Navigationsgerät (Free Lifetime Maps, 13cm (5 Zoll) Display, TMC, Fahrspurassistent, Parkassistent, IQ Routes, Europa 45","12,47","6,41"
Amazon.de,withings,99,B00S5I9H4O,"Withings Aktivitätstracker Pop Smart Watch Aktivitäts und Schlaf tracker, Shark Grau, 70077401","18,38","16,44",B00BKRQ4E8,"Withings WS-50 Smart Body Analyzer, schwarz","13,87","1,63",B01F3LJ2RW,Withings Body - Analyse der Körperzusammensetzung,"13,02","13,59"
Amazon.de,bose quietcomfort 35,"98,99",B01E3SNO1G,Bose QuietComfort 35 kabellose Kopfhörer schwarz,"62,55","51,16",B01E3SNO3E,Bose QuietComfort 35 kabellose Kopfhörer silber,"15,47","27,21",B00M1NEUKK,Bose QuietComfort 25 Acoustic Noise Cancelling Kopfhörer (geeignet für Apple-Geräte) schwarz,"9,36","2,71"
Amazon.de,the night manager,"98,99",B01BTXNBI4,,"55,23",0,B01BWAHNH4,The Night Manager - Die komplette 1. Staffel [Blu-ray],"29,85","25,29",B01BWAHMCU,The Night Manager - Die komplette 1. Staffel [3 DVDs],"4,83","10,04"
Amazon.de,badeschuhe damen,"98,98",B01H23A5WK,Beco Badeschuh Surf,"11,24",0,B013COPMJE,BECO Badeschuhe / Surfschuhe für Damen und Herren,"6,78",0,B00VEFUUGE,,"5,66",0
Amazon.de,batman,"98,98",B00DU61NFW,Batman - The Dark Knight Trilogy [Blu-ray],"21,15","7,81",B00CMPTIUO,Batman 1-4 [Blu-ray],"12,76","8,55",B01CPLX8PA,Batman v Superman: Dawn of Justice – Ultimate Edition [Blu-ray],"10,16","0,29"
Amazon.de,gamer stuhl,"98,98",B0056YNWVO,"DX Racer1, Bürostuhl, Gaming Stuhl, Schreibtischstuhl, Chefsessel mit Armlehnen, Gaming chair, Gestell Nylon, 78 x 124-134 x 52 cm, Stoffbezug schwarz / rot","45,18","45,11",B019IZKTUS,"MC Racing 5 Gaming Stuhl, Chefsessel mit Armlehnen, Büro-/Schreibtischstuhl, Sportsitz Optik, inklusiv Kissen, Bezug Kunstleder/ PVC, circa 69 x 125-135 x 58 cm, schwarz / rot, Robas Lund 62495SR3","20,3","29,47",B00BU2S8YW,"DX Racer5 Gaming Stuhl, Schreibtischstuhl, Bürostuhl, Chefsessel mit Armlehnen, Gaming chair, Gestell Nylon schwarz, 78 x 52 x 124-134 cm, Stoff schwarz / grau","7,31","4,47"
Amazon.de,hängematte,"98,98",B0002DFBJ0,"Jobek 95000 Rope Pro Aufhängeset für Hängematten, max. 160kg","11,82","3,89",B00M7RU6K8,,"10,8",0,B001CQID1O,"Kronenburg Hängematte Mehrpersonen 220 x 160 cm, 2 Kissen 70 x 40 cm - Belastbarkeit bis 300 kg","10,65",0
Amazon.de,mia and me,"98,98",B01723I6JO,Mattel Mia and Me DHJ82 - Magisches Armband,"10,62","3,26",3505137561,Mia and me - Die Legende von Centopia,"9,45","2,77",B00FBWFJ3K,Mattel Mia and Me BFW35 - Puppe mit Ring,"5,7","3,54"
Amazon.de,samsung ssd,"98,98",B01AAKZRP2,"Samsung 750 EVO MZ-750250BW 250GB interne SSD (6,35 cm (2,5 Zoll)) schwarz","33,8","13,32",B00P73B1E4,"Samsung MZ-75E500B/EU 850 EVO interne SSD 500GB (6,4 cm (2,5 Zoll), SATA III) schwarz","19,43","5,79",B00P736UEU,"Samsung MZ-75E250B/EU 850 EVO interne SSD 250GB (6,4 cm (2,5 Zoll), SATA III) schwarz","11,33","4,06"
Amazon.de,umhängetasche,"98,98",B000CRDB5M,"Eastpak Umhängetasche DELEGATE, 20 liter, Black","27,64","13,87",B004CCRUAU,"Travelite Basics Unisex Umhängetasche, 41x34x20 cm, 25 Liter, Schwarz, 96248","11,43","14,39",B000W9I4WU,"Eastpak Umhängetasche Buddy, 0.5 liter, Black","7,57","2,31"
Amazon.de,bodenwischer,"98,97",B0047Y1HP2,"Vileda UltraMat Komplett-Set, Bodenwischer und Eimer mit PowerPresse","17,37","2,93",B00KM40ELY,Leifheit 55210 Bodenwischer Classic,"15,79","15,44",B0002HOUIE,"Leifheit 55045 Bodenwischer Profi micro duo, 42 cm, mehrfarbig","7,69","5,33"
Amazon.de,dosenöffner,"98,97",B00JEA5X4U,Wenco 510899 Sicherheitsdosenöffner,"38,08","14,18",B00D2WZAOO,Leifheit 3141 Dosenöffner Exact,"15,77","13,02",B003OBY4T0,"Fackelmann 45533 Dosenöffner 15 cm, ABS, edelstahl","7,99",5
Amazon.de,kinderkamera,"98,97",B01BZ1TX9G,"VTech 80-170894 - Kidizoom Duo mit Tragetasche, Digitalkamera, pink","9,8","4,24",B00UC3PP32,"VTech 80-170854 - Digitalkamera - Kidizoom Duo, pink","9,72","9,38",B00BXTLWF4,VTech 80-145004 - Kidizoom Touch Digitalkamera,"8,13","2,65"
Amazon.de,klickfix,"98,97",B000KGRJB2,"KLICKfix Zubehör Lenkeradapter Verpackt, 0211","10,43","4,14",B000OZDKGW,Klickfix Lenker Adapter,"9,23","5,82",B00H6ZJQAM,,"6,13",0
Amazon.de,leiter,"98,97",B00WECMKXM,Hailo L60 Alu-Haushaltsleiter mit EasyClix und Schale (verschiedene Größen),"16,97","13,25",B00WECNAHM,Hailo L20 Alu-Haushaltsleiter mit EasyClix und Bügel (verschiedene Größen),"15,84","10,36",B0089ULWQE,"Hailo Alu-Kombileiter L680 3-teilig 3x 11 Sprossen, metallisch, 1033-701","6,36","3,3"
Amazon.de,schulranzen,"98,97",B00O8SYPEW,Herlitz 11407772 Schulranzen Midi Plus Champion,"29,14","39,65",B00S87IF1I,"Dakine Herren Rucksack Campus, Carbon, 51 x 33 x 23 cm, 33 Liter, 8130057-S16","8,99","4,03",B01GJVJUO0,,"6,05",0
Amazon.de,schwimmweste,"98,97",B007CT6XB2,,"16,23",0,B01DKSGK02,Helly Hansen Unisex Rettungsweste Sport II,"11,39",0,B014R1ME42,,"10,14",0
Amazon.de,sony rx100,"98,97",B0089BUVG0,"Sony DSC-RX100 Cyber-shot Digitalkamera (20 Megapixel, 3,6-fach opt. Zoom, 7,6 cm (3 Zoll) Display, lichtstarkes 28-100mm Zoomobjektiv F1,8 - 4,9, Full HD, bildstabilisiert) schwarz","41,01","23,14",B00KLVFV34,"Sony DSC-RX100 III Digitalkamera (20.1 Megapixel Exmor R Sensor, 3-fach opt. Zoom, 7,6 cm (3 Zoll) Display, Full HD, WiFi/NFC) schwarz","19,33","11,24",B00DM8R866,"Sony DSC-RX100 II Cyber-shot Digitalkamera (20 Megapixel, 3,6-fach opt. Zoom, 7,6 cm (3 Zoll) Display, Full HD, bildstabilisiert, NFC, WiFi) schwarz","16,95",0
Amazon.de,terminplaner,"98,97",3862294102,VintageArt 2017: Terminplaner,"12,93","4,65",386679326X,Chäff Business-Timer 2016/2017 A5 18 Monate Jul 2016 - Dez 2017,"7,67","5,86",3862294048,Timer Schwarz 2017: Terminplaner in Lederoptik,"7,16","4,04"
Amazon.de,warehouse deals,"98,97",B00QISTPLI,"CONVERSE Chuck Taylor All Star Seasonal Ox, Unisex-Erwachsene Sneakers","12,6",0,B008ATNI98,"Apple MacBook Pro Retina Display MC975D/A 39,1 cm (15,4 Zoll) Notebook (Intel Core i7 3615QM, 2,3GHz, 8GB RAM, 256GB Flashspeicher, NVIDIA GT 650M, Mac OS)","7,1",0,B00LA1SKLE,Crocs Crocband Unisex - Erwachsene Clogs,"6,33",0
Amazon.de,xbox 360,"98,97",B002MD3B4K,Xbox 360 - Konsole Elite 120 GB inkl. Wireless Controller,"23,47",0,B005FPD0O8,"Xbox 360 - Konsole Slim 250 GB, schwarz-matt",16,0,B00DYSBMPM,Xbox 360 - 250 GB,"14,05",0
Amazon.de,27 zoll monitor,"98,96",B00UHAXAKK,"Samsung S27E390H 68,58 cm (27 Zoll) Monitor (HDMI, D-Sub, 4ms Reaktionszeit, 1920 x 1080 Pixel) schwarz","12,66","2,6",B00HZF2ME0,BenQ GL2760H,"11,83","11,65",B007Z1AWT6,"Acer G276HLAbid 68,6 cm (27 Zoll) TFT-Monitor (VGA, DVI, HDMI, 5ms Reaktionszeit) schwarz","10,58","2,19"
Amazon.de,alarmanlage,"98,96",B00BY2DFNM,Multi Kon Trade Funk-Alarmanlagen-System M2B GSM SET-4 inkl. umfangreichem Zubehör,"36,7","26,36",B00OCRFG74,iSmartAlarm Preferred Package Überwachungssystem,"16,67","21,57",B00CY9LZPY,"Blaupunkt SA 2700 Smart GSM Funk-Alarmanlage. Sicherheitssystem für Haus, Eigenheim, gewerbliche Räume, Wohnung, Büro, Laden, Geschäft. Steuerung der Alarmanlage mit Smartphone App. Standardset: 1x Alarmzentrale, 1 x Funk-Tür/Fenstersensor, 1 x Funk-Bewegungsmelder, 1 x Funk-Fernbedienung.","7,43",0
Amazon.de,globus,"98,96",B000P1ZOZ0,Idena 569902 Leuchtglobus 30 cm mit Halogen Energiesparlampe und zwei Kartenbildern,"29,61","23,89",B00B2XEYMY,Ravensburger 00558 - tiptoi Interaktiver Globus,"10,38","2,91",B001EO6JII,Idena 569906 Schülerglobus 18 cm mit politischem Kartenbild,"9,78","16,96"
Amazon.de,kühlschrank ohne gefrierfach,"98,96",B002V937DA,Bomann VS 164.1 Kühlschrank / A+ / Kühlen: 102 L / weiß / Abtauautomatik,"11,98","6,75",B007DC216Y,Beko TS 190020 Kühlschrank / A+ / 118 kWh/Jahr / Kühlteil: 88 L / Weiß / Unterbaufähig / Glasablagen,"8,43","2,23",B0071HFNU2,Bomann VS 198 Kühlschrank / A++ / 92 kWh/Jahr / 130 L / weiß,"8,21","7,15"
Amazon.de,mikroskop,"98,96",B003LJIVGC,Bresser junior 8855001 Mikroskop-Set Biolux DE 40x-1024x USB,"18,88","20,64",B001ARF1RY,"Bresser LCD-Mikroskop 50x-500x (2000x digital), 5 Megapixel, 8.9cm (3.5"") LCD Display","9,57","14,64",B001UJJGV4,Bresser junior 8852000 Stereo Mikroskop 20x,"8,89","7,47"
Amazon.de,regal,"98,96",B002TUQQXO,"Demeyere 5614 Polykub Regal 4 Nischen, weiß","20,89","14,2",B00GMHNP66,"Demeyere 399345 Regal Polykub, 4 Nischen, sonoma eiche","11,7","8,73",B0011EAP3Q,"Kinderregal ""Easy Life Compo 8"" Farbe: Weiß","8,46","13,59"
Amazon.de,basketballkorb,"98,95",B005OQ4OKW,"Hudora Basketballständer All Stars, 70 x 80 x 165-205 cm, 71655","29,53","19,39",B000KSN9LE,"Hudora Basketballkorbset In-/Outdoor, schwarz,weiß,rot, 71621","16,91","20,18",B00OEYDE2Y,"Ultrasport Basketballständer Modell 2014,ohne Logoprint , 331300000228","6,99","6,27"
Amazon.de,ghostbusters,"98,95",B00MH9NEZK,Ghostbusters I & II (2 Discs) (4K Mastered) [Blu-ray],"19,29","9,11",B01JKUFBWW,Ghostbusters [Blu-ray],"14,25","11,23",B01JBB4NN8,,"6,1",0
Amazon.de,medela,"98,95",B009M37YA0,"Medela elektrische Doppel-Milchpumpe, Swing maxi","24,72","6,2",B005CTXB28,Medela 030.0028 Swing - moderne elektrische Milchpumpe,"23,2","8,78",B008743JQ8,Medela Freestyle 042.0006 Elektrische Milchpumpe,"12,48","6,86"
Amazon.de,poliermaschine,"98,95",B00IIP17KQ,"Einhell Auto Poliermaschine BT-PO 90 (90 W, Polierteller 240 mm, 3700 U/min, inkl. 1 Textil- und 1 Synthetik-Polierhaube)","19,12","11,76",B00AQWT8OG,Kingbarney XXXL Profiset - Poliermaschine/Schleifmaschine inkl. Koffer 1500 Watt Set 4 + Polierschwamm Zubehörset - inkl. Politur - 30 Teile - Auto polieren,"8,54","9,41",B00ECUCJX0,Kingbarney XL Profiset - Exzenter Poliermaschine / Polierer inkl. Koffer 710 Watt Set 2 + Polierschwamm Zubehörset - 26 Teile - Schleifmaschine - Auto polieren,"5,72","9,41"
Amazon.de,cd player kinder,"98,94",B0028R3B90,Lenco SCD-24 Stereo UKW-Radio mit CD-Player und Teleskopantenne pink,"13,53","8,73",B00FLJWAHQ,Lenco SCD-24 Stereo UKW-Radio mit CD-Player und Teleskopantenne green,"7,92","4,81",B0089AK54E,Lenco SCD-24 Stereo UKW-Radio mit CD-Player und Teleskopantenne blau/schwarz,"6,53","6,61"
Amazon.de,induktionskochplatte,"98,94",B00MEP1QV6,"Bomann Induktions-Einzelkochplatte EKI 5026 CB, 650261","13,13","11,39",B00IOK6RXM,"Tefal IH2018 Induktionskochfeld Everyday (6 voreingestellte Programme, 9 Heizstufen automatische Topferkennung, 2.100 W)","12,32","7,36",B0049MELOQ,"Rommelsbacher CT 3410/IN Induktion Glaskeramik Doppelkochtafel, 3400 W","12,07","13,38"
Amazon.de,soy luna,"98,94",B01AY6P52M,"Soy Luna 70032331 - Roller skate, Größe 36/37","17,79","2,62",1474866484,Disney Soy Luna - Alles ist möglich,"7,25","8,51",2508033367,,"6,3","13,83"
Amazon.de,winsim,"98,94",B01HRJDZC6,"winSIM LTE All 2 GB [SIM, Micro-SIM und Nano-SIM] monatlich kündbar (2 GB LTE-Internet mit max. 50 MBit/s + Datenautomatik, Telefonie-Flat, SMS-Flat, 8,99 Euro/Monat) O2-Netz","44,97","28,53",B01HRJDZE4,"winSIM LTE All 2 GB [SIM, Micro-SIM und Nano-SIM] 24 Monate Laufzeit (2 GB LTE-Internet mit max. 50 MBit/s + Datenautomatik, Telefonie-Flat, SMS-Flat, 6,99 Euro/Monat) O2-Netz","21,88","36,69",B01HRJDZG2,"winSIM LTE All 3 GB [SIM, Micro-SIM und Nano-SIM] monatlich kündbar (3 GB LTE-Internet mit max. 50 MBit/s + Datenautomatik, Telefonie-Flat, SMS-Flat, 11,99 Euro/Monat) O2-Netz","5,04","6,56"
Amazon.de,badeschuhe herren,"98,93",B01H23A5AC,BECO Badeschuhe / Surfschuhe für Damen und Herren,"8,96",0,B00KPP25G2,Waimea Erwachsene Wassersportschuhe Aquaschuhe,"8,96",0,B013COPMJE,BECO Badeschuhe / Surfschuhe für Damen und Herren,"4,92",0
Amazon.de,canon 80d,"98,93",B01C2XJVPC,"Canon EOS 80D SLR-Digitalkamera (24,2 Megapixel, 7,7 cm (3 Zoll) Display, APS-C CMOS Sensor, 45 AF-Kreuzsensoren, DIGIC 6 Bildprozessor, NFC und WLAN, Full HD) nur Gehäuse schwarz","64,3","34,97",B01C2XJWZ6,"Canon EOS 80D SLR-Digitalkamera (24,2 Megapixel, 7,7 cm (3 Zoll) Display, DIGIC 6 Bildprozessor, NFC und WLAN, Full HD) Kit inkl. EF-S 18-55mm 1:3,5-5,6 IS STM schwarz","16,31","15,98",B01CJMBXUC,"Canon EOS 80D 18-135mm IS USM, 1263C042","9,02",0
Amazon.de,fussball,"98,93",B015FP3MNG,,"21,45",0,B00YN1EKRQ,,"13,36",0,B00UEAT750,Mitre Trainingsfußball Impel,"8,3",0
Amazon.de,rasenmäher benzin,"98,93",B00HT94BW8,"Einhell Benzin Rasenmäher GH-PM 40 P (1,6 kW, 40 cm Schnittbreite, 3-fache Schnitthöhenverstellung 32-62 mm, 45 l Fangsack)","16,96","15,67",B01FI5Q4HY,,"8,18",0,B00R2GK7FS,WOLF-Garten Benzinrasenmäher S 4200; 11A-LO5N650,"6,49","5,68"
Amazon.de,samsung note 7,"98,93",B01JMLQZ42,"Samsung Galaxy Note 7 Smartphone (14,4 cm (5,7 Zoll) Display, 64 GB Speicher, Android 6.0) schwarz-onyx","54,91","39,41",B01JMLQTNO,"Samsung Galaxy Note 7 Smartphone (14,4 cm (5,7 Zoll) Display, 64 GB Speicher, Android 6.0) blau-coral","14,49","18,55",B01JMLR3Y8,"Samsung Galaxy Note 7 Smartphone (14,4 cm (5,7 Zoll) Display, 64 GB Speicher, Android 6.0) silber-titanium","9,07","42,04"
Amazon.de,spirituskocher,"98,93",B006Z9783W,"Campingaz Mehrflammkocher Base Camp, blau, 43 x 25 x 7,5cm, 2000010110","13,65","0,83",B002BVYK16,Dometic ORIGO 3000 - 2-flammiger Spirituskocher als freistehendes Modell,"11,49","28,9",B01GJ6KDG4,,"7,07",0
Amazon.de,the man in the high castle,"98,93",B01973WFS0,,"75,12",0,B01JNU7T4M,,"15,57",0,0141186674,The Man in the High Castle (Penguin Modern Classics),"5,38","95,03"
Amazon.de,fiskars,"98,92",B0002TTRLM,"Fiskars Schneidgiraffe, Mehrfarbig","4,77","1,27",B017D2JDS2,"Fiskars Unkrautstecher Xact, schwarz","4,74","2,56",B0002TTRQW,"Fiskars Universalmesser, Schwarz, Länge: 21cm","4,52","1,78"
Amazon.de,fußball,"98,92",B015FP3MNG,,"21,81",0,B00YN1EKRQ,,"14,12",0,B00UEAT750,Mitre Trainingsfußball Impel,"10,37",0
Amazon.de,gameboy,"98,92",B00LEEX3F0,,"23,55",0,B00JXKIG0E,,"12,73",0,B00005B8G1,Game Boy Advance Konsole Clear Blue,"9,97",0
Amazon.de,minions,"98,92",B01076V78K,Minions,"12,18","4,16",B00T2HS0MW,"Undercover MNOH2250 - Mal- und Schreibturm Minions, 25 teilig","7,23",4,B00W765A7S,"Joy Toy 90556 Minion Stuart 3D-Keramiktasse 350 ml in Geschenkpackung, 8 x 12 x 11,5 cm","6,68","4,37"
Amazon.de,nike free 5.0,"98,92",B012NK4JMY,"Nike Free 5.0, Herren Laufschuhe","27,91",0,B012NK4J7O,"Nike Free 5.0, Damen Laufschuhe","15,04",0,B00V8SYGGC,Nike Free 5.0 Herren Laufschuhe,"8,6",0
Amazon.de,under armour herren,"98,92",B01HJ0YRDY,Under Armour Herren Fitness T-Shirt Tech Short Sleeve Tee,"9,43",0,B009VXKZBQ,Under Armour Herren Fitness Hose und Short Mirage Short 8,"7,36",0,B00S53FH9I,Under Armour Herren Fitness T-Shirt und Tank CC Left Chest Lockup,"4,69",0
Amazon.de,wetterstation mit außensensor,"98,92",B001GOPRC0,Wetterstation WS 9140-IT mit Funkuhr und Innen- und Außentemperaturanzeige,"13,75","5,81",B001ARJ27O,"Bresser Funkwetterstation TempTrend, Silber","6,91","2,87",B001HJ5DLE,"TFA Dostmann Funkwetterstation Spectro 35.1089, silber, 4.5 x 11.9 x 13.6cm","4,83","2,76"
Amazon.de,damen rieker pantoletten,"98,91",B017MMBBIS,Rieker 60833 Women Mules Damen Pantoletten,"4,87",0,B00387ETJA,Rieker 46393 Damen Clogs,"2,96",0,B017MMRU5G,,"2,87",0
Amazon.de,dymo,"98,91",B0030E5WYW,Dymo LetraTag LT-100H Etikettendrucker Handgerät,"32,44","8,85",B005SRAU50,Dymo LabelManager 160 Tragbares Beschriftungsgerät,"15,15","6,09",B000KJNZ7Q,"Dymo S0721660 Etikettenband (LetraTag-Etikettiergeräte, Kunststoff, 1,20 cm x 4 m) schwarz auf weiß","9,26","3,2"
