Abteilung,Suchbegriff,Suchhäufigkeit,ASIN,Nr. 1 der geklickten Titel,Klickfreigabe,Umwandlungs-Anteil,ASIN,Nr. 2 der geklickten Titel,Klickfreigabe,Umwandlungs-Anteil,ASIN,Nr. 3 der geklickten Titel,Klickfreigabe,Umwandlungs-Anteil
Amazon.de,monopoly,"99,77",B00AZBUKD6,"Hasbro Spiele 00009398 - Monopoly Classic, Familienspiel","23,29","24,56",B01IO5ANJ0,"Hasbro B6677100 - Monopoly Banking Ultra, Familienspiel","13,95","8,41",B00TPJ4MHO,"Hasbro Spiele B2348100 - Monopoly World, Familienspiel","12,38","13,47"
Amazon.de,nespresso maschine,"99,77",B00G98EJHM,"Krups Nespresso XN1001 Inissia Kaffeekapselmaschine (19 bar, inklusive Welcome Pack mit 16 Kapseln) weiß","23,29","15,23",B004JV77QQ,"DeLonghi Nespresso EN 125.S Kapselmaschine (1260 Watt, 0,7 Liter, Pixie Electric) silber","12,03","11,77",B00T4GWD7E,"DeLonghi Nespresso EN 550.B Lattissima Touch Kapselmaschine (1400 Watt, inklusiv Welcome Pack mit 16 Kapseln) schwarz","8,81","8,13"
Amazon.de,pinata,"99,77",B00007KUUI,Piñata Einhorn,"14,53","3,69",B00007KUUK,Pinata Esel,"9,87","4,55",B0002ISELC,Piñata Schatzkiste,"7,78","4,59"
Amazon.de,playmobil ghostbusters,"99,77",B01LYRIWZ0,PLAYMOBIL 9220 - Ghostbusters Ecto-1,"21,55","15,21",B01LYRGY7M,PLAYMOBIL 9219 - Ghostbusters Feuerwache,"18,83","16,6",B01LYRIWYZ,PLAYMOBIL 9221 - Stay Puft Marshmallow Man,"15,97","16,83"
Amazon.de,poliermaschine,"99,77",B01JGHLTS4,"Einhell Winkelpolierer CC-PO 1100/1 E (1100 W, Polier-/Schleifteller-Ø 180 mm, im Kunststoffkoffer, inkl. Umfangreiches Zubehör)","26,71","17,58",B01JGHLTRK,"Einhell Auto Poliermaschine CC-PO 90 (90 W, Polierteller 240 mm, 3700 min-1, inkl. 1 Textil- und 1 Synthetik - Polierhaube)","14,91","14,5",B00AQWT8OG,Kingbarney XXXL Profiset - Poliermaschine/Schleifmaschine inkl. Koffer 1500 Watt Set 4 + Polierschwamm Zubehörset - inkl. Politur - 30 Teile - Auto polieren,"10,17","5,96"
Amazon.de,poloshirt herren,"99,77",B007RDVNT0,"Nike Herren Poloshirt TS Core, obsidian/white, Gr. L, 454800-451","9,03","2,03",B01MA1UEKJ,"s.Oliver Herren Poloshirt 3899352558, Grün (Russian Green 6653), Large","6,63","6,77",B01M622PKI,"s.Oliver Herren Poloshirt 3899352558, Schwarz (Black 9999), X-Large","4,61","6,23"
Amazon.de,ps4 games,"99,77",B01N5SX9KH,This is the Police - [PlayStation 4],"5,57","7,37",B01H1QQG6W,Death Stranding - [PlayStation 4],"4,35",0,B01M6Y1Y4A,Red Dead Redemption 2 [PlayStation 4],"4,24",0
Amazon.de,ps4 pro,"99,77",B01LQF9UKS,PlayStation 4 Pro - Konsole (1TB),"50,72","88,15",B00ULWWFIC,PlayStation VR - [PlayStation 4],"10,65","1,47",B01MSIVM93,,"8,38",0
Amazon.de,rucksack,"99,77",B004CCRUAK,"Travelite Rucksack BASICS, schwarz (01), 30x41x20 cm, 22 Liter, 96245-01","9,37","10,48",B000CRBEJ2,"Eastpak Rucksack Padded Pak'r, 24 L, Black","6,78","1,8",B00S87IF1I,"Dakine Rucksack Campus Unisex - Erwachsene CAMPUS 33L,Carbon ,33 Liter","6,2","2,22"
Amazon.de,samsung galaxy s8 hülle,"99,77",B01N9Y504T,"Samsung EF-ZG950CBEG Clear View Hülle (geeignet für Samsung S8), Schwarz","29,68","12,51",B01N5W90KS,"Samsung Clear View Klappcover(Standfunktion, inkl. Semi-transparenter Vorderseite, geeignet für Galaxy S8+) schwarz","17,16","3,36",B06XXFL6ZK,mumbi UltraSlim Hülle für Samsung Galaxy S8 Schutzhülle im Mandala Design transparent rosa (Ultra Slim - 0.70 mm),"10,49","21,18"
Amazon.de,sonnenschirmständer,"99,77",B000U5434O,Nexos Sonnenschirmständer 30kg polierter Granit Edelstahl eckig 45 x 45 cm Schirmständer mit Griff und Rollen,"11,83","3,8",B001L6C5V4,"Schneider PE-Schirmständer, weiß, ca. 20 ltr.","10,1","4,98",B01MAUFY2P,Nexos Sonnenschirmständer 25kg polierter Granit Edelstahl eckig 45 x 45 cm Schirmständer mit Griffmulden und Reduzierringen für Schirme bis 3m Durchmesser geeignet,"9,72","3,75"
Amazon.de,star wars,"99,77",B01NAJKBUK,Rogue One - A Star Wars Story [Blu-ray],"11,55","1,07",B0179RK9KC,"Philips Disney Star Wars LED Tischleuchte mit Projektor, schwarz","10,12","10,58",B011T11T8A,Star Wars: The Complete Saga [9 Blu-rays],"7,22","2,67"
Amazon.de,alexa echo,"99,76",B01GAGVCUY,"Amazon Echo, Schwarz","37,35","14,39",B01DFKBG54,"Amazon Echo Dot (2. Generation), Schwarz","34,64","11,26",B01GAGVWYU,"Amazon Echo, Weiß","8,67","13,38"
Amazon.de,babybett,"99,76",B00GSVEZ4C,Julius Zöllner 5790014262 Bettset kleine Eulen rosa mit Applikation 3 teilig,"19,99","4,38",B00NY1ACU0,"Julius Zöllner 5740215000 Bettset Pooh mein Stern, Gr. 100/135+40/60","14,11","21,89",B00HCA8JDG,"Schardt 04 498 02 02 1/723 Komplettbett Classic-Line, weiß mit textiler Ausstattung Big Stars grau","11,63","24,51"
Amazon.de,fjällräven rucksack,"99,76",B002OWETK4,"Fjällräven Unisex Rucksack Kånken, graphite, 27 x 13 x 38 cm, 16 Liter, 23510-031","21,54","3,32",B01E5G21JM,"Fjällräven Re-Kånken Unisex Rucksack, Slate, 13 x 27 x 38 cm","7,41","11,57",B01KLB13EO,"Fjällräven Totepack No.1 Unisex Tasche, Blue Ridge, 11 x 32 x 39 cm","5,85","3,5"
Amazon.de,gaming laptop,"99,76",B01NCUTCGB,"Lenovo Legion Y520 39,62cm (15,6 Zoll Full HD IPS Anti-Glare) Gaming-Notebook (Intel Core i5-7300HQ Quad-Core, 8GB RAM, 1TB HDD + 128GB SSD, NVIDIA GeForce GTX 1050 2GB, Windows 10 Home) schwarz","29,46","22,25",B06XX8PY3M,Acer Predator 21 X Notebook i7-7820HK SSD RAID matt WFHD GTX1080 SLI Windows 10,"10,42",0,B06XTHG2W1,"XMG A507-VE - gzf VALUE Gaming Laptop (15.6"" Full HD IPS, GTX 1050, Intel Core i5-7300HQ, 8GB RAM, 1000GB SSHD, ohne Betriebssystem) schwarz","8,02","44,49"
Amazon.de,hawkers sonnenbrille,"99,76",B01LVUUG2X,Hawkers Herren Sonnenbrille mehrfarbig Einheitsgröße,"10,79","4,43",B01E9F1TDI,Hawkers One Carbon Black Sky  - Unisex-Sonnenbrille,"10,54","5,59",B010FEK1IQ,"Hawkers ONE - Sonnenbrille, CARBON BLACK EMERALD","7,64","3,38"
Amazon.de,hipp,"99,76",B004X0XAFK,"HiPP Kindermilch Combiotik ab 1 Jahr, 4er Pack (4 x 600 g)","10,98","2,47",B004X0XALE,"HiPP Kindermilch Combiotik ab 2 Jahre (4er Pack, 4 x 600 g)","10,56","1,77",B007X2CL6E,"Hipp Bio Kindermilch ab 1 Jahr, 4er Pack (4 x 800 g) - Bio","8,07","4,64"
Amazon.de,kindergartenfreundebuch,"99,76",B00VV58OLA,Meine Kindergarten-Freunde (Pirat),"3,86","2,8",3522458125,Mein Haufen Freunde – Kindergartenalbum,"3,67","1,84",B00VV58OKQ,Meine Kindergarten-Freunde (Prinzessin),"3,53","3,4"
Amazon.de,kindersitz 9-36 kg,"99,76",B01FFSGSQ6,"Britax Römer Autositz EVOLVA 123, Gruppe 1/2/3 (9 - 36 kg), Kollektion 2017, Cosmos Black","13,53","6,88",B06VVDPFZ3,Kinderkraft Comfort UP Kinderautositz  Autokindersitz Autositz Kindersitz 9 bis 36 kg Gruppe 1 2 3 Grau,"11,97","24,91",B005XATCO2,"Cybex Silver Pallas-fix, Autositz Gruppe 1/2/3 (9-36 kg), Pure Black, mit Isofix","11,73","5,14"
Amazon.de,kipling taschen,"99,76",B01IR80H18,"Kipling K15255 Damen Umhängetaschen 35.5x30x18.5 cm (B x H x T), Blau (42W Alaskan Blue)","3,01","0,86",B01MZ0KHP5,"Kipling Defea, Damen Shopper, Pink (Cherry Pink C),","2,33",0,B01M1GU26I,Kipling Damen NEW SHOPPER L Tote Mehrfarbig (Soft Dot),"2,03",0
Amazon.de,kompressor,"99,76",B00LALVTU8,"Einhell Kompressor TH-AC 200/24 OF (1,1 kW, 24 L, Ansaugleistung 140 l / min, 8 bar, ölfrei, große Räder und Haltebügel)","20,44","19,03",B003A5ZBY2,"Black + Decker Kompressor, 11 bar / 160 psi, digitale Druckeinstellung, Kabelfächer, beleuchtete Skala, ASI300","12,03","4,49",B00IPDH28W,Metabo Kompressor für Druckluft-Werkzeug Basic 250-24 W OF / 8 bar Kompressor für mobile Einsätze / öllos mit Manometer,"7,35","13,29"
Amazon.de,mia and me,"99,76",3505137561,Mia and me - Die Legende von Centopia,"10,93","2,63",B01HEVAJHG,"Undercover MMKO3300 - Tattoo Stifte Mia and Me, 6-er Set","5,46","2,23",3864582091,Mia and me - Mein Glitzermalbuch,"5,19","4,15"
Amazon.de,smart watch,"99,76",B01LF0T51I,"Samsung Gear S3 frontier (3,3 cm (1,3 Zoll) Display, NFC, Bluetooth, WLAN, Tizen OS), mit Silikon-Armband","20,93","2,98",B01LX09XIV,Fossil Q Herren Smartwatch FTW2106,"19,38","39,96",B01LZA84RU,Fossil Q Herren-Smartwatch FTW2108,"6,54","4,84"
Amazon.de,sony xperia z5 hülle,"99,76",B016QC8APM,mumbi Schutzhülle Sony Xperia Z5 Hülle transparent weiss (Ultra Slim - 0.55 mm),"88,43","15,93",B014UVDH2M,mumbi Schutzhülle Sony Xperia Z5 Hülle,"3,12","11,59",B014UVDNGM,mumbi Tasche im Bookstyle für Sony Xperia Z5 Tasche,"2,07","12,94"
Amazon.de,thermoskanne,"99,76",B000NQ68ZM,"reer 90500.08 - Edelstahl Isolier-Flasche, 500ml","13,69","4,26",B0082AG9VY,Isosteel VA-9556 Vakuum-Isolierflasche 0.75 L aus 18/8 Edelstahl mit Schraubverschluss und Trinkbecher,"10,97","11,7",B005XU00YI,"Emsa 508932  Isolierkanne, Edelstahl, 1 Liter, Quick Tip Verschluss, 100% dicht, Schwarz, Soft Grip","8,05","5,11"
Amazon.de,under armour herren,"99,76",B00F0P2H06,"Under Armour Ua Tech Ss Tee Herren Fitness - T-shirts & Tanks, Schwarz (Black Twist), Gr. M","8,64","4,36",B00891HSMA,"Under Armour Herren Fitness Hose und Shorts, Blk, MD, 1240128","8,24","4,22",B00KXDNKI8,"Under Armour Herren Fitness Cc Left Chest Lockup Kurzarm T-Shirt, White/graphite, XL, 1257616","4,66","2,56"
Amazon.de,wanduhr,"99,76",B008GBS0UC,"TFA 60.3017 Wanduhr, weiß","12,71","9,15",B0039MHT4G,"TFA 60.3503.10 Wanduhr, Analog, Funk","9,15","6,12",B00FQOM18E,"Hama Wanduhr ohne Ticken PG-220 (modern, geräuscharm, großes Ziffernblatt mit 22 cm, u.a. geeignet für Küche) schwarz","6,03","4,55"
Amazon.de,zehentrenner damen,"99,76",B00KQECLW0,"Birkenstock Gizeh EVA Unisex-Erwachsene Zehentrenner, Schwarz (Black), 39 EU","5,36","0,22",B01LPW4IUO,"Tamaris Damen 27109 Zehentrenner, Schwarz (Black/Muscat 036), 39 EU","5,31","1,38",B01N0JFL1F,"Tommy Hilfiger Damen M1285ONICA 14D3 Zehentrenner, Blau (Midnight 403), 40 EU","4,96","0,27"
Amazon.de,abus fahrradschloss,"99,75",B005VMO49U,"ABUS Faltschloss 6500/85 Bordo Granit X-Plus, Black, 85 cm, 55160","11,12","2,42",B001PLE0XQ,"ABUS Kettenschloss 880, Black, 110 cm, 43307","9,96","5,33",B002VWJTRA,"ABUS Fahrradschloss Tresor 1385/85, Black, 85 cm, 48566","7,55","8,74"
Amazon.de,armani herrenuhr,"99,75",B00NU33TMU,Emporio Armani Herren-Uhren AR1808,"11,13","3,6",B00995H5BO,Emporio Armani Herren-Uhren AR2460,"10,12","6,48",B00A2IEE84,Emporio Armani Herren-Uhren AR2457,"7,87",3
Amazon.de,assassins creed,"99,75",B072MZ8Z3K,Assassin's Creed Origins - [PlayStation 4],"22,51","2,63",B01MZ2FD0E,Assassin's Creed [Blu-ray],16,"10,49",B01LW2XHAE,Assassin's Creed Ezio Collection - [Playstation 4],"15,04","8,93"
Amazon.de,baywatch,"99,75",B072LWZKQB,Baywatch [Blu-ray],"74,89","21,81",B06X9JFHK9,"Baywatch - Die Rettungsschwimmer von Malibu, Staffel 1 [6 DVDs]","7,61","25,96",B0066EPKUE,Baywatch Rettungsschwimmer Kost�m 2-teilig David Hasselhoff Kost�m,"3,97","5,51"
Amazon.de,cluse uhr damen,"99,75",B019PCWHTK,Cluse Unisex-Armbanduhr Analog Quarz Edelstahl CL18112,"12,17","5,43",B00VTD1VH8,Cluse Damen-Armbanduhr Analog Quarz Leder CL18015,"7,81","5,43",B01B6ES122,Cluse Unisex-Armbanduhr Analog Quarz Edelstahl CL18113,"7,78","5,18"
Amazon.de,fifty shades of grey 2 dvd,"99,75",B01N3CW1RO,Fifty Shades of Grey - Gefährliche Liebe (Unmaskierte Filmversion),"88,52","72,08",B00SUOJJD2,Fifty Shades of Grey - Geheimes Verlangen,"5,74","17,48",B06XQSLBXM,Die Schöne und das Biest (Live-Action),"1,94","3,54"
Amazon.de,fritzbox 7490,"99,75",B00EO777DI,"AVM FRITZ!Box 7490 WLAN AC + N Router (VDSL/ADSL, 1.300 Mbit/s (5 GHz), 450 Mbit/s (2,4 GHz), DECT-Basis, Media Server) geeignet für Deutschland","63,81","47,01",B0117ZTDSG,"AVM FRITZ!Box 7430 (VDSL-/ADSL2+, WLAN N, 450 MBit/s (2,4 GHz), TK-Anlage für Voice over IP mit DECT-Basis, Mediaserver) geeignet für Deutschland","13,94","10,24",B01KKJFJ92,"AVM FRITZ!Box 7580 WLAN AC + N Router (VDSL-/ADSL-/ADSL2+-Modem, 4x4 MU-MIMO mit 1.733 (5 GHz) + 800 MBit/s (2,4 GHz), DECT-Basis, Media Server)","5,78","3,16"
Amazon.de,fritzbox 7590,"99,75",B071W8R4PS,"AVM FRITZ!Box 7590 High-End WLAN AC + N Router (VDSL-/ADSL-/ADSL2+, 4x4 MU-MIMO mit 1.733 (5 GHz) + 800 MBit/s (2,4 GHz), bis zu 300 MBit/s durch VDSL-Supervectoring 35b, DECT-Basis, Media Server)","46,9","59,31",B01KKJFJ92,"AVM FRITZ!Box 7580 WLAN AC + N Router (VDSL-/ADSL-/ADSL2+-Modem, 4x4 MU-MIMO mit 1.733 (5 GHz) + 800 MBit/s (2,4 GHz), DECT-Basis, Media Server)","23,32","25,36",B00EO777DI,"AVM FRITZ!Box 7490 WLAN AC + N Router (VDSL/ADSL, 1.300 Mbit/s (5 GHz), 450 Mbit/s (2,4 GHz), DECT-Basis, Media Server) geeignet für Deutschland","11,71","6,07"
Amazon.de,gewürzregal,"99,75",B000T2AREI,Metaltex 364633095 Gewürzregal Pepito mit 3 Etagen,"13,17","6,79",B00PJ2FRT8,"Ostmann 21er Chrom-Gewürzregal leer, 1er Pack","8,48","6,17",B0002FCGMS,"Polder 18-Glas-Gew&uuml;rzregal, silberfarben","6,96","7,82"
Amazon.de,hochdruckreiniger,"99,75",B00HH9QAME,Kärcher K 2 Compact Home Hochdruckreiniger,"22,57","11,32",B0185UN2PG,"Kärcher Hochdruckreiniger K 4 Full Control inkl. Pistole mit Druckanzeige,Vario Power Jet Strahlrohr und Dreckfräser, Reinigungsmittel-Ausbringung und Quick Connect Funktion (max. 20-130 bar, 400 l/h)","11,29","4,79",B00HH9QAT2,"Kärcher Hochdruckreiniger K 2 Basic inkl. Dreckfräser Strahlrohr und Quick Connect Funktion (max.110 bar, 360 l/h)","11,12","8,12"
Amazon.de,honor 9,"99,75",B071KCGJR8,"Honor 9 Smartphone (13,2 cm (5,2 Zoll) 20MP und 12MP Frontkamera, 64GB ROM, 4GB RAM, Android OS) blau","48,84","47,4",B0721QMFJC,"Honor 9 Smartphone (13,2 cm (5,2 Zoll) 20MP und 12MP Frontkamera, 64GB ROM, 4GB RAM, Android OS) blau","24,67","27,18",B01J0RYDPQ,"Honor 8 Smartphone (13,2 cm (5,2 Zoll) Touchscreen, 32GB interner Speicher, Android OS) schwarz","14,77","17,25"
Amazon.de,küchenwaage,"99,75",B000NZEB98,Soehnle 65840 Digitale Küchenwaage Siena silber,"22,96","12,78",B002RLFS20,Soehnle 67080 Digitale Küchenwaage Page Profi,"18,13","5,37",B00UTD5IV4,Soehnle 65118 Digitale Küchenwaage Purista,"15,78","7,95"
Amazon.de,leifheit bodenwischer,"99,75",B0088XOMZU,Leifheit 52014 Set Clean Twist System M,"15,79","8,15",B0090WTEQ0,Leifheit 55077 Wischtuchpresse Profi Evo Set m.Bodenw.,"12,66","8,79",B0002HOUIE,Leifheit 55045 Bodenwischer Profi micro Duo,"12,5","9,03"
Amazon.de,logan,"99,75",B06XCBRWMT,Logan - The Wolverine [Blu-ray],"84,89","77,12",B072L3WDG5,Guardians of the Galaxy Vol. 2 - 2D & 3D Steelbook Edition [3D Blu-ray] [Limited Edition],"2,43","1,34",B01N382ID4,John Wick: Kapitel 2 Steelbook [Blu-ray] [Limited Edition],"2,2","0,64"
Amazon.de,michael kors,"99,75",B009DFSRZS,Michael Kors Damen-Uhren MK3192,"6,26","1,09",B06Y3WPLBZ,Michael Kors Damen-Collier MKJ6669791,"6,15","5,99",B01N02FW6J,Michael Kors Damen-Smartwatch MKT5001,"5,72","1,2"
Amazon.de,nasenhaarschneider,"99,75",B0041R9NMO,Panasonic Nasen-/Ohrhaarschneider ER-GN-30K mit Batteriebetrieb,"36,27","14,12",B00S3G3BZY,Philips Series 3000 Nasen & Ohren haartrimmer (ProtectTube-Technologie) NT3160/10,"23,31","9,94",B00ROSVV0O,"Philips Series 5000 Nasen & Ohren haartrimmer (Dual Cut-Trimmer) NT5175/16, 170 Watt","10,62","4,77"
Amazon.de,penisring,"99,75",B019I3O8DO,"Durex Pleasure Ring, 1 Stück","22,44","4,34",B00D1DT95A,"Big Dingeling Donut, 3er Penisring und Cockring Set, verschiedene Farben","16,78","7,55",B0030ZCB0E,Durex Play Vibrations Penisvibratorring (1 x 1 Stück),"7,99","3,05"
Amazon.de,pfanne,"99,75",B0045CJYHO,"Tefal E43506 Jamie Oliver Pfanne 28 cm, edelstahl","19,31","3,62",B01E3PJUI0,"Tefal So Intensive D50306 Pfanne, 28 cm, antihaftversiegelt, schwarz/metallic","17,21","12,05",B009DGZYW6,Tefal A16806 Logics Pfanne 28 cm,"13,37","8,06"
Amazon.de,rasendünger,"99,75",B000PKKJSI,"COMPO Rasendünger mit Langzeitwirkung, Rasenpflege mit bis zu 3 Monaten Langzeitwirkung für Spiel-, Sport- und Zierrasenflächen, 20 kg für 750 m²","23,15","8,69",B00RQSNYXE,WOLF-Garten 2-in-1: Unkrautvernichter plus Rasendünger SQ 450; 3840745,"11,75","1,06",B0001FPOUK,WOLF-Garten Rasen-Langzeitdünger »Premium« 120 Tage LE 250; 3830030,"7,49","9,78"
Amazon.de,resident evil the final chapter,"99,75",B07146393H,Resident Evil: The Final Chapter  (+ Blu-ray) [Limited Edition],"61,72","83,87",B072C31G1M,Resident Evil: Vendetta [Blu-ray],"19,88","9,34",B01N382ID4,John Wick: Kapitel 2 Steelbook [Blu-ray] [Limited Edition],"1,97","0,16"
Amazon.de,seifenblasen,"99,75",B0002HYC0K,Pustefix 420869725 - Seifenblasen Nachfüllflasche Maxi 1000 ml,"18,73","5,98",B00R642NJ4,SES Deutschland 02251 - Riesenseifenblasen Mega Bubble,"14,92","5,44",B000OZLCTO,"Stadlbauer 420869360 - Pustefix, Großpackung auf Blisterkarte, 70 ml","12,75","29,08"
Amazon.de,selbstbräuner,"99,75",B002QA1VDW,"St. Moriz Self Tanning Mousse Medium 200ml, 1er Pack (1 x 200 ml)","26,83","9,9",B01CGKQFKK,"St. Moriz Professional Neu 60-Minuten Selbstbräunungs-Mousse, mit deutscher Kennzeichnung, 1er Pack (1 x 200 ml)","13,02","13,15",B0013ISRFI,Garnier Ambre Solaire Selbstbräuner Natural Bronzer / Selbstbräunungs-Milch 12h Feuchtigkeit (dermatologisch getestet) 1er Pack - 150 ml,"11,29","7,36"
Amazon.de,stativ,"99,75",B0013J6RXQ,"Cullmann ALPHA 2500 Stativ mit 3-Wege-Kopf (2 Auszüge, Gewicht 1277g, Tragfähigkeit 2,5 kg, 67cm Höhe, Packmaß 67cm)","20,63","10,82",B00XI87KV8,"AmazonBasics Dreibein-Stativ, 127 cm, leicht, mit 3-Wege-Kopf","15,64","17,46",B019WTM7IC,"Hama Fotostativ Action 165 3D (Höhe 61–165 cm,  Gummifüße und Spikes, Belastbarkeit bis 4 kg, Gewicht 1320 g leicht, Kamera Stativ inkl. Tragetasche) schwarz","8,63","6,52"
Amazon.de,whisky,"99,75",B00CEZ2HDC,Dalwhinnie 15 Jahre Highland Single Malt Scotch Whisky (1 x 0.7 l),"9,84","6,46",B002EP7WKU,Bowmore 15 Jahre Islay Single Malt Scotch Whisky (1 x 0.7 l),"5,78","1,85",B004EY1T4E,Bunnahabhain 12 Jahre Islay Single Malt Scotch Whisky (1 x 0.7 l),"5,31","1,03"
Amazon.de,adidas schuhe herren,"99,74",B01MU0P9VL,"Adidas Herren X_plr Hallenschuhe, Mehrfarbig (Lgsogr/Mgsogr/Cblack), 44 EU","11,88","9,14",B00J8MCRV6,"adidas ZX Flux Unisex-Erwachsene Laufschuhe, Grau (Aluminum/Running White), 42 2/3","6,35","7,14",B01MSU2RW3,"Adidas Originals Equipment Support ADV Herren Sneaker, Elfenbein (Ft White / Ft White / C Black), 44 2/3 EU","4,36","5,71"
Amazon.de,bilderrahmen,"99,74",B003TBKKNE,Walther KV040B New Lifestyle Kunststoffrahmen im Format 30 x 40 schwarz,"20,72","8,36",B010XGBEQ4,"Umbra 313016-880 Prisma Bilderrahmen, 4x6 Zoll, kupfer","11,93","7,96",B00WGS9F9G,"Empireposter - Collage Bilderrahmen Family - Kunststoff weiss Multishot - Größe (cm), ca. 69x32 - Wechselrahmen Rahmen-Collage - Qualitäts-Wechselrahmen der Marke empireposter® Frames Profil 15mm Kunststoff weiss mit Glas-Scheibe - Aussengrösse 69x32 cm für 10 Bilder der Größen 10x15 cm","7,97","8,55"
Amazon.de,birkenstock,"99,74",B000KBOPKA,"Birkenstock Classic Madrid Birko-Flor, Damen Pantoletten, Silber (Silber), 39 EU","15,49","5,04",B000MSYTXO,"Birkenstock Classic Arizona Birko-Flor, Unisex-Erwachsene Pantoletten, Schwarz (Schwarz), 43 EU","10,74","11,37",B000UWP8VY,"Birkenstock Classic Gizeh Birko-Flor, Unisex-Erwachsene Zehentrenner, Schwarz (Schwarz), 39 EU","7,37","1,64"
Amazon.de,cr2032,"99,74",B018S4PTNW,"Varta Batterien Professional CR2032 Lithium Knopfzelle (3V, 10-er Pack) in original 1er Blisterverpackung","37,37","9,7",B00005NPS0,Varta Professional CR2032 Lithium-Batterie 3Volt Typ CR 2032,"20,53","8,58",B018S4PSU6,"Varta Batterien Professional CR2032 Lithium Knopfzelle (3V, 5-er Pack)","10,52","6,82"
Amazon.de,destiny 2,"99,74",B06XXKZCSM,Destiny 2 - Standard Edition - [PlayStation 4],"69,07","22,78",074401848X,Destiny 2,"4,36","4,11",B06XY4FD2D,Destiny 2 - Limited Edition - [PlayStation 4],"3,3","12,34"
Amazon.de,dji mavic pro,"99,74",B01M1080NT,DJI Mavic Pro Fly More Combo grau,"55,26","48,26",B01M0AVO1P,DJI CP.PT.000498 Mavic Pro Drohne grau,"28,61","30,09",B0711V1Z5B,,"6,96",0
Amazon.de,filofax,"99,74",B00SKPZ8WW,"Filofax 22513 Organizer Pocket Domino, türkis","7,91","6,72",B06WVH16QY,"Filofax 22577 Terminplaner, Personal Domino Soft Pale, rosa","6,32","2,61",B01HBJE5DU,Filofax 26038 Organizer The Original Personal duck egg,"5,56","5,88"
Amazon.de,gardena schlauch,"99,74",B00HPXVA8G,"Gardena 18066-20 Schlauch Comfort HighFLEX, Mit Power Grip Profil und Hochwertiges Spiralgewebe (Schlauchlänge: 30m, Schlauchdurchmesser: 13mm, Berstdruck: 30 bar, ohne Schlauchstück)","13,32","12,25",B00HPXVIPQ,"Gardena 18030-20 Schlauch Comfort FLEX, Mit Power Grip Profil und Hochwertiges Spiralgewebe (Schlauchlänge: 10m, Schlauchdurchmesser: 13mm, Berstdruck: 25 bar, ohne Schlauchstück)","10,51","5,04",B00HPXVE2S,Gardena 18009-20 Schlauch Classic; aus hochwertigem Qualitätsgewebe (Schlauchlänge: 30m; Schlauchdurchmesser: 13mm; Berstdruck: 22 bar),"9,23","6,97"
Amazon.de,gear s3,"99,74",B01LF0T51I,"Samsung Gear S3 frontier (3,3 cm (1,3 Zoll) Display, NFC, Bluetooth, WLAN, Tizen OS), mit Silikon-Armband","62,52","22,44",B01LF0T540,"Samsung Gear S3 classic (3,3 cm (1,3 Zoll) Display, NFC, Bluetooth, WLAN, Tizen OS), mit Echtleder-Armband","33,88","27,9",B016ZWT64M,"Garmin Forerunner 235 WHR Laufuhr (Herzfrequenzmessung am Handgelenk, Smart Notifications)","0,63",0
Amazon.de,hacksaw ridge,"99,74",B01MR0C21M,Hacksaw Ridge [Blu-ray],"91,2","39,73",B01N382ID4,John Wick: Kapitel 2 Steelbook [Blu-ray] [Limited Edition],"2,41","0,82",B01MTFXA1V,Die irre Heldentour des Billy Lynn [Blu-ray],"0,72",0
Amazon.de,kinderrucksack,"99,74",B00PIY1H64,"Jack Wolfskin Unisex - Kinder Rucksack Moab Jam, azalea red, 40 x 28 x 7cm, 10 liter","8,97","4,01",B002L10NI0,"Jack Wolfskin Unisex - Kinder Rucksack Little Joe, night blue, 31 x 26 x 23 cm, 11 liters, 26221","7,98","6,43",B0197ZO4SM,"Vaude Unisex - Kinder Rucksack Ayla, grenadine, 29 x 21 x 12 cm, 6 Liter, 14878","5,91","5,81"
Amazon.de,miele staubsauger,"99,74",B0094QU3HQ,"Miele S 8340 Ecoline Bodenstaubsauger (1200 Watt, AirClean-Filter) weiß","25,55","11,78",B014PJHMSY,Miele Complete C2 Tango EcoLine Bodenstaubsauger / A / Mangorot / 6-stufiger Drehregler / AirClean-Filter / SBD 290-3 / 10 m Aktionsradius / Integriertes Zubehör,"13,66","9,82",B01LCFSQHA,Miele Blizzard CX1 Excellence EcoLine Bodenstaubsauger,"7,83","12,01"
Amazon.de,mähroboter,"99,74",B01M5KNBMN,"Gardena Mähroboter R40Li, 04071-60","32,95","23,18",B00BCMCIS2,Gardena 4072-20 Mähroboter R70Li,"19,04","22,11",B06WWRPVTQ,"Worx Landroid Rasenmähroboter SO500i bis 500 m², Wifi, App Programmierung, Rasenkantenmähfunktion, Multi Zonen, WR105SI","16,38","22,51"
Amazon.de,nike cap,"99,74",B003X1IDLQ,"Nike Cap Metal Swoosh Logo, schwarz/silber, One Size, 340225","35,92","11,35",B00IE9312S,"NIKE Herren Cap True Snapback, Black/White, One size, 584169-010","12,99",14,B00FKHVP70,"Nike Unisex Baseballkappe Swoosh Heritage 86, Black/Wolf Grey","12,2","12,51"
Amazon.de,plus produkte,"99,74",B0007VHBKO,"Vileda Glitzi Plus mit Antibac - Gründlich, hygienisch & saugstark, 3 Stück","9,69","3,36",B006VABXBS,Swiffer Staubmagnet Set (1 Griff + 3 Ersatztücher),"6,71","2,66",B000MPLG6U,Hansaplast Sensitive Pflaster 20 Strips,"5,48","3,94"
Amazon.de,seifenspender,"99,74",B00TQQ3IO4,"Wenko 21654100 Seifenspender Malta Weiß, Flüssigseifen-Spender, Fassungsvermögen 0,3 L, Keramik, 7,5 x 15,5 x 7,5 cm","10,08","2,67",B00TQQ49MY,"Wenko 21719100 Seifenspender Goa, Kunststoff - Polyresin, 9 x 16 x 7,4 cm, grau","6,57",6,B007WD7Y7K,"axentia Seifenspender zur Wandmontage, 380 ml Fassungsvermögen - Universalspender für Duschgel, Shampoo, Seife - Wandseifenspender für Reinigungsmittel - Wand-Spender für Flüssigseife - Dispenser für Bad & Dusche","6,14","2,74"
Amazon.de,tauchpumpe,"99,74",B00FAMEG4E,"Güde Schmutzwassertauchpumpe GS4002P mit var.Schwimmerschalter, 94630","17,33","13,31",B00B18KADW,"Einhell Tauchpumpe GH-SP 2768 (270 W, max. 6800 l/h, 5 m Eintauchtiefe, max. 35 °C, stufenlos einstellbarer Schwimmschalter, Tragegriff)","9,32","9,94",B00JR37XS8,"Einhell Schmutzwasserpumpe GC-DP 1020 N (1000 W, max. 18000 l/h, max. Förderhöhe 9 m, Fremdkörper bis 20 mm, Edelstahl)","6,82","8,96"
Amazon.de,thermobecher,"99,74",B008TLGIA8,"Emsa 513361 Isolierbecher, Mobil genießen, 360 ml, Quick Press Verschluss, Schwarz, Travel Mug","33,34","8,71",B00VE3I2UW,"Emsa 515615 Isolierbecher, Mobil genießen, 500 ml, Quick Press Verschluss, Schwarz, Travel Mug Grande","14,95","6,81",B00H84XQ7K,"Contigo Thermobecher West Loop, Black Matt, 1000-0289","8,24","3,43"
Amazon.de,wasserfilter,"99,74",B01GFJWA52,"AmazonBasics Wasserfilter 2,3 Liter","23,03","15,22",B01NCE5ZXR,"Brita Wasserfilter Marella, graphit - inkl. 3 Maxtra+ Kartuschen","10,37","7,93",B01GFJWG88,AmazonBasics Wasserfilterkartuschen – 3er Pack,"6,45","3,73"
Amazon.de,werkzeug,"99,74",B0051E16LW,"Mannesmann 89-teiliger Premium Universal- und Haushalts-Werkzeugkoffer, M29085","10,83","2,95",B009I4HRDW,"Mannesmann 130-tlg. Steckschlüssel- und Bitsatz, M29166","9,2","2,97",B0042CWWS0,Makita B-43044 Bohrer Bit Set 66tlg. im MAKPAC,9,"1,45"
Amazon.de,50 shades of grey 2,"99,73",B01N3CW1RO,Fifty Shades of Grey - Gefährliche Liebe (Unmaskierte Filmversion),"89,88","66,05",B00SUOJJD2,Fifty Shades of Grey - Geheimes Verlangen,"5,63","14,08",B06XQSLBXM,Die Schöne und das Biest (Live-Action),"2,21",0
Amazon.de,bose quietcomfort 35,"99,73",B01E3SNO1G,Bose QuietComfort 35 kabellose Kopfhörer schwarz,"64,71","47,45",B01E3SNO3E,Bose QuietComfort 35 kabellose Kopfhörer silber,"13,12","32,09",B00M1NEUKK,Bose QuietComfort 25 Acoustic Noise Cancelling Kopfhörer (geeignet für Apple-Geräte) schwarz,"5,68","3,3"
Amazon.de,brotdose,"99,73",B004TE2KXS,"Emsa 509388 3er Brotdosenset, 6 kombinierbare Halbschalen, 16 x 11 x 4 cm, Bunt, Variabolo Mix it","10,81","13,91",B013KB26CK,OXO Good Grips 11139800MLNYK Lunchbox-to-go,"9,1","5,5",B01MEGPHS6,"Rotho 1111806113 Vesperdose mit herausnehmbarer Trennwand (Größe: S) 0.9 L Inhalt, BPA-frei - Hergestellt in Schweiz, Kunststoff, aqua blau, 18 x 13 x 6 cm","7,33","5,94"
