"Amazon.de","teppich",692,"B00KFM1R3C","Designer Teppich Modern Kariert Kurzflor Design Meliert In Grau Creme Braun","37.29%","49.07%","B01G31KLBC","VIMODA prime1000 Shaggy Hoch-/Langflor Teppich, Modern für Wohn-/Schlafzimmer, Polypropylen, grau, 70 x 140 cm","10.28%","13.43%","B01GAS8LJW","Prime Shaggy Teppich Farbe Türkis Hochflor Langflor Teppiche Modern für Wohnzimmer Schlafzimmer - VIMODA, Maße:70x140 cm","5.64%","10.65%"
"Amazon.de","synology",693,"B01BNPT1EG","Synology DS216J 2 Bay Desktop NAS Gehäuse","28.29%","36.24%","B075L82DP1","Synology DS218+ 2 Bay Desktop NAS Gehäuse","16.91%","13.24%","B00MO6ZV52","Synology DS115j 1 Bay Desktop-NAS-Gehäuse","8.49%","12.20%"
"Amazon.de","blackroll",694,"B003BP5AGA","BLACKROLL STANDARD Faszienrolle - das Original (Härtegrad mittel) - Selbstmassage-Rolle für die Faszien in schwarz + Booklet","27.97%","31.53%","B004E2TDHQ","Blackroll Orange (Das Original) - Faszienrolle inkl. Übungs-DVD, Übungsposter & Booklet. Die Massagerolle für die Faszien, auch Foam Roller, Gymnastikrolle, Fitnessrolle genannt, zur Selbstmassage und Behandlung des Bindegewebes. Qualität Made in Germany","12.98%","14.71%","B016D5QDAQ","BLACKROLL BLACKBOX Faszientool-Set - das Original. Selbstmassage-Produkte für die Faszien in schwarz + DVD & Übungskarte","11.54%","11.53%"
"Amazon.de","jbl kopfhörer",695,"B01M6WNWR6","JBL T450BT Kabelloser On-Ear Bluetooth Kopfhörer mit Integrierter Musiksteuerung und Mikrofon Kompatibel mit Apple und Android Geräten -Schwarz","30.96%","39.04%","B01M5BURG9","JBL E45BT On-Ear Ohraufliegender Bluetooth Kopfhörer Faltbar Inkl. Abnehmbares Verwicklungsfreies Textilkabel mit Universeller 1-Tasten-Fernbedienung mit Integriertem Mikrofon - Schwarz","10.58%","6.87%","B01MG62Z5M","JBL T110 In-Ear-Kopfhörer mit Steuerung und Mikrofon schwarz","8.59%","10.12%"
"Amazon.de","gummistiefel frauen",696,"B00V5SISXC","Tom Joule Mollywelly, Damen Stiefel","32.94%","29.49%","B00VPTCQFM","Tom Joule T_FIELDWELLY, Damen Gummistiefel","17.73%","14.62%","B003TO51NK","Dunlop Dee Kurzstiefel -Gummistiefel,Regenstiefel, Arbeitsstiefel","13.21%","18.46%"
"Amazon.de","tassimo maschine",697,"B06X96X7FJ","Bosch Tassimo Vivy 2 TAS1402 Kapselmaschine (1300 W, 78 dB) schwarz","47.86%","67.65%","B0749Q6LRQ","Bosch TAS6004 Multigetränkeautomat Tassimo My Way, 1500 W, majestic weiß","23.71%","10.39%","B00MOADKUG","Bosch TAS4504 Tassimo Multi-Getränke-kaffeeautomatJOY (mit Brita Wasserfilter, Getränkevielfalt, 1-Knopf-Bedienung), Weiß","8.42%","8.43%"
"Amazon.de","phillips hue",698,"B01LZ8QYPI","Philips Hue White & Color Ambiance E27 LED Lampe Starter Set, drei Lampen 3. Generation inkl. Bridge, dimmbar, bis zu 16 Millionen Farben, steuerbar via App, kompatibel mit Amazon Alexa (Echo, Echo Dot)","17.76%","19.00%","B0148NMVQA","Philips 7190155PH EEK A Hue LightStrip+ Basis Set(ohne Bridge), flexibel erweiterbar, dimmbar, bis zu 16 Millionen Farben, steuerbar via App, kompatibel mit Amazon Alexa (Echo, Echo Dot), 2m, mehrfarbig","10.60%","8.48%","B0748MY3S8","Philips Hue White E27 LED Lampe Doppelpack, dimmbar, warmweißes Licht, steuerbar via App, kompatibel mit Amazon Alexa (Echo, Echo Dot)","10.60%","14.13%"
"Amazon.de","gitarre",699,"B005UWPRPG","CLIFTON Konzertgitarre 4 4, schwarz, Ahorn Griffbrett und Brücke, Fichtendecke, Lern DVD, Karaoke CD, Songbook, gepolsterte Tasche mit Rückengarniture, 2 Stück Plectren, digitales Stimmgerät, Starter Set","27.56%","34.38%","B00DVM6KUS","Classic Cantabile AS-851 4/4 Konzertgitarre Starter Set (Komplettes Anfänger Set mit Klassik Gitarre, Gigbag Tasche, Nylonsaiten, Lehrbuch/Schule inkl CD und DVD, 3x Plektren und Stimmpfeife)","17.95%","28.68%","B005LG2JN4","Yamaha C40BL Akustik Konzertgitarre schwarz","8.17%","3.49%"
"Amazon.de","aquabeads",700,"B00TKNMQLO","Aquabeads 79308 - Kinder Bastelset starter set","27.17%","28.65%","B00TKNNFLO","Aquabeads 79448 - Maxi-Sternenschatulle, Kinder Bastelsets","13.88%","10.13%","B00TKNMU2O","Aquabeads 79328 - Künstlerkoffer, Kinder Bastelsets","11.40%","13.70%"
"Amazon.de","nintendo switch zubehör",701,"B01N4ND1T2","Nintendo Switch Pro Controller","18.28%","17.34%","B01N9RTMWS","HORI NSW-029U Switch Compact PlayStand Nintendo Switch","12.74%","17.34%","B01N7RIIR2","Joy-Con-Lenkrad-Paar","11.18%","20.32%"
"Amazon.de","batterie",702,"B00LN803LE","Varta Batterien Mignon (AA LR6 Vorratspack 40 Stück in umweltschonender Verpackung)","35.06%","42.74%","B001P026Z6","Varta Batterien Mignon (AA LR6 geeignet für energieintensive Geräte z.B. elektronisches Spielzeug, Vorratspack 40 Stück)","13.15%","14.70%","B00LN803K0","Varta Batterien Micro (AAA LR03 Vorratspack 40 Stück in umweltschonender Verpackung)","7.79%","8.76%"
"Amazon.de","windows 10",703,"B010S3VOEO","Microsoft Windows 10 Pro 64bit","49.89%","52.45%","B010WMQGMQ","Windows 10 Home 32/64 Bit USB Flash Drive","19.70%","11.01%","B010S3VVJW","MS Windows 10 Pro 64bit DVD OEM (EN)","10.79%","10.55%"
"Amazon.de","damenuhr",704,"B00BKQT80Q","Daniel Wellington Classic Damen-Armbanduhr Analog Quarz Leder - DW00100036","9.88%","8.15%","B007NFGDGK","Fossil Damen-Uhren ES3077","8.34%","10.33%","B004D4S7AY","Fossil Damen-Uhren ES2811","8.02%","4.35%"
"Amazon.de","adventskalender erwachsene",705,3744893529,"Wunder kommen leise: Adventskalender für Erwachsene","14.45%","16.74%","B01LW1G7EM","Roth Guten Morgen Adventskalender, 1er Pack (1 x 650 g)","12.91%","9.58%","B00OBHOD6A","Huber's Frühstücks-Adventskalender Rentner, 1er Pack (1 x 200 g)","6.87%","4.21%"
"Amazon.de","surface",706,"B07235S2XH","Microsoft Surface Pro 31,24 cm (12,3 Zoll) Notebook (Intel Core i5 der 7. Gen., 8 GB RAM, 256 GB SSD, Windows 10 pro) [neues Modell 2017]","25.54%","21.68%","B01690T7FS","Microsoft Surface Pro 4 31,24 cm (12,3 Zoll) Tablet-PC (Intel Core i5, 4GB RAM, 128 GB, Intel HD Graphics, Windows 10 Pro)","16.55%","6.99%","B0718YXL3S","Microsoft 34,29 cm (13,5 Zoll) Surface Laptop (Intel Core i5, 128GB Festplatte, 4GB RAM, Intel HD Graphics 620, Win 10 S) Platin Grau","11.05%","5.59%"
"Amazon.de","zippo feuerzeug",707,"B001E5FLT0","Zippo Benzin Feuerzeug Chrom Standard gebürstet Regular Sturmfeuerzeug","32.96%","43.19%","B000B5H5SE","Zippo Sturmfeuerzeug 60001206 - 1290005 , matte schwarz  Logo","10.80%","13.63%","B000WN6DOC","Zippo 1300116 Feuerzeug Stocking Girl Trick Emblem","6.57%","6.54%"
"Amazon.de","samsung gear",708,"B01LF0T51I","Samsung SM-R760NDAADBT Gear S3 frontier Smartwatch (3,3 cm (1,3 Zoll) Display, NFC, Bluetooth, WLAN, Tizen OS, mit Silikon-Armband)","28.12%","40.19%","B014WGN4MI","Samsung Gear S2 Classic - Schwarz","10.65%","3.83%","B01GJW7H2Q","Samsung Gear Fit 2 Smartwatch mit Pulssensor und Benachrichtigungen - Schwarz(L)","10.47%","10.53%"
"Amazon.de","schminke",709,"B01N109AKC","Maybelline New York Make-up Koffer, 1er Pack (1 x 1 Stück)","46.08%","19.20%","B007L0FUCK","Briconti Schminkkoffer Everybody's Darling, 1er Pack","34.86%","56.70%","B00WHZY4C6","Briconti Schminkkoffer Beauty Case, schwarz, 1er Pack","4.39%","7.14%"
"Amazon.de","willow tree",710,"B00164M9XA","Willow Tree 26005 Weihnachtsartikel Heilige Familie, 5,1 x 7,6 x 24,1 cm, Natur, Holz","14.84%","8.57%","B003ZXFA40","Schutzengel Ein Stern wacht über Dir / Bright Star von Willow Tree","7.49%","9.10%","B001BDQQ76","Willow Tree 26181 Figur Unser Geschenk, 5,1 x 3,8 x 21,6 cm, Natur","6.75%","5.86%"
"Amazon.de","ps4 spiele neuheiten 2017",711,"B071K5VB69","Metro Exodus [Day One Edition] - [PlayStation 4]","12.65%","3.86%","B071N9SDXL","Call of Duty: WWII - Standard Edition - [PlayStation 4]","9.14%","14.79%","B071FR6VZ6","Need for Speed - Payback - [PlayStation 4]","8.78%","10.29%"
"Amazon.de","tablet 10 zoll",712,"B01F94XBUW","Lenovo TAB2 A10-30 25,65 cm (10,1 Zoll HD IPS) Media Tablet (QC APQ8009 Quad-Core Prozessor, 1,3GHz, 2GB RAM, 16GB eMMC, 2MP +  5MP Kamera, Touchscreen, Dolby Atmos Sound, Android 5.1) midnight blau","19.62%","18.77%","B01M3015CT","Das neue Fire HD 10-Tablet mit Alexa Hands-free, 25,65 cm (10,1 Zoll) 1080p Full HD-Display, 32 GB, schwarz, mit Spezialangeboten","17.84%","35.31%","B01ERY8650","Samsung Galaxy Tab A (2016) T580 25,54 cm (10,1 Zoll) WiFi Tablet PC (Octa Core 2GB RAM Android 6,0 neue Version) schwarz","14.99%","10.37%"
"Amazon.de","sofortbild kameras",713,"B06Y68YRTF","Fujifilm Instax Mini 9 Kamera ice blau","28.77%","27.37%","B06Y698TWW","Fujifilm Instax Mini 9 Kamera flamingo rosa","10.58%","11.19%","B00C24WD5C","Fujifilm  Instax Mini 8 Sofortbildkamera","9.75%","9.81%"
"Amazon.de","schreibtischunterlage",714,"B0007OEHEE","Durable 711319 Schreibunterlage (Duraglas, 50 x 65 cm) transparent","41.67%","42.90%","B000WL6XV2","Sigel HO365 Papier-Schreibunterlage mit Schutzleiste, 2-Jahres-Kalender, 59,5 x 41 cm , 40 Blatt","12.26%","10.82%","B002BDD3QW","Leitz 53120095 Schreibunterlage, Soft-Touch, mit Abdeckung, 50x65 cm, schwarz","11.11%","10.72%"
"Amazon.de","wimpernserum",715,"B005CVGJFM","Revitalash Advanced Augenwimpern-Conditioner, 2ml","25.95%","21.72%","B071YRHVJL","Long4Lashes FX5 Power Formula Wimpernserum 3ml by Oceanic | NEUE FORMEL","14.05%","14.71%","B074V44LBZ","One&Only Cosmetics Eyelash und Eyebrow Serum, 1er Pack (1 x 9 ml)","9.99%","12.11%"
"Amazon.de","skagen damenuhr",716,"B019H4X81W","Skagen Damen-Uhren SKW2410","10.62%","9.18%","B00O1ZA7DK","Skagen Damen-Uhren SKW2267","9.39%","9.33%","B002QCT9M0","Skagen Damen-Uhren 355SMM1","7.45%","6.74%"
"Amazon.de","delonghi kaffeevollautomaten",717,"B00400OMU0","De'Longhi Magnifica S ECAM 22.110.B Kaffeevollautomat (Direktwahltasten und Drehregler, Milchaufschäumdüse, Kegelmahlwerk 13 Stufen, Herausnehmbare Brühgruppe, 2-Tassen-Funktion) schwarz","33.45%","54.17%","B002OHDBLW","De'Longhi ECAM 23.420.SB Kaffeevollautomat (Digitaldisplay, Profi-Aufschäumdüse, Kegelmahlwerk 13 Stufen, Herausnehmbare Brühgruppe, 2-Tassen-Funktion) silber/schwarz","15.37%","21.15%","B000OC7SZ4","DeLonghi ESAM 3000.B Kaffee-Vollautomat (1350Watt, 1,8 Liter, 15 bar, Dampfdüse) schwarz","6.87%","11.87%"
"Amazon.de","spülmaschine",718,"B0095WC4SU","Bosch SMU53L15EU Serie 6 Silence Plus Unterbaugeschirrspüler / A++ / 258 kWh/Jahr / 12 Maßgedecke / 59,8 cm / Edelstahl / 3-fach Wasserschutz","33.08%","27.93%","B00DKYB02U","Bosch SMS50D32EU Serie 4 Silence Plus Freistehender Geschirrspüler / A+ / 12 Maßgedecke / 290 kWh/Jahr / Weiß / Super Silence / Active Water","11.80%","24.14%","B0176A41UG","Beko DFN05L10W Standgeschirrspüler / A+ / Beladungserkennung / Unterbaufähig / Intensivreinigungsfunktion / Verstellbares Korbsystem / Watersafe / Clean und Shine","11.06%","19.31%"
"Amazon.de","handschuhe herren",719,"B00LL1UW82","adidas Herren Handschuhe Fieldplayer","37.01%","39.23%","B014FH4XQ0","Odlo Herren Handschuhe Warm, 10640","27.84%","28.59%","B0188ZPI00","Trust Urban Sensus Touchscreen-Handschuhe (L/XL) schwarz","9.94%","14.10%"
"Amazon.de","kommode",720,"B01LW7NA60","Galdem GAKO3WS Kommode mit 3 Schubladen, Holz, weiß, 70 x 77 x 40 cm","26.21%","29.55%","B00H1PU656","Demeyere 250533 Kommode, Spanplatte, weiß, 80 x 35,3 x 85 cm","12.55%","9.09%","B00AH8OR2M","Songmics Sitzbank Sitzhocker mit Stauraum faltbar 2-Sitzer belastbar bis 300 kg kunstleder weiß 76 x 38 x 38 cm LSF106","12.40%","11.36%"
"Amazon.de","magnettafel",721,"B00191X1MI","Herlitz 10524627 Whiteboard und Magnettafel (silbernen Holzrahmen, 40 x 60cm) weiß","25.71%","36.72%","B018LKYUYW","Be!Board B1201 Glas-Magnettafel schwarz, 60 x 40 cm - auch in weiß","15.34%","10.69%","B0091SYZ2G","Genie Wochenplaner Schreibtafel (Magnet, Abwischbar, Inkl. Stifte, Magnete und Wandbefestigung, 57 x 37 cm)","10.32%","7.67%"
"Amazon.de","tischkreissäge",722,"B017A1N6MU","Einhell Tischkreissäge TC-TS 2025/1 U (2000 W, Sägeblatt Ø 250 x Ø 30 mm, max. Schnitthöhe 85 mm, Tischgröße 640x487 mm)","16.66%","31.25%","B0081C02I4","Bosch Tischkreissäge PTS 10 (Spaltkeil, Tischverlängerung, Winkelanschlag, Absaugschlauch, Karton, 1400 Watt, Kreissägeblatt Nenn-Ø: 254 mm, Schnitttiefe bei 90°: 75 mm)","12.84%","17.50%","B00531AQK0","Bosch Professional Tischkreissäge GTS 10 XC (Motorbremse, Sägeblatt, Absaugadapter, Parallelanschlag, Winkelanschlag, Karton, Sägeblatt-Ø: 254 mm, Sägeblattbohrungs-Ø: 30 mm, 2100 Watt)","9.13%","2.08%"
"Amazon.de","werkzeugkoffer",723,"B0051E16LW","Mannesmann 89-teiliger Premium Universal- und Haushalts-Werkzeugkoffer, M29085","20.25%","29.29%","B005ERFK9U","Mannesmann Alu-Werkzeugkoffer, bestückt, 108-tlg., M29075","15.99%","16.77%","B00678Z5WM","Makita P-90093 Werkzeug-Set 83-teilig","8.18%","6.26%"
"Amazon.de","zippo",724,"B001E5FLT0","Zippo Benzin Feuerzeug Chrom Standard gebürstet Regular Sturmfeuerzeug","36.34%","49.13%","B000B5H5SE","Zippo Sturmfeuerzeug 60001206 - 1290005 , matte schwarz  Logo","10.64%","10.93%","B00NA62UA4","Zippo 2004497 Feuerzeug Gear Wheels","6.20%","5.19%"
"Amazon.de","winterjacke damen",725,"B00NM98WXS","Berydale Damen Parka Jacke wasser- und winddicht","96.29%","98.38%","B00L7GDTF4","Jack Wolfskin Damen Mantel Iceguard","0.99%","0.65%","B00X5SAOMS","erima Damen Steppjacke","0.45%","0.32%"
"Amazon.de","fleischwolf",726,"B002USUA96","Lurch 10250 Drehwolf mit Gebäckvorsatz aubergine / creme","22.71%","41.80%","B000VZ8NOE","Westmark Fleischwolf mit Lochscheibe ( Ø 4,5 mm), Schraubzwinge für Tischmontage, Größe 5, Verzinnter Stahlguss, Silber, 97502260","20.61%","18.63%","B00KM3USAC","Bosch ProPower MFW67440 Fleischwolf (700 W, Blocking Power 2000 W, Größe 8, 3,5 kg/Min) schwarz","14.15%","11.68%"
"Amazon.de","honor 8",727,"B01J0RYDPQ","Honor 8 Smartphone (13,21 cm (5,2 Zoll) Full HD Display, 32 GB Speicher, Android) schwarz","52.00%","50.49%","B01J0RYDPG","Honor 8 Smartphone (13,21 cm (5,2 Zoll) Full HD Display, 32 GB Speicher, Android) blau","20.61%","19.18%","B01J0RYCRA","Honor 8 Smartphone (13,21 cm (5,2 Zoll) Full HD Display, 32 GB Speicher, Android) weiß","10.74%","19.34%"
"Amazon.de","batman",728,"B00DU61NFW","The Dark Knight Trilogy [Blu-ray]","13.07%","18.01%","B071RBPWKP","Batman Glas mit Logo DC Comics ,schwarz","7.61%","8.27%","B01I71AXNC","Batman 0122035 - Brotdose, Bentobox , Fledermaus mit Besteck und Zwischendeckel","6.76%","4.96%"
"Amazon.de","induktionskochfeld",729,"B0053TQS2C","AEG HK634250XB Induktionskochfeld / Glaskeramik / 60 cm / 4-fach Induktion mit Single-Control / Stop und Go-Funktion / Edelstahl","22.53%","22.83%","B018KELUY2","AEG HKA8540IND Einbaukochfeld / autarkes Induktionskochfeld mit Power-Funktion und Timer / 80 cm Glaskeramikkochfeld mit Edelstahlrahmen / 4 elektronische Automatikkochstellen mit Topferkennung / schwarz und silber","12.77%","8.70%","B01NGYUU95","Bauknecht CTAI 9640 IN Induktions Kochfeld / 4 Heizelemente / 60 cm / Simmer Funktion / Edelstahl","11.16%","11.41%"
"Amazon.de","call of duty ww2 ps4",730,"B071N9SDXL","Call of Duty: WWII - Standard Edition - [PlayStation 4]","92.61%","97.66%","B06XS2Q6G6","Call of Duty: WWII - Season Pass | DLC | PS4 Download Code - deutsches Konto","1.79%","0.51%","B072MZ8Z3K","Assassin's Creed Origins - [PlayStation 4]","1.02%","0.51%"
"Amazon.de","basteln mädchen",731,"B007IUOORK","SES  01131 - Glitzerschmetterlinge gießen","15.76%","19.35%",3897777282,"The Girls' Book: Das außergewöhnliche Handbuch für neugierige Mädchen | Spielen, Basteln und Spaß in einem Buch","11.34%","11.59%","B01HTGMMPI","Knorrtoys F15423 - Bastelset Eimer, 750 teilig","10.45%","6.09%"
"Amazon.de","alexa zubehör",732,"B06W586CDZ","TP-Link HS100(EU) intelligente WLAN Steckdose (funktioniert mit Amazon Alexa [Echo, Echo Dot] und Google Home, mit App Steuerung überall und zu jeder Zeit)","18.45%","25.56%","B016H0R7SE","Philips Hue White E27 LED Lampe Starter Set, zwei Lampen inkl. Bridge, dimmbar, warmweißes Licht, steuerbar via App, kompatibel mit Amazon Alexa (Echo, Echo Dot)","13.00%","12.78%","B01GP0NLPE","Alexa-Sprachfernbedienung für Amazon Echo, Echo Dot und Echo Plus","12.77%","19.55%"
"Amazon.de","bluetooth kopfhörer",733,"B01M6WNWR6","JBL T450BT Kabelloser On-Ear Bluetooth Kopfhörer mit Integrierter Musiksteuerung und Mikrofon Kompatibel mit Apple und Android Geräten -Schwarz","35.90%","29.61%","B0756BRVXJ","Anker Bluetooth Kopfhörer SoundBuds Flow in Ear magnetisches Headset, mit Wasserschutzklasse IPX5/7-Stunden-Spielzeit/Mikrofon, federleicht für iPhone, iPad, Samsung, Nexus, HTC und mehr","11.26%","25.66%","B00U5WV250","Sony MDRZX330BT Kopfhörer mit Bluetooth und NFC schwarz","6.53%","5.59%"
"Amazon.de","htc",734,"B01E610DEQ","HTC 10 Smartphone (13,2 cm (5,2 Zoll) Super LCD 5 Display, 1440 x 2560 Pixel, 12 Ultrapixel, 32 GB, Android) carbon grau","18.17%","6.52%","B01LRWRRCS","HTC ONE A9S Smartphone 12,7 cm (5 Zoll) Display (32GB, Nano SIM, Fingerabdruck-Sensor, 4G LTE, 13MP Hauptkamera, 5MP Frontkamera, Android) cast iron","17.92%","36.96%","B071YZXG8H","HTC U11 Smartphone (13,97cm (5,5 Zoll), 16 MP Frontkamera, 64GB Speicher, Android) Sapphire Blue, mit Amazon Alexa","13.44%","5.43%"
"Amazon.de","black friday",735,"B072HW9CFF","Black Friday","23.78%","63.16%","B075WNVL84","Black Friday Shopping Mania - Fashion Mall Special Sale Game","17.06%","21.05%","B00Y0BY80S","Casual Friday Herren Sakko Blazer","13.42%","0.00%"
"Amazon.de","armband damen",736,"B019GZ2XOK","Liebeskind Berlin Ada silver Damen Armband, Pink (rose 0410)","29.92%","29.05%","B009DX1P7W","Fossil Damen-Armband JF00118791","15.68%","12.84%","B01KXLJOES","Elli Damen Strangarmband Kleeblatt 925 Sterling Silber Vergoldet rose 17 cm","9.71%","6.76%"
"Amazon.de","nokia",737,"B072KL7NCC","Nokia 5 Dual SIM Smartphone (13,2 cm (5,2 Zoll), 16GB, 13 Megapixel Kamera, Android 7.0) satin-schwarz","20.94%","9.56%","B074SJJBY2","Nokia 8 13.4 cm (5,3 Zoll) Smartphone (64GB ROM, 4 GB RAM 13 MP Kamera, Android pure) tempered blue, SINGLE Sim","14.30%","0.37%","B0721QSX3B","Nokia 6 Dual SIM Smartphone (13,9 cm (5,5 Zoll), 32GB, 16 Megapixel Kamera, Android 7.0) matt-schwarz","13.00%","4.78%"
"Amazon.de","jbl charge 3",738,"B01FQVHGSG","JBL Charge 3 Tragbarer Bluetooth-Lautsprecher (wasserdicht, mit 6000 mAh Power Bank und Freisprechfunktion) schwarz","49.17%","51.00%","B01G7IU634","JBL Charge 3 Tragbarer Bluetooth-Lautsprecher (wasserdicht, mit 6000 mAh Power Bank und Freisprechfunktion) grau","15.05%","19.95%","B01G7IU616","JBL Charge 3 Tragbarer Bluetooth-Lautsprecher (wasserdicht, mit 6000 mAh Power Bank und Freisprechfunktion) türkis","12.21%","12.59%"
"Amazon.de","haartrockner",739,"B00BCQIK4O","Philips Ionen-Haartrockner HP8232/00, 2200 Watt, weiß","29.72%","28.73%","B00BCQIIMS","Philips Haartrockner HP8230/00, 2100 Watt, schwarz","17.63%","22.09%","B00HXCJS3S","Braun Satin Hair 7 Haartrockner HD 710, mit IonTec und Satin Protect Technologie, 2200 Watt","11.56%","10.45%"
"Amazon.de","brio eisenbahn",740,"B01ACE4MIE","BRIO World 33773 - Eisenbahn Starter Set A, bunt","17.18%","12.14%","B01DNRE7FK","BRIO World 33516 - Country Life Set","14.13%","9.27%","B00RMLUWGW","BRIO World 33727 - Mein Erstes BRIO World Bahn Spiel Set, Zubehör","13.96%","10.86%"
"Amazon.de","laterne",741,"B018LTLTTC","Flower Power 9716 Laterne Inklusive LED-Outdoor Kunststoff-Kerze","25.83%","15.72%","B007AJQZ1M","Ursus 6860000 - Laternen Bastelset Eulen, circa 20 x 15.3 cm, bunt","22.93%","27.11%","B000OZKEXY","Riethmüller 1001 - Lampionset für Kinder, elektrischer Laternenstab und 15 cm Lampion","8.08%","11.98%"
"Amazon.de","ssd 500gb",742,"B00P73B1E4","Samsung MZ-75E500B/EU 850 EVO interne SSD 500GB (6,4 cm (2,5 Zoll), SATA III) schwarz","44.47%","45.50%","B01IAGSD68","Crucial CT525MX300SSD1 MX300 525 GB Interne Festplatte (6,4 cm (2,5 Zoll), SATA)","17.67%","20.29%","B01N6Y18ZM","SanDisk Ultra II Interne SSD 500GB Sata III 2,5 Zoll bis zu 545 MB/Sek.","9.30%","13.93%"
"Amazon.de","spiegel",743,"B00DTRXOM2","Spiegelprofi F0015070 Facettenspiegel Max, 50 x 70 cm, 4 mm stark","33.55%","21.05%","B0030T13CW","axentia 3-fach Vergrößerungs-Standspiegel in Silber, rostfreier Badezimmerspiegel verchromt, runder Kosmetikspiegel im Durchschnitt ca. 17 cm","13.19%","42.98%","B00BSV7XAK","Livitat SX1281-S Wand-/ Badspiegel, 150 x 60 cm, Holz, silber","12.11%","5.26%"
"Amazon.de","lego architektur",744,"B01J41MPF8","Lego 21034 Architecture London, Skyline Sammlungsset","18.23%","23.61%","B012NOGGHQ","Lego 21028 Architecture New York City, Skyline-Kollektion, Bausteine","14.22%","12.38%","B012NOESIA","Lego 21027 Architecture Berlin, Skyline Bauset","10.59%","11.97%"
"Amazon.de","xbox 360 spiele",745,"B00CB8CBH4","Fast & Furious: Showdown","6.86%","7.61%","B0071L2QNA","Grand Theft Auto V - [Xbox 360]","6.57%","9.42%","B004JM5C4Y","Dreamcast Collection","5.86%","2.17%"
"Amazon.de","nikon",746,"B01C672SZ4","Nikon Coolpix B500 Kamera schwarz","18.42%","11.86%","B00FYV5V0Y","Nikon D5300 SLR-Digitalkamera (24,2 Megapixel, 8,1cm (3,2 Zoll) LCD-Display, Full HD, HDMI, WiFi, GPS, AF-System mit 39 Messfeldern) Kit inkl. AF-S DX 18-105 VR Objektiv schwarz","17.35%","11.86%","B00U5W8HFI","Nikon D7200 SLR-Digitalkamera (24 Megapixel, 8 cm (3,2 Zoll) LCD-Display, Wi-Fi, NFC, Full-HD-Video) nur Kameragehäuse schwarz","6.11%","1.69%"
"Amazon.de","usb stick 64gb",747,"B008IEC2K6","Intenso Ultra Line 64 GB USB-Stick USB 3.0 silber","19.29%","21.88%","B00DQGBYDC","SanDisk Ultra 64GB USB-Flash-Laufwerk USB 3.0 bis zu 100MB/Sek","18.20%","19.67%","B01BGTG3JA","SanDisk Ultra Fit 64 GB USB-Flash-Laufwerk USB 3.0 bis zu 150 MB/Sek","11.04%","10.13%"
"Amazon.de","airfryer",748,"B00BS97UUA","Philips HD9240/90 Airfryer XL (2100 W, Heißluftfritteuse, ohne Öl, für 3-4 Personen) schwarz","29.28%","29.53%","B00Y4SN790","Princess XL Heißluftfritteuse/ Aerofryer mit digitalem Display | ohne ÖL - einfach zu reinigen – 3,2 Liter Fassungsvermögen, 182020","28.32%","32.81%","B004WD0I30","Philips Airfryer, Heißluftfritteuse (ohne Öl, 60 Tage risikofrei testen) schwarz HD9220/20","20.64%","14.55%"
"Amazon.de","galaxy s7 edge",749,"B01A5OU154","mumbi Hülle für Samsung Galaxy S7 Edge Schutzhülle","29.97%","1.06%","B01A5NM97I","mumbi Schutzhülle für Samsung Galaxy S7 Edge Hülle transparent weiss","10.99%","0.00%","B01A5ON5PC","mumbi Ledertasche im Bookstyle für Samsung Galaxy S7 Edge Tasche","10.31%","0.00%"
"Amazon.de","dyson v6",750,"B01E02Q656","Dyson DC62 beutel- und kabelloser Staubsauger (350 W, Handstaubsauger mit Lithium-Ionen Akku, Wandhalterung und Ladestation) iron/rot","29.62%","21.81%","B073ZMD1FJ","Dyson V6 Cord-Free beutel- & kabelloser Staubsauger inkl. breiter Elektrodüse, Kombidüse & Fugendüse / Akkusauger für Decken-, Bodenreinigung und Zwischenräume mit Wandhalterung & Ladestation","19.79%","18.70%","B00U654VS6","Dyson V6 Total Clean beutel- und kabelloser Staubsauger (350 W, Softwalze und Fugendüse, Handstaubsauger mit Lithium-Ionen Akku, Wandhalterung und Ladestation) rot","15.02%","20.11%"
"Amazon.de","pferde",751,"B003YGAGJW","Happy People 58983 - Haflinger mit Sound stehend mit Sattel und Zaumzeug","13.32%","1.59%","B003I55E1Y","SES 01155 - Pferde gießen und anmalen","11.72%","15.99%","B00H48M9KU","Moses 90207 - Das Quiz der Pferde und Ponys","6.53%","9.37%"
"Amazon.de","daniel wellington",752,"B00BKQT80Q","Daniel Wellington Classic Damen-Armbanduhr Analog Quarz Leder - DW00100036","25.63%","33.66%","B06XS9VSXR","Daniel Wellington Unisex Erwachsene-Armbanduhr DW00100162","7.24%","3.96%","B00BKQT590","Daniel Wellington Damen-Armbanduhr Canterbury Analog Quarz Nylon DW00100030","6.99%","6.60%"
"Amazon.de","sat receiver",753,"B0168ZZD4S","Xoro HRS 8660 digitaler Satelliten-Receiver mit LAN Anschluss (HDTV, DVB-S2, HDMI, SCART, PVR-Ready, USB 2.0) schwarz","30.31%","39.81%","B018KGYHOU","Edision proton Full HD Satelliten-Receiver FTA HDTV DVB-S2 (HDMI, AV, USB 2.0) Astra 19,2 vorprogrammiert","15.59%","24.73%","B005HPS3CU","TechniSat TECHNISTAR S2, HDTV Sat-Receiver mit Single-Tuner für Empfang in HD (CI+, HDMI, USB 2.0, UPnP, Ethernet, DVR- und Timeshift-Funktion (Farbe: Schwarz)","11.56%","6.61%"
"Amazon.de","auto",754,"B004FN9Q12","Medisana MCH Massagesitzauflage mit 4 Massagezonen und 5 Programmen (ideal für Auto oder Büro)","16.40%","2.49%","B000XUPEJY","ThoMar Airdry Auto-Entfeuchter 1 kg, das Original, wiederverwendbar","8.33%","11.08%","B00KON1JIA","&#x3010;Neue Version&#x3011;Mpow Bluetooth 4.1 Empfänger Drahtlos Bluetooth Receiver Tragbare Bluetooth Adapter Audiogeräte für KFZ Auto Lautsprechersystem mit Stereo 3.5 mm Aux Input- Schwarz","5.53%","2.22%"
"Amazon.de","schreibtischlampe",755,"B000WL6BOQ","Maul Schreibtischlampe MAULstudy, Design Klemmleuchte Metall, Exklusive Leuchtmittel, Schwarz, 8230590, 1 Stück","30.52%","36.89%","B001F5U78Y","Maulatlantic Schreibtischlampe, Klemmfuß, 1700 Lux, 6500 Kelvin, GS-geprüft,  schwarz8213503","14.60%","13.11%","B001BAYCKC","Brilliant G64548A03 Paddy 20W Schreibtischleuchte transparent/blau","7.58%","6.56%"
"Amazon.de","adidas jogginghose herren schwarz",756,"B00MTS18O8","adidas Herren Trainingshose Sereno 14","31.71%","56.11%","B019ZGT352","adidas Herren Hose Condivo 16 Training Pants","28.76%","13.10%","B00T0QDRWS","adidas Herren Hose Essentials Stanford Basic","6.55%","8.21%"
"Amazon.de","fön",757,"B00BCQIIMS","Philips Haartrockner HP8230/00, 2100 Watt, schwarz","34.24%","39.11%","B00BCQIK4O","Philips Ionen-Haartrockner HP8232/00, 2200 Watt, weiß","19.84%","18.62%","B0044DDC04","Grundig HD 6080 Ionen-Haartrockner (2200 Watt), schwarz-silber","9.36%","12.26%"
"Amazon.de","super mario odyssey",758,"B01MUBNPYP","Super Mario Odyssey [Nintendo Switch]","86.43%","97.25%","B075LSK284","Nintendo Switch Konsole Rot + Mario Odyssey","4.87%","0.40%","B07339NC2C","amiibo Super Mario Odyssey Mario","2.28%","0.45%"
