Abteilung,Suchbegriff,Suchhäufigkeit,ASIN,Nr. 1 der geklickten Titel,Klickfreigabe,Umwandlungs-Anteil,ASIN,Nr. 2 der geklickten Titel,Klickfreigabe,Umwandlungs-Anteil,ASIN,Nr. 3 der geklickten Titel,Klickfreigabe,Umwandlungs-Anteil
Amazon.de,telefon,"99,88",B00EDQ4IMS,"Gigaset A415 Telefon, Schnurlostelefon / Mobilteil, Grafik Display, Dect-Telefon, ohne Anrufbeantworter, Freisprechfunktion, Analog Telefon, Desktop Phone, schwarz","11,45","4,95",B00EHMDCTS,"Gigaset C430A Duo Telefon, Schnurlostelefon / 2 Mobilteile, TFT-Farbdisplay, Dect-Telefon, mit Anrufbeantworter, Freisprechfunktion, Analog Telefon, schwarz","7,07","2,85",B008KWRN0K,"AEG Solo 10 - Schnurloses 1.6"" Design DECT-Telefon mit Freisprecheinrichtung im Mobilteil - Weiß","6,32","2,14"
Amazon.de,trinkflasche,"99,88",B001NCDE4S,"Nalgene Trinkflasche Everyday, Blau, 1 L","11,05","8,94",B00V68SQPG,"Nalgene Kunststoffflaschen 'Everyday OTF', Transp./Schwarz, 078900, 5565-9024","7,53","3,44",B00V8C11S4,"Rosti Mepal Wasserflasche Ellipse Polyethylenterephthalat/ABS 6,3&nbsp;x 6,3&nbsp;x 27&nbsp;cm, 500&nbsp;ml, durchsichtig, 6.3 x 6.3 x 27 cm","7,1","4,46"
Amazon.de,ventilatoren,"99,88",B003KHJO6G,"Honeywell HT-900E Kraftvoller und geräuscharmer Turbo-Ventilator, schwarz","25,1","11,69",B001UHOU2G,AEG T-VL 5531 Tower-Ventilator,"14,9","7,97",B001AO0OXI,Honeywell HO-5500RE Turmventilator oszillierend silber/schwarz,"12,43","2,53"
Amazon.de,aptamil,"99,87",B01GDZSZ6Q,"Aptamil Kindermilch 1+, 5er Pack (5 x 600 g)","15,73","16,38",B00D8V08UK,"Aptamil Pronutra Pre Anfangsmilch, von Geburt an, 4er Pack (4 x 800 g)","12,31","10,67",B014HGVU1K,"Aptamil Kindermilch 2+, 5er Pack (5 x 600 g)","11,34","2,54"
Amazon.de,bücher,"99,87",3868826661,"Am Arsch vorbei geht auch ein Weg: Wie Sich Dein Leben Verbessert, Wenn Du Dich Endlich Locker Machst","19,83","12,48",3442380294,BLACKOUT - Morgen ist es zu spät: Roman,"9,26","5,9",3805250940,"Ein ganz neues Leben (Lou, Band 2)","6,21","4,71"
Amazon.de,bücher neuerscheinungen 2017,"99,87",3956497104,Apfelkuchen am Meer,"9,03","2,29",3548288782,Heimweh: Thriller,"5,87","2,55",3548613179,Das Brombeerzimmer,"5,13","2,41"
Amazon.de,desigual tasche,"99,87",B01LZYEVK1,Desigual Damen BOLS_VALKIRIA CAPRI Schultertasche Weiß (1024),"4,31","3,91",B01LWPCCGG,Desigual Damen BOLS_ROTTERDAM SATURYAY Henkeltasche Grün (4026),"4,12","4,41",B01LZYDHW8,Desigual Damen BOLS_LONDON MEDIUM BARBADOS Umhängetasche Rot (3000),"4,06","3,05"
Amazon.de,dyson,"99,87",B01E02Q656,"Dyson DC62 beutel- & kabelloser Staubsauger inkl. schmaler Elektrobürste mit Nylonborsten & Carbonfasern und Fugendüse / Handstaubsauger mit Lithium-Ionen Akku, Wandhalterung & Ladestation","21,43","11,66",B00M8YTI3G,"Dyson DC33c Origin beutelloser Staubsauger (inkl. umschaltbarer Bodendüse mit Saugkraft-Regulierung, Kombi- & Polsterdüse / Bodenstaubsauger mit Energieeffizienzklasse A) gelb","9,52","9,23",B01C90JO7S,"Dyson Pure Cool Link Luftreiniger mit HEPA-Filter, inkl. Fernbedienung & App-Steuerung / Energieeffizienter Ventilator & Luftreinigungsgerät mit Geruchs- & Schadstofffilter, speziell für Allergiker, weiß/silber, 305162-01","8,65","2,62"
Amazon.de,htc u11,"99,87",B0725GZ3SW,"HTC U11 Smartphone (13,97cm (5,5 Zoll), 16 MP Frontkamera, 64GB Speicher, Android) Brilliant Black","45,82","19,56",B071YZXG8H,"HTC U11 Smartphone (13,97cm (5,5 Zoll), 16 MP Frontkamera, 64GB Speicher, Android) Sapphire Blue","31,91","32,6",B0719BNT5S,"HTC U11 Smartphone (13,97cm (5,5 Zoll), 16 MP Frontkamera, 64GB Speicher, Android) Amazing Silver","9,04","12,9"
Amazon.de,kalender 2017 2018,"99,87",B06XY4P5ZS,Chäff-Timer Classic A5 Kalender 2017/2018 [lila Mantra] 18 Monate Juli 2017-Dezember 2018 - Terminkalender mit Wochenplaner - Organizer - Wochenkalender,10,"7,37",B01N4FXP8J,"Busy B Akademischer Terminkalender mit Punkten, von August 2017 bis August 2018 mit Steckfächern sowie zwei Termin- und Stundenplänen","9,12","6,61",B01KYSZQJC,"Brunnen 1072964178 Schülerkalender Inspire (1 Woche in 2 Seiten, August 2017 bis Juli 2018)","4,22","4,51"
Amazon.de,lautsprecher,"99,87",B00YR92T90,Logitech Z333 Multimedia Speakers - Lautsprecher für Home Entertainment (mit 80 Watt und Subwoofer) schwarz,"13,87","9,43",B06XGTYJ4X,JBL Flip 3 Spritzwasserfester Tragbarer Bluetooth-Lautsprecher mit außerordentlich Kraftvollem Klang - Sonderausgabe - Schwarz,"9,7","0,37",B00TFGWAA8,"JBL Go Ultra Wireless Bluetooth Lautsprecher (3,5mm AUX-Eingang, geeignet für Apple iOS und Android Smartphones, Tablets und MP3 geräten) schwarz","7,29","2,49"
Amazon.de,microsoft lumia 950 hülle,"99,87",B00PQVRV5K,mumbi Microsoft Lumia 950 Tasche Etui schwarz (Lasche mit Rückzugfunktion Ausziehhilfe),"30,51",0,B00PQWYOE0,mumbi Flip Case Microsoft Lumia 950 Tasche,30,"20,58",B00PQVKIDW,mumbi Schutzhülle Microsoft Lumia 950 Hülle,"14,7","11,23"
Amazon.de,mikrowelle,"99,87",B00BRH5B6I,Samsung MS23F301EASEG Mikrowelle / 23 L / 800 W / schwarz / silber / Premium Select Line elektronische Steuerung,"17,08","6,51",B00IKDAPRW,"Severin MW 7875 Mikrowelle (700 Watt, 20 Liter, Garraum) silber","9,19","6,95",B007TVJSY2,Sharp Electronics R242BKW Mikrowellengerät,"6,47","3,49"
Amazon.de,navigationsgeräte,"99,87",B01DUGY4R0,"TomTom Start 52 Europe Traffic Navigationsgerät (13 cm (5 Zoll), Lifetime Maps, Fahrspurassistent, 3 Monate Radarkameras, Karten von 48 Ländern Europas)","23,35","6,29",B00BEBPV30,"TomTom Start 25 M Europe Traffic, Navigationsgerät (Free Lifetime Maps, 13cm (5 Zoll) Display, TMC, Fahrspurassistent, Parkassistent, IQ Routes, Europa 45) schwarz","13,27","8,21",B01AXYGLVY,"Garmin Drive 50 LMT CE Navigationsgerät (lebenslange Kartenupdates, Premium Verkehrsfunklizenz, 12,7cm (5 Zoll) Touchdisplay)","10,7","5,89"
Amazon.de,sofortbildkamera,"99,87",B009ZM9R4O,Fujifilm  Instax Mini 8 Sofortbildkamera,"16,98","9,14",B00BK1MI6W,"Fujifilm Instax Mini 8, Sofortbildkamera, Kamera, weiß","16,84","8,62",B00C24WD5C,Fujifilm  Instax Mini 8 Sofortbildkamera,"7,66","8,93"
Amazon.de,sonnenliege,"99,87",B016W06G9A,Vanage Gartenliege Sophia in schwarz mit Sonnendach - Sonnenliege mit Textilbezug und Dach - Liegestuhl ist klappbar - Gartenmöbel - Strandliege aus Aluminium - Relaxliege für den Garten,"19,88","6,98",B005KP7U0I,"Allibert Polyrattan Liege Daytona SL, Grau","12,02","6,4",B00O7UYJGU,"Leco 39398104 Schaukelstuhlkissen, 100 % Polyester in rot, Schaumstofffüllung, Nylongewebe in schwarz","11,2","6,78"
Amazon.de,sonos,"99,87",B00FSCNLME,Sonos PLAY:1 WLAN-Speaker für Musikstreaming (Weiß),"20,41","14,95",B00FSCNODU,Sonos PLAY:1 WLAN-Speaker für Musikstreaming (Schwarz),"11,94","13,87",B01615UVDI,Sonos PLAY:5 WLAN-Speaker für Musikstreaming (Schwarz),"8,19","3,23"
Amazon.de,sony alpha 6000,"99,87",B00IE9XHE0,"Sony Alpha 6000 Systemkamera (24 Megapixel, 7,6 cm (3"") LCD-Display, Exmor APS-C Sensor, Full-HD, High Speed Hybrid AF) inkl. SEL-P1650 Objektiv schwarz","57,51","22,11",B00IE9XH90,"Sony Alpha 6000 Systemkamera (24 Megapixel, 7,6 cm (3"") LCD-Display, Exmor APS-C Sensor, Full-HD, High Speed Hybrid AF) inkl. SEL-P1650 und SEL-55210 Objektiv schwarz","15,16","11,47",B00IE9XHCM,"Sony Alpha 6000 Systemkamera (24 Megapixel, 7,6 cm (3"") LCD-Display, Exmor APS-C Sensor, Full-HD, High Speed Hybrid AF) schwarz","6,21","11,12"
Amazon.de,soy luna,"99,87",B01MRRA33M,Soy Luna 70490001 - Disney Halskette mit Anhänger,"11,94","2,86",B01DXQCMJ4,Soy Luna&nbsp;&ndash;&nbsp;Rollschuhe zum Trainieren&nbsp;&ndash;&nbsp;Gr. 36/37,"10,27","0,82",B01KK8ET6M,"Schmink-Koffer mit umfangreichem Beauty-Set (abziehbarer Nagellack, Lipgloss, Lippenstift u.v.m.) für Fans von Disney’s Soy Luna","5,55","3,28"
Amazon.de,spielzeug ab 2 jahren,"99,87",B0002MOJ62,Quercetti 4190 - Fantacolor Junior,"5,38","5,92",B0012D2CWS,Ravensburger 21403 - Tiere und ihre Kinder,"3,81","4,76",B00B1OUCQG,"Kosmos 697365 - Soundwürfel Bauernhof, Kinderspiel","3,59","7,35"
Amazon.de,spring in eine pfütze,"99,87",3960960050,Spring in eine Pfütze: Bunte Ideen für jeden Tag von Viktoria Sarina,"62,19","84,47",3960960085,Schülerkalender 2017/2018 von JuliaBeautx,"12,35","3,79",3956141326,Mach dieses Buch fertig immer und überall,"4,63","1,34"
Amazon.de,treppenschutzgitter,"99,87",B01G4WERBU,"Safety 1st Quick Close ST Treppenschutzgitter, extra sicheres Metall-Türschutzgitter zum Klemmen, weiß, 73 - 80 cm, Möglichkeit der Verlängerung bis zu 136 cm verlängerbar (ab ca. 6 - 24 Monate)","20,04","11,15",B00GO4N698,Hauck 597026 Open'n Stop Safety Gate,"13,91","4,98",B004AKIH7O,"Geuther Türschutzgitter 2733, weiß","6,46","7,71"
Amazon.de,weber grill zubehör,"99,87",B0071V7WOS,Weber Grill Style Gemüsekorb Edelstahl klein 6481,"6,14","3,55",B01N6J3VGE,"Weber Non Stick Spray, schwarz, 25 x 6 x 9 cm, 17685","5,84","3,33",B0044ERTDY,"Weber 8834 Gourmet BBQ System , Sear Grate Einsatz","5,08","3,92"
Amazon.de,whirlpool,"99,87",B00FQD6PUK,"Bestway Lay-Z-Spa Miami Whirlpool, 180 x 66 cm","40,77","16,47",B00N8P5A36,"Bestway Lay-Z-Spa Palm Springs Whirlpool, 196 x 71 cm","14,34","3,1",B01B9ESTYO,AQUAPARX Whirlpool AP-550SPA *oval 190x120cm* Pool 2Personen Wellness Jacuzzi Spa Whirlpoolzubehör Badewanne 2P Wanne Indoor Outdoor Heizung aufblasbar,"13,11","8,64"
Amazon.de,wäschekorb,"99,87",B00576BLL4,"Wenko 3440113100 Wäschesammler Trio Beige - Wäschekorb, Fassungsvermögen 130 L, 100 % Polyester, 63 x 57 x 38 cm, beige","11,86","5,82",B008F78QTW,"Curver 00709-885-00 Wäschebox Style, 40 L, creme","10,97","3,96",B00C0WB1U4,"Relaxdays Wäschesammler LINEA Bambus H x B x T: ca. 73 x 37 x 33 cm Wäschekorb mit 2 Fächern als Ablage als praktischer Wäschepuff aus waschbarem Leinen zum Herausziehen mit seitlichen Griffen, natur","6,93","2,35"
Amazon.de,bose kopfhörer,"99,86",B01E3SNO1G,Bose QuietComfort 35 kabellose Kopfhörer schwarz,"23,73",3,B0117RGG8E,Bose SoundLink around-ear kabellose Kopfhörer II schwarz,"15,66","11,87",B01L7PSJFO,Bose SoundSport kabellose Kopfhörer schwarz,"9,92","7,6"
Amazon.de,fernglas,"99,86",B0000AKGX3,Olympus 118760 10 x 50 DPS-I Fernglas mit Tasche,"27,88","10,72",B0000YVEG0,Olympus N1240586 8-16x40 Zoom DPS-I Fernglas,"11,67","5,22",B005EJN004,"Eschenbach Optik arena D+ 10x50 Fernglas, BaK-4 Prismen, wasserdicht","9,58","1,44"
Amazon.de,fitbit charge 2,"99,86",B01KSX374E,"Fitbit Standard Charge 2 Unisex Armband Zur Herzfrequenz Und Fitnessaufzeichnung, Schwarz, L, FB407SBKL-EU","84,77","63,36",B01KSX392O,"Fitbit Standard Charge 2 Unisex Armband Zur Herzfrequenz Und Fitnessaufzeichnung, Schwarz, S, FB407SBKS-EU","8,54","7,79",B01LW2TH3Y,"Fitbit Flex 2 Fitness Wristband - Black, One Size","1,47","1,56"
Amazon.de,fossil damenuhr,"99,86",B009BEO81I,Fossil Damen-Uhren ES3202,"6,08","4,59",B01487YLPU,Fossil Damen-Uhren ES3880,"3,85","2,3",B007NFGDGK,Fossil Damen-Uhren ES3077,"3,79","3,76"
Amazon.de,galaxy s7 edge hülle,"99,86",B01C42FH4A,mumbi UltraSlim Hülle für Samsung Galaxy S7 Edge Schutzhülle transparent (Ultra Slim - 0.55 mm),"73,97","10,34",B01CUFNH6G,mumbi double GRIP Hülle für Samsung Galaxy S7 Edge Schutzhülle schwarz,"13,41","5,95",B01A5OU154,mumbi Hülle für Samsung Galaxy S7 Edge Schutzhülle,"2,99","17,57"
Amazon.de,gleitgel,"99,86",B007NC8Z0A,"Durex Perfect Glide, 1er Pack (1 x 50 ml)","17,83","6,04",B019I3ODO8,"Durex Play Feel Gleitgel, 1er Pack (1 x 100 ml)","15,27","7,5",B00UCZOQ1M,"Durex Play Prickelnd Gleit- und Erlebnisgel, 1er Pack (1 x 50 ml)","10,42","4,67"
Amazon.de,gutschein amazon,"99,86",B00X67BMTC,Amazon.de Grußkarte mit Geschenkgutschein - 15 EUR (Happy Birthday Ballons),"38,45","29,56",B06XJ3QRZS,,"15,32","11,09",B01EAMRCZE,Amazon.de Geschenkgutschein in Geschenkbox - 20 EUR (Alle Anlässe),"12,44","8,8"
Amazon.de,iphone 7 schutzhülle,"99,86",B01J1L5IHS,mumbi double GRIP Hülle für iPhone 7 Schutzhülle schwarz,"31,5","7,95",B01J1L5P6C,mumbi Schutzhülle für iPhone 7 Hülle,"30,39","1,64",B01J1L5N3M,mumbi UltraSlim Hülle für iPhone 7 Schutzhülle transparent (Ultra Slim - 0.55 mm),"30,36","3,84"
Amazon.de,katzenklo,"99,86",B002S53480,"Stefanplast  CATHY F Katzentoilettenhaus m. Türe+Filter, blau, 56x40x40cm","15,38","10,98",B00ZE27570,Clean'n'Tidy Katzenklo und Spielstation,"9,58","3,5",B00L4CBA8Y,"PetSafe Katzentoilette für Katzen automatisch, ScoopFree, Silikat Katzenstreu, Sicherheitssensoren, Gesundheitsmonitor, groß, elektrisch, selbstreinigend, hygienisch, geruchsfrei, leiser Motor","7,76","0,93"
Amazon.de,kleiderschrank,"99,86",B012SL0382,"Wimex 450547 Kleiderschrank 5-türig, Alpinweiß, Absetzungen, anthrazit","10,94","1,79",B00855T4YK,"Wimex 119484 Kleiderschrank, 3-türig mit zwei Schubkästen und einer Spiegeltür, Front Korpus Außentüren Eiche Sägerau Nachbildung, 135 x 198 x 58 cm","9,92","11,52",B009V81B7I,"Wimex 163771 Schwebetürenschrank 198 x 180 x 64 cm, Front anthrazit und Glas schwarz, Korpus Alu-Nachbildung","9,11","2,99"
Amazon.de,malbuch für erwachsene,"99,86",3868839356,Fuck - Das ultimative Fluch- und Schimpfmalbuch für Erwachsene,"11,11","1,12",3863554388,Inspiration Traumreise: 50 Ausmalmotive für mehr Entspannung und Achtsamkeit (Farbe rein – Stress raus),"6,57","5,43",B013F67PL2,"Stabilo KREATIVE AUSZEIT Erwachsenen-Malbuch (78 filigrane Motive, inklusive point 88 Fineliner) 15er Pack","5,94","4,4"
Amazon.de,mixer,"99,86",B00UTJQ1RI,"Philips HR2195/08 Standmixer mit 21.000 U/min, 900W, für Smoothies und Milchshakes","14,56",8,B00MHT6LFA,"AEG PerfectMix SB 2400 Mini Mixer / Smoothiemaker mit 0,4 PS-Power-Motor (bis zu 23.000 U/min, 4 Edelstahlmesser, bruchfeste 0,6 l BPA-freie Tritan-Trinkflasche, Standmixer mit gebürstetem Edelstahlgehäuse)","14,21","2,43",B003F7CPPS,"Russell Hobbs Essentials Standmixer (600 Watt, 1,5L Glasbehälter, 2 Geschwindigkeitsstufen), Schwarz, Rot, Transparent, 17956-56","8,99","10,24"
Amazon.de,mobile baby,"99,86",B003I7OHSS,Bieco 23-021096 - 3D Holz Mobile Käferchen,"9,66","2,62",B00BXTT134,"Bieco 02013104 - Musikmobile Petrilla mit Melodie ""Guten Abend Gute Nacht""","7,82","3,6",B00TYL9OGW,Fehn 071214 Musik-Mobile Sleeping Forest,"7,28","5,03"
Amazon.de,ps 4 spiele,"99,86",B0725Z5FMF,Far Cry 5 - Standard Edition - [PlayStation 4],"4,88","1,55",B01N5SX9KH,This is the Police - [PlayStation 4],"4,72","19,15",B06W9L2KY3,Crash Bandicoot N.Sane Trilogy - [PlayStation 4],"4,46","0,82"
Amazon.de,rieker sandalen für damen,"99,86",B00P0S3Q58,"Rieker 64278 Women Open Toe, Damen Sandalen, Blau (pazifik/amaretto/16), 39 EU","4,96","0,66",B017MLF8SI,"Rieker 63684 Women Open Toe, Damen Sandalen, Grau (cement/41), 38 EU","2,99","0,75",B00P0RZLEI,"Rieker 69792 Women Open Toe, Damen Sandalen, Blau (pazifik/14), 39 EU","2,22","1,64"
Amazon.de,s7 hülle,"99,86",B01C42FMMW,mumbi UltraSlim Hülle für Samsung Galaxy S7 Schutzhülle transparent (Ultra Slim - 0.80 mm),"70,04","16,76",B01A5PJK96,mumbi Hülle für Samsung Galaxy S7 Schutzhülle,"7,1","7,03",B01G2DEOEQ,mumbi double GRIP Hülle für Samsung Galaxy S7 Schutzhülle schwarz,"6,31","15,24"
Amazon.de,sandwichmaker,"99,86",B008GT06T2,"Krups FDK 451 Sandwich-Toaster (850 Watt, Toastplatten 25 x 12 cm) schwarz","20,67","7,37",B00A175P98,"Clatronic ST 3477 Sandwichtoaster, blau","9,09","11,1",B000094G35,Cloer 6219 Sandwichmaker / 900 W / für 2 diagonal geteilte Toasts / optische Fertigmeldung / Kabelaufwicklung /,"7,85","4,3"
Amazon.de,schwimmbecken,"99,86",B001IWNDDA,"Intex Family Schwimmbecken, blau, 300 x 200 x 75 cm","25,69","3,94",B001O9C41O,"Bestway Family Pool Blue Rectangular, 262x175x51 cm","8,76","3,86",B000MBUOOO,"Intex Easy Set Aufstellpool, blau, Ø 305 x 76 cm","8,08","3,74"
Amazon.de,wmf,"99,86",B00I5ABIFI,"WMF Kult Mix & Go Smoothie Mini Blender (Tritan Flasche, Edelstahl Mixer)","8,6","5,65",B00ZVUZVFI,WMF Küchenschüssel-Set Gourmet 4-teilig Cromargan Edelstahl rostfrei 18/10 spülmaschinengeeignet,"3,87","3,68",B000XFZK7K,"WMF 0605796030 Gourmet Anti-Geruchseife, Edelstahl Rostfrei, Ø 22 cm","2,95","2,11"
Amazon.de,wäschespinne,"99,86",B004KIM8YE,Leifheit 82001 Wäscheschirm Linomatic 500 deluxe,"25,36","6,83",B00HSEV5K0,Leifheit 85506 Wäscheschirm Linotrend 500 Longline,"14,41","15,44",B004FJOE4A,Leifheit 82002 Wäscheschirm Linomatic 600 deluxe,"8,89","5,31"
Amazon.de,zelt 4 personen,"99,86",B000LPAEQY,"High Peak Unisex Zelt Nevada 4, dunkeloliv/helloliv, 54 x 16 x 16 cm, 10086","15,02","7,08",B00JJW4O0W,"skandika Familienzelt Hammerfest 4, Hellblau/Dunkelblau, 4500","8,01","3,39",B00CKRJPUC,Milestone Camping Kuppelzelt für vier Personen - Orange,"7,58","6,89"
Amazon.de,bcaa,"99,85",B0044P0R5A,"Olimp BCAA Mega Caps 1100, 300 Kapseln, 1er Pack (1 x 384 g)","30,21","11,59",B00790O5XW,"ESN Nitro BCAA Powder Pro Series, Raspberry Ice-Tea, 500g Beutel","23,04","11,34",B003CCSSGQ,"Olimp BCAA XPlode , Zitrone, 500 g","11,41","9,05"
Amazon.de,camping,"99,85",B004SXBYOQ,Campart Travel Campingküche KI-0734,"13,51","2,35",B01E5OZC7C,"ICO ICO021 Outdoor-Camping-Sandwich Toaster, Kein Strom Benötigt, Aluminium, silber, 36 x 16 x 4 cm","13,27","14,79",B001GABJW6,Camp 4 70659 Toaster für 70653/70654,"8,89","5,06"
Amazon.de,crocs kinder,"99,85",B01HEOH67O,"crocs Unisex-Kinder Classic Kids Clogs, Pink (Candy Pink), 27-28 EU","14,42","3,36",B01HEPCVR8,"crocs Unisex-Kinder Crocbandclogk Clogs, Violett (Vibrant Violet), 25-26 EU","10,05","4,53",B002JIO90I,"Crocs Crocband 10998 Unisex - Kinder Clogs & Pantoletten, Blau (Navy), 32/33 EU","9,25","3,24"
Amazon.de,diesel herrenuhr,"99,85",B00KMGPH7I,Diesel Herren-Uhren DZ4318,"12,21","5,22",B00AEFCUDQ,Diesel DZ4282 Herren Uhr,"7,47","1,98",B00M9U8XZS,Diesel Herren-Uhren DZ7312,"7,31","5,65"
Amazon.de,durex,"99,85",B01MZWZG7C,"Durex  Intense Orgasmic Kondome 10er Packung, 1er Pack (1 x 10 Stück)","15,87",8,B00N9W34X6,"Durex Kondome Gefühlsecht, 1er Pack (1 x 16 Stück)","15,56","8,36",B01N0IO1IT,"Durex Intense Orgasmic Gel, Stimulationsgel für die Frau, 1er Pack (1 x 10 ml)","10,78","5,48"
Amazon.de,eiweißpulver,"99,85",B004U4WUFU,"ESN Designer Whey Protein Pro Series, Chocolate (1 x 1 kg)","27,93","6,64",B008BH7KKM,"MyProtein Impact Whey Protein, Vanilla, 1000g","13,44","5,09",B00H96PVE8,"Layenberger LowCarb.one 3K Protein-Shake Vanille-Sahne, 1er Pack (1 x 360 g)","9,51","7,24"
Amazon.de,fahrrad,"99,85",B06WW5NHV5,,"39,39","49,93",B06WWH98BX,,"12,2","11,59",B01N6TZ9CJ,"Gregster Mountainbike 26 Zoll für Damen und Herren in schwarz, Fahrrad mit Aluminium Rahmen Shimano Kettenschaltung und Scheibenbremsen","10,18",0
Amazon.de,freundebuch kindergarten,"99,85",B00VV58OLA,Meine Kindergarten-Freunde (Pirat),"4,82","4,02",3522458125,Mein Haufen Freunde – Kindergartenalbum,"4,29","2,82",B006G786MK,Meine Kindergarten-Freunde - Janosch,"4,15","3,76"
Amazon.de,fritzbox,"99,85",B00EO777DI,"AVM FRITZ!Box 7490 WLAN AC + N Router (VDSL/ADSL, 1.300 Mbit/s (5 GHz), 450 Mbit/s (2,4 GHz), DECT-Basis, Media Server) geeignet für Deutschland","23,8","6,75",B0117ZTDSG,"AVM FRITZ!Box 7430 (VDSL-/ADSL2+, WLAN N, 450 MBit/s (2,4 GHz), TK-Anlage für Voice over IP mit DECT-Basis, Mediaserver) geeignet für Deutschland","22,67","16,32",B01KKJFJ92,"AVM FRITZ!Box 7580 WLAN AC + N Router (VDSL-/ADSL-/ADSL2+-Modem, 4x4 MU-MIMO mit 1.733 (5 GHz) + 800 MBit/s (2,4 GHz), DECT-Basis, Media Server)","11,35","8,15"
Amazon.de,fön,"99,85",B00BCQIK4O,"Philips Ionen-Haartrockner HP8232/00, 2200 Watt, weiß","22,03","5,55",B00BCQIIMS,"Philips Haartrockner HP8230/00, 2100 Watt, schwarz","19,17","7,66",B005ZMO8LU,"AEG Haartrockner HTD 5584 Brown, braun (metallic) silber","7,43","7,31"
Amazon.de,hauswasserwerk,"99,85",B00FGRYMMO,"GARDENA 1753-20 Pumpe Classic Hauswasserwerk 3000/4 eco, mit Thermoschutzschalter, Rückschlagventil; Start/Stop Automatik, (650W Leistung, max. Fördermenge 2.800 l/h, max. Förderhöhe 40m)","14,75","7,14",B00TF6SH2I,"Einhell Hauswasserwerk GC-WW 6538 (650 W, 3800 l/h Fördermenge, max. Förderdruck 3,6 bar, Druckschalter, Manometer, 20 l Behälter)","9,66","11,91",B003CMS8Q6,T.I.P. 31140  Hauswasserwerk HWW 4500 Inox Edelstahl,"6,48","3,76"
Amazon.de,hundespielzeug,"99,85",B0054Q9TMA,"Trixie Dog Activity Flip Board Strategiespiel für Hunde, 23 cm","11,56","2,06",B000958670,"Trixie 3499 Spielset Sun'n'Fun für Hunde, 4 Teile","9,66","3,61",B0029EWVES,"Trixie 35912 Geier ""Gustav"", Plüsch, 28 cm","7,03","2,72"
Amazon.de,kärcher hochdruckreiniger,"99,85",B00HH9QAME,Kärcher K 2 Compact Home Hochdruckreiniger,"23,13","12,97",B0185UN29M,"Kärcher Hochdruckreiniger K 4 Full Control Home inkl. Pistole mit Druckanzeige,Vario Power Jet Strahlrohr und Dreckfräser, Reinigungsmittel-Ausbringung, Quick Connect Funktion und Flächenreiniger T 350 (max. 20-130 bar, 400 l/h)","15,52","7,25",B01N6JJNYU,"Kärcher Hochdruckreiniger K 5 Premium Full Control Plus inkl. Pistole mit Druckanzeige und Tasten zur Druckregulierung, 3-in-1 Multi Jet Strahlrohr: Dreckfräser, Flachstrahl und Reinigungsmitteldüse, Quick Connect Funktion und Schlauchtrommel (max. 20-145 bar, 500 l/h)","9,31","10,3"
Amazon.de,nike schuhe herren,"99,85",B00PYDTKLI,"Nike MD Runner 2, Herren Sneakers, Schwarz (Black/White-Anthracite 010), 44 EU (9 Herren UK)","6,98","2,5",B01M8NJUJA,"Nike Herren Arrowz Gymnastikschuhe, Grau (Black/White/Dk Grey), 41 EU","6,06","1,82",B0147SKCGM,"Nike Herren Free RN Laufschuhe, Schwarz (Black/White-Anthracite), 43 EU","3,73","1,09"
Amazon.de,rasierer,"99,85",B01B1NVCEC,"Philips OneBlade, Trimmen, Stylen, Rasieren / 4 Trimmeraufsätze, 1 Ersatzklinge QP2530/30","17,38","3,13",B000OS72Y0,Remington MB320C Bartschneider-Set,"7,71","3,16",B00YA119EQ,Philips AquaTouch Nass- und Trockenrasierer Präzisionstrimmer S5420/06,"7,59","5,26"
Amazon.de,reisebett,"99,85",B004AHLMEM,"Hauck 604489 Reisebett Dream n Play, 60x120 cm, water blue","26,44","16,13",B004AHLMF6,"Hauck 603673 - Reisebett Dream'n Play Plus 60x120cm, beige/grey","15,36","12,16",B004AHLMEW,"Hauck 603666 Reisebett Dream'n Play Plus 60x120cm, navy/aqua","9,7","7,84"
Amazon.de,schleich pferde,"99,85",B06VTBG9W8,Schleich 42369 - Pferdebox mit Arabern und Pferdepflegerin - Spielzeug,"6,99","0,67",B00HL2DG2Y,Schleich 42104 - Pferde Waschplatz,"4,54","2,76",B01C6WRIKY,Schleich 42346 - Pick up mit Pferdeanhänger,"3,67","1,45"
Amazon.de,sexspielzeug,"99,85",B00O2OZEL0,You2Toys Intimate Spreader tight,"26,89","4,9",B00HW8FXM8,Master Series Black Captain Taint Tesser Stimulating Cock Ring,"25,99","13,47",B001JS792O,Orion 777170 Lustwürfel Deutsch,"8,89","5,06"
Amazon.de,spongebozz,"99,85",B01MT1TUJ3,Started from the Bottom / KrabbenKoke Tape (Ltd. Schwammconnection Boxset),"68,95","99,78",B01MT4WIUX,,"23,9",0,B01N9IDG4A,Black Friday (Limited Deluxe Box),"1,85",0
Amazon.de,staubsauger roboter,"99,85",B01E28OJSE,"ECOVACS ROBOTICS DEEBOT SLIM - Ultra-flacher Staubsaugerroboter mit Direktabsaugung (optimiert für Tierhaare), 15 Watt, hellgrün","27,99","4,85",B01LYOF0KC,"Dirt Devil M612 Spider 2,0 Saugroboter, lange Laufzeit: 90 min, 3 Reinigungsprogramme, Extra flach 7 cm, geringes Gewicht 1,5 kg, weiß / schwarz / rot","18,38","22,12",B00EY7F8N4,"Dirt Devil M607 Saugroboter Spider (17 Watt, 0,27l Staubbehältervolumen, 3 Programme) schwarz","9,86","24,39"
Amazon.de,steckdosenleiste,"99,85",B002MQGGMQ,"Brennenstuhl Eco-Line, Steckdosenleiste 3-fach (mit Schalter und 1,5m Kabel - besonders stromsparend) Farbe: weiß","9,66","4,02",B000MQ7E38,"Brennenstuhl Eco-Line, Steckdosenleiste 8-fach, (mit Schalter und 3m Kabel - besonders stromsparend) Farbe: schwarz","8,41","6,49",B002OJYK5G,"Brennenstuhl Eco-Line, Steckdosenleiste 6-fach mit Überspannungsschutz (mit Schalter und 1,5m Kabel - besonders stromsparend) Farbe: anthrazit","7,65","3,44"
Amazon.de,tastatur,"99,85",B00E6KGKXG,"Logitech K280e Tastatur (Kabelgebunden, Business-Tastatur, QWERTZ, Deutsche Layout) schwarz","14,52","6,66",B00N3OCV7U,"Sharkoon Skiller Pro beleuchtete Gaming Tastatur (9 Multimedia-, 6 Makro- und 3 Profil-Tasten, Software, USB) schwarz","14,02","5,21",B001NP7LN0,"Microsoft Wired Keyboard 600 (Tastatur kabelgebunden, schwarz, deutsches QWERTZ Tastaturlayout)","13,05","15,4"
Amazon.de,waffeleisen,"99,85",B000094G32,"Cloer 1621 Waffelautomat für klassische Herzchen-Waffeln / 930 W / 16,5 cm Durchmesser / stufenlos wählbarer Bräunungsgrad / weiß","17,71","7,74",B01MQNCKYX,GOURMETmaxx 07841 Waffeleisen Belgische Waffeln | 2 Waffeln Gleichzeitig | Antihaftbeschichtung | Bräunungsgrad Verstellbar | 1000 Watt | Rot,"11,55","3,6",B0028R0314,"Severin WA 2103 Waffelautomat, Edelstahl-gebürstet-schwarz / Backampel","6,66","10,3"
Amazon.de,akku rasenmäher,"99,84",B01F2F5GT2,"Makita Akku-Rasenmäher, DLM431Z","17,33","12,8",B00B3RKEE6,"Bosch DIY Akku-Rasenmäher Rotak 32 LI High Power, Akku, Ladegerät, Grasfangbox 31 l (36 V, Ergoflex-System, Schnittbreite 32 cm, Schnitthöhe 30-60 mm)","17,14","8,15",B0032TJFOS,"Bosch DIY Rasenmäher Rotak 32, Grasfangbox 31 l (1200 W, Schnittbreite 32 cm, Schnitthöhe 20-60 mm)","12,84","3,69"
Amazon.de,amazonbasics,"99,84",B015X2NH8G,AmazonBasics Werkzeug-Set für elektronische Geräte,"2,56","1,75",B00V5IM0EU,"AmazonBasics Backmatte, Silikon, 2 Stück","2,15","0,64",B01IVV9AK0,"AmazonBasics - Bettwäsche-Set, Mikrofaser, 230 x 220 cm - Dunkelgrau","2,12","7,89"
Amazon.de,aquarium,"99,84",B01BVDGKJE,"Tetra Starter Line Aquarium-Komplettset (mit LED-Beleuchtung, stabiles 54 Liter Einsteigerbecken mit Technik, Futter und Pflegemitteln)","21,08","31,43",B016KOQSNC,Pacific Terrarium Aquarium f&uuml;r Reptilien und Amphibien,"10,29","4,01",B016KNGKAY,"Wave A2001566 Box Vision 60 Cosmos, 60 x 15 cm / 30 x 30 cm, 50 Liter, 2 x 20 Watt","10,27","4,01"
Amazon.de,bestway pool,"99,84",B014FHC8VC,"Bestway Fast Set Pool, 305 X 76cm","12,08","18,08",B001IWNDDA,"Intex Family Schwimmbecken, blau, 300 x 200 x 75 cm","11,31","0,82",B014FHBB4W,"Bestway Steel Pro Frame Pool Set mit Filterpumpe, 366 X 76cm","9,73","3,23"
