"Amazon.de","huawei p9",489,"B01DO2VU8Q","Huawei P9 Smartphone (13,2 cm (5,2 Zoll) Touch Display, 32GB interner Speicher, Android 6.0) titanium grau","59.17%","61.29%","B01DYN5N06","Huawei P9 lite Smartphone (13,2 cm (5,2 Zoll) Touch-Display, 16GB interner Speicher, 3GB RAM, Android 6) schwarz","11.33%","10.76%","B01DO2W080","Huawei P9 Smartphone (13,2 cm (5,2 Zoll) Touch Display, 32GB interner Speicher, Android 6.0) silber","9.24%","8.07%"
"Amazon.de","fischertechnik",490,"B00TWFTVRW","Fischertechnik 533872 - Baukaesten, Dynamic M","16.70%","16.75%","B00TWFTYKG","Fischertechnik 533874 - Baukaesten, Pneumatic Power","9.74%","8.84%","B00J8G9FGC","Fischertechnik 524327 - Dynamic XL","9.47%","10.69%"
"Amazon.de","samsung galaxy s7 edge",491,"B01BTZFSTC","Samsung Galaxy S7 EDGE Smartphone (5,5 Zoll (13,9 cm) Touch-Display, 32GB interner Speicher, Android OS) schwarz","45.47%","42.42%","B01BTZFVEO","Samsung Galaxy S7 EDGE Smartphone (5,5 Zoll (13,9 cm) Touch-Display, 32GB interner Speicher, Android OS) gold","13.63%","11.87%","B01E1QPH1U","Samsung Galaxy S7 EDGE Smartphone (5,5 Zoll (13,9 cm) Touch-Display, 32GB interner Speicher, Android OS) silber","8.17%","10.10%"
"Amazon.de","iphone 5",492,"B01KOJJXOU","Apple iPhone 5 Weiß 16GB Smartphone (Zertifiziert und Generalüberholt)","30.42%","26.02%","B01KOJK0MY","Apple iPhone 5 Schwarz 16GB Smartphone (Zertifiziert und Generalüberholt)","14.69%","11.22%","B01L9KWQWO","Apple iPhone 5S Space Grau 16GB SIM-Free Smartphone (Zertifiziert und Generalüberholt)","12.87%","20.92%"
"Amazon.de","wandkalender 2018",493,"B073W7Y3BX","Grupo Erik Editores Lily &amp; Val Familienplaner f&uuml;r 2017/2018 (evtl. nicht in deutscher Sprache)","17.66%","8.58%",3866793650,"Wandkalender 2018 89x63cm (größer A1) gefalzt, Wandplaner 15 Monate Nov 17 - Jan 19, FSC-Papier, inkl. A4-Kalender","15.58%","27.23%",3840789923,"Jahresplaner XL - 14 Monate 2018 - Wandkalender / Plakatkalender (99 x 69) - Jahresübersicht - Ferienübersicht - Arbeitstagezählung","10.64%","14.50%"
"Amazon.de","nintendo 3ds xl",494,"B00S84TIJY","New Nintendo 3DS XL metallic schwarz","25.58%","43.49%","B00S84TMZE","New Nintendo 3DS XL metallic blau(TN Variant)","15.78%","17.78%","B008DR5DFO","Nintendo 3DS XL - Konsole, blau/schwarz","14.38%","5.99%"
"Amazon.de","friteuse",495,"B00DNX58NK","DeLonghi F 28.311.W1 Rotofritteuse (1800 Watt, Easy Clean System) weiß","28.72%","31.24%","B00Y4SN790","Princess XL Heißluftfritteuse/ Aerofryer mit digitalem Display | ohne ÖL - einfach zu reinigen – 3,2 Liter Fassungsvermögen, 182020","20.65%","11.89%","B00XUJLZ84","Bomann FR 2264 CB Edelstahl-Fritteuse","10.87%","15.23%"
"Amazon.de","ps3",496,"B0099GQIWA","PlayStation 3 - Konsole mit DualShock 3 Wireless Controller","40.64%","18.60%","B003L771LA","PlayStation 3 - Konsole Slim 120 GB inkl. Dual Shock 3 Wireless Controller","13.98%","20.93%","B00GXU1CQC","PlayStation 3 - Konsole Super Slim 500 GB (inkl. DualShock 3 Wireless Controller + GTA V)","9.27%","6.98%"
"Amazon.de","regal",497,"B073JFXZ4D","INFINIKIT Haven Bücherregal, klein- Weiß","16.67%","11.43%","B007NZ5MGM","Kis Kunststoffregal Plus 60/4, 1 Stück, schwarz, 9503000 0022 01","15.39%","27.86%","B00YHQE6JY","AC Design Furniture 60597 Regal Mariela, 6 Fächer, 3 Stück Schubkasten, Holz, 58 x 39 x 18 cm, weiß","9.53%","3.57%"
"Amazon.de","sonos play1",498,"B00FSCNLME","Sonos PLAY:1 WLAN-Speaker für Musikstreaming (Weiß)","51.99%","63.35%","B00FSCNODU","Sonos PLAY:1 WLAN-Speaker für Musikstreaming (Schwarz)","24.09%","29.13%","B075XVVFHJ","Sonos One - Smart Speaker mit Alexa Sprachsteuerung (Weiß)","11.18%","3.62%"
"Amazon.de","lindt adventskalender",499,"B01GTU2CPA","Lindt & Sprüngli Weihnachts-Tradition Adventskalender, 1er Pack (1 x 250 g)","14.00%","13.42%","B01GTU24XU","Lindt & Sprüngli Weihnachts-Zauber Adventskalender, 1er Pack (1 x 265 g)","11.12%","12.63%","B01GTU1T6S","Lindt 1001 Weihnachtstraum Adventskalender, 1er Pack (1 x 281 g)","7.99%","8.87%"
"Amazon.de","siku",500,"B0014BLM6A","Siku 6286 - 5er Geschenkset 7 (sortiert)","11.22%","10.77%","B000OZVLPO","Siku 6283 - 5er Geschenkset 4 (sortiert)","7.77%","9.60%","B00I65EJ8U","Siku 5502 - Themenpackung Feuerwehr Fahrzeug","7.33%","2.42%"
"Amazon.de","cyber monday 2017",501,"B01DFKBG54","Amazon Echo Dot (2. Generation), Schwarz","15.64%","34.78%","B01J90P010","Das neue Fire 7-Tablet mit Alexa, 17,7 cm (7 Zoll) Display, 8 GB (Schwarz), mit Spezialangeboten","12.62%","21.74%","B00I03NJG6","Skechers Shuffles Sweet Steps Mädchen Sneakers","6.93%","0.00%"
"Amazon.de","4k monitor",502,"B00WUACE4S","Samsung U28E590D 71,12 cm (28 Zoll) Monitor (HDMI, 1ms Reaktionszeit, 60 Hz Aktualisierungsrate, 3840 x 2160 Pixel) Schwarz/Silber","37.14%","59.15%","B01AWG58VM","LG IT Products 29UM58-P.AEU 73,7 cm (29 Zoll) LED Monitor (2 x HDMI, 5ms Reaktionszeit)","19.53%","9.36%","B0163JLIWU","AOC U2879VF 71,1 cm (28 Zoll) Monitor (VGA, DVI, HDMI, DisplayPort, 3840 x 2160, 60 Hz, 1ms Reaktionszeit, 4k) schwarz","5.58%","10.21%"
"Amazon.de","nike damen",503,"B00WR6OAQ0","Nike Jungen Kapuzenpullover Team Club","20.84%","17.19%","B00QMFMT9W","Nike Damen Hose Jersey Cuffed","19.02%","21.35%","B01HS3E7WS","Nike Damen Club Logo Leggings Oberbekleidung","10.36%","11.46%"
"Amazon.de","samsung gear s3",504,"B01LF0T51I","Samsung SM-R760NDAADBT Gear S3 frontier Smartwatch (3,3 cm (1,3 Zoll) Display, NFC, Bluetooth, WLAN, Tizen OS, mit Silikon-Armband)","52.34%","59.62%","B01LF0T540","Samsung Gear S3 classic (3,3 cm (1,3 Zoll) Display, NFC, Bluetooth, WLAN, Tizen OS), mit Echtleder-Armband","28.11%","35.46%","B072HGYZ5V","Samsung SM-R760NDAAROM Smartwatch Gear S3 Frontier schwarz","5.84%","1.81%"
"Amazon.de","adventskalender beauty",505,"B0744NXMR3","Maybelline New York Adventskalender, 1er Pack","19.65%","12.39%","B074PXYMC7","Alessandro Adventskalender 2017, 1er Pack","11.87%","10.40%","B06Y5LZSMP","Boulevard de Beauté Adventskalender Shopping Queen, 1er Pack","9.42%","18.50%"
"Amazon.de","puppenbett",506,"B005CUALAC","roba Puppenwiege aus Puppenmöbel Serie „Fienchen“, Puppenbett zum Wiegen inkl, textiler Ausstattung, Bettwäsche und Himmel, Puppenzubehör, weiß lackiert","30.50%","25.48%","B0018CPCUW","roba Puppenetagenbett aus Puppenmöbel Serie „Happy Fee“, Puppenbett Holz natur, Puppenzubehör inkl, textiler Ausstattung mit abnehmbarer Blume","7.79%","7.95%","B004YAB71I","Bayer Design 51101 - Zubehör - Schrankbett Princess World","7.63%","7.28%"
"Amazon.de","navigationsgeräte für auto",507,"B00BEBPV30","TomTom Start 25 M Europe Traffic Navigationsgerät (Free Lifetime Maps, 13 cm (5 Zoll) Display, TMC, Fahrspurassistent, Parkassistent, IQ Routes, 48 Länder) schwarz","25.71%","31.61%","B01AXYGLVY","Garmin Drive 50 LMT CE Navigationsgerät - lebenslange Kartenupdates, Premium Verkehrsfunklizenz, 5 Zoll (12,7cm) Touchscreen","19.68%","18.32%","B01DUGY4R0","TomTom Start 52 Navigationsgerät (13 cm (5 Zoll) Display, Lifetime Maps, Fahrspurassistent, Karten von 48 Ländern Europas) schwarz","11.49%","11.53%"
"Amazon.de","smartphone ohne vertrag",508,"B01MU9R2EN","Huawei P8 Lite 2017 Smartphone (13.2 cm (5.2 Zoll) Full-HD Touchscreen, 16 GB, Android 7.0) black","11.13%","11.35%","B00ZUIEMM4","HUAWEI P10 lite Smartphone (13,2 cm (5,2 Zoll) Full-HD Display , 32 GB, Android 7.0 Nougat mit HUAWEI Emotion UI 5.1) Schwarz","10.31%","5.41%","B01M36FM03","Samsung Galaxy J7 (2016) Smartphone (13,95 cm (5,5 Zoll) HD Super AMOLED-Display, 16 GB, Android 6.0 Marshmallow) schwarz","7.30%","4.86%"
"Amazon.de","eiskönigin",509,"B00MGPUQR4","Philips Disney Frozen (Die Eiskönigin) LED Projektor Tischleuchte, hellblau, 717690816","8.51%","7.84%","B00UC3AO6A","Disney Frozen / Die Eiskönigin / Bastel-Set:  Bastel Deine Eiskristallarmbänder","8.19%","9.57%","B00VEMM8FI","Hasbro Play-Doh B1860EU4 - Die Eiskönigin – Annas Schlitten, Knete","6.11%","6.21%"
"Amazon.de","make up",510,"B007L0FUCK","Briconti Schminkkoffer Everybody's Darling, 1er Pack","25.23%","18.00%","B01N109AKC","Maybelline New York Make-up Koffer, 1er Pack (1 x 1 Stück)","18.21%","6.75%","B013P9MKMI","L'Oréal Paris Foundation Perfect Match, deckendes Make Up perfekte Verschmelzung mit dem Hautton & 24h Feuchtigkeit, 1er Pack","16.96%","29.86%"
"Amazon.de","tiptoi stift",511,"B00V8KFAHY","Ravensburger 00700 - Tiptoi Stift mit Player","65.33%","70.01%","B00V8K7ZYK","Ravensburger 00506 - Tiptoi Starter-Set mit Stift und Buch","6.63%","6.57%","B00V8K7YGY","Ravensburger 00505 - Tiptoi Starter-Set mit Stift und Spiel Schatzsuche in der Buchstabenburg","6.60%","6.70%"
"Amazon.de","nespresso",512,"B00G98EJHM","Krups Nespresso XN1001 Inissia Kaffeekapselmaschine inklusive Welcome Pack mit 16 Kapseln, weiß","20.77%","26.42%","B004JV77QQ","DeLonghi Nespresso EN 125.S Kapselmaschine (1260 Watt, 0,7 Liter, Pixie Electric) silber","20.43%","33.96%","B074ZFF31Y","DeLonghi EN 500.W Kaffeekapselmaschine mit unterschiedlichen Nespresso Kapseln, 1 L, 1400 W, 19 Bar, silky weiß","11.26%","3.77%"
"Amazon.de","raclette",513,"B000JUF98Y","Severin RG 2341 Raclette-Partygrill mit Naturgrillstein (1500 W, 8 Pfännchen) schwarz","22.44%","28.83%","B007HMT43I","Severin RG 2343 Raclette (Partygrill mit Naturgrillstein) schwarz","11.35%","15.01%","B015SRGK8U","Ultratec RG1200 Raclette (1200 Watt, Duo 4 Gelenkgrill, Raclette-Grill für bis zu 8 Personen)","7.35%","4.48%"
"Amazon.de","e zigarette",514,"B005GOVCCU","DIPSE Die E Zigarette / e Shisha Starterset - 2x eGo-T von mit 1100mAh Evod, CE4 und Ladestandsanzeige ohne Nikotin, 1er Pack (1 x 2 Stück)","50.24%","69.95%","B01ERPNUK0","Eleaf iStick Pico - Neu 75W TC Set Von Eleaf - Schwarz","23.79%","20.22%","B01AEG65JY","Eleaf iJust 2 Elektronische Zigarette ohne Tabak und Nikotin 5,5&nbsp;ml 2600&nbsp;mAh","8.22%","2.73%"
"Amazon.de","le creuset",515,"B00US0G54M","Le Creuset Gusseisen Bräter Signature rund 24 cm, kirschrot","20.06%","15.99%","B00VA5HOXU","Le Creuset Gusseisen Bräter Signature oval, 35 cm, kirschrot","9.19%","6.12%","B0000A14MS","Le Creuset Gusseisen Sauté-Pfanne mit Holzgriff 28 cm, kirschrot","5.14%","4.76%"
"Amazon.de","topfset",516,"B001RNNWMM","Silit Topf-Set 5-teilig Bratentopf Fleischtopf Stielkasserolle Toskana Schüttrand Glasdeckel Edelstahl rostfrei teilmattiert induktionsgeeignet spülmaschinengeeignet","15.29%","13.39%","B0015Z57KW","WMF Topf-Set 5-teilig Bratentopf Fleischtopf Stielkasserolle Provence Plus Schüttrand Glasdeckel Cromargan Edelstahl rostfrei poliert induktionsgeeignet spülmaschinengeeignet","14.90%","13.39%","B010RLCOW8","AmazonBasics Kochset, antihaftbeschichtet, 5-teilig","10.32%","13.49%"
"Amazon.de","taschenlampe",517,"B005FEGYCO","LE Zoombar Superhelle CREE LED Taschenlampe, inklusive 3 AAA Batterie, LED Handlampe, LED Camping Handlampe, Mit einstellbarem Fokus","50.92%","68.48%","B00F9ZH4O6","LED Lenser P7.2 Taschenlampe Box","13.04%","5.33%","B00002N6SG","Mag-Lite S2D016 2D-Cell Stab-Taschenlampe 25 cm schwarz für 2 Mono-Batterien","7.03%","3.48%"
"Amazon.de","beistelltisch",518,"B005ESACU6","IKEA Lack Beistelltisch Weiß, Holz, White, 45 x 55 x 55 cm","16.96%","26.77%","B01N5JSKAJ","Trendsliving M11024-GRA Beistelltisch, Holz, grau, 40 x 40 x 40 cm","11.42%","14.17%","B007N1ARLQ","FMD Möbel 632-001 Beistelltisch Mike (B/H/T) 59 x 38 x 36 cm Eiche","11.10%","10.24%"
"Amazon.de","dr martens",519,"B00XJJ2IP4","Dr. Martens 1460 Smooth, Unisex-Erwachsene Combat Boots,","60.25%","64.53%","B00YE0DY3M","Dr. Martens 2976 GAUCHO Unisex-Erwachsene Chelsea Boots","7.28%","6.54%","B00BJW8XDO","Dr. Martens 1461Z DMC SM-B Unisex-Erwachsene Derby Schnürhalbschuhe46 EU/11UK","6.98%","4.78%"
"Amazon.de","macbook pro",520,"B01M2BLJOM","Apple MacBook Pro 15 Touch Bar, 2,6 GHz, 256 GB SSD, 16 GB RAM, space grau","24.60%","28.77%","B071WNV41G","Apple MacBook Pro 13, i5 2,3 GHz, 8 GB RAM, 128 GB SSD, space grau","23.96%","24.66%","B008ATNHW6","Apple MacBook Pro MD101D/A 33,8 cm (13,3 Zoll) Notebook (Intel Core i5 3210M, 2,5GHz, 4GB RAM, 500GB HDD, Intel HD 4000, Mac OS)","10.30%","1.37%"
"Amazon.de","adventskalender lindt",521,"B01GTU2CPA","Lindt & Sprüngli Weihnachts-Tradition Adventskalender, 1er Pack (1 x 250 g)","13.80%","13.42%","B01GTU24XU","Lindt & Sprüngli Weihnachts-Zauber Adventskalender, 1er Pack (1 x 265 g)","12.05%","13.88%","B00E383IRC","Lindt & Sprüngli Goldstücke Adventskalender, 1er Pack (1 x 156 g)","8.30%","9.02%"
"Amazon.de","stranger things",522,"B076QMGGKF","Hasbro hasc45501020 Stranger Things Monopoly","20.53%","12.75%","B071KLHX6D","Funko Action Figur: Stranger Things 3pk-pack 1 Sammlerstück","14.81%","12.75%","B01M5IK8M9","Funko 13318 Actionfigur Stranger Things: Eleven mit Eggos","13.74%","14.77%"
"Amazon.de","luftbefeuchter",523,"B0047O0LKE","Medisana UHW Ultraschall-Luftbefeuchter, 4,2 Liter (bis 30m²)","33.05%","43.76%","B017DBB1S8","VicTsing Aroma Diffuser,300ml Luftbefeuchter Ultraschall Vernebler Raumbefeuchter Elektrisch Duftlampe Öle Diffusor mit 7 Farben LED,mehr als 30ml/h Feuchtigkeitsabgabe für Raum,Büro,Yoga,Spa,usw","27.50%","31.46%","B00FOIRFMO","Philips HU4803/01 Luftbefeuchter (bis zu 25m², hygienische NanoCloud-Technologie, leiser Nachtmodus, Automodus)","15.34%","8.02%"
"Amazon.de","höhle der löwen produkte",524,"B00A0N2OKG","Scunci Perfect Pony Haargummi","35.36%","23.73%","B0758FFPS3","Beovita 00063 Parodont Zahnfleischpflege Gel 3er Set | Pflegt das Zahnfleisch | Bei Zahnfleischproblemen (Parodontose und Zahnfleischentzündungen) | Dermatologisch getestet | Vegetarisch/Vegan","15.24%","31.21%","B074KGMHP2","Protect Pax 04286 Flüssige Displaybeschichtung","12.78%","14.56%"
"Amazon.de","gregs tagebuch",525,3833936568,"Gregs Tagebuch 12 - Und tschüss!: Band 12","38.80%","45.92%","384320005X","Gregs Tagebuch - Von Idioten umzingelt!","15.37%","9.66%","384320053X","Gregs Tagebuch 2 - Gibt's Probleme?","5.35%","6.90%"
"Amazon.de","call of duty",526,"B071N9SDXL","Call of Duty: WWII - Standard Edition - [PlayStation 4]","68.11%","79.88%","B01F28DVVO","Call of Duty: Infinite Warfare - Legacy Edition - [PlayStation 4]","6.51%","3.49%","B07111DCTN","Call of Duty: WWII - Standard Edition - [PC]","4.43%","3.24%"
"Amazon.de","samsung a5",527,"B01N6M3K34","Samsung Galaxy A5 (2017) Smartphone ( 13,22 cm(5,2 Zoll) Touch-Display, 32 GB Speicher, Android 6.0) schwarz","58.11%","60.76%","B01MU5VUXK","Samsung Galaxy A5 (2017) Smartphone (5,2 Zoll (13,22 cm) Touch-Display, 32 GB Speicher, Android 6.0) gold (European SIM card only)","13.67%","19.16%","B06W2H865T","Samsung Galaxy A5 (2017) Smartphone (5,2 Zoll (13,22 cm) Touch-Display, 32 GB Speicher, Android 6.0) peach-cloud (European SIM card only)","6.98%","6.69%"
"Amazon.de","bruder",528,"B003543KXM","Bruder 02750 - MAN TGA Abschlepp-LKW mit Geländewagen","11.73%","12.11%","B00009AWM4","Bruder 02771 - MAN Feuerwehr mit Drehleiter, Wasserpumpe und Light & Sound Modul","7.39%","5.79%","B004H4TPSI","Bruder 3055 - John Deere 7930 mit Frontlader und Tandemachs-Transportanhänger","6.45%","6.67%"
"Amazon.de","ordner",529,"B01MQQQKGU","DINOR™ Ordner-Wolkenmarmor Recycling 8 cm breit DIN A4 schwarz 10er Pack Made in Germany Ringordner Aktenordner Briefordner Büroordner Pappordner Schlitzordner Grüner Balken Blauer Engel","15.47%","25.54%","B01HR1SLO6","Leitz 11160089 Multifunktions-Ordner (A4, Abgerundeter Rücken 8,2 cm Breite, Gummibandverschluss, Kunststoff, Active Urban Chic) dunkelgrau","12.18%","11.35%","B004L12O6W","Exacompta 53084E Ordnern (PVC, 2 Ringe, Rücken 70 mm, DIN A4) 10er Pack Farben sortiert","10.59%","5.62%"
"Amazon.de","dash buttons",530,"B01I29J290","Ariel Dash Button","12.89%","12.67%","B06Y1MHHXT","Heineken Dash Button","10.69%","11.53%","B06Y1QMW63","Playboy Dash Button","8.51%","7.94%"
"Amazon.de","lego adventskalender 2017",531,"B06WGPS9V6","LEGO City 60155 - Adventskalender","39.29%","35.37%","B06WD3SGCC","LEGO Star Wars 75184 - Adventskalender","29.01%","39.88%","B06WVBM4L8","LEGO Friends 41326 - Adventskalender","8.65%","9.33%"
"Amazon.de","kipling",532,"B01DZGP71M","Kipling GABBIE BP K22621E32 Damen Schultertaschen, 18,5 x 35,5 x 30 cm, Violett (34Z Plum Purple)","5.13%","6.86%","B06Y3WFMWM","Kipling Garan, Damen Schultertasche, Grey (N Slate Grey), 35x25.5x17 cm (W x H L)","3.30%","4.20%","B01N1UDAG4","Kipling Emoli, Damen Shopper, Off-White (Rainy Day), 23.5x18x12 cm (W x H L)","2.98%","2.65%"
"Amazon.de","liebeskind",533,"B01N3AHPGU","Liebeskind Berlin Damen Slam7 Vintag Geldbörse, Schwarz (Black), 2x10x19 cm","6.56%","4.48%","B019GZ2XOK","Liebeskind Berlin Ada silver Damen Armband, Pink (rose 0410)","6.37%","14.43%","B06Y3JWHG4","Liebeskind Berlin Damen Alexandria Sporty Henkeltasche, Braun (Cognac), 12 x 30 x 38 cm","6.11%","3.48%"
"Amazon.de","iphone 8 plus",534,"B075LZ4VQW","Apple MQ8L2ZD/A iPhone 8 Plus 13,94 cm (5,5 Zoll), (64GB, 12MP Kamera, Auflösung 1920 x 1080 Pixel) Space Grau","55.15%","51.78%","B075M4QCKW","Apple MQ8M2ZD/A iPhone 8 Plus 13,94 cm (5,5 Zoll), (64GB, 12MP Kamera, Auflösung 1920 x 1080 Pixel) Silber","17.94%","19.86%","B075LW8Z5R","Apple MQ8N2ZD/A iPhone 8 Plus 13,94 cm (5,5 Zoll), (64GB, 12MP Kamera, Auflösung 1920 x 1080 Pixel) Gold","15.04%","13.01%"
"Amazon.de","lautsprecher bluetooth",535,"B01MSYQWNY","JBL FLIP 4 (Ein voll ausgestatteter, wasserdichter und mobiler Bluetooth-Lautsprecher mit überraschend kraftvollem Sound) schwarz","15.71%","14.71%","B06XPFYG3D","Bose ® SoundLink Revolve Bluetooth Lautsprecher schwarz","10.49%","5.35%","B00TFGWAA8","JBL Go Ultra Wireless Bluetooth Lautsprecher (3,5mm AUX-Eingang, geeignet für Apple iOS und Android Smartphones, Tablets und MP3 geräten) schwarz","9.83%","13.90%"
"Amazon.de","soy luna",536,"B01DXQCMJ4","Soy Luna&nbsp;&ndash;&nbsp;Rollschuhe zum Trainieren&nbsp;&ndash;&nbsp;Gr. 36/37","13.59%","7.39%","B0711XHRNT","Disney Soy Luna 2700-193 Federmäppchen triple, Federtasche, 3 Fächer, Filzstifte, Buntstifte, Zubehör Schule 43-teilig, Polyester, mehrfarbig","10.74%","6.03%","B01MRRA33M","Soy Luna 70490001 - Disney Halskette mit Anhänger","10.15%","9.10%"
"Amazon.de","s7",537,"B01BTZFM0W","Samsung Galaxy S7 Smartphone (5,1 Zoll (12,9 cm) Touch-Display, 32GB interner Speicher, Android OS) schwarz","55.68%","60.23%","B01BTZFQX0","Samsung Galaxy S7 Smartphone (5,1 Zoll (12,9 cm) Touch-Display, 32GB interner Speicher, Android OS) gold","15.07%","16.28%","B06XJ49G5B","Samsung Galaxy S8 Smartphone (5,8 Zoll (14,7 cm) Touch-Display, 64GB interner Speicher, Android OS) midnight black","6.33%","3.03%"
"Amazon.de","ghd glätteisen",538,"B00B7K0WU0","ghd V gold classic Styler, schwarz","44.98%","50.75%","B005U9Q1O0","ghd V gold max Styler, schwarz","13.96%","18.78%","B0012XANQK","ghd V Gold Gift Copper luxe Collection Gl&auml;tteisen und Stylingset","9.60%","5.60%"
"Amazon.de","aquarium",539,"B01BVDGKJE","Tetra Starter Line Aquarium-Komplettset mit LED-Beleuchtung stabiles 54 Liter Einsteigerbecken mit Technik, Futter und Pflegemitteln","44.13%","46.51%","B0042A36H8","Tetra AquaArt Evolution Line LED Aquarium-Komplett-Set 100 Liter anthrazit (moderne LED Beleuchtung, integrierte Tag-Nachtlichtschaltung, gebogene Frontscheibe)","9.48%","5.12%","B001MZYH5G","Juwel Aquarium 71030 Unterschrank Vision 180 SB, schwarz","7.05%","0.93%"
"Amazon.de","echo dot 2",540,"B01DFKBG54","Amazon Echo Dot (2. Generation), Schwarz","55.92%","59.34%","B01DFKC22A","Amazon Echo Dot (2. Generation), Weiß","20.00%","28.85%","B06ZXQV6P8","Das neue Amazon Echo (2. Generation), Anthrazit Stoff","13.92%","7.11%"
"Amazon.de","bosch akkuschrauber",541,"B015WGDX6E","Bosch Professional Akku-Bohrschrauber GSR 12V-15 (mit 2x 2,0 Ah Akku, Ladegerät, 39-tlg. Zubehör-Set, Profi-Tasche, max. Schrauben-Ø: 7 mm, 12 Volt)","23.12%","25.73%","B00TTZU566","Bosch Akkuschrauber IXO (5. Generation, 10 Bits, USB Ladegerät, Dose, 3,6 Volt, 1,5 Ah)","16.02%","28.88%","B010D09GYM","Bosch Akkuschrauber PSR 14,4 LI-2 (Akku, Ladegerät, Schrauber Bit, Koffer, 14,4 Volt, 2,5 Ah)","10.39%","10.68%"
"Amazon.de","gaming monitor",542,"B01DMDKZTC","Samsung LC24F396FHUXEN 59,8 cm (23,5 Zoll) Curved LCD Monitor (HDMI, 15pin D-Sub, 4 ms Reaktionszeit, 1920 x 1080) schwarz-glänzend","23.74%","21.51%","B014RKZ81O","Asus VS248HR 61 cm (24 Zoll) Monitor (VGA, DVI, HDMI, 1ms Reaktionszeit) schwarz","19.58%","27.69%","B014F9QHVC","Acer Predator Z35 89 cm (35 Zoll) Curved Monitor (HDMI, USB 3.0, 4ms Reaktionszeit, Auflösung 2560 x 1080, Nvidia G-Sync, EEK A) schwarz/rot","6.75%","0.81%"
"Amazon.de","kalender",543,3840780012,"Buchkalender Balacron schwarz 2018 - Bürokalender A5 / Cheftimer A5 - 1 Tag 1 Seite - 320 Seiten","10.89%","7.47%","B01MQY9394","Mattel Barbie FGD01 - Adventskalender","10.06%","11.33%",3862294811,"VintageArt 2018 | Kalender | Taschen-Kalender | Grafik Werkstatt | A6: Terminplaner","8.75%","6.13%"
"Amazon.de","s7 edge",544,"B01BTZFSTC","Samsung Galaxy S7 EDGE Smartphone (5,5 Zoll (13,9 cm) Touch-Display, 32GB interner Speicher, Android OS) schwarz","20.35%","43.84%","B01A5OU154","mumbi Hülle für Samsung Galaxy S7 Edge Schutzhülle","19.08%","0.68%","B01A5NM97I","mumbi Schutzhülle für Samsung Galaxy S7 Edge Hülle transparent weiss","14.94%","0.68%"
"Amazon.de","sofa",545,"B00JQ5XPIE","B-famous Houston-2-Pur Polsterecke, Schenkelmaß 226 x 160 cm, Materialmix Kunstleder-Struktur, weiß/grau","24.04%","23.73%","B0711Y9Q69","B-famous 100712 Wohnlandschaft Ecksofa, Stoff, anthrazit, 161 x 313 x 64 cm","14.82%","13.56%","B01N5JSHHT","Trendsliving P04017-GRA Sofa, Stoff, hellgrau, 78 x 169 x 73 cm","12.74%","15.25%"
"Amazon.de","anker",546,"B00WLI5E3M","Anker 24W 2-Port USB Ladegerät mit PowerIQ Technologie für iPhone, iPad, Samsung Galaxy, Nexus, HTC, Motorola, LG und weitere (Schwarz)","36.81%","52.29%","B00VJT3IUA","Anker PowerCore 20100mAh Externer Akku - kompakter als jemals zuvor - extrem hohe Kapazität 2-Port 4.8A Output Power Bank Ladegerät mit PowerIQ Technologie für iPhone, iPad, Samsung Galaxy und weitere (Schwarz/Matt)","21.45%","12.92%","B00VUGOSWY","Anker PowerPort 40W 5-Port USB Ladegerät Multi-Port USB Ladegerät für iPhone 6 / 6 Plus, iPad Air 2 / mini 3, Galaxy S6 / S6 Edge und weitere (Schwarz)","7.75%","7.17%"
"Amazon.de","spiderman homecoming",547,"B073WZG3SP","Spider-Man Homecoming [Blu-ray]","80.34%","82.40%","B073X1WJM8","Spider-Man Homecoming","6.07%","9.30%","B073X3TYWX","Spider-Man Homecoming Steelbook (PopArt) (exklusiv bei Amazon.de) [Blu-ray] [Limited Edition]","3.41%","2.71%"
"Amazon.de","pop socket",548,"B01DNRMTA0","PopSockets: Ausziehbarer Sockel und Griff für Smartphones und Tablets - Blush","25.54%","23.90%","B00UY1YTGG","PopSockets: Ausziehbarer Sockel und Griff für Smartphones und Tablets - Black","15.89%","17.14%","B01LYV2HE8","PopSockets: Ausziehbarer Sockel und Griff für Smartphones und Tablets - White Hear Black","9.01%","8.25%"
"Amazon.de","bluetooth drahtloser lautsprecher",549,"B01MSYQWNY","JBL FLIP 4 (Ein voll ausgestatteter, wasserdichter und mobiler Bluetooth-Lautsprecher mit überraschend kraftvollem Sound) schwarz","17.96%","14.88%","B01N4V4X5M","Anker SoundCore Boost 20W Bluetooth Lautsprecher mit BassUp Technologie. IPX5 Wasserfest, verwendbar als Zusatzakku, 20m Reichweite, Hervorragender Klang & Bass für iPhone, Handy und Tablet","10.80%","16.85%","B06XPFYG3D","Bose ® SoundLink Revolve Bluetooth Lautsprecher schwarz","9.87%","7.00%"
"Amazon.de","samsung a5 2017",550,"B01N6M3K34","Samsung Galaxy A5 (2017) Smartphone ( 13,22 cm(5,2 Zoll) Touch-Display, 32 GB Speicher, Android 6.0) schwarz","56.44%","60.70%","B01MU5VUXK","Samsung Galaxy A5 (2017) Smartphone (5,2 Zoll (13,22 cm) Touch-Display, 32 GB Speicher, Android 6.0) gold (European SIM card only)","15.58%","19.41%","B06W2H865T","Samsung Galaxy A5 (2017) Smartphone (5,2 Zoll (13,22 cm) Touch-Display, 32 GB Speicher, Android 6.0) peach-cloud (European SIM card only)","7.64%","6.63%"
"Amazon.de","wickeltasche",551,"B005M0ITOM","Babymoov Wickeltasche Baby Chic","23.07%","20.78%","B005M0ITP6","Babymoov Wickeltasche Baby Natural","11.73%","16.08%","B006G794E4","Lässig LNB601 Wickeltasche Green Label Neckline Bag, black mélange","9.42%","7.84%"
"Amazon.de","jbl flip 3",552,"B06XGTYJ4X","JBL Flip 3 Spritzwasserfester Tragbarer Bluetooth-Lautsprecher mit außerordentlich Kraftvollem Klang - Sonderausgabe - Schwarz","43.60%","58.99%","B01MSYQWNY","JBL FLIP 4 (Ein voll ausgestatteter, wasserdichter und mobiler Bluetooth-Lautsprecher mit überraschend kraftvollem Sound) schwarz","22.51%","18.78%","B01FQVHGSG","JBL Charge 3 Tragbarer Bluetooth-Lautsprecher (wasserdicht, mit 6000 mAh Power Bank und Freisprechfunktion) schwarz","6.97%","3.97%"
"Amazon.de","tiptoi starter",553,"B01N5K3EPL","Ravensburger 00800 - Tiptoi Starter-Set Wörter-Bilderbuch: Unser Zuhause","31.69%","30.39%","B00V8K81AM","Ravensburger 00507 - Tiptoi Starter-Set mit Stift und Buch","25.69%","27.54%","B00V8K83A0","Ravensburger 00508 - Tiptoi Starter-Set mit Stift und Buch Bilderlexikon Tiere","13.16%","15.30%"
"Amazon.de","barttrimmer",554,"B000OS72Y0","Remington MB320C Bartschneider-Set","26.82%","34.58%","B019EE1FQ0","Braun Bartschneider und Trimmer BT5090, silber, inkl. Präzisionstrimmer, Ladestation und Etui","16.31%","15.93%","B012W0SDFO","Philips Bart- und Haarschneider Series 5000, 17 Längeneinstellungen BT5200/16","12.37%","11.23%"
"Amazon.de","gucci",555,"B00DS3EKKM","GUCCI INTERLOCKING YA133206","30.28%","45.83%","B06XCPMW1W","Gucci Sonnenbrille GG0003S BLACK, 52","15.56%","12.50%","B0009OAIHW","Gucci Rush Eau de Toilette vapo, 50 ml","12.01%","12.50%"
"Amazon.de","samsung galaxy s5",556,"B00IKFB4OS","Samsung Galaxy S5 Smartphone (12,9 cm (5,1 Zoll) Touch-Display, 16 GB Speicher, Android 5) Schwarz","48.05%","37.67%","B00IKFCHGM","Samsung Galaxy S5 Smartphone (5,1 Zoll (12,9 cm) Touch-Display, 16 GB Speicher, Android 4.4) shimmery-white","21.40%","35.65%","B01M12T693","Samsung Galaxy S5 Weiß 16GB SIM-Free Smartphone (Zertifiziert und Generalüberholt)","6.11%","7.62%"
