"Amazon.de","wanduhr",279,"B008GBS0UC","TFA 60.3017 Wanduhr, weiß","21.80%","31.55%","B00FQOM18E","Hama Wanduhr ohne Ticken PG-220 (modern, geräuscharm, großes Ziffernblatt mit 22 cm, u.a. geeignet für Küche) schwarz","10.94%","12.11%","B001B3LGIA","TFA 98.1091 Funk-Wanduhr","9.20%","13.43%"
"Amazon.de","diesel herrenuhr",280,"B00AEFCUDQ","Diesel DZ4282 Herren Uhr","14.54%","18.75%","B00M9U8XDA","Diesel Herren-Uhren DZ7313","12.30%","11.68%","B00KMGPH7I","Diesel Herren-Uhren DZ4318","11.05%","8.83%"
"Amazon.de","spielzeug",281,"B018EALH22","Mattel DPX25 - Mister Pups Geschicklichkeitsspiele","6.25%","11.38%","B06WWGG85P","Ravensburger 27590 - GraviTrax: Starter-Set Konstruktionsspielzeug","4.06%","0.79%","B01J94S8KQ","Das neue Fire HD 8 Kids Edition-Tablet, 20,3 cm (8 Zoll) HD Display, 32 GB, blaue kindgerechte Hülle","2.99%","1.06%"
"Amazon.de","stiefel|stiefeletten",282,"B00U5MXZIM","Clarks Orinoco Club Damen Halbschaft Stiefel","13.27%","21.13%","B00XKZAQSI","Rieker 54953 Damen Stiefeletten","11.38%","12.68%","B00XKZAQZG","Rieker 55298 Damen Stiefeletten","11.11%","4.23%"
"Amazon.de","grafikkarte",283,"B01AY7927A","MSI GeForce GT 710 1024MB DDR3","17.96%","34.91%","B01MG15R5T","MSI NVIDIA GTX 1050 Gaming X 2G Grafikkarte (HDMI, DP, DL-DVI-D, 2 Slot Afterburner OC, VR Ready, 4K-optimiert)","17.49%","7.37%","B01GLJUAWQ","PNY TESLA M40 Module 24GB","10.89%","1.81%"
"Amazon.de","bügeleisen",284,"B004GUQ10I","Tefal FV4680 Dampfbügeleisen Ultragliss, 2.400 W, 120 g Dampfstoß, Durilium Bügelsohle, Türkisblau/Weiß","29.21%","30.37%","B01LZP3LHC","Philips Azur Performer Plus GC4527/00 Dampfbügeleisen (2600 Watt, 220g Dampfstoß, Abschaltautomatik, T-IonicGlide-Bügelsohle)","14.14%","12.97%","B00M89TPZC","Philips Azur Performer GC3811/70 Dampfbügeleisen (2,400 W, 160g Dampfstoß, SteamGlide Plus Bügelsohle) grün/weiß","10.47%","14.54%"
"Amazon.de","switch spiele",285,"B01MUBNPYP","Super Mario Odyssey [Nintendo Switch]","15.32%","29.59%","B06XCS2NXK","The Elder Scrolls: Skyrim [Nintendo Switch]","8.56%","6.86%","B071X9F4D8","Yoshi für Nintendo Switch (Arbeitstitel) - [Nintendo Switch]","7.05%","2.82%"
"Amazon.de","tip toi",286,"B00V8K81AM","Ravensburger 00507 - Tiptoi Starter-Set mit Stift und Buch","19.79%","14.94%",3473418080,"tiptoi® Merken und Konzentrieren (tiptoi® Mein Lern-Spiel-Abenteuer)","11.03%","9.14%","B00V8KFAHY","Ravensburger 00700 - Tiptoi Stift mit Player","9.08%","10.44%"
"Amazon.de","schreibtisch",287,"B01M6YXRW2","Phönix 806259WE Einhänge-Schreibtisch, Holz, weiß, 70 x 120 x 66 cm","31.27%","26.64%","B00AXWLBLC","FMD Möbel 353-001 Winkelkombination LEX Tisch circa 136 x 75 x 68 cm, montiert Regal circa 137 x 71 x 33 cm, weiß","14.94%","17.76%","B00AJKE91C","FMD Möbel 353-001 Winkelkombination LEX Tisch circa 136 x 75 x 68 cm, montiert Regal circa 137 x 71 x 33 cm, eiche","9.62%","13.16%"
"Amazon.de","mülleimer",288,"B00JL5DNF4","Rotho Mülleimer „Twist“ 25 Liter - 33.3 x 25.2 x 47.6 cm - Papierkorb aus Kunststoff (PP) in schwarz/dunkelsilber - Abfallbehälter mit Schwing- oder Klappdeckel","18.49%","25.37%","B0053TDDA2","Rotho Mülleimer „Paso“ 20 Liter│ geruchssicherer Abfalleimer - 29.3x26.6x45.7cm│ Papierkorb aus Kunststoff (PP) in Edelstahl-Optik │ Tretmechanismus zum Öffnen des Abfallbehälters","10.71%","13.21%","B000KJP9YI","helit Papierkorb/H6105895 Ø 310mm, H 320mm schwarz Inh.18l","9.25%","16.23%"
"Amazon.de","razer",289,"B01LQ4BMEQ","Razer Ornata Chroma Gaming Tastatur (mit den Mecha-Membran Tasten, Chroma RGB Beleuchtung und Ergonomischen Design mit Handballenauflage)","13.78%","30.23%","B01N1Z5GPV","Razer Blackwidow Chroma V2 Taktile & Klickende Mechanische Gaming Tastatur (Razer Green Switches, RGB Beleuchtet & voll programmbierbar mit 5 Macrotasten)","10.18%","11.18%","B01MECR863","Razer DeathAdder Elite - Chroma RGB Beleuchtete Gaming Maus (Modernster 16.000 DPI Sensor und Mechanische Maus-Schalter)","8.33%","12.42%"
"Amazon.de","ps 4",290,"B01M4J96DV","PlayStation 4 - Konsole (500GB, schwarz, slim) inkl. 2. DualShock Controller","24.22%","29.16%","B0756HMR7H","PlayStation 4 - Konsole (1TB, schwarz, slim) inkl. FIFA 18 + 2 DualShock Controller","13.92%","18.80%","B073QRG1YR","PlayStation 4 - Konsole (500GB, schwarz, E-Chassis)","10.75%","22.17%"
"Amazon.de","uggs damen boots",291,"B01E977IN6","UGG Damen Mini Bailey Button Kurzschaft Stiefel","35.82%","39.92%","B009K0XN7I","UGG W Classic Short( II) 5825 Damen Schlupfstiefel","16.48%","20.17%","B00HYA6RT2","Ugg Australia Bailey Bow Damen Schlupfstiefel","11.40%","11.34%"
"Amazon.de","homematic",292,"B00CFF3410","HomeMatic Funk-Heizkörperthermostat (IP20, 0 - 55°C, Frostschutz) Weiß, 105155","14.44%","19.79%","B00BZ6XLJ0","HomeMatic Zentrale CCU2","9.82%","7.27%","B007VTYVSA","HomeMatic Funk-Schaltaktor 1-fach für Markenschalter, Unterputzmontage","6.24%","7.87%"
"Amazon.de","geschenke",293,"B019O54T8U","KOSMOS 676018 - Schoko-Werkstatt","15.66%","7.41%","B003SEZMSA","Die selbstrührende Tasse - Lazy Mug","15.05%","17.90%",3848513765,"100 Dinge, die jedes Paar einmal tun sollte","13.11%","14.81%"
"Amazon.de","fitbit",294,"B06ZZNH4H5","Fitbit Unisex Fitness Armband Alta","34.90%","35.12%","B01LW2TH3Y","Fitbit FB403BK-EU Flex 2 Fitness Wristband, One Size, black","21.47%","36.16%","B074KBP5RV","Fitbit Ionic Health & Fitness Smartwatch, Charcoal, Onesize","19.63%","8.13%"
"Amazon.de","heißluftfritteuse",295,"B00Y4SN790","Princess XL Heißluftfritteuse/ Aerofryer mit digitalem Display | ohne ÖL - einfach zu reinigen – 3,2 Liter Fassungsvermögen, 182020","44.76%","55.22%","B00BS97UUA","Philips HD9240/90 Airfryer XL (2100 W, Heißluftfritteuse, ohne Öl, für 3-4 Personen) schwarz","15.72%","8.96%","B006TF4OP2","Tefal ActiFry YV960130 2in1 Heißluft-Fritteuse (1,5 kg Fassungsvermögen, 1.400 Watt, inkl. Rezeptbuch)","6.85%","3.14%"
"Amazon.de","playmobil 123",296,"B0168YK9JS","PLAYMOBIL 6962 - Mein Mitnehm Bauernhof","13.81%","12.29%","B00361FUG4","PLAYMOBIL 6765 - Meine Mitnehm-Arche Noah","13.50%","16.73%","B01BPF7KO2","PLAYMOBIL 6880 - Sternchenbahn mit Schienenkreis","9.49%","9.22%"
"Amazon.de","gaming stuhl",297,"B0056YNWVO","Robas Lund DX Racer 1 Gamingstuhl, Schreibtischstuhl, Bürostuhl, 78 x 124-134 x 52 cm, schwarz/rot","53.69%","56.04%","B019IZKTUS","MC Racing 5 62495SR3, Gaming Stuhl, Sportsitz, Bürostuhl, Schreibtischstuhl, inklusiv Kissen, 69 x 125-135 x 58 cm, schwarz/rot","14.37%","20.27%","B009S68I6A","Robas Lund DX Racer 6 Gamingstuhl, Schreibtischstuhl, Bürostuhl, 78 x 52 x 124-134 cm, schwarz/weiß","5.64%","5.92%"
"Amazon.de","koffer",298,"B01N7IQRZR","HAUPTSTADTKOFFER Alex - NEU 4 Doppel-Rollen Hartschalen-Koffer Trolley Rollkoffer Reisekoffer, 65 cm, 74 L, Aubergine","6.85%","4.57%","B0010HI5XQ","Travelite Koffer ORLANDO, 53 cm, 37 Liter, Schwarz, 98487","5.36%","4.86%","B01LXFCAZR","Samsonite - Base Boost Spinner 78 cm Exp, Black","4.30%","5.14%"
"Amazon.de","maus",299,"B010CTD5UU","VicTsing Mini Schnurlos Maus Wireless Mouse 2.4G 2400 DPI 6 Tasten Optische Mäuse mit USB Nano Empfänger Für PC Laptop iMac Macbook Microsoft Pro, Office Home","20.89%","26.32%","B00AZKNPZC","Logitech B100 Optical Business Mouse, schwarz","18.27%","28.95%","B01MY340P3","HoLife Gaming Maus, [Neue Version] Gamer Maus 7200DPI PC Gaming Maus Hohe Präzision für Pro Gamer mit 7 programmierbaren Tasten/ LED/ ergonomisches Design/ USB-Wired Maus optisch (Schwarz)","7.85%","6.31%"
"Amazon.de","adventskalender für männer",300,"B0747WXNPT","Niederegger Adventskalender Männersache, 1er Pack (1 x 300 g)","42.32%","33.12%","B071JRK6SC","Intersnack Adventskalender 2017, 1er Pack (1 x 790 g)","8.96%","9.16%","B016W77PZM","Bier Adventskalender Welt und Deutschland mit Miller + Kilkenny + Captain Morgan + mehr ... 24 Flaschen Bier Geschenk mit Bieren aus aller WELT & DEUTSCHLAND. Bieradventskalender 2017","6.06%","6.50%"
"Amazon.de","nespresso maschinen",301,"B004JV77QQ","DeLonghi Nespresso EN 125.S Kapselmaschine (1260 Watt, 0,7 Liter, Pixie Electric) silber","19.24%","31.32%","B00G98EJHM","Krups Nespresso XN1001 Inissia Kaffeekapselmaschine inklusive Welcome Pack mit 16 Kapseln, weiß","17.22%","24.98%","B00T4GWD7E","DeLonghi Nespresso EN 550.B Lattissima Touch Kapselmaschine (1400 Watt, inklusiv Welcome Pack mit 16 Kapseln) schwarz","12.53%","8.31%"
"Amazon.de","rucksack",302,"B00S87IF1I","Dakine Rucksack Campus Unisex - Erwachsene CAMPUS 33L,Carbon ,33 Liter","18.82%","17.47%","B01NCME808","Jack Wolfskin Unisex Perfect Day Rucksack","12.79%","17.90%","B000CRBEJ2","EASTPAK Padded Pak'R Rucksack Schwarz","8.61%","9.61%"
"Amazon.de","wlan verstärker",303,"B009CXPY0W","AVM FRITZ!WLAN Repeater 310 (300 Mbit/s, WPS), weiß, deutschsprachige Version","45.32%","52.63%","B00A0VCJPI","TP-Link TL-WA850RE WLAN Repeater (300 Mbit/s, App Steuerung, 1 Port, WPS, LED abschaltbar, kompatibel mit allen WLAN Geräten)","19.84%","21.21%","B00NHLEP8M","Netgear EX2700-100PES N300 WLAN Repeater (300 Mbit/s, 2,4 GHz, 1x Fast-Ethernet Port, WPA und universell kompatibel mit jedem Router/Modem) weiß/grau","9.12%","8.33%"
"Amazon.de","homematic ip",304,"B00ZQG6OTO","Homematic IP Heizkörperthermostat, 140280","15.70%","23.71%","B015R46RQO","Homematic IP Starter Set Raumklima 142546A0","10.63%","9.62%","B00ZQG6MGO","Homematic IP Access Point, 140887A0","9.46%","8.63%"
"Amazon.de","babyphone",305,"B00IBSYNLK","Philips Avent SCD501/00 DECT Babyphone (Smart Eco Mode, Nachtlicht)","31.80%","41.95%","B00E6QIV50","Philips Avent SCD560/00 DECT Babyphone (Smart Eco Mode, Temperatursensor )","17.82%","15.95%","B01BNDNEIC","Philips Avent SCD620/26 Video-Babyphone, 2,7 Zoll Display","11.57%","4.77%"
"Amazon.de","winterschuhe männer",306,"B00Y10WH0G","Mustang Herren Kurzschaft Stiefel","26.29%","37.93%","B00RBAHBWC","Nike Hoodland Suede Herren Desert Boots","17.85%","13.53%","B00KHMMHHU","Timberland Euro Hiker FTC Herren Wanderstiefel","16.70%","9.42%"
"Amazon.de","dyson staubsauger",307,"B01E02Q656","Dyson DC62 beutel- und kabelloser Staubsauger (350 W, Handstaubsauger mit Lithium-Ionen Akku, Wandhalterung und Ladestation) iron/rot","28.71%","20.32%","B00M8YTI3G","Dyson DC33c Origin beutelloser Bodenstaubsauger (750 W, Kombi- und Polsterdüse) gelb","13.83%","21.04%","B073ZL5VDK","Dyson V8 Absolute beutel- und kabelloser Staubsauger (inkl. drei Elektrobürsten)","10.30%","5.76%"
"Amazon.de","milchaufschäumer",308,"B0043W42ZU","Xavax Milchaufschäumer Milchicopter (extra starker Motor mit 14.000 U/min, Spezialspirale, leichte Reinigung, Milk Frother, u.a. geeignet als E-Liquid-Mischer) Matcha-Besen schwarz","21.01%","38.61%","B0043WC0W2","Severin SM 9684 Milchaufschäumer (500 W, Induktion, 500 ml, kaltes und warmes Aufschäumen) edelstahl/weiß","15.01%","10.81%","B00BCQI5PI","Philips Senseo Milk Twister CA6500/60 Milchaufschäumer (500 W, Antihaftbeschichtung, Bedienung auf Tastendruck) schwarz","11.13%","7.82%"
"Amazon.de","samsung s7",309,"B01BTZFM0W","Samsung Galaxy S7 Smartphone (5,1 Zoll (12,9 cm) Touch-Display, 32GB interner Speicher, Android OS) schwarz","53.67%","54.67%","B01BTZFQX0","Samsung Galaxy S7 Smartphone (5,1 Zoll (12,9 cm) Touch-Display, 32GB interner Speicher, Android OS) gold","18.01%","19.46%","B01E1QP8NM","Samsung Galaxy S7 Smartphone (5,1 Zoll (12,9 cm) Touch-Display, 32GB interner Speicher, Android OS) silber","6.03%","8.48%"
"Amazon.de","baby erstausstattung",310,"B00IEV9ZFI","Philips Avent SCH400/00 Babypflege-Set inkl. aller Pflegeartikel, gelb","23.60%","25.06%","B01B1JNOW4","NUK 10256412 Welcome Set, perfekte Erstausstattung für Neugeborene, sieben NUK Produkte in einer schönen Tasche, Weiß/Grau/Mint Neutral","18.63%","16.63%","B01GUYA6DK","Pampers Sensitive Feuchttücher, 1008 Tücher, 18er Pack (18 x 56 Stück)","12.83%","16.63%"
"Amazon.de","liebeskind tasche damen",311,"B01N4TGYQ8","Liebeskind Berlin Damen Maike7 Vintag Umhängetasche, Schwarz (Black), 10 x 16 x 23 cm","12.24%","13.82%","B01N9X64YG","Liebeskind Berlin Damen Gina7 Vintag Henkeltasche, Braun (Cognac), 12 x 27.5 x 33 cm","7.85%","8.82%","B01BHQ3XAO","Liebeskind Berlin Damen Pazia6 Vintag Schultertaschen, Schwarz (Black 0001), 41 x 38 x 9 cm","5.25%","4.41%"
"Amazon.de","rasierer herren",312,"B01B1NVCEC","Philips OneBlade, Trimmen, Stylen, Rasieren / 4 Trimmeraufsätze, 1 Ersatzklinge QP2530/30","16.61%","16.49%","B005F2OSSS","Philips PowerTouch Rasierer PT860/16 (mit Präzisionstrimmer)","14.25%","16.00%","B01N651A07","Braun Multigrooming-Set MGK3080, Bartschneider, Trimmer, Bodygroomer, mit Gillette Flexball, schwarz/blau","9.52%","10.26%"
"Amazon.de","dildo",313,"B015IRVWBU","Tracy's Dog Vibratoren für Sie Silikonvibrator - Sexspielzeug für Frauen Zur Stimulation von Klitoris Und G-Punkt - Erotik Spielzeug, Dildo, Rabbit Vibrator Mit 30 Vibrationsstufen – Wasserfest","43.07%","50.72%","B01E9VVUF4","Tracy's Dog Dong, Realistischer Dildo, Jelly Sex Toy mit Saugnapf - N/A","12.54%","14.86%","B000FUI48U","Orion 523119 Penis-Nachbildung European Lover, 23 cm lang, Ø 4 cm-4,5 cm","8.53%","6.70%"
"Amazon.de","oral b aufsteckbürsten",314,"B01JAA8XQ8","Oral-B Precision Clean Aufsteckbürsten, 10 Stück","31.42%","32.66%","B00L5M26DQ","Oral-B CrossAction Aufsteckbürsten für elektrische Zahnbürsten, 10 Stück","16.15%","16.93%","B004CRSKHM","Oral-B Tiefenreinigung Aufsteckbürsten, 4 Stück","15.04%","16.31%"
"Amazon.de","wii",315,"B005OK7NWO","Nintendo Wii Family Edition - Konsole inkl. Wii Sports + Wii Party, weiß","32.37%","13.25%","B000UVI1G4","Nintendo Wii - Konsole weiß inkl. Wii Sports","27.34%","22.89%","B004ZL4LHS","Nintendo Wii Mario Kart Pack - Konsole inkl. Mario Kart, Wii Wheel, Remote Plus Controller, weiß","7.48%","3.61%"
"Amazon.de","mixer",316,"B000IYGH28","Bosch MFQ3530 Handrührer (450 W, 5 Geschwindigkeitsstufen) weiß/grau","16.14%","27.98%","B00UTJQ1RI","Philips HR2195/08 Standmixer (900W, mit 21.000 U/min, für Smoothies und Milchshakes) schwarz/silber","15.69%","10.42%","B00I5ABIFI","WMF KULT Mix & Go Smoothie Mini Standmixer, Smoothie Maker, 300 Watt, Tritan Flasche, Edelstahl Mixer","13.23%","12.62%"
"Amazon.de","sexspielzeug",317,"B074CT2GVV","Enlove Vibrator Massager Sexspielzeug für Frauen, Männer & Paare Prelude Stimulation Schwarz, 60 g","25.32%","23.66%","B01M61MLPL","Hot Dreams Hot Bondage Sexspielzeug für Paare (Bondage-Manschetten für Anfänger oder Pro), 721 g","23.71%","18.31%","B001JS792O","Orion 777170 Lustwürfel Deutsch","20.53%","22.85%"
"Amazon.de","my little pony",318,"B06WLNL3WT","Hasbro C0677EU4 - My Little Pony Movie Schwimmendes Seepony Pinkie Pie Spielset","12.23%","15.31%","B01C56AGDW","Hasbro My Little Pony B5255EU4 - Kristallkönigreich, Spielset","11.55%","8.79%","B00EIFS8V6","TY 41004 - My Little Pony Baby - Schmusetier Twilight Sparkle, 15 cm","6.98%","8.22%"
"Amazon.de","pc gehäuse",319,"B015J8R1FY","Sharkoon VG5-W PC-Gehäuse (Schnellverschlüsse, 3x 120-mm-LED-Lüfter vorinstalliert, USB 3.0) blau","18.40%","27.33%","B0747VXC9F","Sharkoon TG5 PC-Gehäuse (mit Seitenfenster und Frontblende aus gehärtetem Glas, 2x USB 3.0, 2x USB 2.0, 4x 120 mm LED-Lüfter) blau","12.82%","6.99%","B071GDSBMN","Cooler Master MasterBox Lite 3.1 PC-Gehäuse 'micro-ATX, Mini-ITX, USB 3.0, Seitenfenster' MCW-L3B3-KANN-01","9.07%","5.30%"
"Amazon.de","tastatur",320,"B00F35N0VI","CHERRY KC1000 corded Keyboard USB ultraflat black","25.57%","34.63%","B00E6KGKXG","Logitech K280e Tastatur (Kabelgebunden, Business-Tastatur, QWERTZ, Deutsche Layout) schwarz","14.56%","17.89%","B00N3OCV7U","Sharkoon Skiller Pro beleuchtete Gaming Tastatur (9 Multimedia-, 6 Makro- und 3 Profil-Tasten, Software, USB) schwarz","11.02%","7.45%"
"Amazon.de","kratzbaum",321,"B00KJXFXXC","dibea KB00503 Kratzbaum - extra breit - Katzen Kletterbaum (Höhe 141 cm), grau","20.15%","20.43%","B00GXF23MO","dibea KB00204 Kratzbaum für Katzen, 112 cm Höhe, braun/beige","16.96%","23.40%","B011YTDPYI","Croci C6020453 Kratzbaum Natural Magnolia, 45 x 45 x 99 cm","8.22%","3.73%"
"Amazon.de","schminktisch",322,"B01AXWU2H0","Songmics aushöhlen Schminktisch mit spiegel u. hocker, 4 schubladen inkl. 2 Stück Unterteiler, Kippsicherung, weiß RDT04W","39.50%","48.25%","B0194C9Z0U","Songmics weiß luxuriös Kippsicherung Schminktisch mit 3 spiegel und hocker, 7 schubladen inkl. 2 Stück Unterteiler, Kippsicherung, 145 x 90 x 40 cm RDT91W","18.42%","23.25%","B00S3JPV5Y","FMD Möbel 362-001 - Console Checker, 100 x 80 x 40 cm, bianco","17.49%","6.58%"
"Amazon.de","adventskalender tee",323,"B00ZA7X7KI","Sonnentor Tee-Adventkalender Edition 2015-2017 bio, Aufgussbeutel 24 Stck, 1er Pack (1 x 38 g)","23.86%","27.48%","B06XDTQB66","Teekanne Österreich Adventkalender, 1er Pack (1 x 375 ml)","14.29%","15.14%","B00OKDAS6E","English Tea Shop - Tee Adventskalender Pink Christmas, 24 einzelne Boxen mit würzigen BIO-Tees in hochwertigen Pyramiden-Teebeutel","12.78%","10.17%"
"Amazon.de","fernseher 40 zoll",324,"B0176AR5FY","Grundig LED-Backlight Fernseher (Full HD, Triple Tuner)","33.49%","25.07%","B06XGQ2T49","Samsung MU6179 101 cm (40 Zoll) Fernseher (Ultra HD, HDR, Triple Tuner, Smart TV)","15.99%","15.04%","B0752YKK3T","JVC LT-39VF52J 99 cm (39 Zoll) Fernseher (Full HD, Smart TV, Triple Tuner, WLAN, Bluetooth)","9.56%","16.99%"
"Amazon.de","honor 9",325,"B0721QMFJC","Honor 9 Smartphone (13,08 cm (5,15 Zoll) Full HD Display, 64 GB Speicher, Android 7.0) Grau","62.03%","57.10%","B072KR2Z4J","Honor 9 Smartphone (13,08 cm (5,15 Zoll) Full HD Display, 64 GB Speicher, Android 7.0) schwarz","17.04%","22.77%","B071KCGJR8","Honor 9 Smartphone (13,08 cm (5,15 Zoll) Full HD Display, 64 GB Speicher, Android 7.0) blau","12.25%","17.36%"
"Amazon.de","trockner",326,"B00JGWVGN8","Siemens iQ700 WT46W261 iSensoric Wärmepumpentrockner / A++ / 8 kg / Weiß / Selbstreinigender Kondensator / softDry-Trommelsystem / Super40","22.90%","25.45%","B004EPYJYU","Beko DCU 7330 Kondenstrockner / B / 7 kg / Weiß / Multifunktionsdisplay / Knitterschutz / Trommelbeleuchtung / Reversierende Trommelbewegungen / FlexySense / 16 Programme","17.06%","17.43%","B00DCD6RTK","Samsung DV80F5E5HGWEG Wärmepumpentrockner / A++ / 8 kg / weiß / Vollgrafisches LED Display / Diamond Pflegetrommel","9.20%","5.21%"
"Amazon.de","keyboard",327,"B01KTHMK4W","Yamaha PSR-F51 Keyboard","23.66%","21.30%","B0107NMLGA","RockJam RJ661-SK Super Kit 61 Tasten LCD Elektronisches Unterrichts-Keyboard mit Ständer, Hocker und Kopfhörer","17.53%","24.83%","B018AVHOJ0","RockJam RJ654  tragbares 54-Tasten Digital Keyboard mit Notenständer und Interaktivem LCD-Bildschirm","8.47%","5.43%"
"Amazon.de","hundebett",328,"B00P7HJN4A","Hound Hundebett Comfort, Medium","23.42%","25.99%","B014R0080K","dibea DB00110 Hundebett - Hundekissen, Hundesofa abwischbar mit Wendekissen, 65 x 50 x 20 cm, braun/beige","17.95%","22.56%","B01N05OZZF","dibea DB00521 - Hundebett - Hundekissen - Hundesofa mit Wendekissen (Größe und Farbe wählbar)","10.83%","14.12%"
"Amazon.de","brio",329,"B003AVMUSQ","BRIO World 33280 - Frachtverladestation","6.32%","6.98%","B01N6SMZ6A","BRIO World 33867 - U-Bahn mit Licht und Sound","5.94%","3.76%","B009CJ9E6G","BRIO World 33772 Grosses Schienensortiment XXL - Sonderset (50 Teile)","5.73%","7.96%"
"Amazon.de","makita akkuschrauber",330,"B015PMXG9Y","Makita Akku-Bohrschrauber (10,8 V, 4,0 Ah, inkl. 2 Akkus und Ladegerät), DF331DSMJ","22.15%","29.83%","B00N4VTTR2","Makita Akku-Schlagbohrschrauber 18 V / 1,5 Ah inklusive Akku-Lampe, DHP453RYLJ","13.20%","13.48%","B019Z00N7U","Makita HP457DWE10 Akku- Schlagbohrschrauber-Set inkl. 74tlg. Zubehör","11.62%","11.13%"
"Amazon.de","senseo",331,"B0748KR3S1","Philips Volks-Senseo HD6554/69 Kaffeepadmaschine (Sonderedition 100 Pad Promotion und 2 Gläser gratis) schwarz","28.52%","40.68%","B00U7HJ2PK","Senseo Original HD7817/69 Kaffeepadmaschine (1450 W, 1-2 Tassen gleichzeitig) schwarz","14.24%","16.14%","B01IBZ7LNE","Senseo HD7892/60 Switch 2-in-1 Kaffeemaschine für Filter, Schwarz","9.92%","5.94%"
"Amazon.de","tee adventskalender",332,"B00ZA7X7KI","Sonnentor Tee-Adventkalender Edition 2015-2017 bio, Aufgussbeutel 24 Stck, 1er Pack (1 x 38 g)","32.29%","36.70%","B06XDTQB66","Teekanne Österreich Adventkalender, 1er Pack (1 x 375 ml)","14.44%","15.59%","B00OKDAS6E","English Tea Shop - Tee Adventskalender Pink Christmas, 24 einzelne Boxen mit würzigen BIO-Tees in hochwertigen Pyramiden-Teebeutel","11.52%","8.68%"
"Amazon.de","yankee candle 623g",333,"B0155OG8LK","Yankee Candle 115504 Duftkerze im Glas - Christmas Cookie 623g 10.1x9.8x17.7 cm, Weiß","13.26%","12.60%","B0037EEK7A","Yankee Candle 1093707E Vanilla Cupcake Grosses Jar","9.60%","12.14%","B01CHGKCXE","Yankee Candle Housewarmer RIVIERA ESCAPE 623 g","7.73%","7.84%"
"Amazon.de","carrera bahn",334,"B06XKS5K3V","Carrera 20062423 - Go!!! DTM Touring Contest","25.12%","23.30%","B06XKY7727","Carrera 20062418 Go!!! Disney/Pixar Cars 3 Finish First!","10.69%","15.53%","B01CML4NBQ","Carrera 20062393 - GO!!! Push 'n pass","7.56%","8.87%"
"Amazon.de","adventskalender lego",335,"B06WGPS9V6","LEGO City 60155 - Adventskalender","31.47%","30.75%","B06WD3SGCC","LEGO Star Wars 75184 - Adventskalender","21.65%","28.45%","B06WGPSBPB","LEGO Ninjago 70607 - Verfolgungsjagd in Ninjago City","12.51%","10.60%"
"Amazon.de","luftentfeuchter",336,"B000KJP0VA","UHU 47130 - airmax Luftentfeuchter Original mit 450 g Beutel für Räume bis 45 m³","35.04%","45.92%","B01A6SV4ZA","Comfee MDDF-16DEN3 Luftentfeuchter, Bautrockner, 16L in 24h, Raumgröße ca. 80m³","19.80%","12.13%","B0002HP1KU","Wenko 5410010100 Feuchtigkeitskiller 1 kg - Raumentfeuchter, 24 x 16 x 15 cm, weiß","12.31%","13.72%"
"Amazon.de","plus produkte",337,"B0007VHBKO","Vileda Glitzi Plus mit Antibac - Gründlich, hygienisch & saugstark, 3 Stück","13.40%","16.49%","B004J8JZZA","Ravensburger 20432 - Schwarzer Peter Schaf Kinderkarten","10.85%","7.18%","B01D98NI0I","Pipedream Extreme 802138 - Masturbator","10.19%","2.42%"
"Amazon.de","ps4 headset",338,"B00I8S4E1C","PlayStation 4 Wireless Stereo Headset 2.0, schwarz","52.28%","50.08%","B00CJ5FPUE","Logitech G430 Gaming Kopfhörer (Dolby 7.1 Surround Sound für PC ) blau","7.81%","8.30%","B0101RPMY0","PlayStation 4 Wireless Stereo Headset 2.0, weiß","6.05%","6.49%"
"Amazon.de","familienplaner 2018",339,3866793537,"FamilienPlaner 2018 23x42cm, 5 Spalten, Wandkalender 12 Monate Jan-Dez 2018 - Wandplaner, Familienkalender, Ferientermine, viele Zusatzinfos","13.54%","15.54%",3731825708,"Familienplaner Farbenspiel 2018: Familienkalender, 4 breite Spalten, bunt mit Ferienterminen, Vorschau bis März 2019 und nützlichen Zusatzinformationen.","12.06%","16.39%",3862294978,"Einer für alle! 2018: Familienkalender","9.30%","8.56%"
"Amazon.de","gaming headset",340,"B00CJ5FPUE","Logitech G430 Gaming Kopfhörer (Dolby 7.1 Surround Sound für PC ) blau","27.65%","33.87%","B00SAYCXWG","HyperX Cloud II Gaming Kopfhörer (für PC/PS4/Mac) rot","15.94%","25.93%","B01MYW8COY","Logitech G533 Gaming Headset (kabelloser DTS 7.1 Surround Sound) schwarz","7.91%","5.51%"
"Amazon.de","apple tv",341,"B008ATNJ9C","Apple MC414Z/A AirPort Express Basisstation (802.11a/b/g/n)","48.96%","18.56%","B017K17PQ8","Innovelis 2449 TotalMount Halterung für Apple TV 4 / TV 4K schwarz","16.31%","16.67%","B01ETRIS3K","Fire TV Stick mit Alexa-Sprachfernbedienung","8.67%","46.21%"
"Amazon.de","youtube",342,"B00LV4D70O","YouTube","53.22%","57.41%","B00B7Y0206","vTube für YouTube (Kindle Tablet Edition)","14.09%","14.13%","B06Y1VH2QW","Tube Player - for YouTube","8.21%","10.18%"
"Amazon.de","schleich tiere",343,"B06VT4255G","Schleich 42386 - Farm Word Tier-Mix - Spielzeug","22.00%","19.27%","B01M2AA7OY","Schleich 42387 - Wild Life Starter-Set Figur","10.95%","10.38%","B01MEFOSOV","Schleich 41458 - Waldbewohner Europas Figur","7.64%","8.26%"
"Amazon.de","battlefront 2",344,"B06Y67QHV4","Star Wars Battlefront II - [PlayStation 4]","64.14%","65.55%","B06Y637PY1","Star Wars Battlefront II - Elite Trooper Deluxe Edition - [PlayStation 4]","14.75%","22.25%","B06Y5Y4TJ6","Star Wars Battlefront II (Code in der Box) - [PC]","7.70%","4.28%"
"Amazon.de","iphone 6 hülle",345,"B00OZLO790","mumbi Schutzhülle für iPhone 6 6s Hülle","63.88%","33.33%","B01GG5GMW2","2x mumbi ECO Panzerfolie für iPhone 6 6s Hartglas Glasfolie (bewusst kleiner als das Display, da dieses gewölbt ist","13.95%","0.00%","B01FXUUHUY","mumbi UltraSlim Hülle für iPhone 6 6s Schutzhülle transparent (Ultra Slim - 0.55 mm)","10.63%","15.74%"
"Amazon.de","playstation",346,"B01M4J96DV","PlayStation 4 - Konsole (500GB, schwarz, slim) inkl. 2. DualShock Controller","18.56%","13.75%","B01LQF9UKS","PlayStation 4 Pro - Konsole (1TB)","14.29%","7.28%","B073QRG1YR","PlayStation 4 - Konsole (500GB, schwarz, E-Chassis)","12.42%","14.56%"
"Amazon.de","bilderrahmen",347,"B003TBKKNE","Walther KV040B New Lifestyle Kunststoffrahmen im Format 30 x 40 schwarz","36.18%","41.31%","B010XGBEQ4","Umbra 313016-880 Prisma Bilderrahmen, 4x6 Zoll, kupfer","16.46%","14.29%","B01MYLJT8V","IKEA Ribba Rahmen Weiß, Holz, White, 25 x 25 x 5 cm (23 x 23 Bild)","15.38%","12.36%"
"Amazon.de","bibi und tina",348,"B01JA1XOJI","Schmidt Spiele 51404 Bibi und Tina, Freundschaftsbändchen in Metalldose, Reisespiel","16.99%","16.39%",3845106549,"Bibi und Tina: Meine schönsten Vorlesegeschichten (Bibi & Tina)","11.38%","12.26%","B06XDFDKT8","Craze 57460 - Adventskalender Bibi und Tina","7.18%","3.33%"
"Amazon.de","timberland herren",349,"B00KHMMHHU","Timberland Euro Hiker FTC Herren Wanderstiefel","19.84%","12.55%","B01N1W20UE","Timberland Herren Adventure 2.0 Cupsole Chukka","11.97%","19.10%","B00DDQOJ7S","Timberland EK Rugged WP FTM 6 Inch Plain Toe Herren Halschaft Stiefel","11.48%","12.17%"
"Amazon.de","puppenhaus",350,"B003ADVR3S","KidKraft - Puppenhaus Chelsea","19.67%","19.75%","B0002ML59G","Eichhorn 100002510  Puppenhaus mit Möbeln und Zubehör, bunt","12.70%","12.90%","B0077QT4VG","Playmobil 5167 - Mein Neues Mitnehm-Puppenhaus","9.87%","14.17%"
