"Amazon.de","luftentfeuchter",484,"B000KJP0VA","UHU 47130 - airmax Luftentfeuchter Original mit 450 g Beutel für Räume bis 45 m³","40.28%","51.97%","B01A6SV4ZA","Comfee MDDF-16DEN3 Luftentfeuchter, Bautrockner, 16L in 24h, Raumgröße ca. 80m³","19.96%","12.82%","B0002HP1KU","Wenko 5410010100 Feuchtigkeitskiller 1 kg - Raumentfeuchter, 24 x 16 x 15 cm, weiß","12.92%","13.56%"
"Amazon.de","whiskey",485,"B00CEZ2HDC","Dalwhinnie 15 Jahre Highland Single Malt Scotch Whisky (1 x 0.7 l)","17.07%","20.44%","B004NDJK24","Cooley's Irish Whiskey Miniaturen-Set (4 x 0.05 l)","12.49%","10.57%","B00FYPZK2Y","Pràban na Linne Whisky Probier- und Geschenkset (5 x 0.05 l)","10.07%","7.81%"
"Amazon.de","fire tv stick 2",486,"B01ETRIS3K","Fire TV Stick mit Alexa-Sprachfernbedienung","73.53%","84.92%","B06XTVS1D4","Das neue Fire TV mit 4K Ultra HD und Alexa-Sprachfernbedienung (Version 2017, Anhängerform)","13.95%","8.94%","B01LXP5TXI","Amazon Ethernetadapter für Fire TV und Fire TV Stick mit Alexa-Sprachfernbedienung (nur 2017 Modelle)","3.24%","2.12%"
"Amazon.de","zelda",487,"B01MT8ERQW","The Legend of Zelda: Breath of the Wild [Nintendo Switch]","52.46%","62.02%","B01BPBMJ5Q","Zelda Tri-Force Licht [Andere Plattform]","5.44%","5.81%","B01FWK09UI","The Legend of Zelda: Ocarina of Time 3D - Nintendo Selects - [3DS]","4.85%","4.88%"
"Amazon.de","apple watch series 3",488,"B075LXKJCC","Apple Watch Series 3, 42 mm, Aluminiumgehäuse space grau, Sportarmband grau","42.26%","30.52%","B075M2DTZV","Apple Watch Series 3 OLED GPS Grau Smartwatch - Smartwatches (OLED, Touchscreen, GPS, 18 h, 32,3 g, Grau)","17.00%","19.72%","B075M27HSQ","Apple Watch Series 3, 42 mm, Aluminiumgehäuse gold, Sportarmband sandrosa","8.77%","11.27%"
"Amazon.de","kelly family",489,"B01N372QS3","We Got Love","41.92%","50.65%","B075R11Q2R","We Got Love – Live (2CD/2DVD)","18.06%","19.03%","B072DYGQGY","Over the Hump","7.98%","5.52%"
"Amazon.de","handyhalterung auto",490,"B00884H526","Wicked Chili KFZ Halterung mit Kugelgelenk für Samsung S8 / S7 / S7 Edge / S6 / S6 Edge / S5 / S4 / S3 / A3 2017 / A5 2017 / J5 Autohalterung (Made in Germany, für Bumper & Case)","43.38%","49.66%","B016MIBFES","KFZ Handyhalterung Auto, Universal Windschutzscheibe Smartphone Halterung Auto/ Telefonhalterung mit starker Saugnapf für iPhone 7/7 Plus/6/6S Plus/6S, Samsung S7/S6/S5 Note 5/4/3, HTC und andere,GPS","28.05%","30.40%","B00RDQVPTY","Auto Handyhalterung, Spigen [Stealth] [Design-Patent][Prämie TPU] Unterstützung Auto Smartphone KFZ Halterung iPhone 7/7 Plus/6S/6S Plus, Galaxy S8/S8 Plus/S7/S7 Edge/S6, Galaxy Note 5/4, Huawei P10/P10 Plus/P9/P8, Googld Pixel, HTC, Nexus 5X / 6P, LG G6 und mehr Handy KFZ Halterung - Stealth","6.60%","2.63%"
"Amazon.de","bastelset",491,"B00186MLF2","Glorex 6 1214 072 - Jumbo Bastel-Mix, 1000 Teile","23.33%","27.71%","B000NKJ4C2","Folia 50915/1 - Jumbo Bastelkoffer, 107-teilig","8.45%","10.92%","B01HTGMMPI","Knorrtoys F15423 - Bastelset Eimer, 750 teilig","7.09%","6.23%"
"Amazon.de","calvin klein unterwäsche herren",492,"B00C68EHDU","Calvin Klein Herren Boxershort, 3er Pack (U2664G)","24.47%","23.03%","B0774NFGYB","Calvin Klein Herren Boxershorts, 3er Pack","23.43%","26.92%","B00XBPO55M","Calvin Klein Herren Boxershort WOVEN BOXER - 2P TRAD FIT BOXER","11.82%","11.47%"
"Amazon.de","feuerwehr",493,"B00U770FEC","Dickie Toys 203715001 - City Fire Engine, Feuerwehrauto mit manueller Wasserspritze, 31 cm","12.19%","7.36%","B00V7RCSXW","MTech USA Erwachsene MT-A865FD Taschenmesser, Mehrfarbig, M","9.28%","10.57%","B00IF1VS7U","PLAYMOBIL 5362 - Feuerwehr-Leiterfahrzeug mit Licht und Sound","7.86%","3.92%"
"Amazon.de","braun rasierer",494,"B00WW8BVHO","Braun Series 3 ProSkin Elektrorasierer Herren 3040s, blau","24.88%","35.54%","B012CK6H2A","Braun Series 5 Elektrischer Rasierer 5050cc, mit Reinigungsstation und 2 Reinigungskartuschen, grau/silber","17.48%","15.45%","B01IN8LCHU","Braun Series 9 Rasierapparat 9290cc, mit Reinigungs- und Ladestation, Reise-Etui, silber","14.94%","9.50%"
"Amazon.de","assassins creed",495,"B072MZ8Z3K","Assassin's Creed Origins - [PlayStation 4]","32.53%","39.38%","B00XJTFKSQ","Assassin's Creed Syndicate - Special Edition - [PlayStation 4]","10.83%","7.38%","B01LW2XHAE","Assassin's Creed Ezio Collection - [Playstation 4]","8.58%","5.29%"
"Amazon.de","silvester",496,"B00HVC8TT4","klattschen - Trinkspiel - Das wahrscheinlich beste Trinkspiel aller Zeiten - Partyspiel - Spiel für Erwachsene - Saufspiel und Geschenkidee zum Geburtstag - ähnlich wie Kings Cup oder Ring of Fire","23.42%","26.21%","B00X46PIJU","DENKRIESEN Stadt Land Vollpfosten - Intelligenz-ist-relativ - Stadt Land Fluss neu aufgelegt - Spielblock (Din A3-Format), XXL Spielblock","12.03%","9.90%","B000QTPA78","Piatnik  648366 - Tick Tack Bumm Party Edition","10.33%","4.47%"
"Amazon.de","ipad pro",497,"B01DHDWMZW","Apple  iPad Pro MLMN2FD/A 24,63 cm (9,7 Zoll) Retina Display (A9X, 32GB,  iOS 10) Grau","37.16%","35.44%","B016N6CUI4","Apple iPad Pro ML0N2FD/A 32,8 cm (12,9 Zoll) Tablet PC (Wi-Fi, 4GB RAM, 128GB HDD, Apple iOS, Touchscreen) spacegrau","23.51%","15.19%","B072QDYCDM","Apple MQDY2FD/A 26,67 cm (10,5 Zoll) Tablet-PC (AMD A10 A10X Fusion, 4GB RAM, iOS) rosegold","12.25%","17.30%"
"Amazon.de","heizdecke",498,"B00N5TOVAS","Medisana HU 665 Wärmeunterbett, waschbar, für Matrazen ca. 150 x 80cm","38.43%","41.96%","B00N5TOVA8","Medisana HDW Heizdecke, 4 Temperaturstufen, 2-farbig braun / crème, waschbar","12.74%","15.22%","B075LG2V8J","Sanitas SWB 20 Wärmeunterbett aus Vlies, 3 Temperaturstufen, einfache Fixierung auf der Matratze, Sicherheitssystem","9.83%","9.97%"
"Amazon.de","iphone 5s",499,"B01L9KWQWO","Apple iPhone 5S Space Grau 16GB SIM-Free Smartphone (Zertifiziert und Generalüberholt)","37.72%","39.76%","B00F8JHGXM","Apple iPhone 5S Smartphone 16GB (10,2 cm (4 Zoll) IPS Retina-Touchscreen, 8 Megapixel Kamera, iOS 7) Spacegrau","15.19%","15.66%","B01L9KWM6E","Apple iPhone 5S Silber 16GB SIM-Free Smartphone (Zertifiziert und Generalüberholt)","11.24%","17.38%"
"Amazon.de","parfum damen",500,"B000C1UC8C","Chopard Wish femme/woman, Eau de Parfum Spray, 1er Pack (1 x 75 ml)","12.04%","16.10%","B001PTFVYK","Joop! All About Eve femme/woman, Eau de Parfum, 1er Pack (1 x 40 ml)","7.79%","10.66%","B003YC6GKO","Paco Rabanne Lady Million femme / woman, Eau de Parfum, Vaporisateur / Spray 30 ml, 1er Pack (1 x 30 ml)","7.35%","4.85%"
"Amazon.de","kopfhörer bloothooth",501,"B01M6WNWR6","JBL T450BT Kabelloser On-Ear Bluetooth Kopfhörer mit Integrierter Musiksteuerung und Mikrofon Kompatibel mit Apple und Android Geräten -Schwarz","22.14%","20.99%","B00U5WV250","Sony MDRZX330BT Kopfhörer mit Bluetooth und NFC schwarz","12.42%","14.88%","B01N1KQGXZ","Bluetooth Overhead-Headset, Mpow On-Ear Stereo Wireless Headset Kopfhörer mit Noise Canceling, integriertem Mikrofon Freisprechen,13 Stunden für Smartphones, PC und Laptops usw. (Schwarz & Rot)","12.42%","19.83%"
"Amazon.de","roboter",502,"B0747LZTM8","Anki Roboter Cozmo","22.34%","11.62%","B01LWXF28H","Riley Appbot - Roboter mit Sicherheits Kamera, HD-Video, IR-Nachtsicht, weltweit über Internet fernsteuerbar","9.34%","4.29%","B00TOBXQP2","Clementoni 69412.9 - Galileo - Mein Roboter, Experimentierkaesten","8.49%","11.11%"
"Amazon.de","sony xperia",503,"B06Y2HWT4P","Sony Xperia L1 Smartphone (14 cm (5,5 Zoll) Display, 16 GB Speicher, Android 7.0) Schwarz","17.67%","21.55%","B01L34I7I8","Sony Xperia XCompact Smartphone (11,7 cm (4,6 Zoll), 32 GB Speicher, Android 6.0) Universe Black","13.35%","13.78%","B00AXSXE7U","Sony Xperia Z Smartphone (12,7 cm (5 Zoll) Touchscreen, Quad-Core, 1,5GHz, 2GB RAM, 16GB HDD, 13 Megapixel Kamera, Android 4.1) weiß","7.67%","9.19%"
"Amazon.de","playstation 4 pro",504,"B01LQF9UKS","PlayStation 4 Pro - Konsole (1TB)","42.30%","27.32%","B0777VJGZD","PlayStation 4 Pro - Konsole (1TB, B-Chassis)","13.30%","18.04%","B0774PWPG4","PlayStation 4 Pro - Konsole (1TB, weiß)","9.87%","14.99%"
"Amazon.de","beyblade",505,"B06X9M3N16","Hasbro Beyblade Burst B9498EU6 - Bey Epic Rivals Battle Set, Kreisel","20.90%","17.19%","B072J3465P","Hasbro Beyblade Burst B9490ES0 - Starter Pack Kerbeus K2, Kreisel","12.15%","17.30%","B0711SJQ3P","Hasbro Beyblade Burst B9487ES0 - Starter Pack Valtryek V2, Kreisel","9.52%","7.65%"
"Amazon.de","stereoanlage",506,"B00IJUYY6E","Panasonic Micro HiFi SC-PM250EG-S (20 Watt RMS, CD,UKW, Bluetooth) silber","24.24%","37.73%","B01CKE38V6","Panasonic Micro HiFi SC-PM250EG-K (20 Watt RMS, CD,UKW, Bluetooth) schwarz","7.59%","11.04%","B01844VRYQ","Reflexion PS07BT Mobile Discosoundmaschine (inkl. Bluetooth, Radio, 2x USB, AUX-IN, Karaokefunktion und Akku) schwarz","7.28%","4.12%"
"Amazon.de","taschenlampe",507,"B005FEGYCO","LE Zoombar Superhelle CREE LED Taschenlampe, inklusive 3 AAA Batterie, LED Handlampe, LED Camping Handlampe, Mit einstellbarem Fokus","44.72%","59.35%","B00F9ZH4O6","LED Lenser P7.2 Taschenlampe Box","15.05%","6.85%","B004PZATES","Varta 3x 5 mm LED Day Light (Taschenlampen Flashlight Leuchte Lampe Arbeitsleuchte Taschenleuchte Taschenlicht geeignet für Haushalt, Camping, Angeln, Garage, Notfall, Stromausfall, Outdoor)","11.68%","16.87%"
"Amazon.de","pc",508,"B01H6CL8L4","HP 22-b050ng (X0Y27EA) 54,6 cm (21,5 Zoll / FHD IPS) All in One Desktop PC (AMD Quad-Core A6-7310 APU, 4GB RAM, 1 TB HDD, AMD Radeon R4-Grafikkarte, Windows 10 Home 64) weiß","20.39%","8.82%","B074DYDGXV","Lenovo IdeaCentre 310S Slim Desktop-PC (Intel Pentium J4205 Quad-Core, 8GB RAM, 2TB HDD, Intel HD Grafik 505, Windows 10 Home) silber","6.09%","5.88%","B01JOADGKW","HP Slimline (260-a152ng) Desktop PC (AMD Quad-Core A6-7310 APU, 8 GB RAM, 1 TB HDD, AMD Radeon R4, Windows 10 Home 64) schwarz","5.76%","8.82%"
"Amazon.de","dab radio",509,"B06XNPC6PN","TechniSat DIGITRADIO 1 / Digital-Radio Made in Germany (klein, tragbar, für Outdoor geeignet) mit Lautsprecher, OLED-Display, DAB+, UKW, Favoritenspeicher und leistungsstarkem Akku, schwarz/silber","16.68%","23.32%","B0098HVAOG","Dual DAB 2 A Digital-Radio Adapter mit Fernbedienung (LCD-Display, DAB(+)/UKW-Tuner, Alarmfunktion) Schwarz","10.57%","5.90%","B01F5J324G","TechniSat DIGITRADIO 300 C /Digital-Radio mit Spitzenklang durch integrierten Equalizer und Bassreflextube, DAB+, UKW, 2,8 Zoll Farbdisplay, Radiowecker mit Sleeptimer, Kopfhöreranschluss, AUX-In und Audio-Ausgang analog, anthrazit","10.35%","8.98%"
"Amazon.de","tablet 10 zoll",510,"B074Q5984Y","Lenovo Tab10 25,5 cm (10,1 Zoll HD IPS Touch) Tablet-PC (APQ8009 Quad-Core, 1GB RAM, 16GB eMCP, Android 6.0) schwarz","25.26%","46.27%","B01M3015CT","Das neue Fire HD 10-Tablet mit Alexa Hands-free, 25,65 cm (10,1 Zoll) 1080p Full HD-Display, 32 GB, schwarz, mit Spezialangeboten","11.44%","8.71%","B01ERY8650","Samsung Galaxy Tab A (2016) T580 25,54 cm (10,1 Zoll) WiFi Tablet PC (Octa Core 2GB RAM Android 6,0 neue Version) schwarz","10.86%","8.14%"
"Amazon.de","weihnachten",511,"B075XVQR6L","NIVEA Labellino Geschenkset mit 2 Lippenkugeln, Raspberry & Red Apple und Fresh Mint, 2 Stück","5.67%","3.25%",3499291584,"Früher war mehr Weihnachten","5.35%","6.91%","B005KWJCR0","Die Hit Giganten-Best of Christmas","4.40%","5.01%"
"Amazon.de","lichterkette außen",512,"B005ERKE00","Idena LED Lichterkette 200er, ca. 27,90 m, für innen/außen, warm-weiß","45.97%","46.18%","B005YY96IO","Idena LED Lichterkette 80er, ca. 16 m, für innen/außen, warm-weiß","32.96%","38.35%","B00MAAOEK0","Idena LED Lichterkette 300er, ca. 37,90 m, für innen/außen, warm-weiß","6.96%","5.74%"
"Amazon.de","jogginghose herren lang",513,"B00BLHV60O","Puma Herren Hose Spirit Poly","32.70%","37.78%","B00MTS18O8","adidas Herren Trainingshose Sereno 14","20.74%","22.13%","B00MFCISGO","Nike Herren Trainingshose Libero Tech","9.97%","9.62%"
"Amazon.de","galaxy s7",514,"B01BTZFM0W","Samsung Galaxy S7 Smartphone (5,1 Zoll (12,9 cm) Touch-Display, 32GB interner Speicher, Android OS) schwarz","47.65%","55.92%","B01BTZFQX0","Samsung Galaxy S7 Smartphone (5,1 Zoll (12,9 cm) Touch-Display, 32GB interner Speicher, Android OS) gold","14.62%","19.05%","B01C42FMMW","mumbi UltraSlim Hülle für Samsung Galaxy S7 Schutzhülle transparent (Ultra Slim - 0.80 mm)","8.29%","1.59%"
"Amazon.de","bluetooth kopfhörer",515,"B01M6WNWR6","JBL T450BT Kabelloser On-Ear Bluetooth Kopfhörer mit Integrierter Musiksteuerung und Mikrofon Kompatibel mit Apple und Android Geräten -Schwarz","36.14%","27.18%","B0756BRVXJ","Anker Bluetooth Kopfhörer SoundBuds Flow in Ear magnetisches Headset, mit Wasserschutzklasse IPX5/7-Stunden-Spielzeit/Mikrofon, federleicht für iPhone, iPad, Samsung, Nexus, HTC und mehr","15.44%","31.88%","B00U5WV250","Sony MDRZX330BT Kopfhörer mit Bluetooth und NFC schwarz","7.76%","7.38%"
"Amazon.de","iphone 8 plus",516,"B075LZ4VQW","Apple MQ8L2ZD/A iPhone 8 Plus 13,94 cm (5,5 Zoll), (64GB, 12MP Kamera, Auflösung 1920 x 1080 Pixel) Space Grau","52.20%","55.01%","B075M4QCKW","Apple MQ8M2ZD/A iPhone 8 Plus 13,94 cm (5,5 Zoll), (64GB, 12MP Kamera, Auflösung 1920 x 1080 Pixel) Silber","18.56%","16.52%","B075LW8Z5R","Apple MQ8N2ZD/A iPhone 8 Plus 13,94 cm (5,5 Zoll), (64GB, 12MP Kamera, Auflösung 1920 x 1080 Pixel) Gold","17.20%","15.34%"
"Amazon.de","die drei fragezeichen",517,"B075NVY35J","190/und die Kammer der Rätsel","39.90%","43.74%","B00S5R1496","Kosmos 631949 - Die drei ??? Detektiv-Koffer","10.26%","7.14%",3440126242,"Die drei ???-Kids: Hast du Mut diese verschlossenen Seiten zu öffnen?","5.53%","5.45%"
"Amazon.de","sony",518,"B06Y2HWT4P","Sony Xperia L1 Smartphone (14 cm (5,5 Zoll) Display, 16 GB Speicher, Android 7.0) Schwarz","19.17%","18.06%","B01LHGLALI","Sony NWWM1Z High-Resolution Audio Walkman (256 GB Speicher, Micro SD Slot, S Master HX Engine, Kupfer Gehäuse 10,2 cm (4 Zoll) LED-LCD Multi-Touchdisplay) gold","8.18%","1.39%","B01L34I7I8","Sony Xperia XCompact Smartphone (11,7 cm (4,6 Zoll), 32 GB Speicher, Android 6.0) Universe Black","7.71%","5.56%"
"Amazon.de","fotoalbum",519,"B00SL6I2WI","Hama Jumbo Fotoalbum Fine Art (30 x 30 cm, 100 Seiten, 50 Blatt, Mit Ausschnitt für Bildeinschub) schwarz","32.87%","35.86%","B000VRANHW","Hama Fotoalbum (28 x 24 cm, 50 schwarze Seiten, 25 Blatt, mit Ausschnitt für Bildeinschub, Fotobuch) schwarz","15.73%","19.64%","B01K47GUKC","Hama Fotoalbum La Fleur (Jumbo Album mit 100 schwarzen Seiten, für 400 Fotos im Format 10x15, Blätter-Muster, 30x30) XXL Fotobuch weiß","8.02%","7.50%"
"Amazon.de","topfset",520,"B0015Z57KW","WMF Topf-Set 5-teilig Bratentopf Fleischtopf Stielkasserolle Provence Plus Schüttrand Glasdeckel Cromargan Edelstahl rostfrei poliert induktionsgeeignet spülmaschinengeeignet","22.43%","20.96%","B00KGUFDZQ","M+K by ELO 62059 Meine Küche Topfset Black Cast, 6 teilig","9.97%","12.18%","B00I4D451U","M+K by ELO 99819 Topfset Skyline 4 teilig","7.48%","14.24%"
"Amazon.de","rucksack männer",521,"B01NCME808","Jack Wolfskin Perfect Day Rucksack","40.99%","41.36%","B005OTEHUG","Nike Rucksack Club Team, black/white, 45 x 35 x 22,5 cm, 37 Liter, BA5190-010","31.70%","36.00%","B00S87IF1I","Dakine Rucksack Campus Unisex - Erwachsene CAMPUS 33L,Carbon ,33 Liter","9.93%","8.55%"
"Amazon.de","bücher neuerscheinungen 2017",522,3548288537,"Bevor die Stadt erwacht: Eine Weihnachtsgeschichte","8.54%","8.57%",3956497104,"Apfelkuchen am Meer","7.78%","8.70%",3548377165,"Keine Zeit für Arschlöcher!: ... hör auf dein Herz","6.13%","5.22%"
"Amazon.de","samsung gear s3",523,"B01LF0T51I","Samsung SM-R760NDAADBT Gear S3 frontier Smartwatch (3,3 cm (1,3 Zoll) Display, NFC, Bluetooth, WLAN, Tizen OS, mit Silikon-Armband)","46.68%","60.13%","B01LF0T540","Samsung Gear S3 classic (3,3 cm (1,3 Zoll) Display, NFC, Bluetooth, WLAN, Tizen OS), mit Echtleder-Armband","26.82%","30.06%","B072HGYZ5V","Samsung SM-R760NDAAROM Smartwatch Gear S3 Frontier schwarz","9.87%","3.35%"
"Amazon.de","iphone 5",524,"B01KOJJXOU","Apple iPhone 5 Weiß 16GB Smartphone (Zertifiziert und Generalüberholt)","27.91%","24.30%","B01L9KWQWO","Apple iPhone 5S Space Grau 16GB SIM-Free Smartphone (Zertifiziert und Generalüberholt)","21.68%","32.27%","B0097CZBH4","Apple iPhone 5 Smartphone (4 Zoll (10,2 cm) Touch-Display, 16 GB Speicher, iOS 6) schwarz","13.66%","9.56%"
"Amazon.de","birkenstock",525,"B00ZZP11OY","Birkenstock Classic Arizona Birko-Flor Unisex-Erwachsene Pantoletten","17.14%","17.71%","B003AM95AQ","Birkenstock Classic BOSTON Unisex-Erwachsene Clogs","14.16%","10.83%","B01008R7FC","Birkenstock Classic Gizeh Birko-Flor Unisex-Erwachsene Zehentrenner","7.69%","4.79%"
"Amazon.de","stabmixer",526,"B00A925G3A","Bosch Ergonomischer MSM66110 Stabmixer mit Zubehör(600 W, edelstahl-Mixfuß) weiß/telegrau","26.51%","31.89%","B00EQB0ZY0","Braun Multiquick 7 MQ 745 Aperitive Stabmixer (750 W, Standmixer-Aufsatz (1250 ml) Edelstahl-Schneebesen, EasyClick System, PowerBell Technologie)","14.37%","10.92%","B004MPQQ6G","Siemens MQ5B150N Stabmixer / 300 Watt","12.24%","18.60%"
"Amazon.de","peppa wutz",527,"B001ENZ43K","TY 7146128 - Peppa Baby - Schwein mit rotem Kleid und Bär, 15 cm","15.68%","14.44%",3845103981,"Peppa: Tolle Vorlesegeschichten mit Peppa","11.46%","15.71%","B001ENV4JS","TY 7146130 - Peppa Baby - George, Schwein mit kleinem Dinosaurier, 15 cm","10.43%","11.02%"
"Amazon.de","topmodel",528,"B01JUFBXZQ","TOPModel 8061 - Create your Fantasy Friend Malbuch mit Rubbelbildern","11.38%","14.37%","B01MCZJ02A","TOPModel 8097 - Create your Glamour Special Malbuch","9.44%","12.64%","B06XC2HVSG","TOPModel Geheimcode Tagebuch mit Sound, Motiv 2, 8986,Assorted","7.03%","5.51%"
"Amazon.de","bilderrahmen mehrere fotos",529,"B077NPVN69","Relaxdays Bilderrahmen für 24 Fotos, Fotorahmen zum Hängen, Fotocollage selbst gestalten, HBT: 59 x 86 x 2,5 cm, weiß","40.05%","33.72%","B009UEDICY","Zep Malaga Kunststoff-Bilderrahmen Fr 4 Bilder Je 10 X 15 Cm, Wei, Mae 31 X 31 Cm","18.04%","23.17%","B01LZXLX9Z","Hama Collage Bilderrahmen für Fotocollagen Montreal - Love (Fotorahmen mit Love-Schriftzug und Herzen, für 3 Fotos, Kunststoff-Rahmen, Echtglas, Fotogalerie) weiß","13.13%","13.07%"
"Amazon.de","brotkasten",530,"B004W24P6C","Kesper 18090 Brotbox Melamin Bambus, weiß","23.98%","26.51%","B00083HPIE","Wesco 235 201-01 Brotkasten Grandy, 42 x 23 x 17 cm, weiss","13.42%","11.00%","B000BPM908","Brabantia Brotkasten aus Edelstahl","6.85%","8.17%"
"Amazon.de","kevin allein zu haus",531,"B011JOJU38","Kevin - Allein zu Haus Box 1&2 [Blu-ray]","49.09%","56.05%","B00004W482","Kevin - Allein zu Haus","14.51%","14.57%","B0106WPAZG","Kevin allein zu Haus / Kevin allein in New York","13.68%","15.46%"
"Amazon.de","jogginghose damen",532,"B00QMFMT9W","Nike Damen Hose Jersey Cuffed","35.55%","26.56%","B007PMEO2G","Damen Sweathose mit Bündchen - schwarz, lang","17.83%","27.53%","B01HIELKHM","Nike Damen Trainingshose Gym Vintage Pants","14.26%","10.32%"
"Amazon.de","osram lightify",533,"B074PZLX2P","Osram Smart + Plug Schaltbare Steckdose als Schnittstelle für die Erweiterung Ihres Smart Home Systems, Plastik, grau","22.16%","40.60%","B00JDJC1RY","Osram Lightify Gateway Home- Controller zur Fernsteuerung, Als Remote- Schnittstelle für alle Lightify- Produkte, Kompatibel mit Alexa","13.09%","17.98%","B01N6CD02J","Osram LED Gartenleuchte Lightify Gardenpole mit 5 Spots, 8,5m Länge, Dimmbar, Farbsteuerung RGBW (zzgl. 5 Meter Kabel) Kompatibel mit Alexa","10.41%","15.60%"
"Amazon.de","tageslichtlampe",534,"B00MOIWOAK","Beurer TL 30 Tageslichtlampe, Ausgleich von Lichtmangel, kompakte Größe, inkl. Aufbewahrungstasche","49.13%","54.28%","B005HDLGQW","Beurer TL 80 Tageslichtlampe, Sonnenlicht-Simulation, stufenlose Neigungsverstellung","13.41%","13.65%","B008TZBMWI","Beurer TL 40 Tageslichtlampe, Ausgleich von Lichtmangelerscheinungen mit 10.000 Lux (bei ca. 15 cm Abstand)","9.03%","11.60%"
"Amazon.de","ps3",535,"B0099GQIWA","PlayStation 3 - Konsole mit DualShock 3 Wireless Controller","35.27%","14.47%","B005C5XXI4","PlayStation 3 - Konsole Slim 160 GB (K-Model) inkl. Dual Shock 3 Wireless Controller","14.83%","9.21%","B003L771LA","PlayStation 3 - Konsole Slim 120 GB inkl. Dual Shock 3 Wireless Controller","13.90%","10.53%"
"Amazon.de","geomag",536,"B0080BEKTS","Geomag 252 - Color, 40-teilig","14.62%","16.06%","B00IZ4CUD8","Geomag 722 - Mechanics, 146-teilig","12.69%","12.15%","B000BW08MM","Geomag 452 - Panels, 68-teilig","10.26%","13.22%"
"Amazon.de","friteuse",537,"B00DNX58NK","DeLonghi F 28.311.W1 Rotofritteuse (1800 Watt, Easy Clean System) weiß","30.53%","29.07%","B00XUJLZ84","Bomann FR 2264 CB Edelstahl-Fritteuse","11.89%","15.26%","B00Y4SN790","Princess XL 182020 Heißluftfritteuse (1500 Watt, Aerofryer mit digitalem Display, ohne Öl, einfach zu reinigen, 3,2 l)","9.11%","3.78%"
"Amazon.de","tiptoi buch",538,3473418080,"tiptoi® Merken und Konzentrieren (tiptoi® Mein Lern-Spiel-Abenteuer)","13.92%","13.39%",3473435147,"tiptoi® Meine schönsten Kinderlieder (tiptoi® Bilderbuch)","8.21%","9.81%",3473329118,"tiptoi® Mein großer Weltatlas","7.86%","7.97%"
"Amazon.de","digitaler bilderrahmen",539,"B003U3ZLTE","Intenso Photobase Digitaler Bilderrahmen (20,3cm (8 Zoll) Display, SD Kartenslot, Fernbedienung) schwarz","50.45%","56.23%","B012BJWSJI","Intenso Photo Agent Plus Digitaler Bilderrahmen (17,7 cm (7 Zoll), TFT-LCD Farbdisplay, SD/SDHC/MMC/MS Slot, 16:9, Fernbedienung) schwarz","23.35%","24.86%","B00NCVSQ14","Hama Digitaler Bilderrahmen Slimline Basic (20,3 cm (8 Zoll), SD/SDHC/MMC-Kartenslot, USB 2.0, elektronischer Bilderrahmen mit Fernbedienung, Zufallswiedergabe) schwarz","3.25%","2.49%"
"Amazon.de","glubschi",540,"B002Q4M5PQ","Ty 36006 - Slush Husky Beanie Boos","11.61%","10.75%","B002Q4M3FS","Ty 36008 - Waddles Pinguin Beanie Boos","9.84%","8.18%","B01BPUNVS6","Carletto Ty 37190 - Kiki, Katze mit Glitzeraugen, Glubschis, Beanie Boos, 15cm, grau","6.48%","8.27%"
"Amazon.de","in ears kopfhörer",541,"B001EZYMF4","Sennheiser CX 300-II Precision In-Ear-Kopfhörer (1,2 m Kabellänge, 3,5 mm Klinkenstecker, Tragetasche, Earadapterset S/M/L) schwarz","21.62%","22.73%","B00OHVT2SO","Marshall - Mode EQ Ohrhörer - Schwarz / Messing","14.16%","7.36%","B00UQRM7XA","Beats by Dr. Dre urBeats Ohrhörer (In-Ear)","12.24%","6.17%"
"Amazon.de","lichterkette",542,"B005YY96IO","Idena LED Lichterkette 80er, ca. 16 m, für innen/außen, warm-weiß","34.75%","38.35%","B005ERKE00","Idena LED Lichterkette 200er, ca. 27,90 m, für innen/außen, warm-weiß","28.44%","27.11%","B004BDSL8K","Tenia 200 LED Lichterkette Warmweiß Innen/Außen 20M Weihnachten Gartenbeleuchtung","9.37%","11.85%"
"Amazon.de","cars 3",543,"B075VVYQM5","Cars 3: Evolution","28.05%","15.89%","B01N1JVSF7","Mattel Disney Cars FCW02 - Disney Cars 3 Ultimative Florida Rennstrecke","12.83%","13.26%","B01IDW6KZ0","Mattel Disney Cars DXV34 - Disney Cars 3 Die-Cast Jackson Storm","8.34%","15.49%"
"Amazon.de","basteln mädchen",544,3897777282,"The Girls' Book: Das außergewöhnliche Handbuch für neugierige Mädchen | Spielen, Basteln und Spaß in einem Buch","12.99%","13.96%","B007IUOORK","SES  01131 - Glitzerschmetterlinge gießen","10.72%","13.51%","B003I55E1Y","SES 01155 - Pferde gießen und anmalen","9.93%","11.02%"
"Amazon.de","weber grill zubehör",545,3833842326,"Weber's Wintergrillen: Die besten Rezepte (GU Weber's Grillen)","13.61%","23.57%","B015KP6POO","Weber Geschenkkoffer Silber, 706 g","11.11%","9.28%","B000WEKNYW","Weber 7516 Grifflicht Grill Out","6.31%","3.09%"
"Amazon.de","black roll",546,"B003BP5AGA","BLACKROLL STANDARD Faszienrolle - das Original (Härtegrad mittel) - Selbstmassage-Rolle für die Faszien in schwarz + Booklet","35.53%","36.44%","B004E2TDHQ","Blackroll Orange (Das Original) - Faszienrolle inkl. Übungs-DVD, Übungsposter & Booklet. Die Massagerolle für die Faszien, auch Foam Roller, Gymnastikrolle, Fitnessrolle genannt, zur Selbstmassage und Behandlung des Bindegewebes. Qualität Made in Germany","15.64%","18.24%","B016D5QDAQ","BLACKROLL BLACKBOX Faszientool-Set - das Original. Selbstmassage-Produkte für die Faszien in schwarz + DVD & Übungskarte","12.79%","12.65%"
"Amazon.de","nintendo 2ds",547,"B00NGCILEQ","Nintendo 2DS - Konsole (schwarz) inkl. Mario Kart 7 (vorinstalliert)","39.85%","48.14%","B071NJBW3J","New Nintendo 2DS XL Schwarz + Türkis","16.82%","10.24%","B00KR4TIW0","Nintendo 2DS - Konsole (weiß + rot) inkl. New Super Mario Bros. 2 (vorinstalliert)","13.93%","15.80%"
"Amazon.de","nike pullover männer",548,"B00WR6O33U","Nike Herren Kapuzenpullover Team Club","43.15%","48.80%","B00WUOZQXK","Nike Herren Sweatshirt Team Club Crew","13.56%","16.61%","B00WR6OAQ0","Nike Jungen Unisex Kapuzenpullover Team Club","12.08%","11.21%"
"Amazon.de","lego architektur",549,"B012NOGGHQ","Lego 21028 Architecture New York City, Skyline-Kollektion, Bausteine","16.57%","14.29%","B01J41MPF8","Lego 21034 Architecture London, Skyline Sammlungsset","14.07%","14.13%","B012NOESIA","Lego 21027 Architecture Berlin, Skyline Bauset","7.71%","4.56%"
"Amazon.de","adidas pullover männer",550,"B013SXKD4S","adidas Herren Kapuzenpullover Originals Trefoil","19.74%","15.62%","B01LWUAP2H","adidas Herren Trefoil Crew Sweatshirt, Schwarz","15.70%","12.50%","B007H45IK4","adidas Herren Kapuzentop Originals Trefoil Hoodie","9.68%","12.98%"
"Amazon.de","kinderwagen",551,"B01ELDCSHY","Kinderkraft Moov Multi Kinderwagen Kombikinderwagen 3in1 mit Buggy Babyschale Grau","44.57%","41.59%","B00820VNIS","Bergsteiger Capri Kinderwagen 3 in 1 Kombikinderwagen Megaset 10 teilig inkl. Babyschale, Babywanne, Sportwagen und Zubehör","31.97%","15.04%","B00O683BM6","Quinny Moodd Kinderwagen, mit automatischer Aufklappfunktion, Ruheposition in beide Fahrtrichtungen, modernes Design, ab der Geburt bis ca. 3,5 Jahre, grau","3.00%","0.88%"
