"Amazon.de","lacoste herren",697,"B01N4GBOTN","Lacoste Herren Poloshirt","25.25%","29.64%","B00Q7Z74SS","Lacoste Herren Sweatshirt SH7613 - 00","17.46%","14.01%","B01N1SZMZX","Lacoste Herren Poloshirt","6.50%","9.45%"
"Amazon.de","helene fischer",698,"B06XSQ8LKC","Helene Fischer","46.10%","54.65%","B07797F28R","Helene Fischer (Ltd. Geschenk Edition inkl. 4 CDs + DVD + BluRay)","18.37%","12.11%","B0167P9XCM","Weihnachten (2CD) (mit dem Royal Philharmonic Orchestra)","11.29%","9.08%"
"Amazon.de","sofa",699,"B00JQ5XPIE","B-famous Houston-2-Pur Polsterecke, Schenkelmaß 226 x 160 cm, Materialmix Kunstleder-Struktur, weiß/grau","28.00%","21.82%","B0711Y9Q69","B-famous 100712 Wohnlandschaft Ecksofa, Stoff, anthrazit, 161 x 313 x 64 cm","20.27%","7.27%","B00649COM8","Intex Aufblasmöbel Ausziehbares Sofa Pull-Out Sofa, Schwarz und dunkelgrün, 193x221x66 cm","14.50%","21.82%"
"Amazon.de","uno",700,"B005I5M2F8","Mattel W2087 - Uno, Kartenspiel","38.80%","50.22%","B0043YKXUG","Mattel V9364 - Uno Extreme Kartenspiel","14.11%","9.48%","B000CFWFYM","Mattel K0888-0 - UNO Deluxe, Kartenspiel","12.16%","14.73%"
"Amazon.de","playmobil haus",701,"B06W5XHWVT","PLAYMOBIL 9266 - Modernes Wohnhaus","42.91%","53.34%","B00VLVEAHQ","Playmobil 5303 - Romantisches Puppenhaus","16.02%","10.72%","B0077QT4VG","Playmobil 5167 - Mein Neues Mitnehm-Puppenhaus","10.87%","18.38%"
"Amazon.de","bosch akkuschrauber",702,"B015WGDX6E","Bosch Professional Akku-Bohrschrauber GSR 12V-15 (mit 2x 2,0 Ah Akku, Ladegerät, 39-tlg. Zubehör-Set, Profi-Tasche, max. Schrauben-Ø: 7 mm, 12 Volt)","18.36%","15.57%","B00TTZU566","Bosch Akkuschrauber IXO (5. Generation, 10 Bits, USB Ladegerät, Dose, 3,6 Volt, 1,5 Ah)","15.45%","27.08%","B00W9YOGUA","Bosch Professional Akku-Bohrschrauber GSR 18-2-LI Plus, 2x 2,0 Ah Akku, Ladegerät, L-BOXX, 18 Volt, Drehmoment max.: 63 Nm, Schrauben-Ø max.: 8 mm, 06019E6100","14.18%","9.60%"
"Amazon.de","wlan repeater",703,"B009CXPY0W","AVM FRITZ!WLAN Repeater 310 (300 Mbit/s, WPS), weiß, deutschsprachige Version","37.52%","42.15%","B00A0VCJPI","TP-Link TL-WA850RE WLAN Repeater (300 Mbit/s, App Steuerung, 1 Port, WPS, LED abschaltbar, kompatibel mit allen WLAN Geräten)","22.04%","25.92%","B00N80IK88","AVM FRITZ!WLAN Repeater 1750E (Dual-WLAN AC + N bis zu 1.300 MBit/s 5 GHz + 450MBit/s 2,4 GHz), Rot/Weiß, deutschsprachige Version","9.22%","7.47%"
"Amazon.de","instax mini 9",704,"B06Y62H8YR","Fujifilm Instax Mini 9 Kamera smoky weiß","34.69%","33.61%","B06Y68YRTF","Fujifilm Instax Mini 9 Kamera ice blau","26.17%","20.72%","B06Y698TWW","Fujifilm Instax Mini 9 Kamera flamingo rosa","17.90%","15.90%"
"Amazon.de","spiel des lebens",705,"B01ELG6CJG","Hasbro Spiele 14529594 - Das Spiel des Lebens, Familienspiel","66.39%","70.36%","B00WE3J42G","Hasbro Spiele A6769398 - Das Spiel des Lebens Banking, Familienspiel","17.53%","18.06%","B00OTKNZ04","Hasbro Spiele B0654100 - Das Spiel des Lebens Junior, Familienspiel","5.57%","5.09%"
"Amazon.de","the walking dead",706,"B07572CTKB","The Walking Dead - Die komplette siebte Staffel [Blu-ray]","17.12%","19.45%","B01KACR2KS","The Walking Dead Fleecedecke, 130x160cm","8.59%","20.60%","B01L1DTIIO","McFarlane Toys The Walking Dead - Negans Bat Lucille - 81cm Replik","8.20%","2.75%"
"Amazon.de","haartrockner",707,"B00BCQIK4O","Philips Ionen-Haartrockner HP8232/00, 2200 Watt, weiß","25.70%","27.36%","B00BCQIIMS","Philips Haartrockner HP8230/00, 2100 Watt, schwarz","21.75%","26.60%","B00HXCJS3S","Braun Satin Hair 7 Haartrockner HD 710, mit IonTec und Satin Protect Technologie, 2200 Watt","9.01%","7.85%"
"Amazon.de","calvin klein damen",708,"B00LATFR62","Calvin Klein Damen Bustier MODERN COTTON - BRALETTE","17.81%","22.73%","B00MHK1HR6","Calvin Klein Damen String MODERN COTTON - THONG","17.20%","22.13%","B00LATFQYK","Calvin Klein Damen Schlafanzughose MODERN COTTON - PJ PANT","14.20%","9.29%"
"Amazon.de","google home",709,"B01DFKBG54","Amazon Echo Dot (2. Generation), Schwarz","37.50%","50.00%","B06ZXQV6P8","Das neue Amazon Echo (2. Generation), Anthrazit Stoff","15.86%","19.37%","B06VWKBTVG","Google Home: Ultimate Guide to Quickstart Your Google Home Experience (Google Home Manual, Tips and Tricks, Google Home Book Book 1) (English Edition)","15.17%","4.05%"
"Amazon.de","popsockets",710,"B01DNRMTA0","PopSockets: Ausziehbarer Sockel und Griff für Smartphones und Tablets - Blush","17.00%","17.72%","B00UY1YTGG","PopSockets: Ausziehbarer Sockel und Griff für Smartphones und Tablets - Black","16.61%","13.58%","B01EFKRR88","PopSockets: Ausziehbarer Sockel und Griff für Smartphones und Tablets - Peace Mandala Sky","7.46%","8.99%"
"Amazon.de","laserdrucker",711,"B00VEA9LD2","Samsung Xpress SL-M2026/SEE Monolaser-Drucker (mit ReCP-Technologie für brillante Ausdrucke)","22.12%","24.70%","B00LUH8UJ0","Brother HL-L2300D Monochrome Laserdrucker (2400 x 600 dpi, USB 2.0) schwarz","11.61%","13.21%","B00O1OTEFS","Brother HL-3142CW High-Speed Farblaserdrucker mit WLAN weiß/grau","11.10%","9.95%"
"Amazon.de","schokolade",712,"B00283KUNO","Kinder Riegel Einzelriegel, 36er Pack (36 x 1 Riegel Packung)","15.80%","14.62%","B0042S0CPY","Lindt & Sprüngli Weihnachts-Zauber Präsent, 1er Pack (1 x 250 g)","12.78%","17.37%","B009HP8B8M","Milka Naps Mix Dose Ideal fürs Büro, 1er Pack (1 x 1 kg)","6.61%","4.91%"
"Amazon.de","senseo kaffeemaschine",713,"B0748KR3S1","Philips HD6554/69 Kaffeepadmaschine (Volks-Senseo, Sonderedition 100 Pad Promotion und 2 Gläser gratis) schwarz","21.17%","29.28%","B00U7HJ2PK","Senseo Original HD7817/69 Kaffeepadmaschine (1450 W, 1-2 Tassen gleichzeitig) schwarz","18.30%","24.14%","B01IBZ7LNE","Senseo HD7892/60 Switch 2-in-1 Kaffeemaschine für Filter, Schwarz","12.30%","7.15%"
"Amazon.de","samsung gear",714,"B01LF0T51I","Samsung SM-R760NDAADBT Gear S3 frontier Smartwatch (3,3 cm (1,3 Zoll) Display, NFC, Bluetooth, WLAN, Tizen OS, mit Silikon-Armband)","24.13%","21.32%","B01GJW7H2Q","Samsung Gear Fit 2 Smartwatch mit Pulssensor und Benachrichtigungen - Schwarz(L)","14.45%","16.24%","B01LF0T540","Samsung Gear S3 classic (3,3 cm (1,3 Zoll) Display, NFC, Bluetooth, WLAN, Tizen OS), mit Echtleder-Armband","9.67%","10.66%"
"Amazon.de","werkzeugkoffer",715,"B0051E16LW","Mannesmann 89-teiliger Premium Universal- und Haushalts-Werkzeugkoffer, M29085","22.82%","31.33%","B005ERFK9U","Mannesmann Alu-Werkzeugkoffer, bestückt, 108-tlg., M29075","13.63%","15.10%","B002OL2LKU","Mannesmann Bestückte Werkzeugbox 155-tlg., M29066","8.68%","9.99%"
"Amazon.de","monster high",716,"B01ARGBW1M","Mattel Monster High DNX65 - Fledermaus Draculaura, Ankleidepuppen","13.62%","22.90%","B01NGTMFC3","Mattel Monster High FCV59 - Garten-Monsterfreundin Treesa Thornwillow","11.30%","12.64%","B013INICA0","Mattel Mega Bloks DKT93 - Konstruktionsspielzeug, Monster High Monsterschüler Café","8.14%","4.94%"
"Amazon.de","nussknacker",717,"B002QFACIC","Silit Nussknacker Walnussknacker Haselnussknacker Zinkdruckguss","28.58%","36.86%","B0019QUU6S","Westmark Nussknacker und Sektzange, Zinkdruckguss, Länge: 18 cm, Sieger Nussprofi, Schwarz, 33254470","19.84%","24.36%","B000T5O8GI","Drosselmeyer - Der Nussknacker, schwarz","12.64%","10.35%"
"Amazon.de","philips",718,"B01B1NVCEC","Philips OneBlade, Trimmen, Stylen, Rasieren / 4 Trimmeraufsätze, 1 Ersatzklinge QP2530/30","14.89%","19.61%","B00E62DUTG","Philips Sonicare DiamondClean Elektrische Zahnbürste mit Schalltechnologie HX9352/04, schwarz","9.61%","5.88%","B008LR3KD8","Philips HF3520/01 Wake-Up Light (Sonnenaufgangfunktion, digitales FM Radio, Tageslichtwecker) weiß","8.35%","5.88%"
"Amazon.de","bh cosmetics",719,"B015N4V24K","BH Cosmetics Carli bybel 14 color eyeshadow & highlighter palette (CARLI BYBEL)","38.54%","41.00%","B01MYP79W3","Metal Rose - 11-teiliges Pinselset mit Kosmetiktasche","14.18%","12.34%","B014SRBCD4","Studio Pro Ultimate Brow Palette von BH Cosmetics","11.35%","7.11%"
"Amazon.de","4k monitor",720,"B00WUACE4S","Samsung U28E590D 71,12 cm (28 Zoll) Monitor (HDMI, 1ms Reaktionszeit, 60 Hz Aktualisierungsrate, 3840 x 2160 Pixel) Schwarz/Silber","41.00%","68.75%","B01AWG58VM","LG IT Products 29UM58-P.AEU 73,7 cm (29 Zoll) LED Monitor (2 x HDMI, 5ms Reaktionszeit)","14.28%","5.11%","B0163JLIWU","AOC U2879VF 71,1 cm (28 Zoll) Monitor (VGA, DVI, HDMI, DisplayPort, 3840 x 2160, 60 Hz, 1ms Reaktionszeit, 4k) schwarz","7.68%","7.10%"
"Amazon.de","vibratoren für sie",721,"B015IRVWBU","Tracy's Dog Vibratoren für Sie Silikonvibrator - Sexspielzeug für Frauen Zur Stimulation von Klitoris Und G-Punkt - Erotik Spielzeug, Dildo, Rabbit Vibrator Mit 30 Vibrationsstufen – Wasserfest","52.07%","54.86%","B01MS5KE6Y","Olivia Silikondildo Rabbit Vibrator mit 7 Programmen, 240 g","20.27%","20.61%","B00D3HU3MC","Durex Intense Delight, Minivibrator für sinnliche Stimulation, 1 Stück","8.92%","9.17%"
"Amazon.de","trockner",722,"B00JGWVGN8","Siemens iQ700 WT46W261 iSensoric Wärmepumpentrockner / A++ / 8 kg / Weiß / Selbstreinigender Kondensator / softDry-Trommelsystem / Super40","22.08%","18.75%","B004EPYJYU","Beko DCU 7330 Kondenstrockner / B / 7 kg / Weiß / Multifunktionsdisplay / Knitterschutz / Trommelbeleuchtung / Reversierende Trommelbewegungen / FlexySense / 16 Programme","18.51%","21.53%","B00DCD6RTK","Samsung DV80F5E5HGWEG Wärmepumpentrockner / A++ / 8 kg / weiß / Vollgrafisches LED Display / Diamond Pflegetrommel","12.61%","12.85%"
"Amazon.de","huawei p8 lite 2017",723,"B01MU9R2EN","Huawei P8 Lite 2017 Smartphone (13.2 cm (5.2 Zoll) Full-HD Touchscreen, 16 GB, Android 7.0) black","52.96%","46.70%","B01N4N3GVO","Huawei P8 Lite 2017 Smartphone (13.2 cm (5.2 Zoll) Full-HD Touchscreen, 16 GB, Android 7.0) white","14.82%","18.39%","B01NASALL2","Huawei P8 Lite 2017 Smartphone (13.2 cm (5.2 Zoll) Full-HD Touchscreen, 16 GB, Android 7.0) gold","8.90%","9.32%"
"Amazon.de","geschenkset frauen",724,"B075QK5N6Q","Dove Geschenkset Duschgel Pflege & Öl, Bodylotion Sheabutter, Deo Invisible mit Kerze, 1er Pack","11.22%","15.97%","B00P7XF3K2","Tetesept Bäder Geschenkset Verwöhnmomente, 1er Pack (6 x 20 ml)","8.05%","10.19%","B00A7SKVNG","Geschenk Set Winter-Früchtetee mit je 2 Teegläsern, Untersetzern und Löffeln, 1er Pack (1 x 50 g)","7.96%","6.94%"
"Amazon.de","action cam",725,"B01JS00NFE","APEMAN Action Kamera WIFI sports cam 4K camera 20MP Ultra Full HD Unterwasserkamera Helmkamera wasserdicht mit 2 verbesserten Batterien Transporttasche und kostenlose Accessoires","45.41%","42.27%","B01N3Q4DLS","APEMAN Action Cam 1080P Full HD Unterwasser Aktion kamera wasserdicht Helmkamera 170 ° Weitwinkel mit Zubehör Kits","32.02%","42.03%","B01ERJ4A0K","Apeman A70 Aktion und Sport Kamera mit 2 1050mAh Akkus und Accessoires (14 MP, ​1080P FULL HD, WiFi, 30 m wasserdicht)","6.54%","9.16%"
"Amazon.de","xenoblade chronicles 2",726,"B06XCCP37F","Xenoblade Chronicles 2 [Nintendo Switch]","70.97%","75.92%","B075LKWQN2","Xenoblade Chronicles 2 - Collector's Edition - [Nintendo Switch]","21.51%","20.39%","B075LSG51W","Nintendo Switch Pro Controller - Xenoblade Chronicles 2 Edition","2.13%","1.19%"
"Amazon.de","gaming tastatur",727,"B00N3OCV7U","Sharkoon Skiller Pro beleuchtete Gaming Tastatur (9 Multimedia-, 6 Makro- und 3 Profil-Tasten, Software, USB) schwarz","24.49%","31.00%","B01L6L46LK","Logitech G213 Gaming-Tastatur Prodigy (mit RGB-Hintergrundbeleuchtung, QWERTZ Deutsches Tastaturlayout)","21.30%","20.98%","B01B4O2GKW","Logitech G810 Mechanische Gaming-Tastatur Orion Spectrum (mit RGB und QWERTZ Deutsches Tastaturlayout) schwarz","7.36%","5.67%"
"Amazon.de","bvb",728,"B0106JB4BS","Puma Herren Kapuzenpullover BVB Fan","20.34%","17.01%",3730701118,"BVB-Album: Unvergessliche Sprüche, Fotos, Anekdoten","9.60%","15.65%","B01DUHAG58","Puma BVB Evopower Wash Bag 28x19x11cm - Schwarz","8.94%","13.15%"
"Amazon.de","einhorn kuscheltier",729,"B01MXEPZ4O","Nici 40107.0 - Einhorn Theodor stehend, Plüsch, 45 cm","28.03%","29.52%","B01MSUL4CL","Animagic 31224.4300 - Rainbow - mein Einhorn mit Lichteffekten","12.67%","13.65%","B0712191GF","TY 36852 Pixy, Einhorn mit Glitzeraugen, Glubschi's, Beanie Boo's, Plüsch, Weiß/Bunt, 15 cm","9.70%","6.83%"
"Amazon.de","verlängerungskabel",730,"B00GJP1X6A","Meister Schutzkontakt-Verlängerung ✓ 5 m Kabel ✓ weiß ✓ Kunststoffleitung ✓ IP20 Innenbereich | Verlängerungskabel mit Kindersicherung | Schuko-Verlängerung | 7432510","24.37%","30.98%","B0013NAPKI","Brennenstuhl Kunststoff-Verlängerungskabel 3m weiß, 1161660","20.51%","21.51%","B002THAD9A","Kopp 129713007 3-fach Steckdosenleiste Standard, mit beleuchtetem Schalter, weiß","11.85%","8.18%"
"Amazon.de","kleiderschrank",731,"B009V81B7I","Wimex 163771 Schwebetürenschrank 198 x 180 x 64 cm, Front anthrazit und Glas schwarz, Korpus Alu-Nachbildung","15.18%","8.85%","B00B3LW6LQ","Wimex 153453 Kleiderschrank, 4-türig mit zwei Schubkästen und zwei Spiegeltüren, Korpus, 180 x 198 x 58 cm, anthrazit","13.10%","6.19%","B012SL0382","Wimex 450547 Kleiderschrank 5-türig, Alpinweiß, Absetzungen, anthrazit","10.77%","6.19%"
"Amazon.de","nespresso",732,"B004JV77QQ","De'Longhi Nespresso EN 125.S Kapselmaschine (1260 Watt, 0,7 Liter, Pixie Electric) silber","20.20%","32.79%","B00G98EJHM","Krups Nespresso XN1001 Inissia Kaffeekapselmaschine, weiß","18.27%","19.82%","B00T4GWHKM","De'Longhi Nespresso EN 550.W Lattissima Touch Kapselmaschine (1400 Watt, inklusiv Welcome Pack mit 16 Kapseln) weiß","11.90%","6.56%"
"Amazon.de","barbie pferd",733,"B071J3G2TH","Mattel Barbie FTF02 - Traumpferd und Puppe, laufendes Pferd mit Berührungs- und Geräuschsensoren","28.19%","36.20%","B06XHLJDBY","Mattel Barbie FRV36 - Traumpferd und Puppe, laufendes Pferd mit Berührungs- und Geräuschsensoren","19.21%","20.74%","B01ARGBPBO","Mattel Barbie DMC30 - Barbie Die große Hundesuche, Tanzspaß Pferd und Puppe","15.46%","14.63%"
"Amazon.de","schneeketten",734,"B00318CAYM","pewag Schneeketten 58575 brenta 9 XMB 73 , 1 Paar","38.21%","46.08%","B008CM7DXU","Michelin 92303 Textilschneeketten Easy Grip L13, ABS und ESP kompatibel, TÜV/GS und ÖNORM, 2 Stück","7.80%","2.91%","B00440CWI0","pewag Schneeketten 37017 servo RS 73 , 1 Paar","7.72%","9.29%"
"Amazon.de","ps4 konsole",735,"B0774QFGQ1","PlayStation 4 - Konsole (500GB, schwarz, E-Chassis) inkl. 2. DualShock Controller","25.40%","43.77%","B0765F7HM6","PlayStation 4 - Konsole (1TB, schwarz, slim) inkl. StarWars Battlefront II + 2 DualShock Controller","9.64%","16.98%","B00BIYAO3K","PlayStation 4 - Konsole (500GB)","7.75%","2.83%"
"Amazon.de","outlander",736,"B01HEB8DL0","Outlander - Die komplette erste Season [6 DVDs]","22.20%","34.20%","B075WZ4Q4B","Outlander - Die komplette dritte Season [5 DVDs]","17.18%","8.07%","B01J6T8OIK","Outlander - Die komplette zweite Season [6 DVDs]","15.33%","21.52%"
"Amazon.de","puzzle 1000 teile ravensburger",737,"B01LYO00CD","Ravensburger 19684 - Magische Märchenstunde Erwachsenenpuzzle","18.93%","17.44%","B01NH0USHR","Ravensburger Puzzle 19712 - Großartiges New York Erwachsenenpuzzle","8.74%","8.22%","B00HFR4M8C","Ravensburger 19371 - 99 Beautiful Places on Earth Puzzle","8.02%","8.32%"
"Amazon.de","ordner",738,"B01MQQQKGU","DINOR™ Ordner-Wolkenmarmor Recycling 8 cm breit DIN A4 schwarz 10er Pack Made in Germany Ringordner Aktenordner Briefordner Büroordner Pappordner Schlitzordner Grüner Balken Blauer Engel","20.71%","34.07%","B01HR1SLO6","Leitz 11160089 Multifunktions-Ordner (A4, Abgerundeter Rücken 8,2 cm Breite, Gummibandverschluss, Kunststoff, Active Urban Chic) dunkelgrau","9.53%","7.53%","B005LIMES2","PLUS Japan Zero Max Platzsparordner A4-Überbreite Rosa, dehnbar bis zu 10cm, für 800 Blatt","7.33%","2.47%"
"Amazon.de","pj masks",739,"B06WVDR3QM","Simba 109402040 - PJ Masks Hauptquartier Spielset","19.91%","11.76%","B06XNJ6RFT","PJ Masks Deluxe 16-teiliges-Figuren-Set","13.21%","6.79%","B06VY4HL4Y","Simba 109402086 - PJ Masks Eulette mit Eulengleiter","6.84%","8.20%"
"Amazon.de","kontaktgrill",740,"B00JQ4RM2K","Tefal GC702D Optigrill (2000 W, Standard-Modell, automatische Anzeige des Garzustandes, 6 voreingestellte Grillprogramme) schwarz/silber","35.41%","28.61%","B0051FDKEM","Tefal GC3060 Kontaktgrill 3-in-1 (2000 Watt, 19 x 31,5 cm) silber","15.01%","17.97%","B06W9JMQT1","Tefal GC241D Kontaktgrill Inicio, integrierter Thermostat, 2000 W, edelstahl / schwarz","11.26%","11.82%"
"Amazon.de","lego batman",741,"B06X92M583","Lego 70917 The Batman Movie Das ultimative Batmobil, Batman Spielzeug","15.81%","10.29%","B01J41DHSC","Lego 10737 Juniors Batman gegen Mr. Freeze, Superhelden-Spielzeug für vier bis sieben Jährige","12.99%","15.64%","B01J41HPQ2","Lego 70900 The Batman Movie Jokers Flucht mit den Ballons, Batman Spielzeug","9.78%","13.91%"
"Amazon.de","go pro",742,"B01M14ATO0","GoPro HERO5 Black Action Kamera (12 Megapixel) schwarz/grau","30.55%","24.40%","B074X5WPC5","GoPro HERO6 Black Kamera","20.76%","6.94%","B01N3Q4DLS","APEMAN Action Cam 1080P Full HD Unterwasser Aktion kamera wasserdicht Helmkamera 170 ° Weitwinkel mit Zubehör Kits","16.42%","38.69%"
"Amazon.de","marvel",743,"B008PBA60U","Marvel Limited Blu-ray Edition (Hulk vs.Thor & Wolverine, The Invincible Iron Man, The Next Avengers, Planet Hulk & Thor - Tales of Asgard) (5 Disc Set) [Limited Collector's Edition]","30.56%","14.52%","B01FLRLPPA","Winning Moves WIN44338 - Monopoly: Marvel Comic Retro Spiel - Deutsch","6.73%","7.12%","B01CNOVC5W","Marvel Thermoeffekt Becher [Andere Plattform]","6.47%","9.90%"
"Amazon.de","under armour",744,"B01HJ0YRDY","Under Armour Herren Fitness T-Shirt UA Tech Tee","18.21%","25.29%","B01M3PWHIV","Under Armour Herren Ua Tech 1/4 Zip Fitness-Sweatshirts","11.96%","13.30%","B00RKBOORC","Under Armour Cc Sportstyle Logo Herren Fitness - T-Shirts","8.84%","8.87%"
"Amazon.de","schnellkochtopf",745,"B00RHK1A8W","Tefal P2530738 Secure 5 Neo Schnellkochtopf 22 cm, 6 L, inklusive Korbeinsatz","29.59%","34.56%","B000UAOJ2A","WMF Perfect Schnellkochtopf 6,5l ohne Einsatz Ø 22cm Made in Germany Innenskalierung Cromargan Edelstahl induktionsgeeignet","15.60%","18.67%","B003FN66AM","Elo 99276 Schnellkochtopf / 6 L / Edelstahl","6.29%","8.12%"
"Amazon.de","vikings",746,"B01IAQ0LEK","Vikings - Season 1 [3 DVDs]","30.73%","39.56%","B073SMCQ6V","Vikings - Season 4 Volume 1 [3 DVDs]","20.61%","14.02%","B01F31QJ8C","Vikings - Die komplette Season 3 [3 DVDs]","8.55%","10.90%"
"Amazon.de","jbl charge 3",747,"B01FQVHGSG","JBL Charge 3 Tragbarer Bluetooth-Lautsprecher (wasserdicht, mit 6000 mAh Power Bank und Freisprechfunktion) schwarz","63.47%","71.70%","B01G7IU634","JBL Charge 3 Tragbarer Bluetooth-Lautsprecher (wasserdicht, mit 6000 mAh Power Bank und Freisprechfunktion) grau","7.52%","6.05%","B01G7IU616","JBL Charge 3 Tragbarer Bluetooth-Lautsprecher (wasserdicht, mit 6000 mAh Power Bank und Freisprechfunktion) türkis","7.51%","7.95%"
"Amazon.de","feuerzangenbowle",748,"B00004RYMZ","Die Feuerzangenbowle","20.48%","26.43%","B00008WVDP","Kela 366160 Glas-Feuerzangenbowle-Set, Heinz Rühmann, 15-teilig, 3,5 l, Feuerzangenbowle Heinz Rühmann","18.43%","13.91%","B0018NY6L2","APS 65065 Feuerzangenbowle Hot Pot, 5-teilig","18.24%","14.24%"
"Amazon.de","tonie box",749,"B01F5QQQEM","Toniebox Starterset Rot mit Hörfigur Löwe","44.62%","13.51%","B01F5T2ECC","Boxine 10901-1033 - Tonie Die Maus Mauserlesene Lieder, Lernspielzeug","20.83%","16.22%","B01F5SCFZO","Toniebox Starterset mit Hörfigur Löwe Hellblau","13.93%","5.41%"
"Amazon.de","aquabeads",750,"B00TKNMQLO","Aquabeads 79308 - Kinder Bastelset starter set","22.83%","26.00%","B00TKNMU2O","Aquabeads 79328 - Künstlerkoffer, Kinder Bastelsets","14.39%","16.78%","B00TKNNFLO","Aquabeads 79448 - Maxi-Sternenschatulle, Kinder Bastelsets","11.58%","10.11%"
"Amazon.de","e zigarette",751,"B005GOVCCU","DIPSE e Dampfer / e Zigarette / e Verdampfer Starterset / eZigarette Starter Set - 2x eGo-T mit 1100mAh Evod, CE4 inklusive 10 x 1,5ml Liquid ohne Nikotin (0,0mg)","53.69%","74.79%","B01ERPNUK0","Eleaf iStick Pico - Neu 75W TC Set Von Eleaf - Schwarz","24.73%","13.45%","B01AEG65JY","Eleaf iJust 2 Elektronische Zigarette ohne Tabak und Nikotin 5,5&nbsp;ml 2600&nbsp;mAh","4.82%","4.20%"
"Amazon.de","calvin klein",752,"B00LATFR62","Calvin Klein Damen Bustier MODERN COTTON - BRALETTE","21.78%","29.08%","B00MHK1HR6","Calvin Klein Damen String MODERN COTTON - THONG","17.39%","16.33%","B00LATFQYK","Calvin Klein Damen Schlafanzughose MODERN COTTON - PJ PANT","8.92%","2.55%"
"Amazon.de","fitzek",753,3426199211,"Flugangst 7A: Psychothriller","45.83%","51.11%",3426521083,"AchtNacht: Thriller","8.58%","9.29%",3426633094,"Die Therapie","7.47%","8.16%"
"Amazon.de","huawei mate 10 lite",754,"B076CJFW9C","Huawei Mate 10 lite Dual-Sim Smartphone (14,97 cm (5,9 Zoll), 64GB interner Speicher, Android 7.0) graphite schwarz","69.48%","73.96%","B076CHRGYW","Huawei Mate 10 lite Dual-Sim Smartphone (14,97 cm (5,9 Zoll), 64GB interner Speicher, Android 7.0) prestige gold","15.39%","19.72%","B076CJK4WB","HUAWEI 51091WQY Mate10 lite Dual-Sim Smartphone (14.97 cm (5.9 Zoll), 64 GB interner Speicher, 4 GB RAM, 16 MP + 2 MP Kamera, Android 7.0, EMUI 5.1) Aurora Blau","5.12%","2.46%"
"Amazon.de","nikolaus geschenke",755,"B00DI3HWXO","Confiserie Heidel Weihnachts-Nostalgie Geschenk Säckchen, 1er Pack (1 x 158 g)","17.03%","15.82%","B019W5VZIO","Sheepworld 59255 Lieblingstasse Traumfrau, Porzellan, mit Geschenkanhänger","8.36%","16.18%","B073RM6KQV","sheepworld 45139 Tasse mit Motivdruck Ohne Schwester ist alles doof., Porzellan, Geschenktasse","8.29%","10.18%"
"Amazon.de","badewannen spielzeug",756,"B0007D7O22","TOMY Wasserspiel für Kinder Okto Plantschis mehrfarbig - hochwertiges Kleinkindspielzeug - Spielzeug für die Badewanne - ab 12 Monate","23.26%","26.09%","B00BF3IO22","HABA 6699 - Kugelbahn für die Badewanne","13.51%","8.98%","B00ERK6HU6","Playgro 40115 Badespielzeug- Geschenkset","11.27%","13.75%"
"Amazon.de","furreal friends",757,"B06XYSRJXX","Hasbro FurReal Friends B9070100 - Benni der sprechende Beagle, Elektronisches Haustier","15.11%","21.16%","B06XYTJMYN","Hasbro FurReal Friends B9071100 - Tyler der Königstiger, Elektronisches Haustier","14.38%","12.01%","B06X9BMNV9","Hasbro FurReal Friends B9073EU4 - Mein verspieltes Eisbär Baby, Elektronisches Haustier","9.74%","15.27%"
"Amazon.de","jbl bluetooth kopfhörer",758,"B01M6WNWR6","JBL T450BT Kabelloser On-Ear Bluetooth Kopfhörer mit Integrierter Musiksteuerung und Mikrofon Kompatibel mit Apple und Android Geräten -Schwarz","31.70%","39.64%","B01M5BURG9","JBL E45BT On-Ear Ohraufliegender Bluetooth Kopfhörer Faltbar Inkl. Abnehmbares Verwicklungsfreies Textilkabel mit Universeller 1-Tasten-Fernbedienung mit Integriertem Mikrofon - Schwarz","14.32%","9.51%","B01M2XPWJF","JBL E55BT Kabelloser Over-Ear-Kopfhörer, schwarz","9.87%","5.61%"
"Amazon.de","logitech tastatur",759,"B01L6L46LK","Logitech G213 Gaming-Tastatur Prodigy (mit RGB-Hintergrundbeleuchtung, QWERTZ Deutsches Tastaturlayout)","24.41%","17.44%","B01GHP1IDY","Logitech G910 Mechanische Gaming-Tastatur Orion Spectrum (mit RGB Deutsches Tastaturlayout)","14.40%","6.64%","B00E6KGKXG","Logitech K280e Tastatur (Kabelgebunden, Business-Tastatur, QWERTZ, Deutsche Layout) schwarz","8.85%","15.66%"
"Amazon.de","led",760,"B00H9DY5EI","LED Strip Licht Streifen 5m Band Leiste mit 300 LEDs (SMD 3528) inkl. Netzteil & Fernbedienung","68.04%","71.12%","B00VQ63HLQ","Philips LEDclassic Lampe ersetzt 60 W, E27, warmweiß (2700K), 806 Lumen, Doppelpack","7.23%","13.35%","B0711MQKJX","Briloner Leuchten -  LED TV Beleuchtung, LED Band Dimmbar, Selbstklebend, 2m, USB-Anschluss, geeignet für 32-78 Zoll, Licht-Leiste 48 x RGB-LED Farbwechsel, Lichterkette","5.55%","3.54%"
"Amazon.de","adidas jogginghose herren schwarz",761,"B019ZGT352","adidas Herren Hose Condivo 16 Training Pants","29.61%","14.17%","B00MTS18O8","adidas Herren Trainingshose Sereno 14","28.15%","43.74%","B00T0QDRWS","adidas Herren Hose Essentials Stanford Basic","6.42%","9.78%"
"Amazon.de","hundespielzeug große hunde",762,"B0054Q9TMA","Trixie Dog Activity Flip Board Strategiespiel für Hunde, 23 cm","21.88%","15.80%","B0029EWVES","Trixie 35912 Geier Gustav, Plüsch, 28 cm","16.94%","17.75%","B00B4UR08K","KONG wildknots Plüschbär, Medium/Large, sortiert","8.79%","10.06%"
"Amazon.de","transformers",763,"B00P95QOPQ","Hasbro Transformers B0899ES0 - Robots In Disguise 3-Step Changers Optimus Prime, Actionfigur","12.10%","4.57%","B01N23UX9E","Hasbro Transformers C0641Es0 - Robots In Disguise Hyperchange Heroes 3-Step Bumblebee, Actionfigur","10.95%","6.32%","B00R2DH3Z8","Hasbro Transformers B0910ES0 - Robots in Disguise Warriors Strongarm, Actionfigur","9.85%","7.49%"
"Amazon.de","s7",764,"B01BTZFM0W","Samsung Galaxy S7 Smartphone (5,1 Zoll (12,9 cm) Touch-Display, 32GB interner Speicher, Android OS) schwarz","53.82%","59.45%","B01BTZFQX0","Samsung Galaxy S7 Smartphone (5,1 Zoll (12,9 cm) Touch-Display, 32GB interner Speicher, Android OS) gold","15.96%","19.49%","B01E1QP8NM","Samsung Galaxy S7 Smartphone (5,1 Zoll (12,9 cm) Touch-Display, 32GB interner Speicher, Android OS) silber","7.03%","8.38%"
"Amazon.de","spielzeug ab 3 jahren junge",765,"B00ID4DG3S","HEROS 100039016 - Constructor Rennauto, 50-teilig - Holz-Konstruktionsset - 3 verschiedene Modelvarianten baubar - Made in Germany","11.35%","16.74%","B000JWCJJO","Noris Spiele 606049101 - Hammerspiel Kinderspiel","8.84%","10.68%","B00ATY5WC8","Ravensburger 24726 - Wir spielen Baustelle","8.74%","7.16%"
"Amazon.de","schreibtischlampe",766,"B074YZGPM5","Schreibtischlampe LED Kinder 7W TaoTronics Stimmungslampe Atmosphärenlampe dimmbar mit Schwanenhals, Touchfeld für Farblicht, batteriebetrieben bis zu 6 Stunden","36.47%","41.83%","B000WL6BOQ","Maul Schreibtischlampe MAULstudy, Design Klemmleuchte Metall, Exklusive Leuchtmittel, Schwarz, 8230590, 1 Stück","24.54%","23.97%","B001F5U78Y","Maulatlantic Schreibtischlampe, Klemmfuß, 1700 Lux, 6500 Kelvin, GS-geprüft,  schwarz8213503","6.85%","3.70%"
