Abteilung,Suchbegriff,Suchhäufigkeit,ASIN,Nr. 1 der geklickten Titel,Klickfreigabe,Umwandlungs-Anteil,ASIN,Nr. 2 der geklickten Titel,Klickfreigabe,Umwandlungs-Anteil,ASIN,Nr. 3 der geklickten Titel,Klickfreigabe,Umwandlungs-Anteil
Amazon.de,bose kopfhörer,"99,89",B01E3SNO1G,Bose QuietComfort 35 kabellose Kopfhörer schwarz,"24,31","3,57",B0117RGG8E,Bose SoundLink around-ear kabellose Kopfhörer II schwarz,"15,98","20,75",B0117RFPCC,Bose SoundSport in-ear Kopfhörer für Samsung und Android Geräte schwarz,"8,9","12,39"
Amazon.de,desigual,"99,89",B01LWORY8U,"Desigual Damen T-Shirts TS_ARCANO, Orange (GERANIUM 7054), Large (Herstellergröße: X-Large)","2,54","0,28",B01M1L33IL,Desigual Damen BOLS_DALLAS IVYBLUE Umhängetasche Beige (1001),"2,3","0,73",B01M014GW5,DESIGUAL Damen-Halskette Global traveller Versilbert-72G9EC22028U,"1,96","1,32"
Amazon.de,diesel herrenuhr,"99,89",B00KMGPH7I,Diesel Herren-Uhren DZ4318,"13,94","5,39",B00AEFCUDQ,Diesel DZ4282 Herren Uhr,"7,32","4,19",B00M9U8XZS,Diesel Herren-Uhren DZ7312,"6,47","5,03"
Amazon.de,drohne,"99,89",B01K4U4O9S,Parrot Bebop 2 FPV Drohne im Set mit Skycontroller und FPV-Brille weiß,"19,91","9,43",B013J39S0M,DJI Phantom 3 Standard,"14,75","2,66",B01M1080NT,DJI Mavic Pro Fly More Combo grau,"7,07","0,65"
Amazon.de,duschvorhang,"99,89",B00W02UDI0,"InterDesign Duschvorhang aus Stoff | wasserdichter Duschvorhang mit verstärktem Saum | waschbarer Textil Duschvorhang in der Größe 180,0 cm x 200,0 cm | Polyester dunkelgrau","25,88","8,3",B004Z211IY,"InterDesign Duschvorhang aus Stoff | wasserdichter Duschvorhang mit verstärktem Saum | waschbarer Textil Duschvorhang in der Größe 183,0 cm x 183,0 cm | Polyester rosa","6,63","4,95",B00R2SHZ06,InterDesign Medallion Textil Duschvorhang | 183 cm x 183 cm Duschabtrennung für Badewanne und Duschwanne | Vorhang aus Stoff mit verstärkter Oberkante | Polyester aquamarin,"6,22","3,11"
Amazon.de,fön,"99,89",B00BCQIK4O,"Philips Ionen-Haartrockner HP8232/00, 2200 Watt, weiß","20,51","6,27",B00BCQIIMS,"Philips Haartrockner HP8230/00, 2100 Watt, schwarz","19,47","7,99",B005ZMO8LU,"AEG Haartrockner HTD 5584 Brown, braun (metallic) silber","6,05","4,93"
Amazon.de,gleitgel,"99,89",B007NC8Z0A,"Durex Perfect Glide, 1er Pack (1 x 50 ml)","15,83","0,71",B019I3ODO8,"Durex Play Feel Gleitgel, 1er Pack (1 x 100 ml)","14,91","0,41",B00UCZOQ1M,"Durex Play Prickelnd Gleit- und Erlebnisgel, 1er Pack (1 x 50 ml)","10,98","2,7"
Amazon.de,gta 5 ps4,"99,89",B00KW2FKAQ,Grand Theft Auto V - [PlayStation 4],"89,5","92,64",B072M7NPMC,FIFA 18 - Standard Edition - [PlayStation 4],"1,78","0,13",B0725Z5FMF,Far Cry 5 - Standard Edition - [PlayStation 4],"1,6",0
Amazon.de,gutschein amazon,"99,89",B00X67BMTC,Amazon.de Grußkarte mit Geschenkgutschein - 15 EUR (Happy Birthday Ballons),"36,47","17,4",B06XJ3THFV,,"12,99","11,31",B01EAMRCZE,Amazon.de Geschenkgutschein in Geschenkbox - 20 EUR (Alle Anlässe),"12,99","9,38"
Amazon.de,jbl xtreme,"99,89",B010SZFU9C,"JBL Xtreme Spritzwasserfester Tragbarer Bluetooth Lautsprecher mit 10,000 mAh Akku, Dualem USB-Ladeanschluss und Freisprechfunktion - Blau","40,54","27,81",B010SWJVS6,"JBL Xtreme Spritzwasserfester Tragbarer Bluetooth Lautsprecher mit 10,000 mAh Akku, Dualem USB-Ladeanschluss und Freisprechfunktion - Schwarz","21,48","24,7",B0116XPT46,"JBL Xtreme Spritzwasserfester Tragbarer Bluetooth Lautsprecher mit 10,000 mAh Akku, Dualem USB-Ladeanschluss und Freisprechfunktion - Rot","11,14","24,38"
Amazon.de,katzenklo,"99,89",B002S53480,"Stefanplast  CATHY F Katzentoilettenhaus m. Türe+Filter, blau, 56x40x40cm","14,11","9,2",B00I7WL962,Curver Katzentoilette Sicherheit anthrazit,"12,46","5,66",B00ZE27570,Clean'n'Tidy Katzenklo und Spielstation,"8,45","3,83"
Amazon.de,liebeskind geldbörse,"99,89",B01MSCVE50,"Liebeskind Berlin Damen Sally7 Vintag Geldbörse, Grau (Elephant L), 2.3x9.3x19 cm","13,23","14,98",B01N3AHPGU,"Liebeskind Berlin Damen Slam7 Vintag Geldbörse, Schwarz (Black), 2x10x19 cm","7,37","6,99",B01MPYE7TJ,"Liebeskind Berlin Damen Sallys7 Sodiam Geldbörse, Schwarz (Nairobi Black), 20x10x3 cm","4,92","1,59"
Amazon.de,malbuch für erwachsene,"99,89",3868839356,Fuck - Das ultimative Fluch- und Schimpfmalbuch für Erwachsene,"10,99","1,91",3863554388,Inspiration Traumreise: 50 Ausmalmotive für mehr Entspannung und Achtsamkeit (Farbe rein – Stress raus),"7,08","5,36",B013F67PL2,Erwachsenen-Malbuch - KREATIVE AUSZEIT - 78 filigrane Motive - inklusive 15er Pack point 88 Fineliner,"6,5","3,68"
Amazon.de,michael kors damenuhr,"99,89",B009DFSRZS,Michael Kors Damen-Uhren MK3192,"7,18","4,91",B01N02FW6J,Michael Kors Damen-Smartwatch MKT5001,"4,45","0,77",B00FZE1AZU,Michael Kors Damen-Uhren MK5896,"3,8","2,81"
Amazon.de,mikrowellen,"99,89",B00BRH5B6I,Samsung MS23F301EASEG Mikrowelle / 23 L / 800 W / schwarz / silber / Premium Select Line elektronische Steuerung,"21,86","0,94",B00IKDAPRW,"Severin MW 7875 Mikrowelle (700 Watt, 20 Liter, Garraum) silber","10,38","1,37",B00KHT1CCY,"Samsung GE89MST-1XEG Grill-Mikrowelle (1.200 W) schwarz / silber, 23 l","7,51","0,71"
Amazon.de,monopoly,"99,89",B00AZBUKD6,"Hasbro Spiele 00009398 - Monopoly Classic, Familienspiel","20,63","8,72",B01IO5ANJ0,"Hasbro B6677100 - Monopoly Banking Ultra, Familienspiel","14,22","10,17",B00IPZ0TSU,"Hasbro Monopoly A4770398  - Monopoly Imperium - Edition 2014, Spiel","8,98","13,15"
Amazon.de,ninjago,"99,89",B01J41IPYS,LEGO Ninjago 70621 - Vermillion Falle,"6,88","3,39",B01AC1BJEC,LEGO NINJAGO 70591 - Kryptarium-Gefängnisausbruch,"5,69","4,64",B01J41IPGQ,LEGO Ninjago 70622 - Wüstenflitzer Spielzeug,"5,63","2,22"
Amazon.de,notebook,"99,89",B01N5OBU2X,"Asus E200HA-FD0042TS 29,4 cm (11,6 Zoll) Notebook (Intel Atom x5-Z8350, 2GB RAM, 32GB eMMC, Intel HD Graphics, Win 10) blau","24,28","20,62",B01F94XBZ2,"Lenovo Miix 310 25,65 cm (10,1 Zoll HD) Tablet PC (Intel Atom x5-Z8350 Quad-Core Prozessor, 4GB RAM, 64GB eMMC, Intel HD Grafik, Touchscreen, Windows 10) silber inkl. AccuType QWERTZ  Tastatur","9,94","1,25",B01MQLSQL9,"Asus E200HA-FD0043TS 29,4 cm (11,6 Zoll) Notebook (Intel Atom X5-Z8350, 2GB RAM, 32GB eMMC, Intel HD-Grafik, Win 10 Home) gold","8,47","16,5"
Amazon.de,philips sonicare,"99,89",B00J59G236,"Philips Sonicare EasyClean Elektrische Zahnbürste mit Schalltechnologie HX6510/22, weiß","16,4","3,11",B00E62DUTG,"Philips Sonicare DiamondClean Elektrische Schallzahnbürste, HX9352/04, 2 Watt, schwarz","13,99","1,89",B013ZR4QJU,"Philips Sonicare FlexCare+ Elektrische Zahnbürste mit Schalltechnologie HX6972/35, weiß, Doppelpack","10,34","0,68"
Amazon.de,puppenwagen,"99,89",B00C7R8XK8,"Bayer Design 13057 - Puppenwagen Trendy, pflaume","9,79","8,56",B00LD4Q8DK,"Bayer Design 1307800 - Puppenwagen Trendy, grau/pink","4,63","4,59",B007TSM3L0,"Bayer Chic 2000  555 24 - Puppenwagen Smarty, Funny Pink","4,5","3,81"
Amazon.de,samsung galaxy s8,"99,89",B06XJ49G5B,"Samsung Galaxy S8 Smartphone (5,8 Zoll (14,7 cm) Touch-Display, 64GB interner Speicher, Android OS) midnight black","43,99","24,13",B06XHRDF78,"Samsung Galaxy S8 Smartphone (5,8 Zoll (14,7 cm) Touch-Display, 64GB interner Speicher, Android OS) orchid grey","15,59","17,66",B06XJ65K58,"Samsung Galaxy S8 Smartphone (5,8 Zoll (14,7 cm) Touch-Display, 64GB interner Speicher, Android OS) arctic silver","10,35","16,75"
Amazon.de,samsung gear s3,"99,89",B01LF0T51I,"Samsung SM-R760NDAADBT Gear S3 frontier Smartwatch (3,3 cm (1,3 Zoll) Display, NFC, Bluetooth, WLAN, Tizen OS, mit Silikon-Armband)","63,18","23,21",B01LF0T540,"Samsung Gear S3 classic (3,3 cm (1,3 Zoll) Display, NFC, Bluetooth, WLAN, Tizen OS), mit Echtleder-Armband","23,42","12,01",B014WGN4MI,Samsung Gear S2 Classic - Schwarz,"4,1","37,28"
Amazon.de,schreibtisch,"99,89",B01M6YXRW2,"Phönix 806259WE Schreibtisch, Holz, weiß, 70 x 120 x 66 cm","22,48","8,74",B00AXWLBLC,"FMD Möbel 353-001 Winkelkombination LEX Tisch circa 136 x 75 x 68 cm, montiert Regal circa 137 x 71 x 33 cm, weiß","15,34","5,46",B003CGWGHY,"Demeyere 1001 Schreibtisch Aristote, 3 Schubladen und 1 Nischen, merano / weiß","7,4","22,94"
Amazon.de,schwimmflügel,"99,89",B000JWJDXY,Flipper Swim Safe Schwimmhilfe,"42,95","11,24",B01AK0B9P4,"Bema 18001 - Happy People, Schwimmflügel, orange, 11-30 kg (1-6 years)","9,35","9,91",B00TV5QPNG,"Sevylor Kinder Schwimmhilfe Puddle Jumper Deluxe, Grün (Face)","7,03","0,6"
Amazon.de,tastatur,"99,89",B00E6KGKXG,"Logitech K280e Tastatur (Kabelgebunden, Business-Tastatur, QWERTZ, Deutsche Layout) schwarz","16,89","11,58",B00N3OCV7U,"Sharkoon Skiller Pro beleuchtete Gaming Tastatur (9 Multimedia-, 6 Makro- und 3 Profil-Tasten, Software, USB) schwarz","15,13","9,11",B008IL952C,"Logitech Wireless Combo MK330 - schnurlose Tastatur und Computermaus (2,4GHz, USB, QWERTZ deutsches Tastaturlayout) schwarz","12,18","0,93"
Amazon.de,ue boom 2,"99,89",B0141208EA,"Ultimate Ears BOOM 2 Kabelloser und Bluetooth Lautsprecher (Wasserfest und Stoßfest) schwarz, grau","52,88","5,34",B013JLHLYY,Ultimate Ears BOOM 2 Kabelloser und Bluetooth Lautsprecher (Wasserfest und Stoßfest) wolkenweiß,"7,11","4,09",B01GFOAXUQ,"Ultimate Ears BOOM 2 Kabelloser und Bluetooth Lautsprecher (Wasserfest und Stoßfest) schwarz, grau, weiß","4,55","3,15"
Amazon.de,wäschekorb,"99,89",B00576BLL4,"Wenko 3440113100 Wäschesammler Trio Beige - Wäschekorb, Fassungsvermögen 130 L, 100 % Polyester, 63 x 57 x 38 cm, beige","13,92","5,47",B00C0WB1U4,"Relaxdays Wäschesammler LINEA Bambus H x B x T: ca. 73 x 37 x 33 cm Wäschekorb mit 2 Fächern als Ablage als praktischer Wäschepuff aus waschbarem Leinen zum Herausziehen mit seitlichen Griffen, natur","7,51","2,52",B008F78QTW,"Curver 00709-885-00 Wäschebox Style, 40 L, creme","7,23","5,67"
Amazon.de,xbox one,"99,89",B01MUCTUQX,Xbox One S 500GB Konsole - Forza Horizon 3 Bundle,"20,12","0,58",B016ZLYVKM,Xbox One 500 GB Konsole 2015,"7,65","60,15",B01NBWTYLI,Xbox One S 1TB Konsole - Forza Horizon 3 Bundle,"6,82","5,31"
Amazon.de,aptamil,"99,88",B01GDZSZ6Q,"Aptamil Kindermilch 1+, 5er Pack (5 x 600 g)","16,95","9,52",B014HGVU1K,"Aptamil Kindermilch 2+, 5er Pack (5 x 600 g)","13,05","3,1",B00D8V08UK,"Aptamil Pronutra Pre Anfangsmilch, von Geburt an, 4er Pack (4 x 800 g)","12,82","9,04"
Amazon.de,beats kopfhörer,"99,88",B01LVVF94H,Beats by Dr. Dre EP Kopfhörer schwarz,"19,09","12,11",B01LW36ADS,Beats by Dr. Dre Solo 3 Wireless Kopfhörer rosé-gold,"15,72","7,37",B00KD805BS,Beats by Dr. Dre Solo2 Kopfhörer (On-Ear) schwarz,"14,3","15,48"
Amazon.de,brotdose kinder,"99,88",B00J8JR3UE,"Emsa 513791 Brotdose für Kinder, Herausnehmbare Trennwand, Farmmotiv, Grün, Variabolo Farm Family","14,07","4,07",B00INTKKQE,"sigikid, Mädchen, Brotdose mit buntem Druck, Brotzeitbox Pinky Queeny, Pink, 24472","10,84","5,28",B019QMSLX0,"Lässig Kinder Lunch-box Brotdose Snackbox mit herausnehmbaren Fächern auslaufsicher und dicht, Wildlife Turtle","7,97","7,09"
Amazon.de,calvin klein damen,"99,88",B00SX2726C,"Calvin Klein Damen Bustier MODERN COTTON - BRALETTE, Gr. 36 (Herstellergröße: S), Grau (GREY HEATHER 020)","6,39","1,68",B01NALS2RU,"Calvin Klein Jeans Damen T-Shirt Tika-1 True Icon CN Lwk S/S, Weiß (Bright White 112), 38 (Herstellergröße: M)","5,43","1,14",B01NCQRR98,Calvin Klein Damen ED1TH SMALL TOTE Tote Schwarz (BLACK ),"5,25","0,37"
Amazon.de,crocs kinder,"99,88",B01HEXEY3O,"crocs Unisex-Kinder Crocbandclogk Clogs, Blau (Navy/Red), 22-23 EU","21,89","10,33",B01HEOH67O,"crocs Unisex-Kinder Classic Kids Clogs, Pink (Candy Pink), 27-28 EU","12,39","7,9",B0071F2PTG,"Crocs Crocs Classic, Unisex-Kinder Clogs, Blau (Ocean), 27-29","5,6","1,98"
Amazon.de,dji spark,"99,88",B0723DCXWM,DJI Spark Drohne alpine weiß,"52,9","39,3",B0714Q9ZL2,DJI Spark Drohne Combo meadow grün,"13,97","19,55",B072M1N5SZ,DJI Spark Drohne Combo lava rot,"13,2","23,46"
Amazon.de,dvd player,"99,88",B00BSCAB76,"Sony DVP-SR170 DVD-Player (SCART, NTSC, PAL) schwarz","30,17","23,45",B01GOEM7MO,"Xoro HSD 8470 HDMI MPEG4 DVD-Player (USB 2.0, Mediaplayer, 1080p Upscaling, MultiROM) schwarz","16,84","15,39",B014P07FPS,"Samsung BD-J4500R Blu-ray Player (HDMI, USB 2.0) schwarz","11,13","2,46"
Amazon.de,dyson,"99,88",B01E02Q656,"Dyson DC62 beutel- & kabelloser Staubsauger inkl. schmaler Elektrobürste mit Nylonborsten & Carbonfasern und Fugendüse / Handstaubsauger mit Lithium-Ionen Akku, Wandhalterung & Ladestation","14,31","9,55",B00M8YTI3G,"Dyson DC33c Origin beutelloser Staubsauger inkl. umschaltbarer Bodendüse mit Saugkraft-Regulierung, Kombi- & Polsterdüse / Bodenstaubsauger mit Energieeffizienzklasse A","12,54","1,03",B01I959APS,"Dyson V8 Absolute 164533-01 Akkusauger (kabellos, beutellos, Wandhalterung) gelb / nickel","10,75","6,86"
Amazon.de,flip flops damen,"99,88",B00M17LFWM,"Havaianas Slim Damen Zehentrenner, Braun( Rose Gold), 39/40 EU ( 37/38 Brazilian)","8,07","1,79",B002JCSYCS,"Crocs Crocband flip 11033 Unisex-Erwachsene Zehentrenner, Gr. 39/40 EU, Blau (Navy 410)","4,18","0,55",B01N95T0L2,"Roxy Damen Lahaina Zehentrenner, Mehrfarbig (Black), 39 EU","3,15","4,42"
Amazon.de,htc u11,"99,88",B0725GZ3SW,"HTC U11 Smartphone (13,97cm (5,5 Zoll), 16 MP Frontkamera, 64GB Speicher, Android) Brilliant Black","48,11","33,7",B071YZXG8H,"HTC U11 Smartphone (13,97cm (5,5 Zoll), 16 MP Frontkamera, 64GB Speicher, Android) Sapphire Blue","30,08","22,79",B072F85JB2,"HTC U11 Smartphone (13,97cm (5,5 Zoll), 16 MP Frontkamera, 64GB Speicher, Android) Ice White","6,86","22,36"
Amazon.de,kleiderschrank,"99,88",B012SL0382,"Wimex 450547 Kleiderschrank 5-türig, Alpinweiß, Absetzungen, anthrazit","13,02","4,42",B009V81B7I,"Wimex 163771 Schwebetürenschrank 198 x 180 x 64 cm, Front anthrazit und Glas schwarz, Korpus Alu-Nachbildung","12,25","4,42",B00B3LW6E8,"Wimex 119453 Kleiderschrank, 4-türig mit zwei Schubkästen und zwei Spiegeltüren, Front Korpus Außentüren Eiche Sägerau Nachbildung, 180 x 198 x 58 cm","8,56","3,98"
Amazon.de,kontaktgrill,"99,88",B00JQ4RM2K,"Tefal GC702D Optigrill, Standard-Modell, 2000 W, automatische Anzeige des Garzustandes, 6 voreingestellte Grillprogramme, Edelstahl schwarz/silber","16,31","3,62",B0051FDKEM,"Tefal GC3060 Kontaktgrill 3-in-1 (2000 Watt, 19 x 31,5 cm) silber","13,85","1,09",B00HLC64TQ,Clatronic MG 3519 Multigrill,"9,05","9,6"
Amazon.de,lego nexo knights,"99,88",B06VV73L98,LEGO Nexo Knights 70356 - Der stürmische Steinkoloss,"9,41","3,65",B013JQDXKA,LEGO Nexo Knights 70317 - Fortrex - Die rollende Festung | Ritterburg,"6,16","4,44",B01J41JKVA,LEGO Nexo Knights 70352 - Jestros Monströses Monster-Mobil,"5,87","2,44"
Amazon.de,liebeskind,"99,88",B01L70ITQS,"Liebeskind Berlin Damen Tumba Tgoat Schultertasche, Grau (Hyena Grey), One Size","2,72","0,4",B01MDNDCN6,"Liebeskind Berlin Damen Katima Weave Umhängetasche, Schwarz (Nairobi Black), One Size","2,35","0,21",B01BZXRMGK,"Liebeskind Berlin Damen Maike6 Vintag Umhängetaschen, Braun (Cognac 0006), 23 x 16 x 10 cm","2,26","1,88"
Amazon.de,mini kühlschrank,"99,88",B00K8O20N8,Bomann KB 389 Mini-Kühlschrank / A++ / 51 cm Höhe / 84 kWh/Jahr / regelbarer Thermostat / Kühlmittel R600a / weiß,"26,13","17,24",B00B6VFTTE,Mobicool F16 Minikühlschrank 230 Volt [Energieklasse A++] dunkelblau,"15,72","16,94",B000OLTWYU,"CocaCola 525600 Mini-Kühlschrank / 47,7 cm Höhe / 12/230 Volt / rot","15,18","8,56"
Amazon.de,mobile baby,"99,88",B003I7OHSS,Bieco 23-021096 - 3D Holz Mobile Käferchen,"10,05","7,96",B00PI0J4CM,Mattel Fisher-Price CDN41 3-in-1 Traumbärchen Mobile,"8,41","4,67",B00TYL9OGW,Fehn 071214 Musik-Mobile Sleeping Forest,"6,73","8,22"
Amazon.de,nintendo,"99,88",B01N5OPMJW,Nintendo Switch Konsole Neon-Rot/Neon-Blau,"20,22","0,68",B00NGCILS2,Nintendo 2DS - Konsole (schwarz) inkl. New Super Mario Bros. 2 (vorinstalliert),"12,63","3,18",B071NJBW3J,New Nintendo 2DS XL Schwarz + Türkis,"8,98","1,35"
Amazon.de,oculus rift,"99,88",B01MCRY3Q7,,"46,75",0,B00ZFOGHRG,Oculus Rift,"36,8","9,04",B00910B3B0,"PS3 - Gaming Seat ""Gyroxus""","4,68",0
Amazon.de,ps 4 spiele,"99,88",B01MTX8L70,The Last of Us Part II [PlayStation 4],"4,35",0,B071K5VB69,Metro Exodus [Day One Edition] - [PlayStation 4],"4,05",0,B06W9L2KY3,Crash Bandicoot N.Sane Trilogy - [PlayStation 4],"3,99","0,53"
Amazon.de,rasenmäher,"99,88",B0032TJFOS,"Bosch DIY Rasenmäher Rotak 32, Grasfangbox 31 l (1200 W, Schnittbreite 32 cm, Schnitthöhe 20-60 mm)","22,78","14,45",B00HVFQ5NS,"Bosch DIY Rasenmäher Rotak 40, Grasfangbox 50 l (1700 W, Ergoflex-System, Schnittbreite 40 cm, Schnitthöhe 20-70 mm)","12,42","5,26",B00T38HNQ4,"Einhell Elektro Rasenmäher GC-EM 1536 (1500 W, 36 cm Schnittbreite, 38 l Fangsack, 25-65 mm Schnitthöhe, Highwheeler)","7,55","11,04"
Amazon.de,reisebett,"99,88",B004AHLMEM,"Hauck 604489 Reisebett Dream n Play, 60x120 cm, water blue","20,18","9,86",B004AHLMF6,"Hauck 603673 - Reisebett Dream'n Play Plus 60x120cm, beige/grey","18,3","10,44",B004AHLMEW,"Hauck 603666 Reisebett Dream'n Play Plus 60x120cm, navy/aqua","12,58","7,81"
Amazon.de,rucksack herren,"99,88",B0035WJ0HO,"Jack Wolfskin Unisex Rucksack Perfect Day, schwarz, 48 x 36 x 4cm, 22 liters, 24040","19,33","7,26",B00ZUWDYF6,"Under Armour Herren Multisport Rucksäcke daypack, Red/Gph/Slv, 18 x 12 x 8 cm, 24 Liter 1273274","15,1","14,96",B004CCRUAK,"Travelite Rucksack BASICS, schwarz (01), 30x41x20 cm, 22 Liter, 96245-01","9,08","9,84"
Amazon.de,samsung galaxy s8 hülle,"99,88",B01N9Y504T,"Samsung EF-ZG950CBEG Clear View Hülle (geeignet für Samsung S8), Schwarz","44,04","20,87",B01N5W90KS,"Samsung Clear View Klappcover(Standfunktion, inkl. Semi-transparenter Vorderseite, geeignet für Galaxy S8+) schwarz","10,09","2,71",B06XXFL6ZK,mumbi UltraSlim Hülle für Samsung Galaxy S8 Schutzhülle im Mandala Design transparent rosa (Ultra Slim - 0.70 mm),"9,5","34,78"
Amazon.de,sandalen damen,"99,88",B01N3PA7ZR,"Tamaris Damen 28117 Offene Sandalen , Pink (Rose Gold 582), 39 EU","5,15","0,66",B01MTTY7MW,"Another Pair of Shoes Damen SelmaE1 Offene Sandalen mit Keilabsatz, Braun (Mid Brown21), 39 EU","5,02","0,91",B000EDMSEE,"CONVERSE Chuck Taylor All Star Seasonal Ox, Unisex-Erwachsene Sneakers, Weiß (Optical White), 38 EU","2,33","0,03"
Amazon.de,smart watch,"99,88",B01LX09XIV,Fossil Q Herren Smartwatch FTW2106,"15,88","9,04",B01LF0T51I,"Samsung SM-R760NDAADBT Gear S3 frontier Smartwatch (3,3 cm (1,3 Zoll) Display, NFC, Bluetooth, WLAN, Tizen OS, mit Silikon-Armband)","15,36","0,2",B01JUHZ8G4,Fossil Q Unisex-Armbanduhr FTW20012,"9,39","0,11"
Amazon.de,sonnenschirm,"99,88",B01M0PU96R,"Nexos Sonnenschirm, anthrazit, 300x300 cm rund, Gestell Stahl, Bespannung Polyester, 6.5 kg","12,4","5,8",B00AKQNKSI,"Schneider Sonnenschirm Locarno, natur, 200 cm rund, Gestell Stahl, Bespannung Polyester, 2.4 kg","10,9","1,63",B00BUIH0QS,"Ultranatura Ampelschirm der Bahamas Serie – Kurbelschirm, freischwebend aufgehängt, nutzbar als Balkonschirm, Gartenschirm, Terrassenschirm – Ampelschirm einfach per Kurbel aufspannbar, Grün","7,95","0,34"
Amazon.de,steckdosenleiste,"99,88",B000MQ7E38,"Brennenstuhl Eco-Line, Steckdosenleiste 8-fach, (mit Schalter und 3m Kabel - besonders stromsparend) Farbe: schwarz","9,16","6,62",B002MQGGMQ,"Brennenstuhl Eco-Line, Steckdosenleiste 3-fach (mit Schalter und 1,5m Kabel - besonders stromsparend) Farbe: weiß","8,97","3,76",B002THAD9A,"Kopp 129713007 3-fach Steckdosenleiste Standard, mit beleuchtetem Schalter, weiß","7,64","3,68"
Amazon.de,tischventilator,"99,88",B003WQI6E6,"mumbi USB Ventilator Mini für den Schreibtisch mit An/Aus-Schalter, schwarz","19,6","6,14",B00PHV8I6U,"mumbi USB Ventilator - Mini Fan für den Schreibtisch mit An / Aus-Schalter, rosa","12,23","5,03",B00PHV8ELY,"mumbi USB Ventilator - Mini Fan für den Schreibtisch mit An / Aus-Schalter, grün","11,59","4,6"
Amazon.de,trinkflasche kinder,"99,88",B01LA75KGA,"Camelbak Kinder Eddy .4L Trinkflasche, Hip Hippos, 0.4 Liter","9,66","5,84",B00DZIAA9U,"Contigo Trinkflasche Swish, Magenta, 1000-0239","7,68","0,56",B01L76TD1C,"Ion8 auslaufsichere Wasserflasche / Trinkflasche, BPA-frei","7,58","7,62"
Amazon.de,wickelauflage,"99,88",B00TV6NNA8,"roba Wickelauflage Little Stars, 85 x 75 cm, weiche Wickelunterlage, Baby Wickeltischauflage PU beschichtet","15,45","6,64",B00GSVEMRM,"Julius Zöllner Wickelauflageauflage Softy, 75x85 cm, Kleine Eulen rosa","12,61","7,88",B00NY1AWKK,"Julius Zöllner 2220125000 Wickelauflage Softy, Gr. 75/85 cm, Disney - Pooh mein Stern","7,67","5,99"
Amazon.de,wlan repeater,"99,88",B009CXPY0W,"AVM FRITZ!WLAN Repeater 310 (300 Mbit/s, WPS), weiß, deutschsprachige Version","31,44","7,33",B00A0VCJPI,"TP-Link TL-WA850RE WLAN Repeater(300 Mbit/s, App Steuerung, 1 Port, WPS, LED abschaltbar, kompatibel mit allen WLAN Geräten)","19,87","10,33",B00N80IK88,"AVM FRITZ!WLAN Repeater 1750E (Dual-WLAN AC + N bis zu 1.300 MBit/s 5 GHz + 450MBit/s 2,4 GHz), weiß, deutschsprachige Version","8,16","2,09"
Amazon.de,braun silk epil 9,"99,87",B01MUHILO5,"Braun Silk-épil 9 SkinSpa Epilierer 9-961v, mit 12 Extras, inkl. Rasieraufsatz, Tiefenmassage-Pad, weiß/gold","27,52","2,62",B01N2990FJ,"Braun Silk-épil 9 Epilierer 9-561, mit 6 Extras, inkl. Rasieraufsatz, Trimmeraufsatz, weiß/gold","20,07","3,47",B06WD37ZSP,"Braun Silk-épil 9 SkinSpa Epilierer 9-969v, mit 12 Extras, inkl. Tiefenmassage-Pad, Peelingbürsten, weiß","15,62","2,71"
Amazon.de,drehmomentschlüssel,"99,87",B003A7IZV6,Unitec Drehmomentschlüssel mit Nüssen 20809,"22,81","20,86",B001R4BR1O,Mighty Werkzeug Drehmomentschlüssel,"13,43","4,82",B000S7ZRQM,"Proxxon Drehmomentschlüssel 23353 MicroClick MC200 Antrieb 12,5mm (1/2"")","12,9","9,27"
Amazon.de,dx racer,"99,87",B0056YNWVO,"DX Racer1 Schreibtischstuhl mit Armlehnen, Gestell Nylon, 86x69x35 cm, schwarz/rot","44,81","5,93",B00BU2S8YW,"DX Racer5 Schreibtischstuhl mit Armlehnen, Gestell Nylon, 78x52 x124-134 cm, schwarz/grau","21,86","6,03",B009S68I6A,"DX Racer6 Schreibtischstuhl mit Armlehnen, Gestell Kunststoff, 78x52x124-134 cm, schwarz/weiß","13,64","6,33"
Amazon.de,eastpak rucksack,"99,87",B000CRBEJ2,"Eastpak Rucksack Padded Pak'r, 24 L, Black","27,54","16,09",B000RE5A4U,"Eastpak Rucksack Wyoming, black, 24 liters, EK811008","17,1","10,14",B000CRDBFM,"Eastpak Rucksack PROVIDER, 33 liter, Black","7,62","3,81"
Amazon.de,filofax,"99,87",B00SKPZ2RS,"Filofax 22514 Organizer Personal Domino, türkis","12,33","8,99",B06WVH16QY,"Filofax 22577 Terminplaner, Personal Domino Soft Pale, rosa","7,3","4,91",B06X6MVY87,"Filofax 22582 Terminplaner, Pocket Domino Soft Pale, blau","6,09","6,5"
Amazon.de,fire hd 8,"99,87",B01J94TL6Q,"Das neue Fire HD 8-Tablet, 20,3 cm (8 Zoll) HD Display, 16 GB (Schwarz), mit Spezialangeboten",56,"4,67",B01J94T224,"Das neue Fire HD 8-Tablet, 20,3 cm (8 Zoll) HD Display, 32 GB (Schwarz), mit Spezialangeboten","18,33","4,05",B01AHBC23E,"Fire HD 8-Tablet, 20,3 cm (8 Zoll) HD Display, WLAN, 16 GB (Schwarz) - mit Spezialangeboten","11,64","60,25"
Amazon.de,fjällräven rucksack,"99,87",B002OWETK4,"Fjällräven Unisex Rucksack Kånken, graphite, 27 x 13 x 38 cm, 16 Liter, 23510-031","24,18","7,54",B01E5G21JM,"Fjällräven Re-Kånken Unisex Rucksack, Slate, 13 x 27 x 38 cm","7,81","10,28",B017YCTI3Q,"Fjällräven Kånken Rucksack, Plum, 38 x 27 x 13 cm, 16 Liter","5,51","3,58"
Amazon.de,freundebuch schule,"99,87",3407794754,Mein Kinder Künstler Freundebuch,"7,4","3,66",B015SN7Y0W,Meine Freunde - Mit zauberhaften Ausmalbildern,"5,52","2,19",B00GY8IE5A,Mein erstes Schuljahr: Erinnerungsalbum,"4,78","0,75"
Amazon.de,föhn,"99,87",B00BCQIK4O,"Philips Ionen-Haartrockner HP8232/00, 2200 Watt, weiß","25,63","9,35",B00BCQIIMS,"Philips Haartrockner HP8230/00, 2100 Watt, schwarz","17,98","8,98",B00E4G95Y8,"Remington D5220 Ionen-Haartrockner mit Diffusor, 2400 Watt","6,62","0,98"
Amazon.de,gaming tastatur,"99,87",B00N3OCV7U,"Sharkoon Skiller Pro beleuchtete Gaming Tastatur (9 Multimedia-, 6 Makro- und 3 Profil-Tasten, Software, USB) schwarz","26,51","19,43",B0169TBEJ6,"Sharkoon Skiller Pro Plus beleuchtete Gaming Tastatur (Onboard-Speicher, Multi-Key-Rollover-Unterstützung) schwarz","10,15","0,74",B00ZRUWU92,Sharkoon Shark Zone K30 Gaming-Tastatur mit LED-Beleuchtung schwarz,"9,53","20,87"
Amazon.de,gaskocher,"99,87",B0001P08WY,"Campingaz 40470 Campingkocher Camping 206, Gr. S (20,4 x 12,2 x 12,2 cm)","22,25","5,3",B01CXY9HYA,"Campingaz Camp Bistro XL Campingkocher, 2000030643","20,68","1,65",B006Z9783W,"Campingaz Mehrflammkocher Base Camp, blau, 43 x 25 x 7,5cm, 2000010110","9,95","3,53"
Amazon.de,gin,"99,87",B008JAAT5Y,Monkey 47 Schwarzwald Dry Gin (1 x 0.5 l),"10,9","2,08",B005RYHCUU,Tanqueray London Dry Gin (1 x 1 l),"9,65","0,53",B00BBTIONE,Bombay Sapphire London Dry Gin (1 x 1 l),"7,85","0,47"
Amazon.de,headset,"99,87",B00CJ5FPUE,Logitech G430 Gaming Kopfhörer (Dolby 7.1-Surround-Sound für PC und PS4) blau,"18,93",4,B005HWEYN0,Sennheiser PC 3 Chat Headset,"13,96","13,65",B00SF6NR5G,Plantronics Explorer 50 Bluetooth Headset,"6,54","2,62"
Amazon.de,hundebett,"99,87",B00P7HJN4A,"Hound Hundebett Comfort, Medium","25,08","9,84",B008AVLV9U,"Hundebett Hundesofa Hundekorb Tierbett Verschiedene Größen und Farben Cordura Comfort (XL - 82x62x24, 2 - schwarz)","6,89","7,01",B00PDS7X2M,Hound Hundebett Comfort,"6,12","4,05"
Amazon.de,kalender 2018,"99,87",3840780012,Buchkalender Balacron schwarz 2018 - Bürokalender A5 / Cheftimer A5 - 1 Tag 1 Seite - 320 Seiten,"6,16","7,67",B06XY4P5ZS,Chäff-Timer Classic A5 Kalender 2017/2018 [lila Mantra] 18 Monate Juli 2017-Dezember 2018 - Terminkalender mit Wochenplaner - Organizer - Wochenkalender,"5,92","0,77",B06XG1PYZN,"Sigel J8101 Wochenkalender Jolie 2018, ca. A5, indigo blue - viele Modelle","5,77","1,5"
Amazon.de,kärcher fenstersauger,"99,87",B01N5I45TE,"Kärcher Fenstersauger WV 5 Premium mit wechselbarem Akku - inkl. 2 Saugdüsen (280 und 170 mm), Sprühflasche mit Mikrofaserwischer und Fensterreinigerkonzentrat (Reinigungsleistung: ca. 35 Fenster)","45,96","11,49",B0017S4YN8,Kärcher Fenstersauger WV 50 plus,"9,91",9,B00HUORV7Y,Kärcher 1.633-301.0 Fenstersauger WV2 Plus,"8,4","5,06"
