Abteilung,Suchbegriff,Suchhäufigkeit,ASIN,Nr. 1 der geklickten Titel,Klickfreigabe,Umwandlungs-Anteil,ASIN,Nr. 2 der geklickten Titel,Klickfreigabe,Umwandlungs-Anteil,ASIN,Nr. 3 der geklickten Titel,Klickfreigabe,Umwandlungs-Anteil
Amazon.de,sleek,"99,69",B01AT33NOM,"Sleek Makeup Highlighting Palette Solstice, 1er Pack (1 x 9 g)","15,72","3,29",B01LX9PHGV,"Sleek Makeup Nordic Skies I-Divine Eyeshadow Palette Limited Edition, 1er Pack (12 x 0,8 g)","9,52","0,69",B01CIQ7TF2,"Sleek Makeup I-Divine A New Day, 1er Pack (1 x 9,6 g)","9,14","1,07"
Amazon.de,spielzeug ab 3 jahren,"99,69",B00TQPVCHK,"Noris Spiele 606038000 - Riesenpuzzle Feuerwehr, 45-teilig","4,38","1,69",B019YZ6K0K,KOSMOS Spiele 697655 - Connis erste Spiele,"4,33","0,71",B01N5K3EPL,Ravensburger tiptoi 00800 - Starter-Set mit Stift und Wörter-Bilderbuch ab 3 Jahren,"3,97","0,07"
Amazon.de,under armour herren,"99,69",B00F0P2H06,"Under Armour Men's Tech Short Sleeve Tech Short Sleeve T-shirt, Schwarz (Black), Gr. M","7,84","2,75",B00AM3WTG8,"Under Armour Herren Fitness Sweatshirt Ua Tech 1/4 Zip, Rot (Red), L, 1242220","6,42","3,08",B01HY1AJTO,"Under Armour Ua 8 Woven Graphic Shorts, Herren Fitness - Hosen & Shorts, Schwarz (Black), L","3,45","0,31"
Amazon.de,wachsmalstifte,"99,69",B00BQQO4MW,"Faber-Castell 120011 - Wachsmalkreiden Jumbo, 12-er Box","16,79","8,94",B000JWJ9ZQ,"Pelikan 722942 - Wachsmalstifte 665 / 8d dreieckig, wasserfest","14,37","6,28",B000ET7F8C,"Crayola Mini Kids 52-016T 24 dreieckige Buntstifte, A","10,24","6,89"
Amazon.de,waschtrockner,"99,69",B00XC4V1A4,Siemens WD15G442 iQ500 Waschtrockner / 1088 kWh / 8kg Waschen / 5kg Trocknen / Weiß / Großes Display mit Endezeitvorwahl,"21,69","5,42",B008O6TTZY,LG F1496AD3 Frontlader Waschtrockner / B / 8 kg / 6 Motion DirectDrive / Smart Diagnosis/ weiß,"13,75","6,15",B015FPXL8W,AEG L76680NWD Waschtrockner / Energieklasse A / 1086 kWh / Wolletrockenprogramm / weiß,"5,97","3,92"
Amazon.de,wii u spiele,"99,69",B01KMCXBLA,Super Mario 3D World - Nintendo Selects - [Wii U],"7,68","5,53",B00KX8DQIM,The Legend of Zelda: Breath of the Wild - [Wii U],"6,68","0,66",B01CYL16UA,Wii Party U - Nintendo Selects - [Wii U],"5,62","11,94"
Amazon.de,wäschetrockner,"99,69",B00JGWVGN8,Siemens iQ700 WT46W261 iSensoric Wärmepumpentrockner / A++ / 8 kg / Weiß / Selbstreinigender Kondensator / softDry-Trommelsystem / Super40,"19,12","1,7",B004EPYJYU,Beko DCU 7330 Kondenstrockner / B / 504 kWh/Jahr / 7 kg / Weiß / Multifunktionsdisplay / Knitterschutz / Schontrommel / Trommelbeleuchtung / Super Express - Programm /  Reversierende Trommelbewegungen / FlexySense - elektronische Feuchtemessung,"13,44","2,94",B00HX0X7GO,Bosch WTW86271 Wärmepumpentrockner / A++ / 8 kg / Weiß / Selbstreinigender Kondensator,"10,49","0,71"
Amazon.de,besteckkasten für schubladen,"99,68",B00E6OZ26I,"Kesper 30087 Besteckkasten ausziehbar, Kunststoff, Maße: 29 -50 cm x 38 x 6.5 cm, grau","17,03","12,56",B00CFPCWMC,"Rotho Besteckkasten DOMINO 7 Fächer, Schubladeneinsatz variabel für Besteck, aus Kunststoff (PP) in weiß, Besteckeinsatz für Schubladen bis 60 cm Breite, ca. 39,7 x 34 x 5 cm","12,17","5,12",B005LVFOFY,"Relaxdays Besteckkasten aus Bambus H x B x T: ca. 33,5 x 29 - 45 x 5 cm ausziehbarer Besteckeinsatz als Küchenorganizer und Schubladeneinsatz große Besteckeinlage mit 5 bis 7 Fächern Organizer aus Holz, natur","10,94","8,12"
Amazon.de,bohrmaschine,"99,68",B00359F2UG,"Bosch DIY Schlagbohrmaschine PSB 500 RE, Tiefenanschlag, Zusatzhandgriff, Koffer (500 Watt, max. Bohr-Ø: Holz: 25 mm, Beton: 10 mm)","18,45","3,81",B001349SOQ,Makita HR 2470 SDS-Plus-Bohrhammer,"7,65","1,19",B00359F2VU,"Bosch DIY Schlagbohrmaschine PSB 750 RCE, Tiefenanschlag, Zusatzhandgriff, Koffer (750 Watt, max. Bohr-Ø: Holz: 30 mm, Beton: 14 mm)","6,72","2,69"
Amazon.de,bosch küchenmaschine,"99,68",B0041G5R3Y,"Bosch MUM56340 Küchenmaschine Styline MUM5 (900 Watt, Edelstahl-Rührschüssel, Durchlaufschnitzler, Rühr-Schlagbesen und weiteres Zubehör) silber","17,1","0,5",B004MPQQ02,"Bosch MUM4880 Küchenmaschine MUM4 (600 Watt, Edelstahl-Rührschüssel, Durchlaufschnitzler, Mixeraufsatz Kunststoff, Fleischwolf, Zitruspresse, Rezept DVD) weiß","11,85","8,31",B00008K5XU,"Bosch MUM4405 Küchenmaschine MUM4 (500 Watt, 3.9 Liter) weiß","10,94","10,53"
Amazon.de,couchtisch,"99,68",B00MPNAKVE,trendteam CT Couchtisch Wohnzimmertisch Tisch| Nussbaum Satin| 110 x 65 cm,"7,94","2,83",B01NAGT45H,"Funktionscouchtisch Ben, Dekor Betonoptik, 78 x 78 x 34 cm, 360° drehbar  Apollo","6,23","12,37",B01M8HXBUN,"Relaxdays Couchtisch Holz FLAT 2er Set natur HBT 27 x 80 x 80 cm großer Wohnzimmertisch passt ineinander als Satztisch flacher Beistelltisch mit Chrom-Metall für Stube als Sofatisch, dunkel-braun","5,07",0
Amazon.de,deckenleuchte,"99,68",B00L342BEK,"Ranex Ceiling Dream Collection Moderne Deckenleuchte, Durchmesser 40 cm, grau / satinierte Abdeckung 6000.544","27,04","5,54",B00MILS3YO,"Philips myLiving LED Deckenleuchte Cinnabar, 600 lm, 27,4 x 27,4 x 7,7 cm, weiß 333613116","13,84","1,25",B00HU8X5O8,"Trio Leuchten Deckenleuchte in nickel matt, Stoffschirm weiß 603900301","6,45","0,47"
Amazon.de,dvd,"99,68",B01N3CW1RO,Fifty Shades of Grey - Gefährliche Liebe (Unmaskierte Filmversion),"9,08","0,98",B01MPZB3U0,Phantastische Tierwesen und wo sie zu finden sind,"5,75","0,52",B01MY38YGH,Vaiana,"5,6","0,68"
Amazon.de,f1 2017,"99,68",B072J37P4Y,F1 2017 Special Edition - [Playstation 4],"67,36","15,22",B07235P3TJ,F1 2017 Special Edition - [PC] - [AT-PEGI],"10,33","51,19",B072J37P56,F1 2017 Special Edition - [Playstation 4] - [AT-PEGI],"6,05","19,91"
Amazon.de,gesichtsreinigungsbürste,"99,68",B00NABOT8U,"Beurer FC 45 Gesichtsbürste, weiß","46,9","20,6",B00DGL1QGW,"Olaz Regenerist 3 Zone Reinigungssystem, 1er Pack (1 x 1 Stück)","11,29","5,94",B00LZPLRCE,"Braun Face Gesichtsepilierer und Gesichtsreinigungsbürste 810, silber/weiß","9,16","0,7"
Amazon.de,instax mini 8,"99,68",B009ZM9R4O,Fujifilm  Instax Mini 8 Sofortbildkamera,"25,5","3,68",B00AWKJPOA,"Fujifilm Instax Mini 8, Sofortbildkamera, Kamera, blau","12,78","3,89",B0000C73CQ,"Fujifilm Instax Mini Instant Film, Weiß, Doppelpackung","11,86","0,64"
Amazon.de,kokosöl,"99,68",B013JOSM1C,"mituso Bio Kokosöl, nativ, 1er Pack (1 x 1000 ml) im Drahtbügelglas","32,44","0,84",B013GBN8MG,"MeaVita Bio Kokosöl, nativ, 1er Pack (1 x 1000 ml) im Bügelglas","23,93","12,09",B01EOUWB8A,"Danlee Kokosnussöl, kaltgepresst - nativ, 1er Pack (1 x 500 ml)","11,67","18,23"
Amazon.de,kopfhörer kinder,"99,68",B00K78Z6M2,Philips SHK2000BL/00 Leichtkopfhörer inkl. Laustärkebegrenzung blau,"22,32","13,61",B005OQ5ZM8,JVC HA-KD5-P-E Kinder Stereo Kopfhörer pink,"15,93","15,77",B00NBR705M,"Sony MDR-ZX110 faltbarer Bügelkopfhörer Leistungsstarker Klang, rosa","12,73","7,08"
Amazon.de,kärcher,"99,68",B00HH9QAME,Kärcher K 2 Compact Home Hochdruckreiniger,"17,52","9,49",B0185UN2PG,"Kärcher Hochdruckreiniger K 4 Full Control inkl. Pistole mit Druckanzeige,Vario Power Jet Strahlrohr und Dreckfräser, Reinigungsmittel-Ausbringung und Quick Connect Funktion (max. 20-130 bar, 400 l/h)","10,21","8,72",B00HH9QAT2,"Kärcher Hochdruckreiniger K 2 Basic inkl. Dreckfräser Strahlrohr und Quick Connect Funktion (max.110 bar, 360 l/h)","5,78","9,01"
Amazon.de,lehrerkalender 2017 2018,"99,68",B06Y2F693J,,"18,35","17,44",B06WW49M1K,"Oxford 400080258 Lehrerkalender 2017/2018, A4, dunkelblau","16,71","15,04",B01N4FXP8J,"Busy B Akademischer Terminkalender mit Punkten, von August 2017 bis August 2018 mit Steckfächern sowie zwei Termin- und Stundenplänen","14,19","2,16"
Amazon.de,luftpumpe,"99,68",B001R4BQB0,"BETO Hochdruck Standpumpe, Gold/Schwarz","27,04","6,71",B000NCJEH0,"Intex Luftpumpe Hochleistungshandpumpe, Schwarz, 48 cm","11,11","2,42",B01EBXZNXA,"Fischer Mini-pumpe Doppelhub reversibel, schwarz, 85593","10,88","7,42"
Amazon.de,motorradhelm,"99,68",B005BJS85O,"Protectwear H520-ES-M Motorradhelm,Integralhelm mit Integrierter Sonnenblende, Größe M, Schwarz-Matt","12,07","16,58",B00GTR0EX6,SOXON ST-550 Fighter · Urban Motorrad-Helm Scooter-Helm Integral-Helm Sturz-Helm Sport Helmet Roller-Helm Cruiser · ECE zertifiziert · inkl. Sonnenvisier · inkl. Stofftragetasche · Schwarz · L (59-60cm),"11,48","6,03",B002BAWVWW,"Protectwear H510-11BL-S Motorradhelm, Integralhelm mit Drachendesign, Größe S, Schwarz/Silber/Blau","8,25","6,03"
Amazon.de,nike,"99,68",B00RD8IRK2,"Nike Jungen Kapuzenpullover Team Club, Schwarz (Black/football White), S","10,22","8,57",B00UCEQXT6,"Nike Kinder Jacke Sideline Team, schwarz (black/White), S","10,09","14,03",B01MU384QL,"Nike B NK Air Hoodie PO BF Sweatshirt für Jungen, Grau (Sequoia / Legion Green / Max Gold), M","8,81","12,86"
Amazon.de,pampers,"99,68",B00TRYMNT6,"Pampers Premium Protection New Baby Windeln, Gr. 1 Newborn (2-5 kg), Halbmonatsbox, 1er Pack (1 x 72 Stück)","30,35","11,66",B01GUYA6DK,"Pampers Sensitive Feuchttücher, 1008 Tücher, 18er Pack (18 x 56 Stück)","13,54","8,54",B00AR9HWZ0,"Pampers Baby Dry Windeln, Gr. 4 (8-16 kg), Monatsbox, 1-er Pack (1 x 174 Stück)","10,27","2,51"
Amazon.de,philips avent,"99,68",B009ODOVXQ,"Philips Avent Anti-Kolik Naturnah SCD290/00, Flaschenset für Neugeborene","9,71","0,74",B00E6QIV50,"Philips Avent SCD560/00 DECT Babyphone (Smart Eco Mode, Temperatursensor )","8,17","0,5",B017443YVG,Philips Avent SCF875/02 4-in-1 Babynahrungszubereiter (Dampfgarer und Mixer),"5,35","7,94"
Amazon.de,pulsuhr,"99,68",B000I6FN5I,Beurer PM 25 Pulsuhr,"16,46",21,B00NPZ7WNU,"Polar M400 GPS-Laufuhr, schwarz, 90051092","13,27","2,4",B00VRYOQE4,"POLAR Pulsuhr A300 HR, Schwarz, 90051953","8,71","7,54"
Amazon.de,s8,"99,68",B06XJ49G5B,"Samsung Galaxy S8 Smartphone (5,8 Zoll (14,7 cm) Touch-Display, 64GB interner Speicher, Android OS) midnight black","52,66","14,68",B06XJ65K58,"Samsung Galaxy S8 Smartphone (5,8 Zoll (14,7 cm) Touch-Display, 64GB interner Speicher, Android OS) arctic silver","10,04","9,57",B06XHRDF78,"Samsung Galaxy S8 Smartphone (5,8 Zoll (14,7 cm) Touch-Display, 64GB interner Speicher, Android OS) orchid grey","7,83","4,53"
Amazon.de,schnurloses telefon,"99,68",B00EDQ4IMS,"Gigaset A415 Telefon, Schnurlostelefon / Mobilteil, Grafik Display, Dect-Telefon, ohne Anrufbeantworter, Freisprechfunktion, Analog Telefon, Desktop Phone, schwarz","13,73","0,8",B00EHMDCTS,Gigaset C430A Duo,"7,29","3,01",B00EDQ5084,"Gigaset C430 DECT-Schnurlostelefon (TFT-Farbdisplay, 128 x 160 Pixel, Analog, Babyphone) Silber/Schwarz","6,18","2,68"
Amazon.de,side by side kühlschrank,"99,68",B01KOXODNW,LG Electronics GSJ 361 DIDV Side by Side / A+ / 179 cm / 429 kWh/Jahr / 394 L Kühlteil / 197 Gefrierteil / Digitaldisplay mit Temperaturregelung / No Frost / dunkel graphite,"15,69","1,26",B01KU0HAAM,LG Electronics GSL 361 ICEZ Side by Side / A++ / 179 cm / 375 kWh/Jahr / 394 L Kühlteil / 197 Gefrierteil / Digitaldisplay mit Temperaturregelung / No Frost / dunkel graphite,"9,24","1,09",B009CG50D0,Samsung RS7578THCSREF Side-by-Side Kühlschrank / A++ / 359 L Kühlteil / 176 L Gefrierteil / edelstahl / Twin Cooling,"6,97","0,98"
Amazon.de,sophia thiel,"99,68",3742301179,Einfach schlank und fit: Mit 120 Rezepten zur Traumfigur. Mit Ernährungstipps aus meinem Erfolgscoaching.,"37,52","38,44",3742304240,Fit durchs Jahr mit Sophia: Wochenkalender 2018,"16,61","18,61",B01M7YXLWV,,"15,3","3,13"
Amazon.de,victorinox messer,"99,68",B0001P151W,Victorinox Offiziersmesser Huntsman rot 1.3713,"10,14","3,73",B00BMTWS9E,"Victorinox 67833.S6 SwissClassic Tafelmesser/Tomatenmesser/Brotzeitmesser/Wurstmesser-Set 6-teilig mit Wellenschliff, schwarz","6,86","5,06",B0001P15B2,Victorinox Taschenwerkzeug Rucksack rot 111 mm 0.8863,"4,4","2,13"
Amazon.de,wasserpistole,"99,68",B017TUBVQ0,"Hasbro Supersoaker A9461EU6 - Microburst II, Wasserpistole","18,99","9,69",B00LX4HZXW,Idena 8040009 - Feuerwehr Wasserspritze circa 40 cm,"12,87","5,98",B019PA53ES,"Hasbro Super Soaker B4438EU4 - Breach Blast, Wasserpistole","10,73","4,8"
Amazon.de,baby born zubehör,"99,67",B01MFAAU13,"Zapf Creation 823750 - Baby born Play und Fun Deluxe Schwimm Set, Puppen",5,"4,35",B019F0FYII,"Zapf Creation 822265 - Baby born, Komfortsitz, rosa","4,47","6,51",B019F0G97S,"Zapf Creation 822173 - Baby born, Accessoires-Set, rosa","3,95","5,7"
Amazon.de,baustellenradio,"99,67",B01E8AO1KM,"Makita Baustellenradio Ohne Akku, DMR107","15,78","7,1",B01HMZWC4C,"Makita Akku-Baustellenradio 7,2-18 V, DMR108","15,06","2,63",B008ZPTMKQ,"Bosch Professional GML 10,8 V-LI Akku-Baustellenradio (für 10,8 V Akkubetrieb, Aux-In (3,5 mm), ohne Akku, Netz-Adapter, Karton) schwarz/blau, 0601429200","12,02","8,82"
Amazon.de,bügelbrettbezug,"99,67",B002LLN7NI,"Wenko Bügeltischbezug Air Comfort, Gepolsterter Bügelbrettbezug, Geeignet für Dampfbügeleisen, Größe L, 125 x 45cm","16,8","4,69",B003IX0B6E,"WENKO 1236645500 Bügeltischbezug Green Flowers - dampfbügelgeeignet, Baumwolle, Mehrfarbig","10,94","9,45",B00B81RHGK,"Vileda Premium 2 in 1 140511 Bügeltischbezug, Silber-Grau","9,48","2,97"
Amazon.de,dect telefon,"99,67",B00EDQ4IMS,"Gigaset A415 Telefon, Schnurlostelefon / Mobilteil, Grafik Display, Dect-Telefon, ohne Anrufbeantworter, Freisprechfunktion, Analog Telefon, Desktop Phone, schwarz","16,81","1,4",B01BBWWFB2,"AVM FRITZ!Fon C5 DECT-Komforttelefon (für FRITZ Box, hochwertiges Farbdisplay, HD-Telefonie, Internet-/Komfortdienste, Steuerung FRITZ!Box-Funktionen) deutschsprachige Version","12,37","2,23",B01BI8HG5Y,Gigaset C430HX,"6,73","4,92"
Amazon.de,ebook reader,"99,67",B00QJDO0QC,"Kindle Paperwhite eReader, 15 cm (6 Zoll) hochauflösendes Display (300 ppi) mit integrierter Beleuchtung, WLAN (Schwarz) - mit Spezialangeboten","30,52","0,6",B0186FESVC,"Kindle eReader, 15,2 cm (6 Zoll) Touchscreen ohne Spiegeleffekte, WLAN (Schwarz) - mit Spezialangeboten","16,47","21,35",B01J90P010,"Das neue Fire 7-Tablet, 17,7 cm (7 Zoll) Display, 8 GB (Schwarz), mit Spezialangeboten","10,96","0,08"
Amazon.de,einhorn kuscheltier,"99,67",B00BNTH7AS,"Aurora World 21246 - Dreamy Eyes Einhorn 12In/30.5 cm, weiß","13,79","17,22",B01MXEPZ4O,"Nici 40107.0 - Einhorn Theodor stehend, Plüsch, 45 cm","13,19","6,68",B01MTL83HX,"Nici 40105.0 - Einhorn Rainbow Flair mit Flügel stehend, Plüsch, 32 cm","12,93","1,57"
Amazon.de,einwegkamera,"99,67",B008B6HD96,TopShot Einwegkamera mit 27 Fotos + eingebautem Blitz Einwegkamera Paket mit 5 Kameras,"34,43","12,9",B008B6HCJ2,"TopShot Love weiss Einwegkamera / Hochzeitskamera (27 Fotos, Blitz, 12-er Pack)",16,"7,96",B0170FN5JA,"TopShot Love Hearts red Einwegkamera / Hochzeitskamera (27 Fotos, Blitz, 6+1 Pack)","11,38","12,54"
Amazon.de,esprit kleid,"99,67",B01N5QV9T0,"edc by ESPRIT Damen Kleid 057CC1E004, Rot (Red 630), 36 (Herstellergröße: S)","1,95","0,88",B01N7J0YKD,"ESPRIT Collection Damen Kleid 037EO1E015, Braun (Taupe 240), 38","1,34",0,B01N4PMGG1,"edc by ESPRIT Damen Kleid 057CC1E029, Mehrfarbig (Dark Blue 2 406), 36 (Herstellergröße: S)","1,32",0
Amazon.de,game of thrones staffel 7,"99,67",B0743BNRX9,Game of Thrones: Die komplette 7. Staffel Digipack + Bonus Disc (exklusiv bei Amazon.de) [Limited Edition],"42,29","31,56",B0743CZ46S,Game of Thrones: Die komplette 7. Staffel,"14,23","21,54",B0743DGBT8,Game of Thrones: Die komplette 7. Staffel [Blu-ray],"14,03","14,4"
Amazon.de,heißluftfritteuse,"99,67",B00Y4SN790,"Princess Digitale Heißluftfritteuse (ohne Öl) mit 1500 Watt, 3,2 Liter","25,73","5,04",B006TF4OP2,"Tefal ActiFry YV960130 2in1 Heißluft-Fritteuse (1,5 kg Fassungsvermögen, 1.400 Watt, inkl. Rezeptbuch)","19,61","0,74",B00XVN7QBO,Tristar FR-6990 Crispy Fryer XL – ohne Öl – für bis zu fünf Portionen pro Durchgang,"9,17","13,9"
Amazon.de,huawei p8 lite hülle,"99,67",B00WIAS0GG,mumbi TPU Schutzhülle Huawei P8 Lite Hülle (nicht für das P8 Lite Smart),"23,58","13,41",B00WIK6MRU,mumbi TPU Schutzhülle Huawei P8 Lite Hülle transparent weiss,"20,59","14,03",B00WIJPV5U,mumbi TPU Schutzhülle Huawei P8 Lite Hülle transparent schwarz (nicht für das P8 Lite Smart),"14,68","11,58"
Amazon.de,instax,"99,67",B009ZM9R4O,Fujifilm  Instax Mini 8 Sofortbildkamera,"19,54","3,37",B0000C73CQ,"Fujifilm Instax Mini Instant Film, Weiß, Doppelpackung","11,36","2,25",B00BK1MI6W,"Fujifilm Instax Mini 8, Sofortbildkamera, Kamera, weiß","8,21","4,03"
Amazon.de,kulturbeutel,"99,67",B000BS7982,"Jack Wolfskin Kulturbeutel WASCHSALON, black, ONE SIZE, 86130-600","12,56","6,18",B00JP8LWI2,"Reisenthel Kulturtasche, 28 cm, Dots","11,42","2,63",B009ZRLW4C,"VAUDE Kulturtasche Tecowash, 5,5 Liter","10,49","3,65"
Amazon.de,lego minecraft,"99,67",B013GYABXW,LEGO Minecraft 21123 - Der Eisengolem,"12,44","10,85",B01J41JLTQ,LEGO Minecraft 21129 - Pilzinsel,"9,44","11,79",B012NOBUX6,LEGO Minecraft 21124 - Das End-Portal,"9,31","8,07"
Amazon.de,nokia 5,"99,67",B072KL7MT9,"Nokia 5 SINGLE SIMSmartphone (13,2 cm (5,2 Zoll), 16GB, 13 Megapixel Kamera, Android 7.0) satin-temperiertes-blau","30,18","38,85",B072KL78NZ,"Nokia 3 SINGLE SIM Smartphone (12,7 cm (5 Zoll), 16GB, 8 Megapixel Kamera, Android 7.0) silber-weiß","16,05","7,77",B0721QTBM7,"Nokia 5 Dual SIM Smartphone (13,2 cm (5,2 Zoll), 16GB, 13 Megapixel Kamera, Android 7.0) satin-temperiertes-blau","12,87","15,11"
Amazon.de,pampers 4,"99,67",B00AR9HWZ0,"Pampers Baby Dry Windeln, Gr. 4 (8-16 kg), Monatsbox, 1-er Pack (1 x 174 Stück)","39,05","18,26",B00AFA4DHQ,"Pampers Premium Protection Active Fit Windeln, Gr.4 Maxi (8-16 kg), Monatsbox, 1er Pack (1 x 168 Stück)","12,93","0,66",B019WCXL1Q,"Pampers Premium Protection Windeln, Gr. 4 Maxi (8-16 kg), Monatsbox, 1er Pack (1 x 168 Stück)","12,4","5,13"
Amazon.de,pokemon,"99,67",B072R2S2PR,Pokémon Ultramond - [Nintendo 3DS],"18,07","4,58",B01CCNASK4,Pokémon Sonne - [3DS],"10,83","0,52",B01CCNANYU,Pokémon Mond - [3DS],"9,02","0,52"
Amazon.de,pretty little liars staffel 6,"99,67",B01N6X29TR,Pretty Little Liars - Die komplette sechste Staffel [5 DVDs],"90,3","67,74",B01BM4HRVM,Pretty Little Liars - Die komplette fünfte Staffel [6 DVDs],"5,27","7,93",B01CNXV3GQ,Pretty Little Liars - Die kompletten Staffeln 1-5 (exklusiv bei Amazon.de) [Limited Edition] [28 DVDs],"1,29","20,81"
Amazon.de,sackkarre,"99,67",B0054NYZQ8,pro-bau-tec 10411 Aluminium Transport und Sackkarre,"23,26","11,97",B005XA1EDE,"pro-bau-tec Stapelkarre Treppenrutsche 200 kg, 100005","17,46","18,08",B00GN6EYVG,Wolfcraft Transportsystem TS 850 5501000,"9,71","5,08"
Amazon.de,schaukel,"99,67",B00BU7BF2O,"HUDORA Nestschaukel 90 cm, blau - Garten-Schaukel bis 100 kg belastbar - 72126","13,97","2,52",B000OEKAZM,HUDORA Brettschaukel Kunststoff - GS geprüfte Kinder-Schaukel - 72115,"10,48","19,5",B06XDK2671,"Yorbay Kinderschaukel Gartenschaukel Schaukel belastbar bis 135Kg, mehr Kinder gleichzeitig spielen (Brettschaukel+ Tellerwippe+Rutsche)","9,36","3,81"
Amazon.de,silk epil 9,"99,67",B01MUHILO5,"Braun Silk-épil 9 SkinSpa Epilierer 9-961v, mit 12 Extras, inkl. Rasieraufsatz, Tiefenmassage-Pad, weiß/gold","30,26","4,18",B01N2990FJ,"Braun Silk-épil 9 Epilierer 9-561, mit 6 Extras, inkl. Rasieraufsatz, Trimmeraufsatz, weiß/gold","22,56","5,94",B06WD37ZSP,"Braun Silk-épil 9 SkinSpa Epilierer 9-969v, mit 12 Extras, inkl. Tiefenmassage-Pad, Peelingbürsten, weiß","16,51","4,06"
Amazon.de,tamaris pumps,"99,67",B01LPWLQZY,"Tamaris Damen 22420 Pumps, Blau (Navy 805), 40 EU","8,8","0,5",B01MQFSVPQ,"Tamaris Damen 22426 Pumps, Beige (Nude Patent 253), 38 EU","8,77","1,2",B01MTLNAD5,"Tamaris Damen 22407 Pumps, Pink (Rose 521), 38 EU","7,23","1,33"
Amazon.de,tp link,"99,67",B06W586CDZ,"TP-Link HS100(EU) intelligente WLAN Steckdose (funktioniert mit Amazon Alexa [Echo, Echo Dot], mit App Steuerung überall und zu jeder Zeit)","22,97","1,12",B00A0VCJPI,"TP-Link TL-WA850RE WLAN Repeater(300 Mbit/s, App Steuerung, 1 Port, WPS, LED abschaltbar, kompatibel mit allen WLAN Geräten)","11,66","4,63",B00ADW9R22,"TP-Link TL-PA4010PKIT AV500 Powerline Netzwerkadapter (500Mbit/s, 1 Port, Steckdose, energiesparend, Plug & Play, kompatibel mit Adaptern anderer Marken, 2er Set) weiß","7,71","6,8"
Amazon.de,tv stick,"99,67",B01ETRIS3K,Der neue Fire TV Stick mit Alexa-Sprachfernbedienung,"67,36","2,29",B00LO2DE6K,"Fire TV Stick, Zertifiziert und generalüberholt","14,73","33,78",B00UH2K93O,Amazon Fire TV mit 4K Ultra HD,"8,04","5,55"
Amazon.de,vorhängeschloss,"99,67",B004ZZTJFS,"ABUS Vorhangschloss Aluminium ""myLock"" T65AL/40, schwarz, 50871","25,42","2,5",B007VL757W,"ABUS Vorhangschloss Titalium 64TI/45, 56198","6,77","4,84",B000YJ2DWU,"Mannesmann Messing-Vorhangschloss 35 mm, M 413-35","6,1","3,23"
Amazon.de,babyschaukel,"99,66",B00I96FFFM,Bright Starts 60198 Senecircaportable Babyschaukel,"10,8","0,52",B016OOD6XI,Bright Starts 10410 Bounce and Spring Deluxe Door Jumper,"8,64","0,52",B017XNL39S,Ingenuity 10247 Swing and Go Portable Swing - Hugs & Hoots,"6,61","4,79"
Amazon.de,brotkasten,"99,66",B004W24P6C,"Kesper 18090 Brotbox Melamin Bambus, weiß","18,81","7,38",B00083HPIE,"Wesco 235 201-01 Brotkasten Grandy, 42 x 23 x 17 cm, weiss","8,66","4,25",B00B3W0KH2,"RIG-TIG by Stelton Z00038-1 Box-It Brotkasten, Melamin, Bambus, weiß, 34,5 x 23,5 x 13,0 cm","5,92","2,8"
Amazon.de,einschulung geschenk,"99,66",B00GY8IE5A,Mein erstes Schuljahr: Erinnerungsalbum,"8,26","4,28",B005HAW8DA,Haba 4912 - ABC - Zauberduell,"6,73","1,87",B00JILKQUG,Fleißkärtchen,"6,7","1,6"
Amazon.de,fitbit charge 2 armband,"99,66",B01KSX374E,"Fitbit Standard Charge 2 Unisex Armband Zur Herzfrequenz Und Fitnessaufzeichnung, Schwarz, L, FB407SBKL-EU","93,58","10,13",B06XNZLF2V,"Fitbit Sport Band Charge 2 Sportarmband, Coral, S","0,98",0,B01LW2TH3Y,"Fitbit Flex 2 Fitness Wristband - Black, One Size","0,58",0
Amazon.de,handtücher,"99,66",B00Q4TK2W2,"AmazonBasics Handtuch-Set, ausbleichsicher, 2 Badetücher und 4 Handtücher, Schwarz","30,09","2,85",B011N979T6,"NatureMark NM-HT0842 Frottier Handtücher, 8-er Pack, 50 x 100 cm, 100% Baumwolle, anthrazit / grau","14,21","21,87",B01J1ZM31S,"AmazonBasics - Handtuch-Set, schnelltrocknend, 2 Badetücher und 4 Handtücher - Platingrau","13,09","0,54"
Amazon.de,hausaufgabenheft,"99,66",B000YBUGWM,"Herlitz Aufgabenheft A5, holzfreies Papier, 80 g/m², 48 Blatt, weiß","9,96","8,28",B01EUMIUB4,"Herlitz 50001705 Hausaufgabenheft Smiley World, A5, schwarz","9,39","12,14",3960800088,LEGO® NINJAGO®. Mein Hausaufgabenheft,"6,73","4,77"
Amazon.de,heimkinosystem,"99,66",B00VX9GSNA,"LG LHA725 5.1 3D Blu-ray Heimkinosystem (1000 Watt, Smart TV, DLNA, Bluetooth, 1080p Upscaling) schwarz","16,81","4,68",B00U2XLVK8,"Samsung HT-J5500 5.1 3D Blu-ray Heimkinosystem (1000W, WLAN, Bluetooth, FM Tuner) schwarz","13,39","25,67",B00U2XLX9M,"Samsung HT-J4500 5.1 3D Blu-ray Heimkinosystem (500W, Bluetooth, FM Tuner) schwarz","8,86","3,06"
Amazon.de,klobürste,"99,66",B003SLDWSK,"Wenko 18931100 WC-Garnitur Basic Schwarz - WC-Bürstenhalter, Kunststoff, 14 x 38 x 14 cm, Schwarz","22,23","8,25",B0037X132Q,"Zeller 18319 WC-Bürste ""Schiefer"", Polyresin, 9,5 x 9,5 x 38,5 cm, schwarz","7,89","4,75",B00TQQ3Y9S,"WENKO 21694100 Edelstahl WC-Garnitur Detroit - WC-Bürstenhalter, Edelstahl rostfrei, 8.9 x 41.5 x 8.9 cm, Satiniert","6,75","3,96"
Amazon.de,kontaktlinsen,"99,66",B001G4V9WW,"Air Optix Aqua Monatslinsen weich, 6 Stück / BC 8.6 mm / DIA 14.2 / -1,75 Dioptrien","27,05","2,82",B001PPDS8U,"Biofinity Monatslinsen weich, 6 Stück / BC 8.6 mm / DIA 14.0 / -1,50 Dioptrien","10,23","12,74",B0017IXHAY,"Dailies AquaComfort Plus Tageslinsen weich, 30 Stück / BC 8.7 mm / DIA 14 / -1.75 Dioptrien","10,22","2,62"
Amazon.de,messer,"99,66",B01M00UDDY,"MTech USA Taschenmesser, Grüne Griffausführung, Länge geschlossen in cm: 12.7, MTEC-1145","30,29","11,12",B005EFNWW4,"Out of the blue KG Faltbarer Taschenkamm, Springmesser, 1 Stück","8,77",0,B00BMTWS9E,"Victorinox 67833.S6 SwissClassic Tafelmesser/Tomatenmesser/Brotzeitmesser/Wurstmesser-Set 6-teilig mit Wellenschliff, schwarz","6,78","11,23"
Amazon.de,olaplex,"99,66",B00SNM5US4,"Olaplex Hair Perfector No.3, 100 ml","89,9","25,68",B015CZ0872,"Schwarzkopf Professional Fibreplex No.3 Bond Maintainer, 1er Pack (1 x 100 ml)","2,66","13,65",B0166RVRLQ,"Elkaderm Keraphlex Treatment Step 3, 1er Pack (1 x 1 Stück)","2,57","4,93"
Amazon.de,puzzle,"99,66",B01D24PK96,"Ravensburger 17826 - Unvergessliche Disney Momente, 40320 Teile Puzzle","8,06","3,08",B00J1AVU4K,"Clementoni 31450.8 - Puzzle Minions Impossible, 1000 Teile","6,78","3,82",B00HFUAD9G,"Schmidt 58183 - Schiff vor Anker, Puzzle, 1000 Teile","4,55","9,58"
Amazon.de,reisenthel,"99,66",B00IAO43PG,Reisenthel Reise-Henkeltasche Allrounder 30 Liter ( 48X39.5X29 cm)L Mehrfarbig (Dots),"11,71","5,98",B000K22T7A,Reisenthel BK7003 Carrybag schwarz,"8,79","3,24",B00JP8WPZG,"Reisenthel OR7009 loopshopper, L, dots","6,12","10,93"
Amazon.de,schallzahnbürste,"99,66",B00J59G236,"Philips Sonicare EasyClean Elektrische Zahnbürste mit Schalltechnologie HX6510/22, weiß","16,88","1,84",B003VWDC3G,"Oral-B Pulsonic Slim Schallzahnbürste, Weiß, Standard","15,26","11,86",B013ZR4N16,"Philips Sonicare FlexCare Platinum Elektrische Zahnbürste mit Schalltechnologie HX9172/15, mit UV-Reinigungsgerät, weiß","9,47","0,56"
Amazon.de,taschenrechner,"99,66",B0050OTQ42,"CASIO FX-991DE Plus wissenschaftlicher Taschenrechner / Schulrechner mit 580 Funktionen und natürlichem Display, Solar/Batterie","16,38","2,56",B00VB2ISDM,Casio FX-991DE X wissenschaftlicher ClassWiz Rechner mit natürlichem Display,"13,05","0,82",B0054VVU68,"CASIO FX-82DE Plus wissenschaftlicher Taschenrechner / Schulrechner mit 252 Funktionen und natürlichem Display, Batteriebetrieb","8,93","4,57"
Amazon.de,thermomix kochbücher,"99,66",3961810052,A. i. O. - ALL IN ONE: Rezepte für den Thermomix,"8,48","0,64",3943807827,Mix ohne Fix!: Lieblingsgerichte aus dem Thermomix,"8,22","1,98",3944789547,,"6,2","2,72"
