Abteilung,Suchbegriff,Suchhäufigkeit,ASIN,Nr. 1 der geklickten Titel,Klickfreigabe,Umwandlungs-Anteil,ASIN,Nr. 2 der geklickten Titel,Klickfreigabe,Umwandlungs-Anteil,ASIN,Nr. 3 der geklickten Titel,Klickfreigabe,Umwandlungs-Anteil
Amazon.de,spiderman ps4,"99,63",B01H1QQIGU,Spider-Man - [PlayStation 4],"83,58","98,55",B072MZ8Z3K,Assassin's Creed Origins - [PlayStation 4],"1,97","0,37",B06W9L2KY3,Crash Bandicoot N.Sane Trilogy - [PlayStation 4],"1,5","0,05"
Amazon.de,unterwasserkamera,"99,63",B00004TWM6,Fujifilm Quicksnap Marine 800 Film Einwegkamera für 27 Bilder (wasserdicht bis 10m),"38,18","30,87",B007B7ZC30,"Easypix 10012 Unterwasser Digitalkamera ""Aquapix W1024-I Splash"" in Eisblau","15,95","7,13",B008FWNCLY,"Easypix 10014 Unterwasser Digitalkamera ""Aquapix W1024-Y Splash"" in gelb","4,85","3,24"
Amazon.de,vorhängeschloss,"99,63",B004ZZTJFS,"ABUS Vorhangschloss Aluminium ""myLock"" T65AL/40, schwarz, 50871","25,29","9,18",B000YJ2DWU,"Mannesmann Messing-Vorhangschloss 35 mm, M 413-35","7,43","7,61",B007VL757W,"ABUS Vorhangschloss Titalium 64TI/45, 56198","6,52","5,84"
Amazon.de,zahnbürste elektrische,"99,63",B00KBWBPRY,"Oral-B Pro 600 Elektrische Zahnbürste, mit CrossAction Aufsteckbürste","18,9","9,91",B003RRY446,Oral-B Vitality CrossAction elektrische Zahnbürste mit Timer,"7,95","8,54",B0140IEGIE,"Oral-B Pro 750 Elektrische Zahnbürste, mit CrossAction Aufsteckbürste und Reise-Etui, schwarz","7,88","7,67"
Amazon.de,babydecke,"99,62",B007NZDTP8,"Sonnenstrick SODE6 Erstlingsdecke / Babydecke / Kuscheldecke / Strickdecke, 80 x 80 cm, weiß","14,16","5,79",B01M5EEK5I,LULANDO Babydecke Kuscheldecke Krabbeldecke aus 100% Baumwolle (80x100 cm). Super weich und flauschig. Kuschelige Lieblingsdecke für Ihr Baby. Farbe: Mint - Grey Stars,"10,33","5,95",B007K4RBJM,David Fussenegger 62682179 Baby und Kinderdecke Juwel Patch Boy,"8,52","11,53"
Amazon.de,backofen,"99,62",B00EUB4F0G,Bosch HBA33B150 Serie 6 Einbaubackofen / A / 66 L / Edelstahl / 3D Heißluft Plus,"30,05","26,49",B015EF9L0K,Beko BIC22000X Backofen Elektro / A / 71 L /Vollglas-Innentür / silber,"12,78","15,73",B003HD7YJC,"Severin TO 2034 Toastofen (1500 Watt, 20 Liter) schwarz/silber","9,6","13,11"
Amazon.de,besteckkasten für schubladen,"99,62",B001AEDEJ4,Kesper 17085 Variabler Besteckkasten Bambus ausziehbar von 35 - 58 cm,"16,36","8,17",B00E6OZ26I,"Kesper 30087 Besteckkasten ausziehbar, Kunststoff, Maße: 29 -50 cm x 38 x 6.5 cm, grau","15,1","7,47",B00JL5DD86,"Rotho Besteckkasten BASIC 6 Fächer, Schubladeneinsatz für Besteck aus Kunststoff (PP) transparent, Besteckeinsatz für Schubladen ab 40 cm Breite, ca. 39 x 32 x 5 cm","7,03","6,21"
Amazon.de,bodenwischer,"99,62",B0047Y1HP2,"Vileda UltraMat Komplett-Set, Bodenwischer und Eimer mit PowerPresse","16,37","7,42",B00KM40ELY,Leifheit 55210 Bodenwischer Classic,"11,61","13,5",B01HTTQ6A2,"Vileda Turbo EasyWring & Clean Komplett-Set, Wischmop und Eimer mit PowerSchleuder","10,11","3,12"
Amazon.de,bosch professional,"99,62",B0042CWWS0,Makita B-43044 Bohrer Bit Set 66tlg. im MAKPAC,"4,65","1,09",B00HYZAWLG,"Bosch Professional GSR 18 V-EC Akku-Bohrschrauber, 2x4,0 Ah Akku (EC-Motor, 13 mm Voll-Metall-Bohrfutter, 18 V, L-Boxx) 06019E8101","4,34","4,51",B015WGDX6E,"Bosch Professional GSR 12V-15 Akku-Bohrschrauber (mit 39-teilig Zubehör-Set, 2x Akku 2, 0 Ah, Ladegerät in Tasche, 12V) 0615990GB0","3,59","3,05"
Amazon.de,cd player kinder,"99,62",B0028R3B90,Lenco SCD-24 P  Stereo UKW-Radio mit und Teleskopantenne Rosa,"14,62","11,9",B0145FI0PW,X4-TECH Bobby Joey Kinder MP3-CD-Player mit Akku grün,"10,02","7,14",B001O4D8VO,Fisher-Price P2672 - Lernspaß CD-Spieler,"8,92","3,44"
Amazon.de,crocs,"99,62",B002JCST14,"Crocs Crocband Unisex - Erwachsene Clogs, Blau (Navy 410),Gr. 43-44 (M9/W10 UK-M10W12 US)","22,99","3,92",B0014C5S7S,"Crocs Classic, Unisex-Erwachsene Clogs, Schwarz  (Black 001), 43/44 EU ( US: M10/W12)","11,43","5,44",B001V83AZC,"Crocs Baya Unisex Clogs, schwarz (black 001), 42-43 EU","6,68","5,57"
Amazon.de,gtx 1080,"99,62",B01IHEUDWA,"Asus ROG Strix GeForce GTX1080-A8G Gaming Grafikkarte (Nvidia, PCIe 3.0, 8GB GDDR5X Speicher, HDMI, DVI, Displayport)","31,53","11,41",B01GEML1AU,"KFA2 GeForce GTX 1080 EXOC PCI-E Gaming-Grafikkarte, 8GB GDDR5, schwarz","11,21","12,28",B01GELBO1C,"MSI GeForce GTX 1080 Gaming X 8GB Nvidia GDDR5X 1x HDMI, 3x DP, 1x DL-DVI-D, 2 Slot Afterburner OC, VR Ready, 4K-optimiert, Grafikkarte","9,3","8,41"
Amazon.de,induktionskochfeld,"99,62",B0053TQS2C,AEG HK634250XB Induktionskochfeld / Glaskeramik / 60 cm / 4-fach Induktion mit Single-Control / Stop und Go-Funktion / Edelstahl,"28,15","10,93",B018KELUY2,"AEG HKA8540IND Kochfeld Elektro / Induktion / 76,60 cm / Powerfunktion / Kindersicherung / Timerfunktion / schwarz","8,51","8,54",B0049MELOQ,"Rommelsbacher CT 3410/IN Induktion Glaskeramik Doppelkochtafel, 3400 W","8,36","3,56"
Amazon.de,klobürste,"99,62",B003SLDWSK,"Wenko 18931100 WC-Garnitur Basic Schwarz - WC-Bürstenhalter, Kunststoff, 14 x 38 x 14 cm, Schwarz","23,37","8,73",B0037X132Q,"Zeller 18319 WC-Bürste ""Schiefer"", Polyresin, 9,5 x 9,5 x 38,5 cm, schwarz","8,28","3,97",B00TQQ3Y9S,"WENKO 21694100 Edelstahl WC-Garnitur Detroit - WC-Bürstenhalter, Edelstahl rostfrei, 8.9 x 41.5 x 8.9 cm, Satiniert","7,81","4,79"
Amazon.de,lamy füller,"99,62",B000FA5EHY,"Lamy 09-A Schreiblernfüller A blau, abc","12,13","5,77",B000FA5DRK,"Lamy Füllhalter Safari umbra matt, Feder: F","9,51","2,46",B01BNH9KS6,Lamy 1230634 Safari Füllfederhalter Mittel grün,"8,82","6,96"
Amazon.de,nachtlicht kinder,"99,62",B000SIDE02,OSRAM LED-Steckdosenlicht / Nachtbeleuchtung / LUNETTA / weiß / Dämmerungssensor / 360 ° drehbarer Leuchtkopf,"12,22","8,64",B007C3B8ZO,"Hama ""Bernstein"" LED Nachtlicht für Kinderzimmer und Schlafzimmer (stromsparend, nur 0,2 W, Orientierungslicht für Gang und Keller, Stimmungslicht, Nachtlampe, Eurostecker)","10,4","5,87",3836957531,Die kleine Raupe Nimmersatt - Nachtlicht Streupunkte,"9,21","9,2"
Amazon.de,rasendünger mit unkrautvernichter,"99,62",B00RQSNYXE,WOLF-Garten 2-in-1: Unkrautvernichter plus Rasendünger SQ 450; 3840745,"28,96","7,95",B00SJ3KJBK,WOLF-Garten 2-in-1: Unkrautvernichter plus Rasendünger SQ 50; 3840710,"13,06","12,13",B0196IRV0I,"Compo Floranid Rasendünger plus Unkrautvernichter, Rasenpflege und Unkrautvernichtung in einem Produkt, 12 kg für 400 m²","11,1","8,51"
Amazon.de,rasenmäher elektro,"99,62",B0032TJFOS,"Bosch DIY Rasenmäher Rotak 32, Grasfangbox 31 l (1200 W, Schnittbreite 32 cm, Schnitthöhe 20-60 mm)","15,83","6,73",B00T38HNQ4,"Einhell Elektro Rasenmäher GC-EM 1536 (1500 W, 36 cm Schnittbreite, 38 l Fangsack, 25-65 mm Schnitthöhe, Highwheeler)","11,28","6,92",B00HVFQ5NS,"Bosch DIY Rasenmäher Rotak 40, Grasfangbox 50 l (1700 W, Ergoflex-System, Schnittbreite 40 cm, Schnitthöhe 20-70 mm)","6,53","2,83"
Amazon.de,samsung galaxy s8,"99,62",B06XJ49G5B,"Samsung Galaxy S8 Smartphone (5,8 Zoll (14,7 cm) Touch-Display, 64GB interner Speicher, Android OS) midnight black","24,55","8,56",B01N5W90KS,"Samsung Clear View Klappcover(Standfunktion, inkl. Semi-transparenter Vorderseite, geeignet für Galaxy S8+) schwarz","17,61","6,15",B06XHRDF78,"Samsung Galaxy S8 Smartphone (5,8 Zoll (14,7 cm) Touch-Display, 64GB interner Speicher, Android OS) orchid grey","17,53","8,79"
Amazon.de,schlüsselanhänger,"99,62",B002DLXBU0,"Wedo 262101801 Schlüsselanhänger Kunststoff (mit Ring, auswechselbare Etiketten) 10 Stück, schwarz","15,98","15,28",B016KE9YN8,"Depesche 8665 - Schlüsselanhänger Schutzengel, sortiert","15,61","4,22",B000WKND0C,"Durable 195700 Schlüsselanhänger, 6 Stück farbig sortiert","11,89","17,29"
Amazon.de,teleskop,"99,62",B002SYKS80,Celestron AstroMaster 130 EQ 130/650 Newton-Spiegelteleskop mit Nachführmotor und Stahlstativ,"17,59","16,99",B00K0O1P0K,National Geographic 50/360 Teleskop,"10,51","16,99",B001MUP49E,Celestron NexStar 130 SLT – computergesteuertes 130/650 Newton-Spiegelteleskop,"9,79","8,49"
Amazon.de,thermomix,"99,62",3943807827,Mix ohne Fix!: Lieblingsgerichte aus dem Thermomix,"11,72","3,36",3944789547,,"8,2","3,48",B00OAXFNQ4,"Krups Prep & Cook HP5031 Multifunktions-Küchenmaschine (1.550 Watt, bis zu 12.000 U/min, inklusive hochwertigem Zubehör)","8,14","1,45"
Amazon.de,tischtennisbälle,"99,62",B0012QJW6E,"JOOLA Tischtennis-Bälle Training 40mm, Orange 12er Blister Pack","22,95","8,77",B002A9N7UY,75 Tischtennisbälle 38mm ohne Aufdruck weiss stabiles Material,"12,72","10,64",B0002GTJTA,JOOLA Tischtennis-Bälle Rossi 3-Stern 40 weiss 6er Blister,"8,79","5,79"
Amazon.de,überwachungskamera,"99,62",B017AJNE60,"HiKam A7 Wireless IP Kamera HD für Außenbereich IP66 mit deutscher App/Anleitung/Support (Überwachungskamera, Kamera mit WiFi, WLAN Kamera, Outdoor)","32,7","26,12",B00VWKWJF6,"HiKam S5 mini drahtlose IP Überwachungs-Kamera (HD, 720p)","21,55","23,16",B00TDNYNP8,"Netgear Arlo VMS3230-100EUS Smart Home 2 HD-Überwachung Kamera-Sicherheitssystem (100% kabellos, Indoor/Outdoor, Bewegungssensor, Nachtsicht) weiß","13,62","2,39"
Amazon.de,b00zcfydla|b00zcfyt5k|b00zcfyf2w|b00zcfyfao|b0198qe5ma|b01n4tevha|b01eae1fx2|b01ciebu22|b01ciebs74|b01ciebxzg|b01muh9bet|b01gk98ye8|b01cvolbpk|b01cvolbqo|b01fz1gu48|b01mug1hto|b01busmyhc|b01busn07k|b01busn4m6|b01busn0do,"99,61",B01CIEBXZG,"SanDisk iXpand 128 GB Flash-Laufwerk, Apple MFI-zertifiziert","18,62","13,19",B01CIEBU22,"SanDisk iXpand 32 GB Flash-Laufwerk, Apple MFI-zertifiziert","18,01","2,15",B00ZCFYF2W,SanDisk 64GB Connect Wireless Stick,"12,46","0,74"
Amazon.de,birkenstock madrid,"99,61",B000XW0T56,"Birkenstock Classic Madrid Birko-Flor, Damen Pantoletten, Schwarz (Schwarz Lack), 38 EU","23,98","4,13",B000MSU55U,"Birkenstock Classic Madrid Birko-Flor, Unisex-Erwachsene Pantoletten, Schwarz (Schwarz), 39 EU",8,"7,13",B000KBKGSU,"Birkenstock Classic Madrid Birko-Flor, Damen Pantoletten, Silber (Silber), 38 EU","7,01","1,48"
Amazon.de,boxsack,"99,61",B000WP086Y,"ScSPORTS Jugendliche Boxhandschuhe Boxbandagen Tasche, petrol/schwarz, 5,5 kg","28,42","9,76",B002Y0CS36,"ScSPORTS Boxsack-Set, Boxsack gefüllt 25 kg, Boxhandschuhe, Boxbandagen, Boxsackhalterung 5-Punkt Stahlkette, 80 x 30 cm, Kunstleder, beige / petrol","17,92","13,27",B000OZQDPW,HUDORA Punchingball Set mit Boxhandschuhen & Pumpe - Boxsack-Set - 74501/01,"8,6","5,11"
Amazon.de,bruder spielzeug,"99,61",B003543KXM,Bruder 02750 - MAN TGA Abschlepp-LKW mit Geländewagen,"3,65","3,19",B004OW0I7U,Bruder 02776 - MAN TGA Tieflader mit JCB 4CX Baggerlader,"3,44","1,63",B00005BH1P,Bruder 02430 - Liebherr Radlader L574,"3,36","1,9"
Amazon.de,füller,"99,61",B00OBC3QEA,Pelikan 947366 Twist Füllhalter (Universell für Rechts- und Linkshände) silber,"12,48","18,08",B003C1VQBG,"Parker S0161590 Jotter Füllfederhalter (edelstahl mit Chromeinfassung, mittlere Schreibfeder, Geschenkbox)","9,29","4,13",B001R8D5AG,Herlitz 10999753 Schulfüllhalter (inkl. Patrone) minze/lila,"8,85","8,88"
Amazon.de,gardena schlauchwagen,"99,61",B0049PAX6I,"Gardena 8004-20 Classic Schlauchwagen 60 HG Set; mit Schlauchführung; stufenlos regulierbare Spritze; Nachtropfstop (Schlauchlänge 20 m; Maximale Kapazität 60 m 1/2"", 50 m 5/8"", 35 m 3/4"")","20,09","18,17",B006YTU1XC,Gardena 2692-20 Schlauchwagen-Set,"15,15","11,02",B0049P7686,"Gardena 8001-20 Classic Schlauchwagen 60 TS Set; mit drehbarer Anschlussachse; stufenlos regulierbare Spritze; Nachtropfstop (Schlauchlänge 20 m; Maximale Kapazität 60 m 1/2"", 50 m 5/8"", 35 m 3/4"")","13,2","7,35"
Amazon.de,ghd glätteisen,"99,61",B00B7K0WU0,GHD Profi-Glätteisen gold Classic Styler Mit EU-Stecker,"49,82","33,56",B0012XANQK,ghd V Gold Gift Copper luxe Collection Gl&auml;tteisen und Stylingset,"27,03","32,62",B003WOKJF2,"Remington Pearl Haarglätter S9500, mit Keramikbeschichtung","5,45","0,77"
Amazon.de,klimperklein,"99,61",3772464823,Nähen mit JERSEY - KLIMPERKLEIN: Nähideen für Kinder (Größe 104-164),"54,52","36,17",3772464920,Nähen mit JERSEY - KLIMPERGROSS: Lieblingsmodelle in Erwachsenengröße (XS - XXL). Mit 2 großen Schnittmusterbogen. Von der Bestseller-Autorin,"13,15","14,67",3772464025,Nähen mit JERSEY - kinderleicht!: für Babys und Kids von 0 bis 8 Jahren,"11,69","17,51"
Amazon.de,lego minecraft,"99,61",B013GYABXW,LEGO Minecraft 21123 - Der Eisengolem,"11,72","13,3",B01CCT2FGI,LEGO Minecraft 21127 - Die Festung,"10,53","6,8",B01J41JLTQ,LEGO Minecraft 21129 - Pilzinsel,"8,82","10,51"
Amazon.de,make up,"99,61",B007L0FUCK,"BriConti Schminkkoffer 'Everybody's Darling', Make-Up Set","25,39","3,97",B0013BK35C,"Maybelline New York Make-Up EverFresh Sand 30 / Schminke in einem Hautfarbe-Ton für eine langanhaltende Abdeckung mit hohem Tragekomfort, 1er Pack (1 x 30 ml)","15,87","15,23",B013P9MKMI,"L'Oréal Paris Foundation Perfect Match, N4 Beige / deckendes Make Up - perfekte Verschmelzung mit dem Hautton & 24h Feuchtigkeit, 1er Pack (1 x 30 ml)","12,89","19,87"
Amazon.de,mam flaschen,"99,61",B00BY80GGU,MAM 66298000 - Anti-Colic Starter-Set,"13,51","5,58",B00L956WAM,"MAM 66321520 - Easy Start Anti-Colic 260 ml, Babyflasche, Neutral","11,79","5,78",B00WSA7YVS,"MAM 99957411 - Easy Active Baby Bottle 270 ml, Babyflasche, Doppelpack für Jungen","9,09","14,05"
Amazon.de,mobile klimaanlage,"99,61",B00AYCNJ3E,"De'Longhi PAC N81 Mobiles Klimagerät (Max. Kühlleistung 9400 Btu/h (35°C/80% R.H.), Separate Entfeuchtungsfunktion, Geeignet für Räume bis 80 m³) Weiß","38,14","13,47",B00GWJLAZM,"SUNTEC mobiles lokales Klimagerät IMPULS 2.0+  [Für Räume bis 60 m³ (~25 m²), Kühlen + Entfeuchten, 7.000 BTU/h, Energieeffizienzklasse A]","21,72","16,46",B001AO0OXI,Honeywell HO-5500RE Turmventilator oszillierend silber/schwarz,"5,6","0,46"
Amazon.de,new balance herren,"99,61",B00CIPLLRG,"New Balance M_W574, Herren Sneakers, Schwarz (Black/Grey), 43 EU (9 Herren UK)","14,79","11,03",B01MFG6NFF,"New Balance Herren 1550 Sneakers, Grau (Grey), 45 EU","10,07","8,27",B01MZX1XL0,"New Balance Herren 565 Sneakers, Mehrfarbig (Navy/Red), 44 EU","8,44","11,03"
Amazon.de,nokia,"99,61",B071HTGC1R,"Nokia 3310 Dual SIM, Version 2017, Mobiltelefon Retro Dark Blue","42,59","6,81",B013J7BMAM,"Nokia 105 Dual SIM, cyan","8,81","20,74",B01NAV37ZQ,Nokia 150 schwarz(single sim),"7,14","17,48"
Amazon.de,pizzastein grill,"99,61",B004ZY6VPA,Vesuvo V38301 Pizzastein- / Brotbackbackstein Set für Backofen und Grill / eckig / 38x30 cm / mit Pizzaschaufel und Pizzamehl,"37,1","11,09",B01AUYFNR0,"Relaxdays 10019339 Pizzastein für Backofen rund, Baking Stone aus Cordierit für knusprige Steinofenpizza wie in Pizzeria Grillstein für Pizza, Brot und Flammkuchen in Herd und Grill, Durchmesser 33 cm, 1 cm dick, beige","16,53","12,02",B01M4LUPHJ,"Relaxdays Pizzastein Set 1,5 cm Stärke mit Metallhalter und Pizzaschieber aus Holz HBT 7 x 43 x 31,5 cm rechteckiger Brotbackstein für Pizza und Flammkuchen mit Pizzaschaufel für Pizzaofen, natur","13,44","7,79"
Amazon.de,puppe,"99,61",B019F0FYOM,"Zapf Creation 822524 - my little Baby born, SuperSoft, rosa","6,67","3,43",B0009UZ902,"Simba 105039005 - New Born Baby, Funktions-Baby-Puppe (trinkt/näßt), inklusive Zubehör, 43 cm","6,46","6,09",B00DOW9GV0,Nines d'Onil 700 - Babypuppen - Mein Baby,"6,2","3,35"
Amazon.de,pürierstab,"99,61",B00A925G3A,"Bosch MSM66110 Ergonomischer Stabmixer mit Zubehör, Edelstahl-Mixfuß (600 Watt) sonstige","24,72","6,62",B00EQB0ZY0,"Braun MultiQuick 7 MQ 745 Aperitive Stabmixer, 750 W, Standmixer-Aufsatz (1.250 ml), Edelstahl-Schneebesen, EasyClick System, PowerBell Technologie","11,59","2,23",B000T7URXY,Bosch MSM6B150 Stabmixer (300 Watt) weiß,"8,6","5,91"
Amazon.de,rasentrimmer akku,"99,61",B00HEF4XR0,"Einhell Akku Rasentrimmer GE-CT 18 Li Solo Power X-Change (Lithium Ionen, 18 V, 240 mm Schnittkreis, 20 Kunststoffmesser, ohne Akku und Ladegerät)","12,52","2,92",B00JC4W3N2,"Makita Akku-Rasentrimmer, (18 V, ohne Akku und Ladegerät), DUR181Z","11,82","4,42",B00FQIC5P4,"Black+Decker 450W Elektro-Rasentrimmer, E-Drive, 25cm Schnittbreite, mit Zahnradantrieb, Automatische Fadeneinstellung, Führungsschiene ST4525",10,"12,89"
Amazon.de,rucksack damen,"99,61",B002OWETK4,"Fjällräven Unisex Rucksack Kånken, graphite, 27 x 13 x 38 cm, 16 Liter, 23510-031","14,76","0,6",B01BU6ELJ8,"Dakine Damen Garden Rucksack, Wallflower, 44 x 30 x 16 cm, 20 Liter","8,46","20,48",B01J4RQSZ0,"Jack Wolfskin Damen Ancona Rucksack, Sand Dune Geometric Leaves, 44 x 30 x 3 cm, 14 Liter","8,01","10,03"
Amazon.de,schnurloses telefon,"99,61",B00EDQ5084,"Gigaset C430 Telefon, Schnurlostelefon / Mobilteil, TFT-Farbdisplay, Dect-Telefon, ohne Anrufbeantworter, Freisprechfunktion, Analog Telefon, schwarz","10,46","2,03",B00EDQ4IMS,"Gigaset A415 Telefon, Schnurlostelefon / Mobilteil, Grafik Display, Dect-Telefon, ohne Anrufbeantworter, Freisprechfunktion, Analog Telefon, Desktop Phone, schwarz","7,77","3,6",B00EHMDCTS,"Gigaset C430A Duo Telefon, Schnurlostelefon / 2 Mobilteile, TFT-Farbdisplay, Dect-Telefon, mit Anrufbeantworter, Freisprechfunktion, Analog Telefon, schwarz","7,26","2,91"
Amazon.de,taschenrechner,"99,61",B0050OTQ42,"CASIO FX-991DE Plus wissenschaftlicher Taschenrechner / Schulrechner mit 580 Funktionen und natürlichem Display, Solar/Batterie","21,67","2,48",B00VB2ISDM,Casio FX-991DE X wissenschaftlicher ClassWiz Rechner mit natürlichem Display,"11,45","1,41",B0054VVU68,"CASIO FX-82DE Plus wissenschaftlicher Taschenrechner / Schulrechner mit 252 Funktionen und natürlichem Display, Batteriebetrieb","8,45","2,46"
Amazon.de,wasserhängematte,"99,61",B00E4NPWJI,"Intex Erwachsene Mesh Mats, farblich sortiert , 178 x 94 cm","75,85","34,65",B00FILJ318,"Bestway Luftmatratze Aqua Lounge, 160x84 cm","4,55","13,15",B00SQS7L4Q,"Jilong mesh floater - Wasser Luftmatratze mit Netz-Liegefäche und Kopfteil, 180x80 cm, 2-farbig sortiert","3,63","11,57"
Amazon.de,wimpernserum,"99,61",B005CVGJFM,"Revitalash Advanced Augenwimpern-Conditioner, 2ml","32,43","12,86",B007IU2Y4K,"SA3 Magic Lashes Wimpernserum, 1er Pack (1 x 4 ml)","21,47","20,45",B006Z89U8Y,"M2 Beauté Magic Eyes Eyelash Activating Serum,  1er Pack (1 x 5 ml)","9,72","5,87"
Amazon.de,4k fernseher,"99,6",B01DO8MPRK,"Hisense H43MEC3050 108 cm (43 Zoll) Fernseher (Ultra HD, Triple Tuner, Smart TV)","19,93","33,18",B01IW655YY,"Sony KD-55XD7005 138.8 cm (55 Zoll) Fernseher (Ultra HD, Smart TV)","13,98",0,B01GV1DK1C,"LG 55UH615V 139 cm (55 Zoll) Fernseher (Ultra HD, Triple Tuner, Smart TV) schwarz","10,14","12,94"
Amazon.de,aquarium deko,"99,6",B000WFI2VC,"Trixie 8853 Felsformation mit Höhle/Pflanzen, 22 cm","8,48","4,59",B001J4ZWCM,"Hobby 40208 Arizona Rock 2, 24 x 26 x 14 cm","6,29","3,15",B0026GXXMS,"Penn Plax SBR10 SpongeBob's Ananas Haus, 16.5 cm",5,"4,73"
Amazon.de,battlefront 2,"99,6",B06Y67QHV4,Star Wars Battlefront II - [PlayStation 4],"56,28","45,52",B06Y637PY1,Star Wars Battlefront II - Elite Trooper Deluxe Edition - [PlayStation 4],"31,02","26,99",B06Y685561,Star Wars Battlefront II  (Code in der Box) [AT-Pegi] - [PC],"7,14","18,42"
Amazon.de,beats,"99,6",B01LW0M4J1,Beats by Dr. Dre Solo 3 Wireless Kopfhörer schwarz,"17,78","9,26",B01LVVF94H,Beats by Dr. Dre EP Kopfhörer schwarz,"15,09","8,51",B01LW36ADS,Beats by Dr. Dre Solo 3 Wireless Kopfhörer rosé-gold,"10,55","8,46"
Amazon.de,beren und luthien,"99,6",3608961658,Beren und Lúthien,"66,27","23,56",1328791823,Beren and Lúthien,"12,18","5,86",0008214190,Beren and Luthien,5,"7,2"
Amazon.de,couchtisch,"99,6",B01NAGT45H,"Funktionscouchtisch Ben, Dekor Betonoptik, 78 x 78 x 34 cm, 360° drehbar  Apollo","8,55","13,61",B00MPNAKVE,trendteam CT Couchtisch Wohnzimmertisch Tisch| Nussbaum Satin| 110 x 65 cm,"6,75","8,16",B00CESVD5C,"FMD Möbel 627-001 Couchtisch Klara 77 x 44 x 40 cm, eiche / weiß","5,97","30,61"
Amazon.de,deckenventilator mit beleuchtung,"99,6",B0016KUYAO,Westinghouse 7815840 Deckenventilator Turbo Swirl,"12,44","2,23",B002Y15CWO,Westinghouse 7255740 Deckenventilator Bendan,"10,47","2,24",B00OUV4UBK,"AEG Deckenventilator, D-VL 5667","6,75","4,34"
Amazon.de,dect telefon,"99,6",B00EDQ4IMS,"Gigaset A415 Telefon, Schnurlostelefon / Mobilteil, Grafik Display, Dect-Telefon, ohne Anrufbeantworter, Freisprechfunktion, Analog Telefon, Desktop Phone, schwarz","12,26","6,64",B01BBWWFB2,"AVM FRITZ!Fon C5 DECT-Komforttelefon (für FRITZ Box, hochwertiges Farbdisplay, HD-Telefonie, Internet-/Komfortdienste, Steuerung FRITZ!Box-Funktionen) deutschsprachige Version","12,25","2,39",B00EDQ5084,"Gigaset C430 Telefon, Schnurlostelefon / Mobilteil, TFT-Farbdisplay, Dect-Telefon, ohne Anrufbeantworter, Freisprechfunktion, Analog Telefon, schwarz","9,14","2,56"
Amazon.de,einwegkamera,"99,6",B008B6HD96,TopShot Einwegkamera mit 27 Fotos + eingebautem Blitz Einwegkamera Paket mit 5 Kameras,"16,93","7,61",B00285PLAE,"Hochzeitskamera ""Weiße Rose"" - 10er Pack Einwegkamera mit Blitz (27 Aufn. 400 ASA)","14,08","2,8",B0170FN5JA,"TopShot Love Hearts red Einwegkamera / Hochzeitskamera (27 Fotos, Blitz, 6+1 Pack)","12,77","9,19"
Amazon.de,haba,"99,6",B00BF3CK90,HABA 7628 - Entdeckersteine Klangspaß,"5,14","1,52",B001P4ZACS,HABA 4655 - Meine ersten Spiele - Erster Obstgarten,"4,94","1,42",B0046UUO06,Haba Mein erster Spieleschatz- Die große HABA-Spielesammlung,"3,49","1,68"
Amazon.de,honor,"99,6",B01MXFV5D3,"Honor 6X LTE Dual Sim Smartphone (14 cm (5,5 Zoll) Full HD, Touch-Display, 32 GB, Android 6.0) grau","28,01","12,5",B01J0RYDPG,"Honor 8 Smartphone (13,2 cm (5,2 Zoll) Touchscreen, 32GB interner Speicher, Android OS) blau","24,42","29,83",B01GTOMDIC,"Honor 5C Smartphone (13,2 cm (5,2 Zoll) Touch-Display, 1920 x 1080 pixels, 13 Megapixel, 16 GB interner Speicher, Android M EMUI 4.1) grau","9,9","12,67"
Amazon.de,kajak,"99,6",B00AIQ8LGG,"Intex Schlauchboot Aufblasbares Kajak Boot Explorer K2 Phthalates Free Inkl. 84 Paddel und Luftpumpe, 312 X 91 X 51 cm","13,01","9,58",B00691GHY2,"Sevylor Kajak Adventure Kit, ozenblau/grau (314 X 88 cm)","9,48","4,04",B06XCGX9Y7,Cambridge Single sitzen in Angeln Kajak mit Trolley + Gratis Spray Deck M Jungle Camo,"9,38",0
Amazon.de,kindle fire,"99,6",B01J94TL6Q,"Das neue Fire HD 8-Tablet, 20,3 cm (8 Zoll) HD Display, 16 GB (Schwarz), mit Spezialangeboten","32,08","10,01",B01J90P010,"Das neue Fire 7-Tablet, 17,7 cm (7 Zoll) Display, 8 GB (Schwarz), mit Spezialangeboten","22,36","18,88",B01J94T224,"Das neue Fire HD 8-Tablet, 20,3 cm (8 Zoll) HD Display, 32 GB (Schwarz), mit Spezialangeboten","8,41","7,56"
Amazon.de,kratzbaum für katzen,"99,6",B00KJXFXXC,"dibea KB00503 Kratzbaum für Katzen, 141 cm Höhe, extra breit, grau","14,08","4,73",B00GXLSQ60,"dibea KB00403 Kratzbaum XXL (240 - 260 cm Höhe - höhenverstellbar), grau","9,67","2,1",B0041O4W8M,Kerbl 82529 Kratzbaum Safari 38 x 38 x 60 cm dunkelbraun mit borte,"8,63","5,22"
Amazon.de,kugelgrill,"99,6",B0001VQI2M,"Grillchef by Landmann Holzkohle-Kugelgrill, Schwarz, 48 x 56 x 85 cm","19,04","12,86",B004W72E5Q,Nexos YG00263_G Mini Grill Kugelgrill Holzkohlegrill für Garten Terrasse Camping Festival Picknick BBQ Barbecue  Ø 30 cm grün,"12,65","6,9",B0038MC2JE,"Landmann Holzkohle - Kugelgrill Black Pearl comfort, Schwarz, 67 x 55 x 88 cm","10,3","7,23"
Amazon.de,kugelschreiber,"99,6",B001G5SU5K,"Parker S0705560 Jotter-Kugelschreiber (Edelstahl mit Chromverzierung, Geschenkbox) schreibfarbe blau","12,51","2,5",B004DBFPNE,"BIC Kugelschreiber Cristal Medium / 10 Kulis in Blau / Strichstärke 0,4 mm / Dokumentenecht","7,71","8,02",B000FA5EB0,LAMY 205 logo Kugelschreiber Stahl / schwarz,"7,53","3,45"
Amazon.de,kühlbox elektrisch,"99,6",B00TZXVBPG,Severin KB 2922 Elektrische Kühlbox / A++ / 41.6 cm Höhe / 70 kWh/Jahr / zum Kühlen und Warmhalten geeignet [Energieklasse A++],"21,15","7,77",B00BJF9JPC,EZetil Mirabelle E24 Thermoelektrische Kühlbox 12V,"19,72","7,33",B019PT5QVE,"MOBICOOL 9103501257 Elektrische Kühlbox fürs Auto U26 DC, 12 Volt Anschluss, 25 Liter","6,78","3,67"
Amazon.de,malen nach zahlen,"99,6",B003BDVE3A,Ravensburger Malen nach Zahlen 29550 - Einhorn,"8,5","3,59",3741520926,Malen nach Zahlen: Komm zur Ruhe,"4,33","2,46",B01G4PRB38,"Ravensburger Malen nach Zahlen 28563 - Magisches Einhorn, Malset","3,33","3,74"
Amazon.de,nagellack,"99,6",B00A1Y177A,"Color Club Halo Hues #977 ""Cloud Nine"" - Hologramm Nagellack","9,97","5,9",B019ORCY3U,"Maybelline New York Make-Up Nagellack Superstay 3D Gel-Effekt Topcoat / Gel- Überlack ohne UV-Lampe, mit bis zu 10 Tagen Halt, 1 x 10 ml","7,92","4,64",B00CN87VR2,"Maybelline New York Make-Up Nailpolish Color Show Nagellack Burgundy Kiss / Ultra glänzender Farblack in sattem Weinrot, 1 x 7 ml","7,24","7,73"
Amazon.de,peppa wutz,"99,6",3845103981,Peppa: Tolle Vorlesegeschichten mit Peppa,"10,23","5,33",B01M8I3963,BIG Spielwarenfabrik 800057113 - Playbig Bloxx Pig Peppa´s Family,"7,81","4,44",3849909743,Peppa Pig Wimmelbuch: Mit Rätselspaß,"6,88","3,2"
Amazon.de,playstation vr,"99,6",B00ULWWFIC,PlayStation VR - [PlayStation 4],"51,67","27,87",B071JF78RL,,"6,91",0,B01LSFGWR0,PlayStation Kamera für PS4 (2016),"4,22","2,55"
Amazon.de,samsonite koffer,"99,6",B00ULI8JQI,Samsonite - Neopulse - SPINNER 75/28,"16,71","13,83",B007WQJSGM,"Samsonite S'Cure Spinner 75/28 Koffer, 75cm, 102 L, Black","16,22","16,6",B01LXFCAZR,"Samsonite - Base Boost Spinner 78 cm Exp, Black","7,71","5,65"
Amazon.de,senseo,"99,6",B0000BY5H0,Senseo HD7810/60 Original Kaffeepadmaschine (1 - 2 Tassen gleichzeitig) schwarz,"19,22","14,04",B01BPJG8NW,Senseo HD7829/60 Viva Café Kaffeepadmaschine (Kaffee Boost Technologie) schwarz,"8,78","5,82",B01IBZ7LNE,"Senseo HD7892/60 Switch 2-in-1 Kaffeemaschine für Filter, Schwarz","8,17","4,44"
Amazon.de,transformers spielzeug,"99,6",B00P95QOPQ,"Hasbro Transformers B0899ES0 - Robots In Disguise 3-Step Changers Optimus Prime, Actionfigur","11,28","11,27",B00UT9T1OS,"Hasbro Transformers B1564EU4 - Robots In Disguise Mega Optimus Prime, Actionfigur","7,31","5,44",B00R2DH3Z8,"Hasbro Transformers B0910ES0 - Robots in Disguise Warriors Strongarm, Actionfigur","7,01","9,18"
