"Amazon.de","hängesessel",509,"B01HGFB1M2","AMANKA XXL Hängesessel 185x130cm Hängestuhl 2 Personen Hängesitz bis 150 kg Baumwolle Hängematte inkl. 360° Swivel Hängeschaukel Lilac Grau","9,80%","24,39%","B00INVKEAO","Hängesessel zum Aufhängen - mit rundem Sitzkissen - Weiß Beige - Belastbarkeit max. 100 kg","8,21%","5,21%","B015ED0LII","Home Deluxe - Polyrattan Hängesessel - Cielo - inkl. Gestell, Sitz- und Rückenkissen","7,91%","1,86%"
"Amazon.de","iphone xs max hülle",510,"B07FLTCS9D","ESR Kompatibel mit iPhone XS MAX Hülle, Gehärtetes Glas Handyhülle TPU Rahmen [Stoßfest] [Kratzfest] Crystal klar Durchsichtige Handy Schutzhülle Kabelloses Laden Unterstützen Glashülle 6,5 Zoll-Klar","9,06%","9,94%","B07JWJGXZL","Humixx iPhone XS Max Hülle,Hochwertigem 9H Gehärtetem Anti-Gelb Glas Rückseite mit Soft TPU Weich Rahmen Schutzhülle,Ultra Dünn Transparent Crystal Clear Handyhülle für iPhone XS Max - Klar","8,14%","11,23%","B07GZR8QYR","Humixx iPhone XS Max Hülle Hochwertigem Stoßfest, Anti-Fingerabdruck, Anti-Scratch FeinMatt Federleicht Hülle Bumper Cover Schutz Tasche Schale Hardcase für iPhone XS Max-Schwarz","7,36%","10,54%"
"Amazon.de","erotische filme prime",511,"B07JMHXG2K","Dunkle Lust","10,60%","2,86%","B06Y2GGBXS","Below Her Mouth","8,09%","0,00%","B07JMCWFZ2","Dunkle Lust","7,90%","2,86%"
"Amazon.de","cinderella",512,"B011RGDE9Y","Cinderella (2015) [dt./OV]","17,14%","41,01%","B00OKAWYEG","Cinderella","14,81%","41,30%","B011REDI60","Cinderella (2015) [dt./OV]","11,30%","4,20%"
"Amazon.de","geldbeutel männer",513,"B015KHNEM8","Fa.Volmer ® Schwarze Herren Ledergeldbörse aus echtem Leder Querformat #SQ90","15,07%","20,94%","B01C3FUNGA","I-CLIP Geldbörse Robutense Carbon Schwarz","8,68%","4,53%","B07JPD533S","Herren Geldbeutel Geldbörse mit Geldklammer Münzfach und Sichtfenster | RFID Blocker Kreditkartenetui Karten Portemonnaie | Dünne Brieftasche Portmonee für Männer XB-033 Kohlefaser-Schwarz","7,72%","5,50%"
"Amazon.de","bademantel herren",514,"B07CJGYT4D","Herren Bademantel XS S M L XL - 100% Baumwolle, Oeko TEX Zertifiziert - Bademantel aus Baumwollfrottee mit Kapuze, 2 Taschen, Gürtel - Saunamantel, Weich, Saugfähig und Bequem","12,69%","14,58%","B00IUI8IEO","aqua-textil Bademantel Baumwolle für Damen Herren mit Kapuze, Frottee Sauna-Mantel, Föhr Uni, Sylt Zwei-farbig Morgenmantel weich und super flauschig, Bath-Robe Waden lang XS bis XXXL","8,22%","8,77%","B01HAI74OY","ZOLLNER Bademantel mit Schalkragen, Unisex, viele Größen, weiß, Reine Baumwolle, 020","7,09%","7,84%"
"Amazon.de","staubsauger beutellos",515,"B01MTF06KN","Philips FC9332/09 beutelloser Staubsauger PowerPro Compact (650 W, 1,5 L Staubvolumen, integrierte Bürste) weiß","19,86%","20,94%","B01DSOO0B4","Rowenta RO3731EA beutelloser Bodenstaubsauger Compact Power Cyclonic ohne Filter-Set (750 Watt, hocheffizienter Filter) schwarz/blau","12,70%","15,62%","B01MT60NRQ","Kärcher Staubsauger VC 3 beutellos, Bodenstaubsauger mit Komfortausstattung, hocheffizienter Hepa-Filter, 700 Watt, gelb-schwarz, handlich, leise & allergikerfreundlich","4,12%","3,00%"
"Amazon.de","liam neeson",516,"B078WYMTS4","The Commuter [dt./OV]","11,88%","7,14%","B071X9NR8S","Silence","7,30%","3,06%","B078WYS5SL","The Commuter [dt./OV]","6,62%","0,00%"
"Amazon.de","steckdosenleiste",517,"B002OJYK5G","Brennenstuhl Eco-Line 6-fach Steckdosenleiste (mit Überspannungsschutz, Steckerleiste, Kindersicherung, Schalter und 1,5 m Kabel) anthrazit","11,67%","15,21%","B002MQGGMQ","Brennenstuhl Eco-Line 3-fach Steckdosenleiste (Steckerleiste mit Kindersicherung, Schalter und 1,5 m Kabel) weiß","10,81%","16,98%","B001NKYR5U","Brennenstuhl Primera-Line, Steckdosenleiste 10-fach (Steckerleiste mit 2 Schaltern für je 5 Steckdosen und 2m Kabel) Farbe: schwarz","7,89%","7,97%"
"Amazon.de","rockabilly kleider damen",518,"B07G75TNZN","MisShow Damen elegant 50er Jahre Petticoat Kleider Gepunkte Rockabilly Kleider Cocktailkleider","15,99%","20,94%","B018WUPN2E","Dresstells Neckholder Rockabilly 1950er Polka Dots Punkte Vintage Retro Cocktailkleid Petticoat Faltenrock","14,13%","13,45%","B071GTD9TD","bbonlinedress 1950er Vintage Retro Cocktailkleid Rockabilly V-Ausschnitt Faltenrock","4,42%","4,31%"
"Amazon.de","mauspad",519,"B000KHTBQM","Sharkoon 1337 Gaming Mauspad, L, schwarz","18,07%","23,16%","B07G41Q2VL","Sidorenko Gaming Mauspad | Mousepad 280 x 200 mm | Fransenfreie Ränder | spezielle Oberfläche verbessert Geschwindigkeit und Präzision | Rutschfest | schwarz","14,86%","19,18%","B00E3G1XVC","Sidorenko Gaming Mauspad | Mousepad | spezielle Oberfläche verbessert Geschwindigkeit und Präzision | Fransenfreie Ränder | Rutschfest | Blau","6,34%","6,21%"
"Amazon.de","toilettenpapierhalter",520,"B00TQQ2YEO","WENKO 21564100 Stand WC-Garnitur Rivalta/Bürstenhalter, Edelstahl rostfrei/Glas, 18 x 70 x 20 cm, matt","10,55%","8,05%","B01LL8WO6C","Wangel Toilettenpapierhalter ohne Bohren, Patentierter Kleber + Selbstklebender Kleber, Aluminium, Matte Finish","8,85%","9,94%","B07FDVFJC9","Ruicer Toilettenpapierhalter ohne bohren Klopapierhalter Selbstklebend Papierhalter Edelstahl für Badezimmer","8,68%","12,39%"
"Amazon.de","esstisch",521,"B00Y3J67TM","Agionda Esstisch Toledo in Weiss und Nussbaum 140 x 90 cm mit kratzfester Melamin Oberfläche","10,62%","9,28%","B01DT3GM1A","möbelando Esszimmertisch Esstisch Auszugstisch Ausziehtisch Tisch Esszimmer Bomuli I (Weiß)","6,86%","9,28%","B01LY8AKNL","SAM Baumkantentisch 200x100 cm Quarto, Esszimmertisch aus Akazie, Holz-Tisch mit schwarz lackierten Beinen","6,65%","2,06%"
"Amazon.de","komödie",522,"B00IKBUOJ8","Everybody's Fine [dt./OV]","8,39%","0,00%","B07MCCYN4P","Es war einmal ein Deadpool [dt./OV]","6,10%","11,38%","B06ZY8B2QN","Ein Dorf sieht schwarz [dt./OV]","4,49%","0,81%"
"Amazon.de","mikrofon",523,"B00AE4T0Q2","Auna MIC-900B USB Kondensator Mikrofon für Studio-Aufnahmen inkl. Spinne (16mm Kapsel, Nierencharakteristik, 320Hz - 18KHz) schwarz","10,49%","7,85%","B0744FJPCB","Neewer NW-700 Kondensator-Mikrofon-Kit, Schwarzer Mikrofon, Schwarze 48V Phantomspeisung, NW-35 Boom Scherenarm Ständer mit Shock Montage and Pop Filter, XLR-Stecker auf XLR-Buchse Kabel","10,48%","7,25%","B00XOXRTX6","Neewer® nw-700 Professional Studio Rundfunk Aufnahme Kondensator Mikrofon & nw-35 verstellbar Aufnahme Mikrofon Federung Scissor Arm Ständer mit Shock Mount und Montage Klemme Kit","9,77%","8,92%"
"Amazon.de","kostüm kinder",524,"B00HCG8TV2","Drachen-Kostüm, F82 Gr.98-104, für Kinder, Drache Kind Drachen-Kostüme für Fasching Karneval, Kleinkinder-Karnevalskostüme, Kinder-Faschingskostüme, Geburtstags-Geschenk Weihnachts-Geschenk","6,15%","7,69%","B079R7NR64","OVERDOSE Kind-Jungen-Mädchen-Karikatur-Entwurf Fox Hoodie-Jacken-Outwear-Mäntel 0.5-3 Jahre alt","5,64%","2,46%","B07HNKRX14","Yigoo Ladybug Mädchen Marienkäfer Kostüm Kinder Halloween Karneval Marinette Overall Party Cosplay 3er Set - Jumpsuit, Augenmaske, Tasche M","4,90%","4,31%"
"Amazon.de","jurassic world",525,"B00YSJIWW2","Jurassic World [dt./OV]","21,78%","57,41%","B00YSII5IO","Jurassic World [dt./OV]","14,26%","7,87%","B07DHYXKGJ","Jurassic World: Das Gefallene Königreich [dt./OV]","13,48%","14,81%"
"Amazon.de","gleitgel",526,"B00JF11E5A","Deluxe Lumunu Aqua Gleitgel Gleitfreude, Langzeitwirkung auf Wasserbasis (250ml)","23,11%","29,02%","B019I3ODO8","Durex Play Feel Gleitgel auf Wasserbasis – Leichtes, seidiges Gleitmittel für gefühlsechtes Empfinden – 1 x 100 ml in der praktischen Dosierflasche","14,19%","14,39%","B00GYDH84I","Durex Play Gleitgel Ausprobierpaket für Sie und Ihn mit 3 Artikeln (Feel, Wärmend, Prickelnd) zu je 50 ml - 150 ml gesamt","10,98%","10,18%"
"Amazon.de","liquid",527,"B0772NPNN7","Maxiliving 20er x 10ml E Liquid 0,0mg Nikotin 10 Aromen e-liquid für E-Zigarette","14,31%","11,47%","B07KYH5WC5","E Liquids ohne Nikotin, E-liquids 12 X 10mL, E-Zigaretten Liquid Set 50VG/50PG Refill Electronic Cigarette, für Elektronische Zigaretten, Shishas Nikotinfrei","13,54%","19,87%","B07FMW29K8","Joylink E Liquids, Aktualisiert 12 X 10mL E Liquido 80VG/20PG Vaper Eliquid E Shish Liquids Set Getränk Geschmack Refill Electronic Cigarette Liquid Set für Elektronische Zigarette, Ohne Nikotin","10,02%","9,85%"
"Amazon.de","under armour herren",528,"B00RKBOORC","Under Armour Herren CC Sportstyle Logo Kurzarmshirt, Orange (Orange), Small","8,08%","8,58%","B00GOAO19G","Under Armour Herren Rival Fitted Full Zip Oberteil, Schwarz, XL","6,88%","3,86%","B07LFRPZSR","Under Armour Herren Ua Raid 8 Shorts Kurze Hose","5,74%","6,72%"
"Amazon.de","valentinstag geschenk",529,"B01MQWIKU1","Sex Gutscheine mit verschiedenen Stellungen für Paare (für sie & ihn) ❤️ Liebesgutscheine/Sexy Love Coupons für Freund & Freundin, Männer & Frauen - Lustige Witzige Geschenke/Valentinstag Geschenk","7,08%","5,82%","B00GL06UZW","VIP-LASER 3D Glas Kristall Quader XL Herz mit zwei Wunschnamen + Datum im Hochformat, Beleuchtung:mit Color Leuchtsockel 5 LED Silber","6,97%","10,58%","B016QBV68Q","Schlummerlicht24 Led Unendlichkeitszeichen mit Namen Liebe Liebesbeweise zur Hochzeit Verlobung Jahrestag Hochzeitsgeschenke Wohnzimmer Schlafzimmer Freundin Partner Geschenk","6,55%","9,52%"
"Amazon.de","bosch professional",530,"B07J251N8X","Bosch Professional 40tlg. Werkzeug Set (in L-Case)","11,36%","5,73%","B015WGDX6E","Bosch Professional Akkuschrauber GSR 12V-15 (2x 2,0 Ah Akku, 12 Volt, Schrauben-Ø max: 7 mm, in Tasche)","7,80%","18,70%","B07J243BCJ","Bosch Professional 16tlg. Werkzeug Set (in Tasche)","6,80%","3,05%"
"Amazon.de","armband frauen",531,"B07HN8Q3LT","Amtier Ankerarmband für Männer Frauen Paare Pärchen mit Geschenkbox, Herren Damen Ankerarmbänder aus Nylon & Edelstahl Anker Unisex Armband - Grau 7,5zoll/19cm","11,08%","12,88%","B07GKT24ZD","Yesiidor 5Pcs böhmisches mehrschichtiges Armband-Gesetzte Frauen-Mädchen-Art und Weise Vinatge Reizend Schildkröte-Korn-Liebes-Karten-Goldketten-Armband-Armband-Geschenk","7,93%","6,02%","B0779BGPD9","GOOD.designs ® Freundschaftsband mit Buchstabe für Freund|Freundin friends M Magdalena Maike Mara Mareike Maren Marie Marina Melanie Melina Melissa Milena Miriam Mona Mike Manuel Marc Marcel","6,63%","8,42%"
"Amazon.de","thermomix",532,"B00OAXFNQ4","Krups Prep&Cook HP5031 Multifunktions-Küchenmaschine (1,550 Watt, bis zu 12.000 U/min, mit Kochfunktion) weiß/edelstahl","42,90%","7,46%","B071RXD51P","Stone4Slide Thermomix Gleitbrett Gleiter aus Acryl-Glas White","17,52%","10,45%","B0776DL416","Gleitbrett für Thermomix® TM5 - Zubehör Anthrazit-grau Smart-Innovativ von Leckerhelfer","4,49%","2,99%"
"Amazon.de","autoradio",533,"B07JVDVBXP","[Verbesserte] ieGeek Autoradio mit Bluetooth Freisprecheinrichtung,USB/MP3/FM/WMA/WAV/TF-Media Player + Fernbedienung,Single Din Universal Autoradio","9,73%","16,51%","B074DXPS77","Sony DSX-A210UI MP3 Autoradio (mit Extrabass, USB, AUX Anschluss und iPod/iPhone Control Funktion) Beleuchtung: rot","9,31%","10,34%","B074DYNSKP","Sony DSX-A410BT MP3 Autoradio (Dual Bluetooth, NFC, USB, AUX Anschluss, Beleuchtung, 4 x 55 Watt, Freisprechen) rot","9,22%","9,73%"
"Amazon.de","doku",534,"B07BFLX2Y9","Unsere Erde 2","34,48%","3,12%","B00LISYUQS","Unsere Erde [dt./OV]","7,63%","1,56%","B07BFLPGG7","Unsere Erde 2","4,95%","0,00%"
"Amazon.de","fahrradhelm kinder",535,"B00TGQ7S72","Uvex Kinder Kid 3 Fahrradhelm","20,44%","25,61%","B01HJZXKIM","Abus Unisex - Kinder Fahrradhelm Anuky","10,35%","10,63%","B07BLBBCV2","Uvex Kinder Air Wing Fahrradhelm","6,22%","5,63%"
"Amazon.de","schwangerschaftstest",536,"B00D6B1900","Clearblue Schwangerschaftstest, mit Anzeige der Wochen, 1 digitaler Test, 1er Pack (1 x 1 Stück)","16,97%","17,17%","B00424AUAA","Clearblue Schwangerschaftstest, Schnell und Einfach, 1 Test, 1er Pack (1 x 1 Stück)","13,72%","14,97%","B07CXL973F","Geratherm early detect, 3er Pack Schwangerschaftstest Frühtest mit extra großer Testzone und hygienischem Teststab, 3 Stück Schwangerschafts-Frühtest | SS Test","10,55%","10,49%"
"Amazon.de","oral b zahnbürste elektrische",537,"B0140IEGIE","Oral-B Pro 750 Elektrische Zahnbürste, mit CrossAction Aufsteckbürste, Bonus Pack mit Reise-Etui, schwarz","22,63%","28,37%","B072VBF6M4","Oral-B PRO 2 2900 Elektrische Zahnbürste für extra Zahnfleischschutz dank visueller Andruckkontrolle, mit 2. Handstück, Schwarz","11,89%","12,75%","B00KBWBPRY","Oral-B Pro 600 Elektrische Zahnbürste, mit Timer und CrossAction Aufsteckbürste, weiß","8,86%","13,43%"
"Amazon.de","sexspielzeug männer",538,"B0796SS47K","Muschi Masturbator Sexspielzeug Nabini 3D Gummimuschi Realistische Masturbatoren Männer Lifelike Erotik-Sexspielzeug Männer Silicone Vagina Masturbieren Mann mit Extra Eng Vagina und Anal（4.7lb）","18,23%","15,48%","B07L4CKJWK","Elektrische Cup-Masturbatoren Masturbieren Mann Männer Doppel Masturbation Blowjob Cup Automatischer Männlicher Masturbator Sex Men Cup USB-Aufladung Vaginale Erotik Oral SexSpielzeug für Männer","9,11%","11,75%","B07D1PH9LX","JIULOVE Erotik Sexspielzeug Lebensechte Sexpuppen Simulation Mann Größe Orales Saugen des Unterkörpers kann eine vielzahl von haltung Sex Spielzeug für Männer 165cm, 1","7,84%","2,64%"
"Amazon.de","kingsman",539,"B075QYKR54","Kingsman - The Golden Circle [dt./OV]","33,88%","59,52%","B075QXSLLR","Kingsman - The Golden Circle [dt./OV]","17,10%","5,26%","B01093X6I0","Kingsman: The Secret Service [dt./OV]","13,79%","23,55%"
"Amazon.de","gürtel damen",540,"B0792QL3GG","Demarkt Ledergürtel schmaler Damengürtel Damen Gürtel mit rund Schnalle 105CM (Beige)","8,14%","8,00%","B01JZX07UU","Ledergürtel 100 % echt Leder, Jeansgürtel, 3 cm breit und ca. 0.25 cm stark, Gürtel, Made in Germany, Anzugsgürtel, Hüftgürtel, Vascavi (105 cm Gesamtlänge 115 cm, Schwarz)","7,69%","11,65%","B07CWQ4HP6","Ledergürtel Damengürtel Echtledergürtel Jeansgürtel 3 cm breit für Damen und Herren Gürtel perfekt für Freizeitkleidung (110cm/43.3'', Black)","5,72%","1,48%"
"Amazon.de","smartwatch damen",541,"B075344T1X","Garmin vívomove HR Sport Rosegold Fitness-tracker Roségold mit weißem Silikonarmband M","10,26%","6,56%","B075ZTMBH2","X-WATCH SIONA Smartwatch Damen iOS und Android Watch - Damenuhr rosegold Aktivitätstracker Damen elegant Fitnessarmband mit Herzfrequenz Fitness Uhr mit Schrittzähler","7,75%","9,46%","B07JGGL5NW","JOLI XW PRO | Damen Smartwatch rosegold - Smartwatch Damen iOS - Schrittzähler Uhr Damen - Fitness Smartwatch","6,41%","5,21%"
"Amazon.de","dokumentation",542,"B07BFLPGG7","Unsere Erde 2","10,71%","0,00%","B07BFLX2Y9","Unsere Erde 2","10,19%","0,00%","B00LISBFIO","Unsere Erde [dt./OV]","5,51%","0,00%"
"Amazon.de","bohemian rhapsody film",543,"B07JYNQJG5","Bohemian Rhapsody [dt./OV]","29,96%","7,19%","B07JZ7V83R","Bohemian Rhapsody [dt./OV]","20,83%","43,62%","B07JJH7VCQ","Bohemian Rhapsody - Exklusives FeaturetteBecoming Freddie","16,43%","9,05%"
"Amazon.de","the flash",544,"B07FV2HCXD","The Flash - Staffel 4","21,95%","0,00%","B07FTXYYGS","The Flash - Staffel 4","21,43%","0,00%","B00TFWOFNC","The Flash - Staffel 1","10,95%","0,00%"
"Amazon.de","brotkasten",545,"B07F7CWRJM","Lumaland Cuisine Brotkasten Brotdose Brotbox aus Metall mit Bambus Deckel, Brotbehälter rechteckig, 30,5 x 23,5 x 14 cm Weiss","18,08%","15,86%","B00083HPIE","Wesco 235 201 Grandy Brotkasten weiß 22x42x17cm (L/B/H), Edelstahl","7,42%","6,18%","B000BPM908","Brabantia Brotkasten aus Edelstahl","6,84%","8,56%"
"Amazon.de","raspberry pi 3 b+",546,"B07BDR5PDW","Raspberry 1373331 Pi 3 Modell B+ Mainboard, 1 GB","34,61%","50,38%","B07DDCRFP6","ABOX Raspberry Pi 3 Modell B Plus (B +) Ultimatives Starterkit mit 32GB Class 10 SanDisk Micro SD Karte, 2,5A EIN/aus-Schaltnetzteil und Premium Black","20,62%","16,12%","B07BNPZVR7","UCreate Raspberry Pi 3 Model B+ Desktop Starter Kit (16 GB, schwarz)","7,11%","7,54%"
"Amazon.de","federmäppchen",547,"B07H9QR8WX","Shager - 1pcs Federmäppchen Rosa Groß/Federtasche Mädchen Teenager 3 Fach Pink, Große Kapazität Briefpapier Pouch Stifteetui Mäppchen Leinen, 20 * 11CM (A)","13,32%","6,88%","B000VZK4FK","Eastpak Oval Single Federmäppchen, 22 cm, Schwarz","8,26%","14,11%","B07DLTQB4X","iSuperb Studenten Mäppchen Klein Federmäppchen kinder Schulmäppchen für Mädchen, Junge, Teenager Einfarbig 19,8 x 8 x 5cm (Rosa)","5,94%","5,64%"
"Amazon.de","helium balloon gas",548,"B012XN5SMQ","Helium Ballongas + 50 bunte Latexballons (Ø 25cm) + Polyband HeliumStar® Einwegflasche XXL mit 0,420 m³ Liter Heliumgas","10,28%","13,96%","B075DCTDL8","Helium Ballongas Einweg Heliumflasche XL 250 Liter für 30 Luftballons","9,37%","10,42%","B07DQLC28L","PASAMO Deutsches Marken Premium für 45 Ballons 23cm GARANTIERT Helium 99,996 % Reines Helium Ballongas SOFORTVERSAND24h","8,20%","9,67%"
"Amazon.de","grinder",549,"B01MCZF5P3","Grinder TOPELEK Grinder 4 Teilig Crusher Herb Pipe Gras Mühle Kitchen Grinder Metall für Tabak,Spice, Kräuter, Gewürze,Herb,Pollen 50mm Schwarz.","16,72%","25,31%","B00V4OT34U","LIHAO Pollen Grinder Crusher für Tabak,Spice,Kräuter,Gewürze,Herb,Kaffee 4-Teiliges Set mit Pollen Scraper (Nickel-Schwarz)","8,07%","12,01%","B01KSVSLRE","Fancyli Lightning Grinder, 4 Pieces 2.48 Tobacco Grinder Spice Grinder Herb Grinder with a Cleaning Brush (Red)","6,61%","4,64%"
"Amazon.de","grand tour",550,"B07KQLZGJK","The Grand Tour - Staffel 3 [dt./OV]","62,09%","4,76%","B07KQP8TC6","The Grand Tour - Staffel 3 [dt./OV]","14,65%","0,00%","B01JAUQP86","The Grand Tour - Staffel 1 [dt./OV]","6,40%","0,00%"
"Amazon.de","diffuser",551,"B01B44UJ92","TaoTronics Aroma Diffuser 300ml Luftbefeuchter Oil Düfte Humidifier Holzmaserung LED mit 7 Farben für Yoga Salon Spa Wohn-, Schlaf-, Bade- oder Kinderzimmer Hotel","19,09%","17,04%","B07FP488L6","Diffuserlove 550ML diffuser Aroma diffuser Ultraschall Luftbefeuchter Trag usor Cool Mist Humidifier mit 7 Farben LED und AUTO-Abschaltung Funktion,Perfekt für SPA, Massage, Yoga","9,73%","2,78%","B07DRK9WS9","Diffusor Aromatherapie,VicTsing Aroma Diffuser 150ml Luftbefeuchter Ultraschall Vernebler, Ultra Leise Diffuser BPA-Free Öle Diffusor mit 8 Farben LED Humidifier Duftlampe für Kinderzimmer Wohn- Büro","9,08%","12,31%"
"Amazon.de","all or nothing",552,"B07KYX85HB","All or Nothing: Manchester City - Staffel 1 [dt./OV]","16,33%","0,00%","B07KYX7JKZ","All or Nothing: Manchester City - Staffel 1 [dt./OV]","13,33%","0,00%","B07FN611SP","All or Nothing: Die Dallas Cowboys - Staffel 3 [dt./OV]","8,69%","0,00%"
"Amazon.de","staubsauger roboter",553,"B06WRWZ9BH","ILIFE V5s Pro Saugroboter mit Wischfunktion | automatischer Staubsauger Roboter | 2in1 nass Wischen oder Staubsaugen | für Hartböden | benetzt bis zu 180qm | Fallschutz | beutellos | mit Ladestation","24,80%","30,43%","B0182G4BO4","iRobot Roomba 605 Saugroboter (reinigt alle Hartböden und Teppiche, Dirt Detect Technologie, 3-Stufen-Reinigungssystem) weiß","10,66%","6,52%","B079QM5GL9","iRobot Roomba 671 Saugroboter (reinigt alle Hartböden und Teppiche, Dirt Detect Technologie, 3-Stufen-Reinigungssystem, WLAN-fähig und per App programmierbar) schwarz","9,37%","5,07%"
"Amazon.de","cheerleader kostüm",554,"B07DTJLFRF","Redstar Fancy Dress - Damen Cheerleader-Kostüm - Uniform mit Pompons - Halloween, American High School - 6 Größen 34-44 - Rot - M","17,32%","22,46%","B00I3HJJ2M","Smiffy's 40065S - Damen Cheerleader Kostüm, Kleid und Pompons, Größe: 36-38, rot","14,31%","15,71%","B01ID2BVK4","Travelday Damen-Highschool Cheerleader-Abendkleid -Up Party Halloween-Kostüm-Ausstattung","8,84%","5,75%"
"Amazon.de","coco",555,"B077SXRRZ7","Coco [dt./OV]","42,62%","57,86%","B077T23HNG","Coco [dt./OV]","15,04%","3,33%","B077TXMG7N","Coco (inkl. Bonusmaterial) [dt./OV]","9,21%","12,60%"
"Amazon.de","sicario",556,"B0166QJF98","Sicario [dt./OV]","33,02%","44,45%","B07FKLGT7N","Sicario 2 [dt./OV]","18,30%","41,81%","B0166PH6PE","Sicario [dt./OV]","14,89%","3,09%"
"Amazon.de","smart tv",557,"B07B6JMD2Q","Samsung NU7179 138 cm (55 Zoll) LED Fernseher (Ultra HD, HDR, Triple Tuner, Smart TV)","13,28%","9,96%","B07HQSDTQM","Thomson 32FD5526 80 cm (32 Zoll) Fernseher (Full HD, Smart TV, Triple Tuner) Schwarz","11,32%","15,30%","B07KV1DM4B","Techwood F40T52C 102 cm (40 Zoll) Fernseher (Full HD, Triple-Tuner, Smart TV, Prime Video)","7,00%","10,32%"
"Amazon.de","cbd öl",558,"B07KXXGYXC","Natura-Med 10% Premium Essential | 10ml - CB1 und CB2 Aktivator (10%) CBD (G) Hanf Öl Tropfen mit Extrakt (10%)","25,68%","28,12%","B07J3CB6L6","Geschenk der Natur Bio 500 mg CBG Öl-Tropfen, Vollspektrum mit 5 % Hanfextrakt, 10 ml","19,39%","22,59%","B07HQLBP4W","ALPEX-MED 10% PREMIUM ESSENTIAL 10ml CB1 und CB2 Aktivator","9,00%","8,88%"
"Amazon.de","hausschuhe herren",559,"B01JS2RHFQ","Andres Machado - Dynamic - Unisex-Hausschuh aus Naturwolle und Feinfilz mit anatomischer Sohle - Made in Spain -.EU 37 bis 47","9,38%","9,51%","B07C54TTG8","VeraCosy Komfortable Herren Memory Foam Hausschuhe, wollähnliche Plüschflausch gefütterte Pantoffeln mit Gummisohle für Drinnen und Draußen","7,14%","7,79%","B07FN48R2K","Lico Herren Bioline Man Flache Hausschuhe","6,92%","8,87%"
"Amazon.de","massagegerät",560,"B01CU0CM7G","Naipo Schulter Massagegerät Elektrisch für Nacken Rücken Shiatsu Nackenmassagegerät mit Wärmefunktion 3D-Rotation Massage Einstellbaren Geschwindigkeiten für Haus Büro Auto","13,76%","19,72%","B01M5JC3PC","Naipo Massagegeräte Vibration Handmassagegerät mit Infrarot Wärmefunktion und Klopf Massage, 6 Austauschbaren Aufsätzen, Verschiedenen Geschwindigkeitsstufen, für Rücken Beine Fuß Nacken Schulter","8,58%","7,26%","B002KFZW4W","Beurer MG 16 Mini-Massager, grün","7,96%","8,58%"
"Amazon.de","ipad 2018 hülle",561,"B06XZH8SKF","JETech Hülle für iPad (9,7 Zoll, Modell 2018 / 2017, 6. / 5. Generation), Intelligent Schutzhülle mit Auto Schlafen / Wachen, Schwarz","32,49%","42,11%","B06XTPSCW3","Fintie Hülle für iPad 9.7 Zoll 2018/2017 - Ultradünn Schutzhülle mit transparenter Rückseite Abdeckung Cover mit Auto Schlaf/Wach für 9.7 iPad 6. Generation / 5. Generation, Roségold","8,44%","9,91%","B06XY9XRCH","Fintie Hülle für iPad 9.7 Zoll 2018/2017 - Ultradünn Schutzhülle mit transparenter Rückseite Abdeckung Cover mit Auto Schlaf/Wach für 9.7 iPad 6. Generation / 5. Generation, Himmelgrau","6,10%","7,40%"
"Amazon.de","supreme",562,"B078JVTD15","Supreme Italia Herren Kapuzenpullover Hoodie Hooded Logo Jacke Stickerei Skate Streetwear Stylisch Dope Fashion schwarz rot grau weiß Langarm Kapuze 100% kardierte Baumwolle","14,50%","12,78%","B0786D9KCX","Soteer Windbreaker Coole Jacke Mit Kapuzen Streetwear Unisex Damen Herren Jungen Mädchen Reißverschluss Cool Schwarz Weiß","8,88%","7,78%","B07GZQNGDG","Fünfte Straße Gürteltasche Hüfttasche, Umhängetasche Schultertasche, Cross Bag, Hip Bag, Sporttasche (Schwarz)","8,38%","8,33%"
"Amazon.de","nike schuhe herren",563,"B078X1W7KK","Nike Herren Air Max 270 Gymnastikschuhe Bianco","8,76%","3,42%","B07MNTBJ3C","Nike Herren Air Max Invigor Laufschuhe","6,80%","4,65%","B07GJM14S4","Nike Unisex-Erwachsene T-lite Xi Low-Top","5,80%","8,80%"
"Amazon.de","kaffeemühle",564,"B0722WVHPH","KYG Kaffeemühle 300W Elektrische Kaffeemühle Kaffeebohnen Nüsse Gewürze Getreide Mühle mit Edelstahlmesser 50g Fassungsvermögen (schwarz)","20,60%","26,34%","B00R7HKAWC","Melitta Kaffeemühle Molino, elektrisch, Scheibenmahlwerk, schwarz 101901","7,14%","7,01%","B073YB7PYD","Groenenberg Hand-Kaffeemühle mit Keramik-Mahlwerk Manuelle Kaffeemühle | Espresso-Mühle | Edelstahl | Stufenlose Mahlgradeinstellung","6,60%","5,82%"
"Amazon.de","bloothooth kopfhörer",565,"B07J694TB1","Bluetooth Kopfhörer, ENACFIRE E18 Bluetooth Kopfhörer in Ear Bluetooth 5.0 Headset Stereo-Minikopfhörer Sport Kabellose Bluetooth Kopfhörer mit Portable Mini Ladekästchen und Integriertem Mikrofon","11,93%","10,18%","B0756BRVXJ","Anker Bluetooth Kopfhörer SoundBuds Flow in Ear magnetisches Headset, mit Wasserschutzklasse IPX5/7-Stunden-Spielzeit/Mikrofon, federleicht für iPhone, iPad, Samsung, Huawei, HTC und mehr","8,30%","14,22%","B07LCXGNJR","Bluetooth Kopfhörer Kabellos Mini in Ear Kopfhörer HiFi Noise Cancelling Sport Headphones Wireless für iOS Android Schwarz","6,57%","4,04%"
"Amazon.de","lol surprise",566,"B07HRK6PPV","L.O.L Surprise! 557050E7C Hairgoal Puppen-Serie 5-1A, Multi","18,18%","24,28%","B07BK7SWNJ","L.O.L. Surprise 552062E7C Under Wraps-Eye Spy 2A, Verschiedene Farben","11,21%","16,99%","B078VZBX4P","L.O.L. Surprise 554639E5C Pearl Style 2, Verschiedene Farben","10,28%","8,54%"
"Amazon.de","lucifer",567,"B07FMDBPQ3","Lucifer - Staffel 3 [dt./OV]","29,88%","0,00%","B01H0Z55BG","Lucifer - Staffel 1 [dt./OV]","20,20%","1,79%","B07FMV15T3","Lucifer - Staffel 3 [dt./OV]","14,78%","0,00%"
"Amazon.de","winterjacke damen",568,"B07FJYWFJG","ONLY Damen Parka Onliris Aw Cc OTW","7,19%","6,05%","B07GXRL6BG","Berydale Damen Parka mit Kapuze und Daumenschlaufen","5,59%","5,29%","B075726ZCZ","Marikoo Damen Winter Jacke Parka Mantel Winterjacke warm gefüttert B362 [B362-Karmaa-Weiss-Gr.XL]","5,46%","4,16%"
"Amazon.de","notizbuch",569,"B01NAT49WS","Dickes Notizbuch Liniert/Lined notebook mit Stiftschleife - Lemome A5 Breites Liner-Notizbuch mit Tasche zum Schreiben + Seitenteiler Geschenke, Gebändert, 125g/m², Groß, 180 Seiten, A5","12,64%","17,54%","B07HJCSM1Q","Matilda Myres Notizbuch – Roségoldfolie A5 grau","7,39%","6,61%","B07BBN5883","GRT A5 PU Leder Bunte Schreiben Notebook Journal Tagebuch Notizbuch Täglichen Notizblock Nette Reise Journal (Set von 4 Zufällige Farbe)","5,67%","2,50%"
"Amazon.de","sherlock holmes",570,"B001T3B4V6","Sherlock Holmes","35,15%","0,00%","B00FYWH6A6","Sherlock Holmes [dt./OV]","6,57%","5,20%","B00HFG2L7M","Sherlock - Staffel 1 [dt./OV]","5,04%","7,51%"
