"Amazon.de","led",257,"B01I1HQ372","B.K.Licht LED Stripes, 5m Stripe, Lichterkette, Band, Streifen, LED Leiste, LED Lichtleiste, LED Bänder, Lichterkette LED, weiß, bunt, inkl. Fernbedienung, inkl. Farbwechsel, selbstklebend","17,49%","28,32%","B01KVH6NA2","KINGSO 500x 5mm LED Leuchtdioden Dioden set Elektronik komponenten rund 5 Farben(100er Jede Farbe)","9,99%","6,33%","B072KH1WPC","Led TV Hintergrundbeleuchtung,2M USB Led Beleuchtung Hintergrundbeleuchtung Fernseher USB für 40 bis 60 Zoll HDTV,TV-Bildschirm und PC-Monitor,Led Strip.MEHRWEG","9,07%","15,03%"
"Amazon.de","stiefeletten damen",258,"B016MDQIOU","Stiefelparadies Damen Stiefeletten Chelsea Boots Flandell","9,81%","10,54%","B01CSIQRIK","Stiefelparadies Damen Stiefeletten High Heels mit Blockabsatz Profilsohle Flandell","6,23%","5,62%","B01LFOTASC","Stiefelparadies Damen Stiefeletten Schlupfstiefel gefüttert Flandell","5,26%","6,50%"
"Amazon.de","asterix",259,"B01CSUD60U","Asterix - Sieg über Cäsar [dt./OV]","13,45%","2,26%","B01CSGEPPO","Asterix erobert Rom","11,34%","6,78%","B01CSUD9WU","Asterix bei den Briten [dt./OV]","10,46%","3,02%"
"Amazon.de","handyhülle iphone 7",260,"B01LAHQYVK","iPhone 8 Hülle, iPhone 7 Hülle, X-Level [Guardian Serie] Soft Flex TPU Case Ultradünn Handyhülle Silikon Bumper Cover Schutz Tasche Schale Schutzhülle für iPhone 7/ iPhone 8 4,7 Zoll - Weinrot","9,09%","7,82%","B01N0PYYWU","Imikoko® Hülle für iPhone 8/iPhone 7 Matt Marmor Weich Silikon Handyhülle Stein Marble Schlank TPU Bumper Handytasche Flexible Schutzhülle Soft Back Cover Gummi Dünn(4.7)","6,76%","5,31%","B01M1SCIOV","Spigen® [Ultra Hybrid 2 Kompatibel mit iPhone 8/7 Hülle, Einteilige Transparent Schutzhülle für Apple iPhone 7 iPhone 8 Case Black (042CS20926)","6,46%","10,05%"
"Amazon.de","sporttasche",261,"B072KKBJD7","PUMA Pro Training II M Sporttasche, Puma Black, 61 x 31 x 29 cm","16,31%","20,56%","B01M5KAQZ0","adidas Uni Tiro Sporttasche, Tiro , Gr. Small (Herstellergröße: Small), Black/Dark Grey/White","7,18%","6,00%","B072R2VKR9","PUMA Pro Training II S Sporttasche, Puma Black, 42x26x50 cm","6,09%","8,07%"
"Amazon.de","the 100",262,"B0129294EY","The 100 Staffel 1","20,13%","2,59%","B07M7FBP9P","The 100 Staffel 5","15,23%","2,59%","B01290R0ZQ","The 100 Staffel 1","15,05%","0,00%"
"Amazon.de","john wick",263,"B01MRCF2Y0","John Wick: Kapitel 2 [dt./OV]","31,40%","10,17%","B00XQSJ42S","John Wick [dt./OV]","18,62%","64,96%","B01MRCHZK4","John Wick: Kapitel 2 [dt./OV]","17,59%","0,80%"
"Amazon.de","küchenmaschine",264,"B0041G5R3Y","Bosch MUM5 MUM56340 Styline Küchenmaschine (900 W, 3 Rührwerkzeuge Edelstahl, spülmaschinenfest, 3,9 Liter, Teigmenge 2kg, Durchlaufschnitzler 3 Scheiben, Mixaufsatz, Zitruspresse, Fleischwolf) grau","11,76%","7,42%","B00E6H953G","Philips HR7627/02 Küchenmaschine (650 Watt, inkl. Knethaken, 2 Geschwindigkeiten) weiß","8,92%","14,11%","B075WYRPYM","Klarstein Preis/LEISTUNGSSIEGER Bella Rossa Küchenmaschine (1200 W, 5.2 Liter, 6-Stufen, 3 Profi-Rührwerkzeuge) rot","8,21%","9,37%"
"Amazon.de","haarschneidemaschine",265,"B0002DDISG","Braun Haarschneider/Trimmer HC5050, mit 17 Längeneinstellungen, schwarz","16,98%","21,27%","B00KNCXFR0","Panasonic ER-GP80 Profi-Haarschneidemaschine für Akku- und Netzbetrieb, schwarz","8,73%","5,14%","B0034B7W6C","Philips Series 3000 Haarschneider (11 Längen) QC5115/15, Schwarz","7,93%","11,39%"
"Amazon.de","horror prime filme",266,"B01BYJLXO2","Carrie (2013)","7,45%","0,00%","B078PKF4G3","The Crucifixion","7,39%","50,00%","B071L28QRX","Get Out [dt./OV]","7,36%","0,00%"
"Amazon.de","sofa",267,"B0711Y9Q69","Jockey Ecksofa, Stoff, anthrazit, 161 x 313 x 64 cm","7,45%","5,62%","B00PZGSIA8","Küchen-Preisbombe Sofa Couch Ecksofa Eckcouch in weiss/hellgrau Eckcouch mit Hocker - Minsk XXL","7,08%","7,87%","B07KBPRTPR","Urnight Sex Lendenkissen mit Zentimeter Sex-Kissen Sofa Faltbares Aufblasbare Geschlechts Ramp Inflatable position master Kissen Sex Kissen Sex-Spielzeug für Paare","6,89%","2,25%"
"Amazon.de","high school musical",268,"B00K5RESLK","High School Musical","26,36%","48,34%","B00K5R5C4M","High School Musical","20,00%","4,63%","B00K5REW8Y","High School Musical 2","6,29%","22,10%"
"Amazon.de","bose",269,"B0756CYWWD","Bose ® QuietComfort 35 Wireless Kopfhörer II (mit Amazon Alexa), schwarz","12,14%","13,57%","B0117RGGDE","Bose SoundTouch 10 kabelloses Music System (geeignet für Alexa) schwarz","10,51%","14,05%","B00X9XD1LK","Bose ® SoundLink Mini Bluetooth Lautsprecher II carbon","8,70%","15,35%"
"Amazon.de","herren uhr",270,"B071CGG1B5","BUREI Herren Uhren Ultra Dünne Schwarze Minimalistische Quartz mit Datumsanzeige und Milanese Armband","8,77%","14,56%","B07D5SLYCM","Herren Uhren Männer Militär Wasserdicht Sport Chronograph Schwarz Edelstahl Armbanduhr Luxus Design Business Datum Kalender Modisch Analog Quarzuhr","7,47%","7,55%","B07H9CMYQM","Herren Schwarz Uhren Männer Militär Wasserdicht Sport Groß Chronograph Armbanduhr Mann Luxus Mode Datum Kalender Analoge Quarz Uhr","6,12%","6,33%"
"Amazon.de","sitzsack",271,"B07K3TJSVG","Sitzbag Sitzsack Sessel XL - XXL für Kinder und Erwachsene - In & Outdoor Sitzsäcke Kissen Sofa Hocker Sitzkissen Bodenkissen (XXL - 80cm Durchmesser, Schwarz)","18,88%","26,60%","B077T3C1Y9","Der größte Sitzsack Europas - Riesiger Giga Sitzsack in Grau mit 1500l Memory Schaumstoff Füllung und Waschbarem Bezug - Gemütliches Sofa, Riesen Bett, Bean Bag für Kinder und Erwachsene","15,31%","5,95%","B004AP4WSM","Patchhome 2 in 1 Funktion Sitzsack Sitzkissen Bean Bag - Rot - 100cm Durchmesser in 25 Farben und 3 versch. Größen - fertig befüllt","10,62%","10,72%"
"Amazon.de","western",272,"B07DD5LM3Y","Feinde - Hostiles [dt./OV]","8,23%","23,20%","B01AYJ7VKI","Open Range - Weites Land","5,85%","1,20%","B01MS3SLVH","Die glorreichen Sieben [dt./OV]","4,48%","6,40%"
"Amazon.de","karl lagerfeld",273,3868828702,"Karl","12,13%","18,50%","379138452X","CHANEL: Karl Lagerfeld - Die Kampagnen","9,54%","9,92%",3742300016,"Karl Lagerfeld: Kleine Anekdoten aus dem Leben eines großen Modeschöpfers","3,86%","7,77%"
"Amazon.de","bürostuhl",274,"B01HNXGLFO","Songmics Racing Bürostuhl, Lederimitat, schwarz, 60 x 60 x 111 cm","15,88%","19,32%","B00UTC9T7E","Songmics Bürostuhl mit hoher Rückenlehne, Lederimitat, schwarz, 67 x 66 x 114 cm","6,96%","7,49%","B01DSPHJX4","Songmics Racing Stuhl, Lederimitat, schwarz, grau und weiß, 85 x 66 x 34 cm","5,40%","4,88%"
"Amazon.de","fluch der karibik",275,"B00EXHJKT8","Fluch der Karibik","22,02%","40,60%","B00FCLK278","Fluch der Karibik","13,83%","3,92%","B0711XR9DD","Pirates of the Caribbean: Salazars Rache (Teil 5) [dt./OV]","7,86%","8,66%"
"Amazon.de","iphone xs",276,"B07HBCCGY8","Apple iPhone XS (64 GB) - Space Grau","37,76%","30,88%","B07HBP1C2C","Apple iPhone XS (64 GB) - Silber","15,67%","17,06%","B07HBCSB2K","Apple iPhone XS (256 GB) - Space Grau","14,29%","19,85%"
"Amazon.de","riverdale",277,"B07BSVVF4F","Riverdale: Staffel 1","21,19%","0,00%","B07BST3RPX","Riverdale: Staffel 1","17,37%","0,47%","B07L8YG2W7","OLIPHEE Herren Riverdale Southside Serpents gedruckt Hoodie Long Sleeve Pulli mit Kapuze","6,87%","13,32%"
"Amazon.de","samsung galaxy s10",278,"B07MTXWLRQ","Samsung Galaxy S10 Smartphone (15.5cm (6.1 Zoll) 128GB interner Speicher, 8GB RAM, Prism White) - Deutsche Version","52,53%","33,68%","B07MTXWLRP","Samsung Galaxy S10 Smartphone (15.5cm (6.1 Zoll) 128GB interner Speicher, 8GB RAM, Prism Black) - Deutsche Version","13,63%","25,26%","B07MTXCK1R","Samsung Galaxy S10+ Smartphone (16.3cm (6.4 Zoll) 512GB interner Speicher, 8GB RAM, Ceramic Black) - Deutsche Version","9,88%","6,84%"
"Amazon.de","batman",279,"B00EVA5ANC","Batman Begins [dt./OV]","12,14%","0,49%","B00G0OFW9O","The Dark Knight [dt./OV]","7,54%","0,00%","B07HWQGM8F","Batman, Staffel 1","7,14%","3,88%"
"Amazon.de","schuhschrank",280,"B07DJ4F78J","PREMAG Portable Schuhablage Organizer Tower, weiß, modulare Schrankregal für platzsparende, Schuhregal Regale für Schuhe, Stiefel, Hausschuhe 3 * 7","15,12%","11,65%","B07175JYGH","Albatros Vincent (L) -Weiss-mit 14 Fächern und Klicksystem 104 x 48 x 30cm (BxHxT) Schuhschrank mit Sitzkissen MDF Breite: 104 cm","6,99%","6,96%","B07GFS1WH7","Movian Idro moderner  3-türiger Schuhschrank, 25 x 75 x 128, Bedruckt","5,20%","2,09%"
"Amazon.de","the middle",281,"B0178IVM2Q","The Middle - Staffel 1","20,35%","0,00%","B0178IADYY","The Middle - Staffel 1","13,78%","0,00%","B07C36FWL2","The Middle - Staffel 8","9,65%","0,00%"
"Amazon.de","king of queens",282,"B0777PB24C","King of Queens - Staffel 1 [dt./OV]","22,82%","2,04%","B0777RF1NT","King of Queens - Staffel 1 [dt./OV]","15,33%","2,04%","B0777QFG1T","King of Queens - Staffel 4 [dt./OV]","8,96%","4,08%"
"Amazon.de","sex and the city",283,"B00IG5MHWK","Sex and the City - Staffel 1","18,87%","50,93%","B00HNB4Y0G","Sex And The City","15,85%","3,12%","B00IF4UZLW","Sex and the City - Staffel 1","15,12%","5,61%"
"Amazon.de","mixer",284,"B00I5ABIFI","WMF Kult X Mix & Go Smoothie Mini Standmixer (300 Watt, Smoothie Maker, Tritan Flasche 600 ml) silber","19,00%","25,94%","B07CZCJH2K","Mixer Smoothie Maker, Fochea Standmixer, 700 Watt Blender, 3 in 1 Multifunktion Smoothiemaker + Fleisch Zerkleinerer/Ice Crusher + Kaffeemühle,24000U/Min mit 570ml Sport-Flasche BPA frei Tritan","7,20%","6,19%","B00VH9Z026","2in1-800 Watt Standmixer mit Mix-Behälter aus Glas 1,5 Liter inklusive Kaffeemühle, BPA-Free Smoothie Maker Ice-Crusher","5,96%","6,15%"
"Amazon.de","wandregal",285,"B07FF181D2","LIFA LIVING Runde Wandregal aus Holz und Metall Schwarz mit 4 Böden - Holzregal - Vintage und Natur Stil, Gewürzboard Küchenregal Regal 4 Etagen - Holz und Metall Küchenregal | Ø55 cm x 11 cm","5,83%","3,35%","B00OXNEU5Q","SONGMICS Wandregal 3er Set Schweberegale, MDF Holz, Tiefe 15 cm, 60/45/30 cm, weiß U-Form Wandboard LWS66W","5,74%","7,54%","B075CT3ZT8","SONGMICS Wandregal 3er Set U-Form Schweberegal kreatives Lounge Cube Regal aus MDF-Platte Weiß LWS40WT","5,15%","7,68%"
"Amazon.de","benjamin blümchen",286,"B001QBIWU2","Benjamin Blümchen","40,10%","0,00%","B00HYYWGRU","Benjamin Blümchen - Staffel 1","8,12%","2,67%","B00HYZBC3I","Benjamin Blümchen - Staffel 1","5,56%","5,33%"
"Amazon.de","faschingskostüme",287,"B00VVK9SHO","amscan 844276-55 2 Partnerkostüme Schinken & Ei, Mehrfarbig, M/L","6,56%","6,51%","B01NBMYD3I","Carry me Affen-Kostüm, F102 Gr. M- XL, Affen-Kostüme Affe Kostüme Affen-Faschingskostüm, Fasching Karneval, Faschings-Kostüme, Geburtstags-Geschenk Erwachsene, Huckepack","5,35%","6,85%","B00GNSGHXC","Widmann 98872 Kostüm, Mehrfarbig(blau/lila/rosa), M","5,20%","6,85%"
"Amazon.de","akkuschrauber",288,"B01JIOGFD4","Makita Akku-Schlagbohrschrauber (2x Akku/Ladegerät im Transportkoffer, 170 W, 10.8 V) HP331DSAX3","15,14%","10,80%","B00TTZU566","Bosch Akkuschrauber IXO (5. Generation, 10 Bits, USB Ladegerät, Dose, 3,6 Volt, 1,5 Ah)","14,29%","27,59%","B015WGDX6E","Bosch Professional Akkuschrauber GSR 12V-15 (2x 2,0 Ah Akku, 12 Volt, Schrauben-Ø max: 7 mm, in Tasche)","10,61%","10,05%"
"Amazon.de","tischlampe",289,"B00VV32S2S","Schreibtischlampe LED TaoTronics Tischleuchte 5 Farb- und 7 Helligkeitsstufen dimmbar Touchfeldbedienung USB-Anschluss für Aufladung des Smartphones Weiß","7,68%","16,24%","B009SNO60K","WOFI Tischleuchte Cesena 1-flammig, grau, Ø ca. 14 cm, Höhe ca. 32 cm, Stoffschirm 832401500000","7,00%","8,69%","B073GVWX2T","MiniSun – ‘Angus’ Tischleuchte im retro Körbchenstil mit einem schwarzen Finish und einem schwarzen Lampenschirm – Tischlampe","6,79%","3,12%"
"Amazon.de","horror filme ab 18",290,"B00FYUQHTE","No One Lives - Keiner überlebt!","9,74%","8,14%","B00FYTD7W0","No One Lives - Keiner überlebt!","7,87%","3,49%","B0716CXGF3","Sieben Minuten nach Mitternacht [dt./OV]","6,82%","4,65%"
"Amazon.de","deadpool",291,"B07D2JDPRY","Deadpool 2 [dt./OV]","23,01%","43,92%","B01BG2KU7S","Deadpool [dt./OV]","15,58%","16,23%","B07MCCYN4P","Es war einmal ein Deadpool [dt./OV]","11,47%","14,73%"
"Amazon.de","jason statham",292,"B01E664ZUY","Hardcore [dt./OV]","20,09%","19,42%","B01E65NCCW","Hardcore [dt./OV]","10,17%","0,00%","B00LC6QHW6","Homefront [dt./OV]","7,10%","3,40%"
"Amazon.de","iphone xs hülle",293,"B07GZRY7NB","Humixx iPhone XS Hülle (spezielles Design für iPhone XS), Anti-Fingerabdruck, Anti-Scratch FeinMatt FederLeicht Hülle Bumper Cover Schutz Tasche Schale Hardcase für iPhone XS-Schwarz","16,15%","20,08%","B07GZMQ8D9","laxikoo iPhone XS Hülle, iPhone X Handyhülle, Silikon Hülle iPhone XS Schutzhülle Anti-Scratch Stoßfest Unterstützt Kabelloses Aufladen Ultra Dünn TPU Bumper case für iPhone XS/iPhone X Case Cover","10,88%","14,80%","B07GRZCX7L","ESR Kompatibel mit iPhone XS Hülle, iPhone X Hochwertig Gehärtetes Glas Handyhülle TPU Rahmen [Stoßfest] [Kratzfest] Crystal Clear Durchsichtige Schutzhülle Glashülle für iPhoneXS (5,8 Zoll) - Klar","10,07%","9,66%"
"Amazon.de","ohrringe",294,"B07HHYR1X7","KEKEDA 2018 Trend Fashion Ohrringe Frauen Retro Metall Ohrringe geometrische groß Anhänger Ohrringe","11,74%","23,29%","B07JGBYFCT","Damen-Ohrstecker-Set Edelstahl weiß rosévergoldet niedliche Tier-Katzen-Elefanten-Stern geometrische Zirkonia Kunstperle Schneeflocken Twise geometrisches Peace-Zeichen Symbol klein Statement Ohrsteck","9,21%","4,93%","B077YWLK18","Suyi Mode Hohl Lotus Blume Ohrringe Kristall Einfach Schick Ohrringe Set BRG","6,87%","4,72%"
"Amazon.de","e shisha",295,"B075LD415J","Salcar V60 E Zigarette/ E Shisha Starterset und 5x10ml E liquid || V60 Mod Kit mit 2200mah Akku + 2.0ml Top Refill Verdampfer + 0.5 Ohm Verdampferköpfe, 0,0mg Nikotin (Schwarz)","12,31%","13,83%","B07HXP8P2Z","E Zigarette Shisha Starter Set und 5x10ml E liquid 80W Mod Kit mit 0.5 Ohm/ 3.0ml Verdampfer 2000mah Akku Starterset Dampfer Vape, Regelbare Watt LED Bildschirm 0,0mg Nikotin KUBO LZ80W – Schwarz","10,77%","20,13%","B07L312HG2","IMECIG B1 80W E Zigarette Starter Set, Regelbare Watt LED Bildschirm Dampfer Vape Starterset, Vape Box Mod Kit mit 2ml Verdampfer Tank, ohne Nikotin, Schwarz (Mehrweg-Verpackung)","6,53%","3,62%"
"Amazon.de","toniebox figuren",296,"B074W4WKMP","tonies® Hörfigur - 30 Lieblings-Kinderlieder - Spiel- & Bewegungslieder","15,28%","18,21%","B07D7S6195","tonies® Hörfigur - Unser Sandmännchen - Nachts wenn Alles schläft!","6,93%","7,52%","B07JLCGTQ9","tonies 01-0156 30 Lieblings-Kinderlieder - Tierlieder Hörfigur, Bunt","5,16%","6,65%"
"Amazon.de","kostüm kinder jungen",297,"B0032R4CHU","Widmann - Kinderkostüm S.W.A.T Officer","7,51%","9,16%","B00HCG8VRE","Drachen-Kostüm, F82 Gr.104-110, für Kinder, Drache Kind Drachen-Kostüme für Fasching Karneval, Kleinkinder-Karnevalskostüme, Kinder-Faschingskostüme, Geburtstags-Geschenk Weihnachts-Geschenk","6,25%","6,82%","B07BJ7F83C","amscan König der Diebe Robin Hood Kostüm Kinder Jungen","5,66%","5,86%"
"Amazon.de","tastatur",298,"B077BT728N","Logitech K280e Tastatur (Kabelgebunden, Business-Tastatur, QWERTZ, Deutsche Layout) schwarz","21,94%","29,19%","B00F35N0VI","CHERRY KC1000 corded Tastatur USB, schwarz,QWERTZ","13,31%","22,35%","B014SJ0IAA","HAVIT Gaming Tastatur und Maus Set, LED Hintergrundbeleuchtung QWERTZ (DE-Layout), 7 Tasten Gaming Maus mit 7 LEDs als Beleuchtung (800 / 1200 / 2400 / 3200 DPI einstellbar) (Schwarz)","7,96%","4,00%"
"Amazon.de","echo",299,"B06ZXQV6P8","Amazon Echo (2. Gen.), Intelligenter Lautsprecher mit Alexa, Anthrazit Stoff","16,22%","29,09%","B0792HCFTG","Echo Dot (3. Gen.) Intelligenter Lautsprecher mit Alexa, Anthrazit Stoff","14,43%","16,44%","B07C76F3P2","Echo Input (Schwarz) – Bringen Sie Alexa auf Ihren Lautsprecher – Externer Lautsprecher mit 3,5-mm-Audioeingang oder Bluetooth erforderlich","9,78%","9,66%"
"Amazon.de","handstaubsauger",300,"B071ZYGP6G","Holife Generation II Handstaubsauger, Akku Staubsauger Kabellos (Nass & Trocken, 100W Zyklon-Staubsauger, 14.8V Lithum-ion Akku, Schnelles Aufladen Tech) für Autos Zuhause【Testsieger 2,0 gut】","23,64%","25,57%","B002EIJVHO","Philips ECO FC6148/01 Akkusauger (beutellos, 10,8V Li-Ionen-Akku, 9 Minuten Saugleistung, 100 Watt) grau","7,75%","6,89%","B07CJQJ9CZ","Holife Akku Handstaubsauger, Kabellos, 4.5KPA/25Min Beutelloser staubsauger mit Wandhalterung (11,1V/ 2200mAh Lithium , HEPA-Filter, 400mL Trockenkapazität) mit flexiblem Saugschlauch für Auto Zuhause","4,14%","5,31%"
"Amazon.de","schuhe herren",301,"B07FYFR6VR","Wonesion Herren Fitness Laufschuhe Atmungsaktiv Rutschfeste Mode Sneaker Sportschuhe, ,","7,59%","6,09%","B01IXW8WYW","SOLLOMENSI Laufschuhe Retwin Turnschuhe Straßenlaufschuhe Sneaker mit Snake Optik Damen Herren Sportschuhe","6,46%","8,94%","B07KT8NRYX","adidas Herren Forest Grove Fitnessschuhe","5,35%","4,15%"
"Amazon.de","samsung",302,"B07HKNF367","Samsung Galaxy A7 (2018) Smartphone [6 Zoll, 64GB, 24 Megapixel]","25,01%","27,17%","B07HKV9RPB","Samsung Galaxy J4+ Smartphone (15.26 cm (6 Zoll), 32GB, 13 Megapixel Kamera)","9,50%","15,76%","B0725WZK1N","Samsung Galaxy J5 DUOS Smartphone (13,18 cm (5,2 Zoll) Touch-Display, 16 GB Speicher, Android 7.0) schwarz","8,95%","13,59%"
"Amazon.de","der untergang",303,"B00JO955KS","Der Untergang","41,16%","77,82%","B00JIOUGIK","Der Untergang","24,97%","6,21%","B07CJF51YZ","Hitler - Die letzten 10 Tage","6,74%","3,56%"
"Amazon.de","kleiderständer",304,"B00GTEXCE2","SONGMICS Kleiderständer Garderobenständer mit Rollen Höhenverstellbar von 113 bis 198 cm, Edelstahl plattierte Rohre LLR401","10,88%","16,82%","B00YTMX296","SONGMICS HSR01W Kleiderständer Kleiderstange Garderobenständer mit schuhablage, Metall, Cremeweiß, 90 x 44,5 x 173 cm","7,32%","6,26%","B003R5JQDM","IDIMEX Garderobenwagen GROSSO Kleiderständer Rollgarderobe Garderobenständer, mit Schuhablage, 2 Kleiderstangen, höhenverstellbar, Metallrohr verchromt","6,02%","7,11%"
"Amazon.de","bademantel damen",305,"B00JE7KGQI","aqua-textil Bademantel mit Kapuze Damen Herren, Morgenmantel weich und super flauschig, Coral Fleece Saunamantel lang, Malibu in den Größen XS bis XXXL","12,83%","14,89%","B07KX3T77Y","CityComfort Damen-Luxus-Bademantel mit Kapuze und Sherpa-Kapuze und Manschetten. Superweiche Robe mit pelzgefüttertem Kapuzenbademantel für Damen","9,54%","11,57%","B07C34YCPZ","DecoKing Bademantel XS - XXXL kurz Damen Herren Unisex mit Kapuze Morgenmantel Mikrofaser weich leicht kuschelig Microfaser Fleece Robby","8,79%","7,73%"
"Amazon.de","erotik",306,"B07J516DDW","The Kiss - Ich Will Dich","11,24%","25,43%","B06Y2GGBXS","Below Her Mouth","5,82%","0,19%","B0748GF7YN","Enlove Silikon Dreifacher Vibrator Paar Vibratoren für Sie Klitoris und G-punkt Leise AnalPlug Prostata Stimulator mit 7 Vibrationsfrequenz","5,70%","3,23%"
"Amazon.de","waffeleisen",307,"B000094G32","Cloer 1621 Waffelautomat für klassische herzchen-Waffeln / 930 W/Waffelgröße 15,5 cm/stufenlos wählbarer Bräunungsgrad/weiß Metall","20,39%","32,25%","B008GT06QK","Krups FDK 251 Waffeleisen, 850 Watt für Belgische Waffeln, schwarz - edelstahl","15,52%","15,65%","B07DN58CBM","Sandwichmaker | Aicok 3 in 1 Sandwichtoaster | Tisch-Grill | mit Waffeleisen | 3 Abnehmbare Platten-Sets | American Toast, Waffeln, Fleisch | Antihaftbeschichtet | Muschel Edelstahl | Schwarz","5,73%","3,41%"
"Amazon.de","fahrradschloss",308,"B00ZUX4B4I","nean Fahrrad-Ketten-Schloss, Zahlen-Code-Kombination-Schloss, Stahlkettenglieder, schwarz, 6 mm x 900 mm","12,70%","18,03%","B07K2SPCQD","BIFY Fahrradschloss, Fahrradschloss Zahlen Stahlkettenglied 38mm x920mm 650g Kettenschloss für Fahrräd, Motorräd und Elektrofahrzeuge Schwarz","8,23%","11,78%","B07DGWMMZ8","Toptrek Faltschloss mit Halterung Fahrradschloss Schlüssel Lang 85cm 8 Gelenken Fahrradschloß Sicherheitsstufe Level 10 Fahrrad Faltschloß für Mountainbike/Rennrad/BMX/MTB (Schwarz)","6,67%","3,84%"
"Amazon.de","boxershorts men",309,"B06WD95LS4","Antonio Rossi Herren Hipster Fitted 12 er pack","11,59%","11,73%","B073ZJ6M2H","Best Basics Boxershorts Hipster American Style Boxer Unterhosen Baumwolle Herren","7,83%","8,13%","B01KDTB2A4","MERISH Boxershorts Men Herren 12er Pack Unterwäsche Unterhosen Männer Retroshorts 213 + 218","6,55%","6,10%"
"Amazon.de","lampe",310,"B0756D92G6","B.K.Licht Design 2x Industrielle Vintage LED Pendelleuchte Hängeleuchte Ø 30cm für E27 Leuchtmittel, schwarz und weiß wählbar, für Wohnzimmer Esszimmer Restaurant Keller Untergeschoss usw.","8,49%","7,06%","B01N7RSZ9A","B.K.Licht Deckenlampe LED 12W, Sternenlicht, Deckenleuchte für Wohnzimmer, Flur, Badezimmer, kaltweiss, 230V, IP20, Ø 290mm","8,05%","7,76%","B06WW8YB9N","E27 Creative Edison Kronleuchter Antique DIY Kronleuchter 5 Köpfe Lampen Vintage Industrial Deckenleuchte Pendelleuchte Leuchte Retro Industrial Dining Hall Schlafzimmer Hotel Home Lighting Zubehör","6,62%","3,53%"
"Amazon.de","huawei mate 20 pro",311,"B07J6NNNGP","Huawei Mate 20 Pro 128GB Handy, Android 9.0 (Pie), Dual SIM, schwarz (West European Version)","46,88%","36,05%","B07JVNMSMN","Huawei Mate20 Pro Dual-SIM Smartphone Bundle (6,39 Zoll, 128 GB interner Speicher, 6 GB RAM, Android 9.0, EMUI 9.0) schwarz + USB Typ-C-Adapter [Exklusiv bei Amazon] - Deutsche Version","23,17%","18,45%","B07JH3RMPT","Huawei Mate 20 Pro 128GB Handy, blau/lila, Android 9.0 (Pie), Dual SIM, Twilight (West European Version)","6,13%","6,87%"
"Amazon.de","purge",312,"B00IK6OD68","The Purge - Die Säuberung","22,56%","8,18%","B07HF73RK2","The Purge – Die Säuberung - Staffel 1 [dt./OV]","17,92%","2,40%","B07HF7WKTW","The Purge – Die Säuberung - Staffel 1 [dt./OV]","12,69%","0,15%"
"Amazon.de","sessel",313,"B01MRICW2H","Bellboni® Couchhusse für Einsitzer Couchsessel oder Loungesessel, Sofabezug, bi-elastische Stretchhusse, Spannbezug für viele gängige Einer Sessel, grau","10,70%","11,86%","B078DZCD7B","ESTEXO® Fernsehsessel, TV Sessel, Lounge, Relaxsessel, Polstersessel, Lesesessel, Stoff, Kissen (Grau)","7,52%","7,22%","B011QR339K","SONGMICS Schaukelstuhl Relaxstuhl 5-Fach verstellbares Fußteil Belastbarkeit (Grau), LYY10G","4,93%","7,73%"
"Amazon.de","küchenwaage",314,"B075J7XG8Q","ADORIC Küchenwaage Digitalwaage Professionelle Waage Electronische Waage, Küchenwaage mit LCD Display-wunderbare Präzision auf bis zu 1g(5kg Maximalgewicht)-Silbrig","24,52%","31,37%","B00L5M0JDU","ProfiCook PC-KW 1061 digitale Küchenwaage mit großem LCD-Display, Wiegefläche aus Edelstahl, Tara-Funktion, Abschaltautomatik","11,53%","11,48%","B07K9CTYD9","ADORIC Küchenwaage mit Größe Oberfläche-Wunderbare Präzision auf bis zu 1g(5kg Maximalgewicht), Küchenwaage Digitalwaage Professionelle Waage Electronische Waage 2018","9,43%","2,47%"
"Amazon.de","porno",315,"B07DV2114C","Swinger: Komm, spiel mit uns! (Unzensiert)","9,05%","8,42%","B002WS2862","Sex - Der Porno für Paare - Volume 2","5,60%","2,02%","B07DTY1983","Swinger: Komm, spiel mit uns! (Unzensiert)","5,16%","0,34%"
"Amazon.de","wimpern",316,"B078MNHRBC","Anself Falsche Wimpern, 5 Paare 3D Nerzhaar Wimpern Natürliche Schwarz Lange Pure Handgemacht mit Unsichtbares Band Wiederverwendbar (#1)","14,23%","14,49%","B01E9QRPVM","5 Pair / Lot Nette Criss Kreuzen Falsche Voluminöse Wimpern","11,62%","16,92%","B00CDWSONS","Ardell Professional Echthaarwimpern, 1er Pack (1 x 4 Paar)","7,90%","7,23%"
"Amazon.de","huawei p20",317,"B07BHD7MHL","Huawei P20 Smartphone (14,7 cm (5,8 Zoll), 128GB interner Speicher, 4GB RAM, 20 MP Plus 12 MP Leica Dual Kamera, Android 8.1, EMUI 8.1, Dual SIM) Black (West European Version)","47,75%","37,78%","B07BHDC9V6","Huawei P20 lite Smartphone (14.83 cm (5.84 Zoll), 64GB interner Speicher, 4GB RAM, 16 MP Plus 2 MP Kamera, Android 8.0, EMUI 8.0, Dual SIM) Midnight Black (West European Version)","17,30%","13,43%","B07C8S4J7X","Huawei P20 Smartphone Bundle (14,7 cm (5,8 Zoll), 128GB interner Speicher, 4GB RAM, 20 MP Plus 12 MP Leica Dual Kamera, Android 8.1, EMUI 8.1) Schwarz [Exklusiv bei Amazon] - Deutsche Version","13,10%","27,69%"
"Amazon.de","lego ninjago",318,"B07FNWJ5P7","LEGONINJAGO 70665 Samurai-Roboter","9,15%","15,10%","B07FP6QNP8","LEGONINJAGO 70666 Goldener Drache","8,98%","12,56%","B075T1Q2WQ","LEGO Ninjago 70641 - Lloyds Nachtflitzer, Unterhaltungsspielzeug","5,41%","5,12%"
"Amazon.de","outlander",319,"B07LGZSGBX","Outlander - Staffel 4 [dt./OV]","24,89%","49,23%","B07LHFX5DD","Outlander - Staffel 4 [dt./OV]","11,89%","4,41%","B00RYBXVHM","Outlander - Staffel 1 [dt./OV]","9,24%","5,44%"
"Amazon.de","beamer",320,"B079BH7X7Z","QKK Beamer, Mini Beamer mit tragbarer Tasche, Videobeamer unterstützt 1080P Full HD, Verbindung mit HDMI VGA SD USB AV Gerät, Heimkino Projektor, Weiß.","17,75%","19,11%","B07HQQPY8C","Beamer APEMAN Tragbarer Mini Beamer 3500 Lumen Unterstützt 1080P Full HD Videobeamer Heimkino Projektor Kompatibel mit HDMI / VGA / AV / Micro SD / USB Flash Laufwerk / PS4 / Chromecast","11,87%","18,55%","B06WW8D4KF","2018 Aktualisiert RAGU Z400 Mini Multimedia Tragbar Full HD Beamer, +70% Helligkeit 50,000 Stunden Unterstützung HDMI VGA USB AV SD verbunden mit Amazon TV Fierstick-Laptop Smartphone/iPad Xbox","7,27%","7,92%"
"Amazon.de","werkzeugkoffer",321,"B0051E16LW","Mannesmann 89-teiliger Premium Universal- und Haushalts-Werkzeugkoffer, M29085","20,99%","36,79%","B005ERFK9U","Brüder Mannesmann Alu-Werkzeugkoffer, bestückt, 108-tlg., M29075","11,44%","11,23%","B00LITZ53E","Monzana® Werkzeugkoffer XXL gefüllt Set 929tlg | Qualitätswerkzeug - Werkzeugkasten Werkzeugkiste Werkzeugtrolley silber","8,37%","8,06%"
"Amazon.de","portemonnaie damen",322,"B07BHQPL9F","Gr8life Damen Vintage Geldbörse, Lange Portemonnaie mit Große Kapazität, Elegante und Süße Damen Geldbeutel Rosa","8,96%","10,65%","B01N1NIH1X","Damen Süß Leder Geldbörse ACGE Pu neuer Stil Damen Lang Geldbörse, Stieg, 22","8,94%","9,57%","B07F9MHBTQ","Geldbörse Damen Leder Gross, Geldbeutel Damen Groß Viele Fächer mit 24 Kartenfächer, Lang Portemonnaie Frauen RFID Schutz, Damen Portmonee Leder mit Handyfach und Reißverschluss (Rot)","7,08%","7,07%"
