"Amazon.de","laufband",701,"B01IPCHJPS","Sportstech F10 Laufband mit Smartphone App Steuerung, Schmiersystem, Pulsgurt im Wert von 39,90 € inklusive, Bluetooth, 1PS, 10 KM/H, für GEH- und Lauftraining mit 13 Programmen - kompakt klappbar","18,55%","14,69%","B01I195ZDI","Fitifito FT300 Klasse Einsteiger Laufband mit Pulsgurt Smartphone App Steuerung, hydraulisches Klappsystem zu Einem super Preis! 1PS, 10kmh Optimal für Anfänger und Fortgeschrittene! Gehen Walken Joggen","13,56%","16,10%","B075SJ6C9F","Sportstech F37 Profi Laufband 7PS bis 20 km/h, Selbstschmiersystem, Smartphone Fitness App, 15% Steigung, Bluetooth MP3, große Lauffläche mit 8 Zonen Dämpfungssystem bis 150 Kg - klappbar","7,78%","5,93%"
"Amazon.de","geldbörse herren",702,"B015KHNEM8","Fa.Volmer ® Schwarze Herren Ledergeldbörse aus echtem Leder Querformat #SQ90","12,53%","17,35%","B01C3FUNGA","I-CLIP Geldbörse Robutense Carbon Schwarz","9,08%","5,07%","B00DBSVW96","Fa.Volmer ® Schwarze Ledergeldbörse aus echtem Leder im Hochformat mit RFID Schutz Phoenix 3","8,71%","12,85%"
"Amazon.de","new balance schuhe frauen",703,"B07L6PM5X4","New Balance Damen 574v2 Sneaker","11,43%","13,41%","B07KV9CWFG","New Balance Damen 574v2 Sneaker 36,5 EU","8,87%","6,70%","B073HNQKRR","New Balance Damen 220 Sneaker, Rose","6,96%","8,42%"
"Amazon.de","nespresso maschine",704,"B004JV77QQ","De'Longhi Nespresso EN 125.S Kapselmaschine Pixie Electric | 1260 Watt | 0,7 Liter | Flexible Tassen-Abstellfläche für verschiedene Gläser | silber","18,20%","37,09%","B00G5YOVZA","DeLonghi Nespresso Inissia EN 80.B | Hochdruckpumpe | Energiesparfunktion | kompaktes Design | Schwarz","12,49%","15,95%","B07G3QSZSY","Krups Nespresso XN900T Vertuo Plus Kaffeekapselmaschine, Automatische Kapselerkennung, 1,7 l Wassertank, 5 Tassengrößen, Titanium/Edelstahl","7,58%","4,49%"
"Amazon.de","badehose für herren",705,"B07G99C4R9","Urban Classics Herren Shorts Block Swim","9,13%","10,49%","B079BHRFNT","Arcweg Badehose für Herren Jungen Badeshorts für Männer Kurz Vielfarbig Schnelltrocknend Beachshorts Boardshorts Strand Shorts Trainingshose mit Mesh-Futter und Verstellbarem Tunnelzug Größe S-2XL","6,55%","8,80%","B07C85Z1RS","Aqua Speed® Herren Badehose | Schwimmhose | S-XXXL | Modern UV-Schutz | Chlor resistent | Kordelzug","6,40%","7,71%"
"Amazon.de","hotel",706,"B07FN3M9LM","Hotel Transsilvanien 3 - Ein Monster Urlaub","30,24%","57,06%","B00FFLJ95Q","Hotel Transsilvanien","27,81%","3,59%","B016N9FQZA","Hotel Transsilvanien 2 [dt./OV]","18,78%","24,11%"
"Amazon.de","sketchers damen",707,"B07MJH5GHC","Skechers Damen 12980 Sneaker","9,24%","13,56%","B07L4FL458","Skechers Damen 12615 Sneaker","6,89%","7,16%","B07NX5QC45","Skechers Damen Graceful-get Connected Sneaker","6,80%","9,34%"
"Amazon.de","faszienrolle",708,"B079WMHMMN","BODYMATE Faszienrolle Standard Mittel-Hart mit GRATIS E-Book - Schwarz 30x15cm","20,33%","24,89%","B01BVTWXFI","Liebscher und Bracht Set: Faszienrolle und Faszienball (je 2 Stück) zum Faszien Training von Muskeln, Bindegewebe und Stoffwechsel mit Übungen auf DVD","13,39%","12,53%","B00HDAKYDS","BLACKROLL® Standard Faszienrolle. Original Massagerolle für das Faszien-training. Trainingsrolle in versch. Farben erhältlich","12,27%","10,95%"
"Amazon.de","vaporizer",709,"B07K8MYMC6","Vaporizer, Verdampfer - Graveda - mit Keramik-Mundstück & -Kräuterkammer, Vaporisator, Inhalator, 2200 mAh Akku, inkl. Zubehör, geeignet für Kräuter, Weed, Cannabis","15,45%","20,35%","B07H4NJBTH","Vaporizer, Verdampfer Smono 4-10 Jahre Garantie- 365 Tage Rückgaberecht","15,10%","22,76%","B013PL894Y","X-Max V2 Pro Vaporizer Schwarz","8,56%","6,85%"
"Amazon.de","gucci gürtel",710,"B07JZRBZ3G","DAWN CARTER Herren Gürtel Ratsche Automatik Gürtel für Männer 52mm Breit Ledergürtel-Herren Gürtel Echt Leder Leather Belt Ledergürtel A10-115","15,11%","2,83%","B07F6YM44N","Leder Gürtel Mode Schwarz Instagram heiß Altes Gold, 95CM 26-28(80)","13,93%","25,51%","B07HLJ9B6S","ZuoShi Herren Gürtel Automatik Ledergürtel mit GG Schnalle","13,52%","21,46%"
"Amazon.de","bücher bestseller 2018",711,3868829164,"Das Leben ist zu kurz für später: Stell dir vor, du hast nur noch ein Jahr - ein Selbstversuch, der dein Leben verbessern wird","16,26%","16,59%",3945362296,"Wenn gestern unser morgen wäre","11,73%","10,63%",3736305567,"Save Me (Maxton Hall Reihe, Band 1)","6,34%","6,19%"
"Amazon.de","meg",712,"B07L5VRT29","Meg [dt./OV]","60,25%","11,63%","B07L5TH9XK","Meg [dt./OV]","20,50%","0,00%","B07FQ3Q5YP","MEG [Blu-ray]","9,36%","60,39%"
"Amazon.de","tapete",713,"B0778GKTPF","AllRight Optik Vliestapete Vlies Wand Tapete 3D Barock Rolle Wandtapete Dekoration 10M","8,56%","12,50%","B0795227NQ","Fine Décor fd42282 Quarz Fractal Tapete, Rose Gold","7,06%","10,16%","B00L5JEX9O","A.S. Création Vliestapete Memory Tapete neo barock glamourös klassisch 10,05 m x 0,53 m grau metallic schwarz Made in Germany 953723 95372-3","6,18%","7,03%"
"Amazon.de","faultier kostüm",714,"B07519VFBT","Faul-Tier Kostüm, F130 Gr. 98-104, für Kinder, Faultier-Kostüme Faul-Tiere für Klein-Kinder Fasching Karneval, Karnevalskostüme, Kinder-Faschingskostüme, Geburtstags-Geschenk Weihnachts-Geschenk","23,93%","3,57%","B07HHP9LBY","Jumpsuit Onesie Tier Karton Fasching Halloween Kostüm Sleepsuit Cosplay Overall Pyjama Schlafanzug Erwachsene Unisex Lounge Kigurumi Faultier for Höhe 140-187CM","11,85%","23,81%","B07227PM7B","Katara 1744 -Faultier Kostüm-Anzug Onesie/Jumpsuit Einteiler Body für Erwachsene Damen Herren als Pyjama oder Schlafanzug Unisex - viele verschiedene Tiere","6,61%","20,24%"
"Amazon.de","hosen damen",715,"B07C15FRXD","Tomwell Damen Mode Streifen Trainingsanzug Frauen Lange Ärmel Zipper Top + Lange Hose Sportswear 2 Stück Set Sport Yoga Outfit","11,07%","8,03%","B07J54PFG5","Xinan Damen Yoga Hose Women Skinny Ripped Pants High Taille Stretch Slim Bleistift Hose","5,35%","2,59%","B077ZQD2TR","Yogogo Damen 3/4 Gestreift Leggings Hose Hohe Taille Pants | Dünne Hosen | Sport Fitness Workout Leggins | Elastische Dünne Hosen | Sporthose","4,81%","3,89%"
"Amazon.de","mini kühlschrank",716,"B0792DQTDL","Gino Gelati 2 in 1 Mini Kühlschrank mit Kühl- und Heizfunktion an der Steckdose und am Zigarettenanzünder anschließbar GG-57W-4L BSS","12,24%","7,55%","B00B6VFTTE","Mobicool F16, thermo-elektrischer Mini-Kühlschrank, 15 Liter, 230 V, für Catering, Büro, Hotel oder zu Hause, Blau","12,00%","13,67%","B00K8O20N8","Bomann KB 389 Mini-Kühlschrank/A++ / 51 cm Höhe / 84 kWh/Jahr / regelbarer Thermostat/Kühlmittel R600a / weiß","10,25%","15,11%"
"Amazon.de","ordner",717,"B01MQQQKGU","DINOR Ordner-Wolkenmarmor Recycling 8 cm breit DIN A4 schwarz 10er Pack Made in Germany Ringordner Aktenordner Briefordner Büroordner Pappordner Schlitzordner Grüner Balken Blauer Engel","15,89%","26,83%","B000KJO6EC","Falken PP-Color Kunststoff-Ordner 8 cm breit DIN A4 schwarz Ringordner Aktenordner Briefordner Büroordner Plastikordner Schlitzordner","13,04%","21,01%","B01HR1SLO6","Leitz Multifunktions-Ordner, A4, Abgerundeter Rücken (8,2 cm Breite), Gummibandverschluss, Kunststoff, Active Urban Chic, Dunkelgrau, 11160089","9,19%","7,38%"
"Amazon.de","resident evil 2 remake",718,"B07DPBCXG7","Resident Evil 2 - 100% UNCUT [PlayStation 4 ]","73,66%","79,49%","B07DM6YN7G","Resident Evil remake 2 uncut PEGI - Bonus Edition - PS4","4,58%","7,09%","B07MSV7MC6","Resident Evil 2 Remake [Limited Lenticular uncut Edition] (PS4)","3,77%","3,67%"
"Amazon.de","magnettafel",719,"B002LDFUHC","MOB Whiteboard - Sieger Preis-Leistung - 10 Größen wählbar - Magnettafel beschreibbar - Magnetwand mit Alurahmen, magnetisch (60 x 90 cm)","22,49%","27,69%","B00191X1MI","Herlitz 10524627 Whiteboard und Magnettafel (silbernen Holzrahmen, 40 x 60cm) weiß","12,86%","17,92%","B0725QS3V5","Navaris Magnettafel Magnetpinnwand Memoboard zum Beschriften - 60x40 cm Notiztafel div. Designs - Tafel abwaschbar mit Halterung Magneten Stift","8,13%","6,35%"
"Amazon.de","sexy dessous",720,"B07LBMZ3ZZ","Meaneor_Fashion_Origin Damen Sexy Body Dessous Rückenfrei Spitze Bodysuit Negligee Reizwäsche Unterwäsche Babydoll Lingerie Erotic Nachtwäsche","8,64%","9,27%","B07BVVXFGY","Aranmei Damen Rückenfrei Bodysuit Spitze Bodys Sexy Dessous Negligee Unterwäsche Babydoll Lingerie Erotic Nachtwäsche","6,21%","6,39%","B07KPGWWTP","LANSKIRT Damen Unterwäsche, Frauen Sexy erotik Dessous offen Crotch Body Nachtwäsche Versuchung Nightgown Nighty Unterwäsche Spitze G-String Thongs V-String Höschen (XL, ?Schwarz)","5,28%","3,99%"
"Amazon.de","drachenzähmen leicht gemacht 3",721,"B07NBDYHWQ","Drachenzähmen leicht gemacht 3 - Die geheime Welt (DVD)","42,52%","35,70%",3833236620,"Drachenzähmen leicht gemacht 3: Die geheime Welt: Das ultimative Buch der Drachen","9,42%","13,41%","B07NBCL3M5","Drachenzähmen leicht gemacht 3 - Die geheime Welt (Blu-ray)","9,06%","7,60%"
"Amazon.de","gartendeko",722,"B00S87UUEI","Solar - Metall Eule - Stimmungslicht Dekorationsbeleuchtung","7,89%","8,56%","B07FP6MFXK","Yokunat LED Solar Laterne für Draußen, Solar Garten Hängende Laterne Zylinderförmige Nachtlicht Wasserdicht IP44 mit Lichtempfindlichkeit für Veranda/Rasen/Hof/Gehweg/Auffahrt/Weihnachten","5,37%","5,41%","B06XR9B3ZR","LED Solar Lichterkette Kristall Kugeln 4.5 Meter 30er Warmweiß, Mr.Twinklelight Außerlichterkette Deko für Garten, Bäume, Terrasse, Weihnachten, Hochzeiten, Partys, Innen und außen","4,83%","4,05%"
"Amazon.de","ncis",723,"B01ACJZ378","Navy CIS - Staffel 13 [dt./OV]","26,44%","34,32%","B01ACJKFHQ","Navy CIS - Staffel 13 [dt./OV]","18,28%","6,49%","B00J4UI38S","Navy CIS - Staffel 10 [dt./OV]","9,13%","3,78%"
"Amazon.de","schrittzähler",724,"B073WR7CGM","YAMAY Fitness Armband,Wasserdicht IP67 Fitness Tracker Smartwatch Aktivitätstracker Pulsuhren Smart Watch Schrittzähler Fitness Uhr Vibrationsalarm Anruf SMS Whatsapp Beachtenfür iOS Android Handy","11,67%","10,77%","B06ZZN34TD","YAMAY Fitness Armband Schrittzähler Armbanduhr Ohne Bluetooth Aktivitätstracker mit Zeit Dtum Schrittzähler Kalorienzähler Entfernungsrechner Schlafmonitor für Damen Kinder Herren Ohne App Handy","7,43%","6,72%","B00QN1KYIS","ANGEBOT des Tages, NAKOSITE Bester und Einfacher 3D Schrittzähler, Genauer Schrittmesser mit Gurt plus Gratis eBook. NSPD 2433, Tri-Axis Technologie Pedometer, Weiß, leicht abzulesende Anzeige. BONUS: eBook “How I Lost Weight Walking”. 365 Tage Garantie","7,09%","7,95%"
"Amazon.de","reiskocher",725,"B0156PTDZ6","Reishunger Reiskocher (1,2l / 500W / 220V) Warmhaltefunktion, hochwertiger Innentopf, Löffel und Messbecher – Reis für bis zu 6 Personen","35,34%","39,21%","B00BEJ77WK","Russell Hobbs 19750-56 Reiskocher Cook@Home, Warmhaltefunktion, 1.8l, inkl. Dampfgarer-Einsatz, Reislöffel, Messbecher, 700 Watt, Edelstahl/schwarz","17,43%","22,53%","B07L4M4VCV","PerfectCook Edelstahl Reiskocher Dampfgarer klein, 3in1 Gerät (Reiskocher, Risottokocher, Gemüsegarer), Multikocher 1,2L, Risotto Topf, Dämpfeinsatz, Reistopf für alle Reisarten, inkl 1kg Reis","8,73%","7,75%"
"Amazon.de","top gun",726,"B00HV30GLW","Top Gun [dt./OV]","17,10%","56,97%","B07N7814RB","TEXTIL MONSTER Kapuzenpullover - Top Gun Logo","16,99%","5,79%","B00GSBLX60","Top Gun [dt./OV]","10,53%","3,86%"
"Amazon.de","bollerwagen",727,"B079M323NC","Sekey Faltbarer Bollerwagen mit Bremsen Faltbar Handwagen Klappbar Gartenanhänger Gartenwagen Transportwagen für Alle Untergründe Geeignet, Schwarz","11,39%","15,27%","B01CE3DLVK","HOMFA Bollerwagen faltbar Transportwagen Handwagen Transportkarre Gartenwagen Faltwagen Strandwagen bis 80KG Vorderräder 360° drehbar 90x52x64cm Blau","7,83%","11,51%","B00WEN7IGU","Hauck Eco Mobil - Bollerwagen Handwagen Transportwagen, für 2 Kinder Geeignet, mit Sonnendach und Sitzpolster, Faltbar, Traglast 50 kg - Forest Green","7,16%","3,14%"
"Amazon.de","damen pullover",728,"B07K6RB17V","Sweatshirts für Damen, Kapuzenpullover Frauen einfarbig gestreift Langarm mit Kapuze Pullover Tops Shirt lose Bekleidung Langarmshirts sportbekleidung Hoodie Damenbekleidung Sport & Freizeit","6,05%","4,14%","B07K6DLCMX","Damen Pulli Langarm T-Shirt Rundhals Ausschnitt Lose Bluse Hemd Pullover Oversize Sweatshirt Oberteil Tops","5,33%","6,75%","B075NXXW56","ECOWISH Damen Kontrastfarbe Pulli Pullover Rollkragen Sweatshirt Kapuzenpulli Top Hoodies","4,78%","8,28%"
"Amazon.de","dashcam",729,"B07DL4XL94","apeman Dashcam 1080P Full HD DVR Autokamera 3 Zoll LCD-Bildschirm 170 ° Weitwinkel, G-Sensor, WDR, Parkmonitor, Loop-Aufnahme, Bewegungserkennung","16,71%","28,45%","B06Y2C986L","apeman Full HD 1080P Dashcam Autokamera Video Recorder mit 170° Weitwinkelobjektiv, 3 Zoll LCD-Bildschirm, WDR, Bewegungserkennung, Parkmonitor, Loop-Aufnahme, Nachtsicht und G-Sensor","9,10%","8,94%","B00BY82RG2","iTracker GS6000-A12 GPS WiFi Autokamera Dashcam 2K 1440p SuperHD 1296p Dash-Cam","7,49%","3,85%"
"Amazon.de","usb hub",730,"B00Y211AFM","Anker Ultra Slim Extra Leicht 4 Port USB 3.0 Hub, Datenhub für MacBook, MacBook Air/Pro/Mini, iMac, MacPro, Windows Laptops und Ultrabooks, sowie PCs und mehr (Schwarz)","30,27%","35,95%","B06Y1WX3CK","UGREEN USB 3.0 Hub 7 USB Ports Dockingstation USB HUB mit Netzteil USB Verteiler SuperSpeed bis zu 5Gbp Datenhub Schwarz","5,32%","4,21%","B00JX1ZS5O","Sabrent USB HUB - 4-Port -USB 3.0 Hub mit einzelnen Power Schalter und LEDs (HB-UM43)","5,02%","6,11%"
"Amazon.de","die unglaublichen",731,"B00OKQSAWA","Die Unglaublichen - The Incredibles","26,73%","37,89%","B07HQPS5LG","Die Unglaublichen 2 [dt./OV]","17,46%","30,29%","B00OKOOP94","Die Unglaublichen - The Incredibles","11,02%","2,27%"
"Amazon.de","keanu reeves",732,"B07MV6JB16","Siberia [dt./OV]","18,65%","12,70%","B07MV75RRP","Siberia [dt./OV]","11,16%","0,00%","B00ILNUT5Y","Der blutige Pfad Gottes","8,98%","6,35%"
"Amazon.de","matratze 140 x200",733,"B07G2NJ8BQ","Mister Sandman A0151 Matratze, Komfortschaum, Rollmatratze, Härtegrad (140 x 200 cm)","9,33%","10,82%","B074G1H4FV","Hilding Sweden Essentials Schaumstoffmatratze in Weiß / Mittelfeste Matratze mit orthopädischem 7-Zonen-Schnitt für alle Schlaftypen (H2-H3) / 200 x 140 x 16 cm","9,25%","8,17%","B004LAWJQ8","Betten ABC 7 Zonen Matratze OrthoMatra KSP-500 - Das Original / Orthopädische Kaltschaummatratze Härtegrad H3 in 140 x 200 cm - auch für Allergiker geeignet","7,00%","9,65%"
"Amazon.de","bong",734,"B00BO4SIK0","Black Leaf Elite 6-Arm Percolator Eis-Bong 38 cm 18er Inside Diffusor Chillum, 14er Kopf","12,82%","10,55%","B00IO1CNLQ","Black Leaf JOE Glasbong 18cm","11,51%","17,43%","B0748FKW4C","Glas Bong Double Tree Kuppel Kaffeemaschine Rohr 18mm Schüssel Wasserleitung Höhe 40cm (Grün)","5,74%","3,56%"
"Amazon.de","louis vuitton",735,"B07KJGXWGX","Noah Birch Neverfull Style Damier Tote Shoulder Women's Organizer Handbag Shoulder Fashion Bag","24,14%","15,07%","B07B7BN78N","LeahWard Damen 2 IN 1 Schultertasche mit Clutch Bag Designer-Einkaufstaschen 861 (BRAUN)","7,35%","8,22%","B01MRMVKMD","LeahWard® Damen Double Or Single Zip Kunstleder Geldbörsen Damen Brieftaschen Coin Taschen Geldbörsen (braun Double Zip Geldbörsen)","6,25%","10,96%"
"Amazon.de","plattenspieler",736,"B0076Z72RQ","Dual DTJ 301.1 USB DJ-Plattenspieler (33/45 U/min, Pitch-Control, Magnet-Tonabnehmer-System, Nadelbeleuchtung, USB Kabel) schwarz","12,55%","8,31%","B000VADN76","Karcher KA 8050 Plattenspieler mit eingebauten Lautsprechern silber","9,39%","16,40%","B07D6LN1W6","DIGITNOW! Tragbarer Gürtel-Drive 3-Gang-Retro-Style-Plattenspieler Vinyl-Schwarzer Aktenkoffer-Plattenspieler mit Stereo-Lautsprecher,unterstützt USB-Ausgang/Kopfhörer-Jack / MP3/ Musikwiedergab","7,78%","11,01%"
"Amazon.de","kopfhörer in ears",737,"B0736SCQ4X","KLIM Fusion Audio Kopfhörer - Langlebig + 5 Jahre Garantie - Innovativ: In-Ear-Kopfhörer mit Memory Foam [ Neue 2019 Version ] Schwarz","15,03%","18,11%","B07BWHHBST","Gritin In Ear Kopfhörer, Ear Ohrhörer Metallisches Stereo Headset Earphones mit Ohrstöpseln und Mikrofon für iPhone, Android Smartphones und MP3 Players usw","9,14%","15,34%","B07DLPM755","Jayfi JA40 Bass HiFi Stereo In-Ear Kopfhörer Geräuschisolierung Ohrstöpsel Ohrhörer aus Gesundem Metall mit Mikrofon Schwarz","8,13%","8,40%"
"Amazon.de","fototapete",738,"B073VG138N","livingdecoration Fototapete Wald 366 x 254 cm Bäume Sonne Schlafzimmer Tapete inklusiv Kleister","7,98%","7,04%","B01BMI5K4E","murando - Fototapete 350x245 cm - Vlies Tapete - Moderne Wanddeko - Design Tapete - Wandtapete - Wand Dekoration - Pusteblume Blumen bokeh Abstrakt f-C-0040-a-b","5,86%","6,03%","B01AUW3BIK","murando - Fototapete Steinoptik 400x280 cm - Vlies Tapete - Moderne Wanddeko - Design Tapete - Wandtapete - Wand Dekoration - Steintapete Steine Stein Mauer Steinoptik 3D f-B-0013-a-a","5,01%","3,52%"
"Amazon.de","bluse damen",739,"B07MMSYSKM","Yieune Damen Bluse Langarm V-Ausschnitt Elegant Blumen Hemd Casual Oberteile Tops","11,01%","11,27%","B07JCQ2Y2K","ECOWISH Damen Bluse Leopardenmuster Hemd V Ausschnitt Button Down Shirt Kragen Langarmshirt Oberteile Top","6,43%","6,33%","B07K6DLCMX","Damen Pulli Langarm T-Shirt Rundhals Ausschnitt Lose Bluse Hemd Pullover Oversize Sweatshirt Oberteil Tops","6,34%","7,25%"
"Amazon.de","predator upgrade",740,"B07HB9LL62","Predator - Upgrade [Blu-ray]","31,83%","20,64%","B07H7W5CPX","Predator - Upgrade [dt./OV]","31,63%","62,62%","B07H7W1TMZ","Predator - Upgrade [dt./OV]","12,50%","6,15%"
"Amazon.de","jackie chan",741,"B07GDPVJH5","New Police Story","6,41%","2,55%","B079G6RJTT","Stadt der Gewalt - Uncut","5,86%","2,55%","B00EQZMGQG","Shanghai Knights [dt./OV]","5,79%","2,55%"
"Amazon.de","klimmzugstange",742,"B000LKZIRE","Trend-Welt Unisex – Erwachsene Türreck Klimmzugstange Mattschwarz 72-105cm","14,35%","22,22%","B07B9Z67NG","NOQUIT Premium Klimmzugstange - einfach ohne Schrauben in den Türrahmen einhängen - Das stylischste Türreck für Zuhause","13,27%","11,11%","B01L45V6HA","Magnoos Klimmzugstange Matador zur Befestigung Ohne Schrauben für Zuhause Premium Türreck | Nur Hier Reckstange 20 cm Höher im Türrahmen als andere Stangen","10,88%","12,83%"
"Amazon.de","beyblade",743,"B07BXM9P7Z","Lavendei Kampfkreisel Set | 4D Fusion Modell Metall Masters Speed Kreisel mit Basis-Arena für Kindertag, Ostern, Weihnachten, Geburtstag und Neues Jahr (Kit 1)","8,15%","11,81%","B076HG28T3","CRAZE BLADEZ Kampfkreisel 2er Set Kampf Kreisel Metall Duell Pack Battle 10310","8,05%","6,66%","B078216H3D","Hasbro Beyblade Burst E1060ES0 Starter Pack S2 Minoboros M2, Kreisel","6,21%","8,24%"
"Amazon.de","anthem ps 4",744,"B07F7KBXXJ","Anthem - Legion of Dawn Edition - [PlayStation 4]","45,97%","44,31%","B071GQT9M7","Anthem - Standard Edition - [PlayStation 4]","37,18%","49,07%","B07MSVF2Q5","Anthem - Standard Edition inkl. Steelbook - [PlayStation 4]","7,24%","3,33%"
"Amazon.de","wendy",745,"B073RP1N15","Wendy - Der Film","24,48%","11,06%","B073RPGS1D","Wendy - Der Film","15,73%","0,48%","B07H2L5RQF","Wendy 2 - Freundschaft für immer","15,18%","79,33%"
"Amazon.de","minnie mouse kostüm damen",746,"B01B88TBDE","Urbancoco Damen Mädchen Basic Solid vielseitige dehnbaren informell Mini Skater Rock","23,92%","24,15%","B00Y1GKI88","Karnevalkostüm Vielzweckrock, rot mit weißen Punkten (38/40)","9,52%","10,37%","B009DB9LJ8","WIDMANN 77441 - Damen Kostüm Mouse Girl, Kleid und Ohren, Größe S","4,85%","3,40%"
"Amazon.de","ps4 headset",747,"B079T6FRG2","PlayStation 4 Gold Wireless Headset","18,64%","8,19%","B0711LKKGD","Beexcellent Gaming Headset für PS4 PC Xbox One, LED Licht Crystal Clarity Sound Professional Kopfhörer mit Mikrofon für Laptop Mac Handy Tablet Blau","11,74%","20,01%","B071ZMJP72","PS4 Gaming Headset, NUBWO N2 Stereo Wired PC Gaming Headset mit Rauschunterdrückungsmikrofon, Over-Ear Kopfhörer für PC, MAC, PlayStation 4, Xbox One, Android und iPhone-Black","6,32%","6,89%"
"Amazon.de","feuerzeug",748,"B001E5FLT0","Zippo Benzin Feuerzeug Chrom Standard gebürstet Regular Sturmfeuerzeug","9,15%","7,13%","B003YUZ6G6","100 x Einwegfeuerzeuge Feuerzeug Feuerzeuge transp.","8,61%","11,49%","B074T7VYTN","Mini USB Feuerzeuge Wiederaufladbar Winddicht Flammenlose Elektronische Plamsa Feuerzeug Tragbar, Silber","6,45%","5,06%"
"Amazon.de","bügelbrett",749,"B00IVI77JU","Leifheit Bügeltisch Classic S Basic, für kleine Haushalte, Bügelbrett mit fester Bügeleisenablage, höhenverstellbares Bügelbrett klein zusammenklappbar","24,37%","30,33%","B0018O2QSG","Vileda Viva Express Smart Plus Bügeltisch, blau, dampfdurchlässiger Oberfläche, 114 x 34 cm","10,01%","13,69%","B00IVI72PY","Leifheit Bügeltisch Air Board M Solid Plus ist höhenverstellbar, Bügelbrett für Dampfbügeleisen, Dampfbügeltisch mit Zwei-Seiten-Bügeleffekt","6,40%","5,04%"
"Amazon.de","kinder",750,"B004M443IK","Kinder Disco Hits","8,75%","0,00%","B07L3BCRTJ","Kindergeburtstag","4,79%","0,00%","B0794SNF6C","Das neue Fire HD 8 Kids Edition-Tablet, 8-Zoll-HD-Display, 32 GB, blaue kindgerechte Hülle","4,15%","1,11%"
"Amazon.de","blutdruck messgeräte",751,"B008KWO3Q2","Medisana BU 510 Oberarm- Blutdruckmessgerät 51160, mit Arrhythmie-Anzeige, mit WHO Ampel-Farbskala, für eine präzise Blutdruckmessung","26,85%","33,78%","B00440D8A6","Sanitas SBM 21 Oberarm-Blutdruckmessgerät, vollautomatische Blutdruck- und Pulsmessung am Oberarm mit Arrhythmie-Erkennung","11,81%","14,00%","B01KOC0W38","Sanitas SBC 22 Handgelenk-Blutdruckmessgerät (vollautomatische Blutdruck- und Pulsmessung, Warnfunktion bei möglichen Herzrhythmusstörungen)","10,87%","12,33%"
"Amazon.de","oberteile damen",752,"B07BWC63XD","YOINS Schulterfrei Sexy Oberteil Tops Oberteile Blusen Damen Off Shoulder Top Tunika für Damen Einfarbig","6,56%","10,65%","B07F8VB9BC","friendGG❤❤Damen Langarm-Top,Damen Colorblock Langarm-Pullover,Damen Rundhalsausschnitt Oberteil,Damen Oberteile Elegant,Tunikashirts Sweatshirt,Damen Pullover","6,06%","4,59%","B01NBIPT0T","ECOWISH V Ausschnitt Oberteile Damen Kreuz Pullover Langarmshirts Tops Hemd Shirt","5,63%","5,43%"
"Amazon.de","heizlüfter",753,"B0043RD490","Clatronic Heizlüfter HL 3379, 2 Heizstufen (1000/max. 2000 Watt), Kaltstufe (Ventilator), 2 unterschiedliche Aufstellmöglichkeiten, weiß","18,69%","28,41%","B07FTCK7ZG","Heizlüfter - Elektrische Heizung 1800W Keramik Heizgerät Energiesparend Heizlüfter, 3 Mode, 2s Aufheizen, Überhitzungschtuz Abschaltfunktion, für Haus Büro Badezimmer","8,28%","9,44%","B00MFEHQMO","Rowenta Heizlüfter Instant Comfort Compact 2000, SO2320 (Grau)","7,07%","8,01%"
"Amazon.de","jacke herren",754,"B07BNSQ45H","!Solid Tilden Herren Übergangsjacke Herrenjacke Jacke gefüttert mit Kapuze","6,38%","10,22%","B014R7JTUI","Geographical Norway Herren Softshell Funktions Outdoor Jacke wasserabweisend","5,75%","9,58%","B07CVQ9M3K","THE NORTH FACE Herren Evolve Ii Tri Jacket Doppeljacke","5,41%","5,43%"
"Amazon.de","poster",755,"B07KPF7L87","Enno Vatti 100 Movies Bucket List Scratch Off Poster - Top Filme Rubbelkarte (42 x 59,4 cm)","13,05%","4,44%","B07FW6551F","Heimlich® Premium Poster (4 Stück in DIN A4) | Große Auswahl an Motiven im Shop | auch mit Rahmen » Coco Chanel «","9,74%","7,22%","B07N83KT5R","decomonkey | Poster 5er – Set schwarz-weiß Abstrakt Kunstdruck Wandbild Print Bilder Kunstposter Wandposter Posterset Monstera Blätter Ananas Grün","7,55%","3,33%"
"Amazon.de","tshirt damen",756,"B0156H3TF4","Levi's Damen T-Shirt The Perfect Tee","10,96%","9,68%","B07D7WBSZ6","Ehpow Damen Kurzarm T-Shirt V-Ausschnitt Casual Sommer Lose Shirt Oversize Oberteile","10,41%","8,99%","B07B6N98R5","Hevoiok Damen Kurzarm-Shirt Oberteile Sexy Dreifacher Farbblock Streifen Bluse Frühling Sommer T Shirt Frauen Casual Locker Beiläufig Tanktops","5,78%","6,22%"
"Amazon.de","festplatte extern",757,"B06VVS7S94","WD Elements Portable, externe Festplatte - 1 TB - USB 3.0 - WDBUZG0010BBK-WESN","21,06%","25,15%","B01MTAEVJM","Externe Festplatte tragbare 160GB-2,5Zoll USB 3.0 Backups HDD Tragbare für TV,PC,Mac,MacBook, Chromebook, Wii u, Laptop,Desktop,Windows","11,94%","6,33%","B06W55K9N6","WD Elements Portable, externe Festplatte - 2 TB - USB 3.0 - WDBU6Y0020BBK-WESN","8,91%","10,65%"
"Amazon.de","expanse",758,"B07ND3NJ3N","The Expanse - Staffel 3 [dt./OV]","19,26%","1,40%","B07NJ2LPQM","The Expanse - Staffel 1 [dt./OV]","19,00%","3,27%","B077H3HM76","The Expanse - Staffel 1","17,14%","32,24%"
"Amazon.de","iphone 6s zertifiziert",759,"B01M0SA4OB","Samsung S7 Schwarz 32GB SIM-Free Smartphone (Zertifiziert und Generalüberholt)","40,47%","12,50%","B01L9KXU7O","Apple iPhone 6s, 4,7 Display, SIM-Free, 64 GB, 2015, Space Grau (Refurbished)","11,43%","50,00%","B01L9KXO70","Apple iPhone 6s, 4,7 Display, SIM-Free, 64 GB, 2015, Silber (Generalüberholt)","4,47%","0,00%"
"Amazon.de","wärmflasche",760,"B07JQFR2V2","Blumtal Wärmflasche mit weichem Bezug - 1,8L Wärmeflasche, Bettflasche, Wärmflasche Kinder, grau","14,35%","18,66%","B004VCWBSW","Hugo Frosch Wärmflasche Klassik 1,8 Ltr. mit Microfaserbezug in Tierfelloptik grau","13,40%","13,63%","B00MTU44LU","Fashy 35674.0 Wärmflasche 1er Pack ~ Thermoplast- Wärmeflasche Doppellamelle, geruchsneutral, recyclingfähig, robust und langlebig, fugenloser, schmaler Flaschenhals ~ 2,0 Liter, anthrazit","5,49%","4,69%"
"Amazon.de","homematic ip",761,"B00ZQG6OTO","Homematic IP Heizkörperthermostat, 140280","11,02%","22,95%","B01KPM3OQ4","Homematic IP 143159A0A Wandthermostat mit Luftfeuchtigkeitssensor","9,03%","10,62%","B015R46RQO","Homematic IP Smart Home Starter Set Raumklima - Intelligente Heizungssteuerung per Smartphone","8,77%","5,76%"
"Amazon.de","fasching",762,"B07888VT36","Fasching 2018","7,55%","0,00%","B0772S777D","ABYED® Jumpsuit Tier Karton Fasching Halloween Kostüm Sleepsuit Cosplay Fleece-Overall Pyjama Schlafanzug Erwachsene Unisex Lounge","6,14%","6,11%","B00GNSGHXC","Widmann 98872 Kostüm, Mehrfarbig(blau/lila/rosa), M","5,38%","9,44%"
